"UC","Grupos","Família","Gênero","Espécie","Autor","Táxon_completo","Barcode","BD_Origem","Herbário","Coletor","Número_da_Coleta","Origem_FFBr","ConfiançaID","ConfiançaLoc","Localidade","Já listada"
"ESTAÇÃO ECOLÓGICA JATAÍ","Angiosperms","Acanthaceae","Hypoestes","sanguinolenta","(Van Houtte) Hook. f.","ACANTHACEAE Hypoestes sanguinolenta (Van Houtte) Hook. f.","SPFR016007","Splink","SPFR","Faria, L.B.","107","Cultivated","Bronze","High","Estação Ecológica de Jataí","Não"
"ESTAÇÃO ECOLÓGICA JATAÍ","Angiosperms","Amaranthaceae","Alternanthera","brasiliana","(L.) Kuntze","AMARANTHACEAE Alternanthera brasiliana (L.) Kuntze","SPFR016008","Splink","SPFR","Faria, L.B.","118","Native","Bronze","High","Estação Ecológica de Jataí","Não"
"ESTAÇÃO ECOLÓGICA JATAÍ","Angiosperms","Amaranthaceae","Alternanthera","rufa","(Mart.) D.Dietr.","AMARANTHACEAE Alternanthera rufa (Mart.) D.Dietr.","SPFR010459","Splink","SPFR","Groppo, M.","1242","Native","Bronze","High","Estação Ecológica de Jataí, beira da Lagoa do Diogo","Não"
"ESTAÇÃO ECOLÓGICA JATAÍ","Angiosperms","Amaranthaceae","Chamissoa","altissima","(Jacq.) Kunth","AMARANTHACEAE Chamissoa altissima (Jacq.) Kunth","SPFR016009","Splink","SPFR","Faria, L.B.","129","Native","Bronze","High","Estação Ecológica de Jataí","Não"
"ESTAÇÃO ECOLÓGICA JATAÍ","Angiosperms","Anacardiaceae","Anacardium","humile","A.St.-Hil.","ANACARDIACEAE Anacardium humile A.St.-Hil.","SPFR016253","Splink","SPFR","Gimenez, V.M.M.","4462","Native","Bronze","High","Estação Ecológica de Jataí","Não"
"ESTAÇÃO ECOLÓGICA JATAÍ","Angiosperms","Anacardiaceae","Lithraea","molleoides","(Vell.) Engl.","ANACARDIACEAE Lithraea molleoides (Vell.) Engl.","HPBR009997","Splink","HPBR","Toppa, R.",,"Native","Bronze","High","ESTAÇÃO ECOLÓGICA JATAÍ","Não"
"ESTAÇÃO ECOLÓGICA JATAÍ","Angiosperms","Anacardiaceae","Tapirira","guianensis","Aubl.","ANACARDIACEAE Tapirira guianensis Aubl.","SPFR016010","Splink","SPFR","Faria, L.B.","168","Native","Bronze","High","Estação Ecológica de Jataí","Não"
"ESTAÇÃO ECOLÓGICA JATAÍ","Angiosperms","Annonaceae","Annona","coriacea","Mart.","ANNONACEAE Annona coriacea Mart.","HPBR010127","Splink","HPBR","Toppa, R.",,"Native","Bronze","High","ESTAÇÃO ECOLÓGICA JATAÍ","Não"
"ESTAÇÃO ECOLÓGICA JATAÍ","Angiosperms","Annonaceae","Annona","crassiflora","Mart.","ANNONACEAE Annona crassiflora Mart.","HPBR010134","Splink","HPBR","Toppa, R.",,"Native","Bronze","High","ESTAÇÃO ECOLÓGICA JATAÍ","Não"
"ESTAÇÃO ECOLÓGICA JATAÍ","Angiosperms","Annonaceae","Annona","dioica","A.St.-Hil.","ANNONACEAE Annona dioica A.St.-Hil.","HPBR009994","Splink","HPBR","Toppa, R.",,"Native","Bronze","High","ESTAÇÃO ECOLÓGICA JATAÍ","Não"
"ESTAÇÃO ECOLÓGICA JATAÍ","Angiosperms","Annonaceae","Duguetia","furfuracea","(A.St.-Hil.) Saff.","ANNONACEAE Duguetia furfuracea (A.St.-Hil.) Saff.","SPFR016011","Splink","SPFR","Faria, L.B.","69","Native","Bronze","High","Estação Ecológica de Jataí","Não"
"ESTAÇÃO ECOLÓGICA JATAÍ","Angiosperms","Annonaceae","Duguetia","lanceolata","A.St.-Hil.","ANNONACEAE Duguetia lanceolata A.St.-Hil.","HPBR010027","Splink","HPBR","Toppa, R.",,"Native","Bronze","High","ESTAÇÃO ECOLÓGICA JATAÍ","Não"
"ESTAÇÃO ECOLÓGICA JATAÍ","Angiosperms","Annonaceae","Xylopia","aromatica","(Lam.) Mart.","ANNONACEAE Xylopia aromatica (Lam.) Mart.","SPFR016012","Splink","SPFR","Faria, L.B.","29","Native","Bronze","High","Estação Ecológica de Jataí","Não"
"ESTAÇÃO ECOLÓGICA JATAÍ","Angiosperms","Apocynaceae","Aspidosperma","tomentosum","Mart. & Zucc.","APOCYNACEAE Aspidosperma tomentosum Mart. & Zucc.","HUFABC000535","Splink","HUFABC","Pereira-Silva, E.F.L.","EP0049EEJ-80","Native","Latão","High","Estação Ecológica de Jataí - Oitocentos Alqueires, Expedito das parcelas permanentes (10x25m) de 2002. Remanescente Leste da EEJ, porção Norte - 1º Levantamento","Não"
"ESTAÇÃO ECOLÓGICA JATAÍ","Angiosperms","Apocynaceae","Ditassa","obcordata","Mart.","APOCYNACEAE Ditassa obcordata Mart.","SPFR002703","Splink","SPFR","Mechi, M.R.","125","Native","Ouro","High","Estação Ecológica do Jataí","Não"
"ESTAÇÃO ECOLÓGICA JATAÍ","Angiosperms","Apocynaceae","Forsteronia","glabrescens","Müll.Arg.","APOCYNACEAE Forsteronia glabrescens Müll.Arg.","SPFR010214","Splink","SPFR","Mechi, M.R.","50","Native","Bronze","High","Estação Ecológica de Jataí","Não"
"ESTAÇÃO ECOLÓGICA JATAÍ","Angiosperms","Apocynaceae","Hancornia","speciosa","Gomes","APOCYNACEAE Hancornia speciosa Gomes","HPBR010008","Splink","HPBR","Toppa, R.",,"Native","Bronze","High","ESTAÇÃO ECOLÓGICA JATAÍ","Não"
"ESTAÇÃO ECOLÓGICA JATAÍ","Angiosperms","Apocynaceae","Himatanthus","obovatus","(Müll. Arg.) Woodson","APOCYNACEAE Himatanthus obovatus (Müll. Arg.) Woodson","HPBR010421","Splink","HPBR","Toppa, R.",,"Native","Bronze","High","ESTAÇÃO ECOLÓGICA JATAÍ","Não"
"ESTAÇÃO ECOLÓGICA JATAÍ","Angiosperms","Apocynaceae","Mesechites","mansoanus","(A.DC.) Woodson","APOCYNACEAE Mesechites mansoanus (A.DC.) Woodson","UEC195411","Splink","UEC","Leitao Filho, H.F.","18915","Native","Bronze","High","Estação Ecológica de Jataí","Não"
"ESTAÇÃO ECOLÓGICA JATAÍ","Angiosperms","Apocynaceae","Odontadenia","lutea","(Vell.) Markgr.","APOCYNACEAE Odontadenia lutea (Vell.) Markgr.","SPFR000092","Splink","SPFR","Marcondes-Ferreira, W.","436","Native","Ouro","High","Estação Ecológica de Jataí","Não"
"ESTAÇÃO ECOLÓGICA JATAÍ","Angiosperms","Apocynaceae","Oxypetalum","balansae","Malme","APOCYNACEAE Oxypetalum balansae Malme","UEC053166","Splink","UEC","Leitao Filho, H.F.","18911","Native","Bronze","High","Estação Ecológica de Jataí","Não"
"ESTAÇÃO ECOLÓGICA JATAÍ","Angiosperms","Apocynaceae","Prestonia","calycina","Müll.Arg.","APOCYNACEAE Prestonia calycina Müll.Arg.","UEC195662","Splink","UEC","Leitao Filho, H.F.","18912","Native","Bronze","High","Estação Ecológica de Jataí, Em cerrado denso, alto.","Não"
"ESTAÇÃO ECOLÓGICA JATAÍ","Angiosperms","Apocynaceae","Prestonia","tomentosa","R.Br.","APOCYNACEAE Prestonia tomentosa R.Br.","UPCB00080250","GBIF","UPCB","Leitao, H.F.","18894","Native","Bronze","High","Estação Ecológica de Jataí, em cerrado denso, alto.","Não"
"ESTAÇÃO ECOLÓGICA JATAÍ","Angiosperms","Apocynaceae","Tabernaemontana","catharinensis","A.DC.","APOCYNACEAE Tabernaemontana catharinensis A.DC.","SPFR016014","Splink","SPFR","Faria, L.B.","9","Native","Bronze","High","Estação Ecológica de Jataí","Não"
"ESTAÇÃO ECOLÓGICA JATAÍ","Angiosperms","Apocynaceae","Tabernaemontana","hystrix","Steud.","APOCYNACEAE Tabernaemontana hystrix Steud.","HPBR009978","Splink","HPBR","Toppa, R.",,"Native","Bronze","High","ESTAÇÃO ECOLÓGICA JATAÍ","Não"
"ESTAÇÃO ECOLÓGICA JATAÍ","Angiosperms","Apocynaceae","Temnadenia","violacea","(Vell.) Miers","APOCYNACEAE Temnadenia violacea (Vell.) Miers","SPFR002554","Splink","SPFR","Mechi, M.R.","59","Native","Ouro","High","Estação Ecológica de Jataí","Não"
"ESTAÇÃO ECOLÓGICA JATAÍ",,"Apocynaceae","Vailia","bicuspidata","(E.Fourn.) Morillo","APOCYNACEAE Vailia bicuspidata (E.Fourn.) Morillo","SPFR002544","Splink","SPFR","Mechi, M.R.","186",,"Bronze","High","Estação Ecológica de Jataí","Não"
"ESTAÇÃO ECOLÓGICA JATAÍ","Angiosperms","Araliaceae","Didymopanax","macrocarpus","(Cham. & Schltdl.) Seem.","ARALIACEAE Didymopanax macrocarpus (Cham. & Schltdl.) Seem.","SPFR016016","Splink","SPFR","Faria, L.B.","136","Native","Bronze","High","Estação Ecológica de Jataí","Não"
"ESTAÇÃO ECOLÓGICA JATAÍ","Angiosperms","Araliaceae","Didymopanax","vinosus","(Cham. & Schltdl.) Marchal","ARALIACEAE Didymopanax vinosus (Cham. & Schltdl.) Marchal","57018","Splink","IAC","Marcondes-Ferreira, W.","415","Native","Ouro","High","Estação Ecológica de Jataí","Não"
"ESTAÇÃO ECOLÓGICA JATAÍ","Angiosperms","Arecaceae","Allagoptera","campestris","(Mart.) Kuntze","ARECACEAE Allagoptera campestris (Mart.) Kuntze","HPBR010087","Splink","HPBR","Toppa, R.",,"Native","Bronze","High","ESTAÇÃO ECOLÓGICA JATAÍ","Não"
"ESTAÇÃO ECOLÓGICA JATAÍ","Angiosperms","Arecaceae","Attalea","exigua","Drude","ARECACEAE Attalea exigua Drude","42757","Splink","IAC","Bernacci, L.C.","3348","Native","Bronze","High","Estação Ecológica do Jataí","Não"
"ESTAÇÃO ECOLÓGICA JATAÍ","Angiosperms","Arecaceae","Butia","leiospatha","(Barb.Rodr.) Becc.","ARECACEAE Butia leiospatha (Barb.Rodr.) Becc.","10243","GBIF","SPFR","Mechi, M.R.","142",,"Bronze","High","Estação Ecológica de Jataí","Não"
"ESTAÇÃO ECOLÓGICA JATAÍ","Angiosperms","Arecaceae","Syagrus","loefgrenii","Glassman","ARECACEAE Syagrus loefgrenii Glassman","SPFR010243","Splink","SPFR","Mechi, M.R.","142","Native","Ouro","High","Estação Ecológica de Jataí","Não"
"ESTAÇÃO ECOLÓGICA JATAÍ","Angiosperms","Arecaceae","Syagrus","petraea","(Mart.) Becc.","ARECACEAE Syagrus petraea (Mart.) Becc.","HUFABC000523","Splink","HUFABC","Pereira-Silva, E.F.L.","EP0037EEJ-80","Unknown","Latão","High","Estação Ecológica de Jataí - Oitocentos Alqueires, Expedito das parcelas permanentes (10x25m) de 2002. Remanescente Leste da EEJ, porção Norte - 1º Levantamento","Não"
"ESTAÇÃO ECOLÓGICA JATAÍ","Angiosperms","Asteraceae","Achyrocline","satureioides","(Lam.) DC.","ASTERACEAE Achyrocline satureioides (Lam.) DC.","SPFR016330","Splink","SPFR","Mechi, M.R.","121","Native","Bronze","High","Estação Ecológica de Jataí","Não"
"ESTAÇÃO ECOLÓGICA JATAÍ","Angiosperms","Asteraceae","Ageratum","conyzoides","L.","ASTERACEAE Ageratum conyzoides L.","HPBR010001","Splink","HPBR","Toppa, R.",,"Native","Bronze","High","ESTAÇÃO ECOLÓGICA JATAÍ","Não"
"ESTAÇÃO ECOLÓGICA JATAÍ","Angiosperms","Asteraceae","Aldama","arenaria","(Baker) E.E.Schill. & Panero","ASTERACEAE Aldama arenaria (Baker) E.E.Schill. & Panero","SPF00199609","Splink","SPF","Mechi, M.R.","172","Native","Prata","High","Estação Ecológica de Jataí","Não"
"ESTAÇÃO ECOLÓGICA JATAÍ","Angiosperms","Asteraceae","Aspilia","clausseniana","Baker","ASTERACEAE Aspilia clausseniana Baker","SPFR002550","Splink","SPFR","Mechi, M.R.","76","Native","Bronze","High","Estação Ecológica de Jataí","Não"
"ESTAÇÃO ECOLÓGICA JATAÍ","Angiosperms","Asteraceae","Aspilia","floribunda","(Gardner) Baker","ASTERACEAE Aspilia floribunda (Gardner) Baker","HUFU00081757","Splink","HUFU","Godoy, S.A.P.","2493","Native","Ouro","High","Estação Ecológica de Jataí","Não"
"ESTAÇÃO ECOLÓGICA JATAÍ","Angiosperms","Asteraceae","Baccharis","dracunculifolia","DC.","ASTERACEAE Baccharis dracunculifolia DC.","SPFR016018","Splink","SPFR","Faria, L.B.","121","Native","Bronze","High","Estação Ecológica de Jataí. Localizada próxima às Ruínas do Porto.","Não"
"ESTAÇÃO ECOLÓGICA JATAÍ","Angiosperms","Asteraceae","Baccharis","trinervis","Pers.","ASTERACEAE Baccharis trinervis Pers.","47195","GBIF","UEC","Leitao Filho, H.F.","18889","Native","Bronze","High","Estação Ecológica de Jataí.","Não"
"ESTAÇÃO ECOLÓGICA JATAÍ","Angiosperms","Asteraceae","Bidens","gardneri","Baker","ASTERACEAE Bidens gardneri Baker","SPFR016019","Splink","SPFR","Faria, L.B.","75","Native","Bronze","High","Estação Ecológica de Jataí","Não"
"ESTAÇÃO ECOLÓGICA JATAÍ","Angiosperms","Asteraceae","Chresta","sphaerocephala","DC.","ASTERACEAE Chresta sphaerocephala DC.","SPFR016020","Splink","SPFR","Faria, L.B.","148","Native","Bronze","High","Estação Ecológica de Jataí","Não"
"ESTAÇÃO ECOLÓGICA JATAÍ","Angiosperms","Asteraceae","Chromolaena","barbacensis","(Hieron.) R.M.King & H.Rob.","ASTERACEAE Chromolaena barbacensis (Hieron.) R.M.King & H.Rob.","SPFR002521","Splink","SPFR","Mechi, M.R.","119","Native","Bronze","High","Estação Ecológica de Jataí","Não"
"ESTAÇÃO ECOLÓGICA JATAÍ","Angiosperms","Asteraceae","Chromolaena","maximiliani","(Schrad. ex DC.) R.M.King & H.Rob.","ASTERACEAE Chromolaena maximiliani (Schrad. ex DC.) R.M.King & H.Rob.","SPFR016332","Splink","SPFR","Mechi, M.R.","122","Native","Bronze","High","Estação Ecológica de Jataí","Não"
"ESTAÇÃO ECOLÓGICA JATAÍ","Angiosperms","Asteraceae","Chromolaena","pungens","(Gardner) R.M.King & H.Rob.","ASTERACEAE Chromolaena pungens (Gardner) R.M.King & H.Rob.","HUFU00081754","Splink","HUFU","Godoy, S.A.P.","2496","Native","Ouro","High","Estação Ecológica de Jataí","Não"
"ESTAÇÃO ECOLÓGICA JATAÍ","Angiosperms","Asteraceae","Chromolaena","squalida","(DC.) R.M.King & H.Rob.","ASTERACEAE Chromolaena squalida (DC.) R.M.King & H.Rob.","HUFU00081753","Splink","HUFU","Godoy, S.A.P.","2497","Native","Ouro","High","Estação Ecológica de Jataí","Não"
"ESTAÇÃO ECOLÓGICA JATAÍ","Angiosperms","Asteraceae","Chrysolaena","cognata","(Less.) Dematt.","ASTERACEAE Chrysolaena cognata (Less.) Dematt.","SPFR016335","Splink","SPFR","Mechi, M.R.","168","Native","Bronze","High","Estação Ecológica de Jataí","Não"
"ESTAÇÃO ECOLÓGICA JATAÍ","Angiosperms","Asteraceae","Cyrtocymura","scorpioides","(Lam.) H.Rob.","ASTERACEAE Cyrtocymura scorpioides (Lam.) H.Rob.","SPFR016022","Splink","SPFR","Faria, L.B.","34","Native","Bronze","High","Estação Ecológica de Jataí","Não"
"ESTAÇÃO ECOLÓGICA JATAÍ","Angiosperms","Asteraceae","Dasyphyllum","sprengelianum","(Gardner) Cabrera","ASTERACEAE Dasyphyllum sprengelianum (Gardner) Cabrera","SPFR000244","Splink","SPFR","Marcondes-Ferreira, W.","425","Native","Ouro","High","Estação Ecológica de Jataí","Não"
"ESTAÇÃO ECOLÓGICA JATAÍ","Angiosperms","Asteraceae","Elephantopus",,"L.","ASTERACEAE Elephantopus L.","2571","GBIF","SPFR","Mechi, M.R.","184",,"Bronze","High","Estação Ecológica de Jataí","Não"
"ESTAÇÃO ECOLÓGICA JATAÍ","Angiosperms","Asteraceae","Emilia","sonchifolia","(L.) DC.","ASTERACEAE Emilia sonchifolia (L.) DC.","SPFR016023","Splink","SPFR","Faria, L.B.","1","Naturalized","Bronze","High","Estação Ecológica de Jataí. Localizada próxima às Ruínas do Porto.","Não"
"ESTAÇÃO ECOLÓGICA JATAÍ","Angiosperms","Asteraceae","Hoehnephytum","trixoides","(Gardner) Cabrera","ASTERACEAE Hoehnephytum trixoides (Gardner) Cabrera","SPFR016333","Splink","SPFR","Mechi, M.R.","147","Native","Bronze","High","Estação Ecológica de Jataí","Não"
"ESTAÇÃO ECOLÓGICA JATAÍ","Angiosperms","Asteraceae","Lessingianthus","onopordioides","(Baker) H.Rob.","ASTERACEAE Lessingianthus onopordioides (Baker) H.Rob.","HUFU00081815","Splink","HUFU","Mechi, M.R.","118","Native","Ouro","High","Estação Ecológica de Jataí","Não"
"ESTAÇÃO ECOLÓGICA JATAÍ","Angiosperms","Asteraceae","Lessingianthus","rubricaulis","(Humb. & Bonpl.) H.Rob.","ASTERACEAE Lessingianthus rubricaulis (Humb. & Bonpl.) H.Rob.","47193","GBIF","UEC","Leitao Filho, H.F.","18892","Native","Bronze","High","Estação Ecológica de Jataí.","Não"
"ESTAÇÃO ECOLÓGICA JATAÍ","Angiosperms","Asteraceae","Mikania","cordifolia","(L.f.) Willd.","ASTERACEAE Mikania cordifolia (L.f.) Willd.","SPFR016025","Splink","SPFR","Faria, L.B.","141","Native","Bronze","High","Estação Ecológica de Jataí","Não"
"ESTAÇÃO ECOLÓGICA JATAÍ","Angiosperms","Asteraceae","Mikania","oblongifolia","DC.","ASTERACEAE Mikania oblongifolia DC.","SPFR002555","Splink","SPFR","Mechi, M.R.","46","Native","Bronze","High","Estação Ecológica de Jataí","Não"
"ESTAÇÃO ECOLÓGICA JATAÍ","Angiosperms","Asteraceae","Mikania","psilostachya","DC.","ASTERACEAE Mikania psilostachya DC.","RB00410570","GBIF","RB","Leitao Filho, H.F.",,"Native","Ouro","High","Estação Ecologica de Jataí.","Não"
"ESTAÇÃO ECOLÓGICA JATAÍ","Angiosperms","Asteraceae","Moquiniastrum","barrosoae","(Cabrera) G. Sancho","ASTERACEAE Moquiniastrum barrosoae (Cabrera) G. Sancho","SPFR002569","Splink","SPFR","Mechi, M.R.","138","Native","Ouro","High","Estação Ecológica de Jataí","Não"
"ESTAÇÃO ECOLÓGICA JATAÍ","Angiosperms","Asteraceae","Moquiniastrum","polymorphum","(Less.) G. Sancho","ASTERACEAE Moquiniastrum polymorphum (Less.) G. Sancho","SPFR016024","Splink","SPFR","Faria, L.B.","151","Native","Ouro","High","Estação Ecológica de Jataí","Não"
"ESTAÇÃO ECOLÓGICA JATAÍ","Angiosperms","Asteraceae","Moquiniastrum","pulchrum","(Cabrera) G.Sancho","ASTERACEAE Moquiniastrum pulchrum (Cabrera) G.Sancho","SPFR013701","Splink","SPFR","Gimenez, V.M.M.",,"Native","Ouro","High","Estação Ecológica de Jataí","Não"
"ESTAÇÃO ECOLÓGICA JATAÍ","Angiosperms","Asteraceae","Piptocarpha","rotundifolia","(Less.) Baker","ASTERACEAE Piptocarpha rotundifolia (Less.) Baker","SPFR016027","Splink","SPFR","Faria, L.B.","86","Native","Bronze","High","Estação Ecológica de Jataí","Não"
"ESTAÇÃO ECOLÓGICA JATAÍ","Angiosperms","Asteraceae","Tilesia","baccata","(L.) Pruski","ASTERACEAE Tilesia baccata (L.) Pruski","SPFR016031","Splink","SPFR","Faria, L.B.","87","Naturalized","Bronze","High","Estação Ecológica de Jataí","Não"
"ESTAÇÃO ECOLÓGICA JATAÍ","Angiosperms","Asteraceae","Trichogonia","attenuata","G.M.Barroso","ASTERACEAE Trichogonia attenuata G.M.Barroso","SPFR002513","Splink","SPFR","Mechi, M.R.","95","Native","Bronze","High","Estação Ecológica de Jataí","Não"
"ESTAÇÃO ECOLÓGICA JATAÍ","Angiosperms","Asteraceae","Trichogonia","salviifolia","Gardner","ASTERACEAE Trichogonia salviifolia Gardner","UEC130620","Splink","UEC","Leitao Filho, H.F.","18886","Native","Ouro","High","Estação ecológica de Jataí.","Não"
"ESTAÇÃO ECOLÓGICA JATAÍ","Angiosperms","Asteraceae","Verbesina","sordescens","DC.","ASTERACEAE Verbesina sordescens DC.","47191","GBIF","UEC","Leitao Filho, H.F.","18895","Native","Bronze","High","Estação Ecológica de Jataí.","Não"
"ESTAÇÃO ECOLÓGICA JATAÍ","Angiosperms","Asteraceae","Vernonanthura","membranacea","(Gardner) H.Rob.","ASTERACEAE Vernonanthura membranacea (Gardner) H.Rob.","SPFR002522","Splink","SPFR","Mechi, M.R.","123","Native","Bronze","High","Estação Ecológica de Jataí","Não"
"ESTAÇÃO ECOLÓGICA JATAÍ","Angiosperms","Asteraceae","Vernonanthura","polyanthes","(Sprengel) Vega & Dematteis","ASTERACEAE Vernonanthura polyanthes (Sprengel) Vega & Dematteis","SPFR016028","Splink","SPFR","Faria, L.B.","134","Native","Bronze","High","Estação Ecológica de Jataí","Não"
"ESTAÇÃO ECOLÓGICA JATAÍ","Angiosperms","Asteraceae","Wedelia","goyazensis","Gardner","ASTERACEAE Wedelia goyazensis Gardner","IBGE00029703","Reflora","UEC","Leitao, H.F.","18907","Native","Ouro","High","Estação Ecológica de Jatai.","Não"
"ESTAÇÃO ECOLÓGICA JATAÍ","Angiosperms","Balanophoraceae","Helosis","cayanensis","(Sw.) Spreng.","BALANOPHORACEAE Helosis cayanensis (Sw.) Spreng.","182195","GBIF","SPF","Groppo, M.","1250","Native","Bronze","High","Estação Ecológica de Jataí","Não"
"ESTAÇÃO ECOLÓGICA JATAÍ","Angiosperms","Bignoniaceae","Adenocalymma","peregrinum","(Miers) L.G.Lohmann","BIGNONIACEAE Adenocalymma peregrinum (Miers) L.G.Lohmann","SPF00225472","Splink","SPF","Faria, L.B.","179","Native","Ouro","High","Estação Ecológica de Jataí, Ao longo da trilha que leva à Represa Beija-Flor","Não"
"ESTAÇÃO ECOLÓGICA JATAÍ","Angiosperms","Bignoniaceae","Amphilophium","elongatum","(Vahl) L.G.Lohmann","BIGNONIACEAE Amphilophium elongatum (Vahl) L.G.Lohmann","SPF00225477","Splink","SPF","Faria, L.B.","53","Native","Ouro","High","Estação Ecológica de Jataí, Ao longo da trilha que leva às Ruínas do Porto","Não"
"ESTAÇÃO ECOLÓGICA JATAÍ","Angiosperms","Bignoniaceae","Amphilophium","mansoanum","(DC.) L.G.Lohmann","BIGNONIACEAE Amphilophium mansoanum (DC.) L.G.Lohmann","SPFR002620","Splink","SPFR","Mechi, M.R.","24","Native","Bronze","High","Estação Ecológica de Jataí","Não"
"ESTAÇÃO ECOLÓGICA JATAÍ","Angiosperms","Bignoniaceae","Amphilophium","paniculatum","(L.) Kunth","BIGNONIACEAE Amphilophium paniculatum (L.) Kunth","SPFR000288","Splink","SPFR","Marcondes-Ferreira, W.","421","Native","Latão","High","Estação Ecológica de Jataí","Não"
"ESTAÇÃO ECOLÓGICA JATAÍ","Angiosperms","Bignoniaceae","Anemopaegma","arvense","(Vell.) Stellfeld ex de Souza","BIGNONIACEAE Anemopaegma arvense (Vell.) Stellfeld ex de Souza","HPBR010117","Splink","HPBR","Toppa, R.",,"Native","Bronze","High","ESTAÇÃO ECOLÓGICA JATAÍ","Não"
"ESTAÇÃO ECOLÓGICA JATAÍ","Angiosperms","Bignoniaceae","Anemopaegma","chamberlaynii","(Sims) Bureau & K.Schum.","BIGNONIACEAE Anemopaegma chamberlaynii (Sims) Bureau & K.Schum.","SPF00225479","Splink","SPF","Faria, L.B.","96","Native","Ouro","High","Estação Ecológica de Jataí, Última trilha à esquerda antes das Ruínas do Porto","Não"
"ESTAÇÃO ECOLÓGICA JATAÍ","Angiosperms","Bignoniaceae","Anemopaegma","glaucum","Mart. ex DC.","BIGNONIACEAE Anemopaegma glaucum Mart. ex DC.","HPBR010072","Splink","HPBR","Toppa, R.",,"Native","Bronze","High","ESTAÇÃO ECOLÓGICA JATAÍ","Não"
"ESTAÇÃO ECOLÓGICA JATAÍ","Angiosperms","Bignoniaceae","Cuspidaria","convoluta","(Vell.) A.H.Gentry","BIGNONIACEAE Cuspidaria convoluta (Vell.) A.H.Gentry","SPF00225483","Splink","SPF","Faria, L.B.","165","Native","Ouro","High","Estação Ecológica de Jataí","Não"
"ESTAÇÃO ECOLÓGICA JATAÍ","Angiosperms","Bignoniaceae","Cuspidaria","pulchra","(Cham.) L.G.Lohmann","BIGNONIACEAE Cuspidaria pulchra (Cham.) L.G.Lohmann","SPF00225481","Splink","SPF","Faria, L.B.","140","Native","Ouro","High","Estação Ecológica de Jataí, Ao longo da trilha que leva às Ruínas do Porto","Não"
"ESTAÇÃO ECOLÓGICA JATAÍ","Angiosperms","Bignoniaceae","Dolichandra","unguis-cati","(L.) L.G.Lohmann","BIGNONIACEAE Dolichandra unguis-cati (L.) L.G.Lohmann","225484","GBIF","SPF","Faria, L.B.","173","Native","Ouro","High","Estação Ecológica de Jataí","Não"
"ESTAÇÃO ECOLÓGICA JATAÍ","Angiosperms","Bignoniaceae","Fridericia","chica","(Bonpl.) L.G.Lohmann","BIGNONIACEAE Fridericia chica (Bonpl.) L.G.Lohmann","SPFR016336","Splink","SPFR","Mechi, M.R.","103","Native","Ouro","High","Estação Ecológica de Jataí","Não"
"ESTAÇÃO ECOLÓGICA JATAÍ","Angiosperms","Bignoniaceae","Fridericia","craterophora","(DC.) L.G.Lohmann","BIGNONIACEAE Fridericia craterophora (DC.) L.G.Lohmann","SPF00225485","Splink","SPF","Faria, L.B.","85","Native","Ouro","High","Estação Ecológica de Jataí, Ao longo da trilha que leva às Ruínas do Porto","Não"
"ESTAÇÃO ECOLÓGICA JATAÍ","Angiosperms","Bignoniaceae","Fridericia","florida","(DC.) L.G.Lohmann","BIGNONIACEAE Fridericia florida (DC.) L.G.Lohmann","SPF00225474","Splink","SPF","Faria, L.B.","98","Native","Ouro","High","Estação Ecológica de Jataí, Ao longo da trilha que leva às Ruínas do Porto","Não"
"ESTAÇÃO ECOLÓGICA JATAÍ","Angiosperms","Bignoniaceae","Fridericia","platyphylla","(Cham.) L.G.Lohmann","BIGNONIACEAE Fridericia platyphylla (Cham.) L.G.Lohmann","SPF00225482","Splink","SPF","Faria, L.B.","84","Native","Ouro","High","Estação Ecológica de Jataí, Ao longo da trilha que leva às Ruínas do Porto","Não"
"ESTAÇÃO ECOLÓGICA JATAÍ","Angiosperms","Bignoniaceae","Fridericia","speciosa","Mart.","BIGNONIACEAE Fridericia speciosa Mart.","SPF00225475","Splink","SPF","Faria, L.B.","38","Native","Ouro","High","Estação Ecológica de Jataí, Última trilha à esquerda antes das Ruínas do Porto","Não"
"ESTAÇÃO ECOLÓGICA JATAÍ","Angiosperms","Bignoniaceae","Fridericia","triplinervia","(Mart. ex DC.) L.G.Lohmann","BIGNONIACEAE Fridericia triplinervia (Mart. ex DC.) L.G.Lohmann","SPF00225478","Splink","SPF","Faria, L.B.","113","Native","Ouro","High","Estação Ecológica de Jataí, Ao longo da trilha que leva às Ruínas do Porto","Não"
"ESTAÇÃO ECOLÓGICA JATAÍ","Angiosperms","Bignoniaceae","Handroanthus","ochraceus","(Cham.) Mattos","BIGNONIACEAE Handroanthus ochraceus (Cham.) Mattos","HPBR009996","Splink","HPBR","Toppa, R.",,"Native","Bronze","High","ESTAÇÃO ECOLÓGICA JATAÍ","Não"
"ESTAÇÃO ECOLÓGICA JATAÍ","Angiosperms","Bignoniaceae","Jacaranda","caroba","(Vell.) DC.","BIGNONIACEAE Jacaranda caroba (Vell.) DC.","SPF00225480","Splink","SPF","Faria, L.B.","125","Native","Ouro","High","Estação Ecológica de Jataí, Ao longo da trilha que leva às Ruínas do Porto","Não"
"ESTAÇÃO ECOLÓGICA JATAÍ","Angiosperms","Bignoniaceae","Jacaranda","decurrens","Cham.","BIGNONIACEAE Jacaranda decurrens Cham.","SPFR002541","Splink","SPFR","Mechi, M.R.","37","Native","Bronze","High","Estação Ecológica de Jataí","Não"
"ESTAÇÃO ECOLÓGICA JATAÍ","Angiosperms","Bignoniaceae","Jacaranda","puberula","Cham.","BIGNONIACEAE Jacaranda puberula Cham.","SPFR002542","Splink","SPFR","Mechi, M.R.","176","Native","Ouro","High","Estação Ecológica de Jataí","Não"
"ESTAÇÃO ECOLÓGICA JATAÍ","Angiosperms","Bignoniaceae","Lundia","obliqua","Sond.","BIGNONIACEAE Lundia obliqua Sond.","SPF00225473","Splink","SPF","Faria, L.B.","97","Native","Ouro","High","Estação Ecológica de Jataí, Ao longo da trilha que leva às Ruínas do Porto","Não"
"ESTAÇÃO ECOLÓGICA JATAÍ","Angiosperms","Bignoniaceae","Pyrostegia","venusta","(Ker Gawl.) Miers","BIGNONIACEAE Pyrostegia venusta (Ker Gawl.) Miers","225476","GBIF","SPF","Faria, L.B.","27","Native","Ouro","High","Estação Ecológica de Jataí, Ao longo da trilha que leva às Ruínas do Porto","Não"
"ESTAÇÃO ECOLÓGICA JATAÍ","Angiosperms","Bignoniaceae","Stizophyllum","perforatum","(Cham.) Miers","BIGNONIACEAE Stizophyllum perforatum (Cham.) Miers","SPFR016312","Splink","SPFR","Gimenez, V.M.M.","4475","Native","Bronze","High","Estação Ecológica de Jataí","Não"
"ESTAÇÃO ECOLÓGICA JATAÍ","Angiosperms","Bignoniaceae","Tabebuia","aurea","(Silva Manso) Benth. & Hook.f. ex S.Moore","BIGNONIACEAE Tabebuia aurea (Silva Manso) Benth. & Hook.f. ex S.Moore","HPBR010045","Splink","HPBR","Toppa, R.",,"Native","Bronze","High","ESTAÇÃO ECOLÓGICA JATAÍ","Não"
