"UC","Grupos","Família","Gênero","Espécie","Autor","Táxon_completo","Barcode","BD_Origem","Herbário","Coletor","Número_da_Coleta","Origem_FFBr","ConfiançaID","Localidade","Já listada"
"ESTAÇÃO ECOLÓGICA ITAPEVA","Angiosperms","Melastomataceae","Miconia","trianae","Cogn.","MELASTOMATACEAE Miconia trianae Cogn.","SPSF00041094","Splink","SPSF","Baitello, J.B.","2190","Native","Ouro","Estação Ecológica","Não"
"ESTAÇÃO ECOLÓGICA ITAPEVA","Angiosperms","Melastomataceae","Microlicia","minima","Markgr.","MELASTOMATACEAE Microlicia minima Markgr.","76027","GBIF","UEC","Souza, V.C.","8630","Native","Bronze","Estação Ecológica de Itapeva, Campo arenoso.","Não"
"ESTAÇÃO ECOLÓGICA ITAPEVA","Angiosperms","Melastomataceae","Pleroma","hatschbachii","(Wurdack) P.J.F.Guim.&Michelang.","MELASTOMATACEAE Pleroma hatschbachii (Wurdack) P.J.F.Guim.&Michelang.","254021","GBIF","SP","Chiea, S.A.C.","695","Native","Bronze","Estação Ecológica de Itapeva","Não"
"ESTAÇÃO ECOLÓGICA ITAPEVA","Angiosperms","Melastomataceae","Pleroma","martiale","(Cham.) Triana","MELASTOMATACEAE Pleroma martiale (Cham.) Triana","HUEFS0178444","Splink","HUEFS","Cielo Filho, R.","866","Native","Bronze","Estaçao Ecológica.","Não"
"ESTAÇÃO ECOLÓGICA ITAPEVA","Angiosperms","Melastomataceae","Pleroma","oleifolium","(DC.) R. Romero & Versiane","MELASTOMATACEAE Pleroma oleifolium (DC.) R. Romero & Versiane","254252","GBIF","SP","Chiea, S.A.C.","693","Native","Ouro","Estação Ecológica de Itapeva","Não"
"ESTAÇÃO ECOLÓGICA ITAPEVA","Angiosperms","Melastomataceae","Pleroma","stenocarpum","(Schrank et Mart. ex DC.) Triana","MELASTOMATACEAE Pleroma stenocarpum (Schrank et Mart. ex DC.) Triana","SPSF00039597","Splink","SPSF","Baitello, J.B.","2027","Native","Ouro","Estação Ecológica","Não"
"ESTAÇÃO ECOLÓGICA ITAPEVA","Angiosperms","Melastomataceae","Rhynchanthera","dichotoma","(Desr.) DC.","MELASTOMATACEAE Rhynchanthera dichotoma (Desr.) DC.","SPSF00039819","Splink","SPSF","Ribeiro, A.P.","52","Native","Prata","Estação Ecológica","Não"
"ESTAÇÃO ECOLÓGICA ITAPEVA","Angiosperms","Melastomataceae|Orchidaceae","Corymborkis",,"Thouars","MELASTOMATACEAE|ORCHIDACEAE Corymborkis Thouars","UPCB00018565","Reflora","UPCB","Ribeiro, A.P.","52",,"Ouro","Estação Ecológica, aceiro da SP.","Não"
"ESTAÇÃO ECOLÓGICA ITAPEVA","Angiosperms","Meliaceae","Guarea","macrophylla","(Vell.) T.D.Penn.","MELIACEAE Guarea macrophylla subsp. tuberculata (Vell.) T.D.Penn.","291989","Splink","SP","Souza, V.C.","7446","Native","Ouro","Estação Ecológica de Itapeva","Não"
"ESTAÇÃO ECOLÓGICA ITAPEVA","Angiosperms","Meliaceae","Guarea","macrophylla","Vahl","MELIACEAE Guarea macrophylla Vahl","SPSF00040499","Splink","SPSF","Lima, C.R.","77","Native","Bronze","Estação Ecológica","Não"
"ESTAÇÃO ECOLÓGICA ITAPEVA","Angiosperms","Monimiaceae","Mollinedia","elegans","Tul.","MONIMIACEAE Mollinedia elegans Tul.","SPSF00041102","Splink","SPSF","Baitello, J.B.","2198","Native","Prata","Estação Ecológica","Não"
"ESTAÇÃO ECOLÓGICA ITAPEVA","Angiosperms","Monimiaceae","Mollinedia","schottiana","(Spreng.) Perkins","MONIMIACEAE Mollinedia schottiana (Spreng.) Perkins","SPSF00041100","Splink","SPSF","Baitello, J.B.","2196","Native","Prata","Estação Ecológica","Não"
"ESTAÇÃO ECOLÓGICA ITAPEVA","Angiosperms","Moraceae","Brosimum","gaudichaudii","Trécul","MORACEAE Brosimum gaudichaudii Trécul","SPSF00041468","Splink","SPSF","Baitello, J.B.","2241","Native","Bronze","Estação Ecológica","Não"
"ESTAÇÃO ECOLÓGICA ITAPEVA","Angiosperms","Myrtaceae","Blepharocalyx","salicifolius","(Kunth) O.Berg","MYRTACEAE Blepharocalyx salicifolius (Kunth) O.Berg","33435","GBIF","FLOR","Aguiar, O.T.","1256","Native","Ouro","Estação Ecológica, caminho para o bairro de Engenheiro Maia próximo a um córrego.","Não"
"ESTAÇÃO ECOLÓGICA ITAPEVA","Angiosperms","Myrtaceae","Campomanesia","adamantium","(Cambess.) O.Berg","MYRTACEAE Campomanesia adamantium (Cambess.) O.Berg","ASU0009282","Splink","ASU","Souza, V.C.","7456","Native","Ouro","Estacao Ecologica","Não"
"ESTAÇÃO ECOLÓGICA ITAPEVA","Angiosperms","Myrtaceae","Campomanesia","pubescens","(Mart. ex DC.) O.Berg","MYRTACEAE Campomanesia pubescens (Mart. ex DC.) O.Berg","SPSF00041862","Splink","SPSF","Baitello, J.B.","2358","Native","Ouro","Estação Ecológica","Não"
"ESTAÇÃO ECOLÓGICA ITAPEVA","Angiosperms","Myrtaceae","Eugenia","aurata","O.Berg","MYRTACEAE Eugenia aurata O.Berg","101649","GBIF","SPF","Tamashiro, J.Y.","1314","Native","Latão","Estação Experimental de Itapeva","Não"
"ESTAÇÃO ECOLÓGICA ITAPEVA","Angiosperms","Myrtaceae","Eugenia","bimarginata","DC.","MYRTACEAE Eugenia bimarginata DC.","SPSF00041848","Splink","SPSF","Baitello, J.B.","2354","Native","Ouro","Estação Ecológica","Não"
"ESTAÇÃO ECOLÓGICA ITAPEVA","Angiosperms","Myrtaceae","Eugenia","hamiltonii","(Mattos) Mattos","MYRTACEAE Eugenia hamiltonii (Mattos) Mattos","241637","GBIF","MBM","Souza, V.C.","8726","Native","Ouro","Estação Ecológica de Itapeva.","Não"
"ESTAÇÃO ECOLÓGICA ITAPEVA","Angiosperms","Myrtaceae","Eugenia","hiemalis","Cambess.","MYRTACEAE Eugenia hiemalis Cambess.","SPSF00041304","Splink","SPSF","Baitello, J.B.","2215","Native","Ouro","Estação Ecológica","Não"
"ESTAÇÃO ECOLÓGICA ITAPEVA","Angiosperms","Myrtaceae","Eugenia","pitanga","(O.Berg) Nied.","MYRTACEAE Eugenia pitanga (O.Berg) Nied.","SPSF00041867","Splink","SPSF","Cielo Filho, R.","922","Native","Ouro","Estação Ecológica","Não"
"ESTAÇÃO ECOLÓGICA ITAPEVA","Angiosperms","Myrtaceae","Myrcia","albidotomentosa","(Amshoff) McVaugh","MYRTACEAE Myrcia albidotomentosa (Amshoff) McVaugh","41896","GBIF","SPSF","Cielo Filho, R.","928","Native","Ouro","Estação Ecológica","Não"
"ESTAÇÃO ECOLÓGICA ITAPEVA","Angiosperms","Myrtaceae","Myrcia","albotomentosa","DC.","MYRTACEAE Myrcia albotomentosa DC.","SPSF00041888","Splink","SPSF","Cielo Filho, R.","926","Native","Ouro","Estação Ecológica","Não"
"ESTAÇÃO ECOLÓGICA ITAPEVA","Angiosperms","Myrtaceae","Myrcia","anacardiifolia","Gardner","MYRTACEAE Myrcia anacardiifolia Gardner","118288","GBIF","ESA","Aguiar, O.T.","1257","Native","Bronze","Estação Ecológica","Não"
"ESTAÇÃO ECOLÓGICA ITAPEVA","Angiosperms","Myrtaceae","Myrcia","bella","Cambess.","MYRTACEAE Myrcia bella Cambess.","306936","Splink","SP","Souza, V.C.","7438","Native","Ouro","Estação Ecológica de Itapeva, cerradão","Não"
"ESTAÇÃO ECOLÓGICA ITAPEVA","Angiosperms","Myrtaceae","Myrcia","brasiliensis","Kiaersk.","MYRTACEAE Myrcia brasiliensis Kiaersk.","SP029677","Splink","SP","Tamashiro, J.Y.","1324","Native","Bronze","Estação Experimental de Itapeva, Engenheiro Maia","Não"
"ESTAÇÃO ECOLÓGICA ITAPEVA","Angiosperms","Myrtaceae","Myrcia","glomerata","(Cambess.) G.P.Burton & E.Lucas","MYRTACEAE Myrcia glomerata (Cambess.) G.P.Burton & E.Lucas","SPSF00041861","Splink","SPSF","Baitello, J.B.","2357","Native","Ouro","Estação Ecológica","Não"
"ESTAÇÃO ECOLÓGICA ITAPEVA","Angiosperms","Myrtaceae","Myrcia","guianensis","(Aubl.) DC.","MYRTACEAE Myrcia guianensis (Aubl.) DC.","189444","GBIF","MBM","Souza, C.","7068","Native","Ouro","Estação Ecológica.","Não"
"ESTAÇÃO ECOLÓGICA ITAPEVA","Angiosperms","Myrtaceae","Myrcia","hartwegiana","(O.Berg) Kiaersk.","MYRTACEAE Myrcia hartwegiana (O.Berg) Kiaersk.","SPSF00041303","Splink","SPSF","Baitello, J.B.","2214","Native","Ouro","Estação Ecológica","Não"
"ESTAÇÃO ECOLÓGICA ITAPEVA","Angiosperms","Myrtaceae","Myrcia","multiflora","(Lam.) DC.","MYRTACEAE Myrcia multiflora (Lam.) DC.","UEC111214","Splink","UEC","Souza, V.C.","7445","Native","Ouro","Estação Ecológica de Itapeva.","Não"
"ESTAÇÃO ECOLÓGICA ITAPEVA","Angiosperms","Myrtaceae","Myrcia","selloi","(Spreng.) N.Silveira","MYRTACEAE Myrcia selloi (Spreng.) N.Silveira","SPSF00040127","Splink","SPSF","Lima, C.R.","328","Native","Ouro","Estação Ecológica","Não"
"ESTAÇÃO ECOLÓGICA ITAPEVA","Angiosperms","Myrtaceae","Myrcia","splendens","(Sw.) DC.","MYRTACEAE Myrcia splendens (Sw.) DC.","UEC111211","Splink","UEC","Souza, V.C.","7438","Native","Ouro","Estação Ecológica de Itapeva.","Não"
"ESTAÇÃO ECOLÓGICA ITAPEVA","Angiosperms","Myrtaceae","Myrcia","subcordata","DC.","MYRTACEAE Myrcia subcordata DC.","SPSF00041894","Splink","SPSF","Aguiar, O.T.","1264","Native","Ouro","Estação Ecológica","Não"
"ESTAÇÃO ECOLÓGICA ITAPEVA","Angiosperms","Myrtaceae","Myrcia","venulosa","DC.","MYRTACEAE Myrcia venulosa DC.","SPSF00041892","Splink","SPSF","Aguiar, O.T.","1262","Native","Ouro","Estação Ecológica","Não"
"ESTAÇÃO ECOLÓGICA ITAPEVA","Angiosperms","Myrtaceae","Myrciaria","cuspidata","O.Berg","MYRTACEAE Myrciaria cuspidata O.Berg","SPSF00041858","Splink","SPSF","Aguiar, O.T.","1255","Native","Ouro","Estação Ecológica","Não"
"ESTAÇÃO ECOLÓGICA ITAPEVA","Angiosperms","Myrtaceae","Myrciaria","tenella","(DC.) O.Berg","MYRTACEAE Myrciaria tenella (DC.) O.Berg","SPSF00041902","Splink","SPSF","Cielo Filho, R.","934","Native","Ouro","Estação Ecológica","Não"
"ESTAÇÃO ECOLÓGICA ITAPEVA","Angiosperms","Myrtaceae","Psidium","australe","Cambess.","MYRTACEAE Psidium australe Cambess.","SPSF00041891","Splink","SPSF","Baitello, J.B.","2362","Native","Ouro","Estação Ecológica","Não"
"ESTAÇÃO ECOLÓGICA ITAPEVA","Angiosperms","Myrtaceae","Psidium","firmum","O.Berg","MYRTACEAE Psidium firmum O.Berg","3146","GBIF","HURB","Baitello, J.B.","2364","Native","Ouro","Estação ecológica.","Não"
"ESTAÇÃO ECOLÓGICA ITAPEVA","Angiosperms","Myrtaceae","Psidium","grandifolium","Mart. ex DC.","MYRTACEAE Psidium grandifolium Mart. ex DC.","SPSF00041903","Splink","SPSF","Cielo Filho, R.","935","Native","Ouro","Estação Ecológica","Não"
"ESTAÇÃO ECOLÓGICA ITAPEVA","Angiosperms","Myrtaceae","Psidium","laruotteanum","Cambess.","MYRTACEAE Psidium laruotteanum Cambess.","SPSF00041904","Splink","SPSF","Cielo Filho, R.","936","Native","Ouro","Estação Ecológica","Não"
"ESTAÇÃO ECOLÓGICA ITAPEVA","Angiosperms","Ochnaceae",,,"DC.","OCHNACEAE Ochnaceae DC.","UEC017309","Splink","UEC","Souza, V.C.","7454",,"Latão","Estação Ecológica de Itapeva","Não"
"ESTAÇÃO ECOLÓGICA ITAPEVA","Angiosperms","Ochnaceae","Ouratea","floribunda","(A.St.-Hil.) Engl.","OCHNACEAE Ouratea floribunda (A.St.-Hil.) Engl.","292805","GBIF","SP","Souza, V.C.","8730","Native","Bronze","Estação Ecológica de Itapeva","Não"
"ESTAÇÃO ECOLÓGICA ITAPEVA","Angiosperms","Ochnaceae","Ouratea","humilis","(A.St.-Hil.) Engl.","OCHNACEAE Ouratea humilis (A.St.-Hil.) Engl.","186188","GBIF","UEC","Souza, V.C.","8730","Native","Ouro","Brasil, São Paulo, Município de Itapeva. Estação Ecológica de Itapeva.","Não"
"ESTAÇÃO ECOLÓGICA ITAPEVA","Angiosperms","Ochnaceae","Ouratea","salicifolia","(A.St.-Hil. & Tul.) Engl.","OCHNACEAE Ouratea salicifolia (A.St.-Hil. & Tul.) Engl.","SPSF00040490","Splink","SPSF","Baitello, J.B.","2178","Native","Bronze","Estação Ecológica","Não"
"ESTAÇÃO ECOLÓGICA ITAPEVA","Angiosperms","Ochnaceae","Ouratea","spectabilis","(Mart.) Engl.","OCHNACEAE Ouratea spectabilis (Mart.) Engl.","ESA023531","Reflora","ESA","Souza, V.C.","8730","Native","Ouro","Estação Ecológica de Itapeva. Transição campo-cerrado.","Não"
"ESTAÇÃO ECOLÓGICA ITAPEVA","Angiosperms","Onagraceae","Ludwigia","nervosa","(Poir.) H.Hara","ONAGRACEAE Ludwigia nervosa (Poir.) H.Hara","290332","Splink","SP","Tamashiro, J.Y.","1327","Native","Ouro","Estação Experimental de Itapeva Engenheiro Maia","Não"
"ESTAÇÃO ECOLÓGICA ITAPEVA","Angiosperms","Orchidaceae","Epidendrum","denticulatum","Barb.Rodr.","ORCHIDACEAE Epidendrum denticulatum Barb.Rodr.","SPSF00039751","Splink","SPSF","Ribeiro, A.P.","33","Native","Ouro","Estação Ecológica","Não"
"ESTAÇÃO ECOLÓGICA ITAPEVA","Angiosperms","Orchidaceae","Gomesa","flexuosa","(Lodd.) M.W.Chase & N.H.Williams","ORCHIDACEAE Gomesa flexuosa (Lodd.) M.W.Chase & N.H.Williams","SPSF00040494","Splink","SPSF","Baitello, J.B.","2182","Native","Ouro","Estação Ecológica","Não"
"ESTAÇÃO ECOLÓGICA ITAPEVA","Angiosperms","Orchidaceae","Gomesa","ramosa","(Lindl.) M.W.Chase & N.H.Williams","ORCHIDACEAE Gomesa ramosa (Lindl.) M.W.Chase & N.H.Williams","SPSF00039600","Splink","SPSF","Baitello, J.B.","2030","Native","Ouro","Estação Ecológica","Não"
"ESTAÇÃO ECOLÓGICA ITAPEVA","Angiosperms","Orchidaceae","Leptotes","bicolor","Lindl.","ORCHIDACEAE Leptotes bicolor Lindl.","SPSF00040275","Splink","SPSF","Baitello, J.B.","2122","Native","Ouro","Estação Ecológica","Não"
"ESTAÇÃO ECOLÓGICA ITAPEVA","Angiosperms","Orchidaceae","Octomeria",,"R.Br.","ORCHIDACEAE Octomeria R.Br.","SPSF00040360","Splink","SPSF","Baitello, J.B.","2139",,"Bronze","Estação Experimental","Não"
"ESTAÇÃO ECOLÓGICA ITAPEVA","Angiosperms","Orchidaceae","Polystachya","caespitosa","Barb.Rodr.","ORCHIDACEAE Polystachya caespitosa Barb.Rodr.","SPSF00040503","Splink","SPSF","Lima, C.R.","81","Native","Ouro","Estação Ecológica","Não"
"ESTAÇÃO ECOLÓGICA ITAPEVA","Angiosperms","Oxalidaceae","Oxalis","conorrhiza","Jacq.","OXALIDACEAE Oxalis conorrhiza Jacq.","74182","GBIF","FLOR","Souza, V.C.","7051","Native","Ouro","Estação Ecológica de Itapeva.","Não"
"ESTAÇÃO ECOLÓGICA ITAPEVA","Angiosperms","Peraceae","Pera","glabrata","(Schott) Baill.","PERACEAE Pera glabrata (Schott) Baill.","SPSF00039706","Splink","SPSF","Aguiar, O.T.","841","Native","Bronze","Estação Ecológica","Não"
"ESTAÇÃO ECOLÓGICA ITAPEVA","Angiosperms","Piperaceae","Piper","mollicomum","Kunth","PIPERACEAE Piper mollicomum Kunth","SPSF00041158","Splink","SPSF","Cielo Filho, R.","807","Native","Ouro","Estação Ecológica","Não"
"ESTAÇÃO ECOLÓGICA ITAPEVA","Angiosperms","Piperaceae","Piper","regnellii","(Miq.) C.DC.","PIPERACEAE Piper regnellii (Miq.) C.DC.","292591","Splink","SP","Tamashiro, J.Y.","1323","Native","Ouro","Estação Experimental de Itapeva. Engenheiro Maia.","Não"
"ESTAÇÃO ECOLÓGICA ITAPEVA","Angiosperms","Poaceae","Andropogon","bicornis","L.","POACEAE Andropogon bicornis L.","SPSF00039673","Splink","SPSF","Baitello, J.B.","2035","Native","Ouro","Estação Ecológica","Não"
"ESTAÇÃO ECOLÓGICA ITAPEVA","Angiosperms","Poaceae","Anthaenantia","lanata","(Kunth) Benth.","POACEAE Anthaenantia lanata (Kunth) Benth.","289924","GBIF","SP","Souza, V.C.","8642","Native","Ouro","Estação Ecológica de Itapeva","Não"
"ESTAÇÃO ECOLÓGICA ITAPEVA","Angiosperms","Poaceae","Axonopus","brasiliensis","(Spreng.) Kuhlm.","POACEAE Axonopus brasiliensis (Spreng.) Kuhlm.","SPSF00041170","Splink","SPSF","Cielo Filho, R.","819","Native","Bronze","Estação Ecológica","Não"
"ESTAÇÃO ECOLÓGICA ITAPEVA","Angiosperms","Poaceae","Axonopus","pressus","(Nees ex Steud.) Parodi","POACEAE Axonopus pressus (Nees ex Steud.) Parodi","289923","GBIF","SP","Souza, V.C.","8640","Native","Ouro","Estação Ecológica de Itapeva","Não"
"ESTAÇÃO ECOLÓGICA ITAPEVA","Angiosperms","Poaceae","Chusquea","meyeriana","Rupr. ex Döll","POACEAE Chusquea meyeriana Rupr. ex Döll","289917","Splink","SP","Souza, V.C.","7441","Native","Ouro","Estação Ecológica de Itapeva","Não"
"ESTAÇÃO ECOLÓGICA ITAPEVA","Angiosperms","Poaceae","Ctenium","polystachyum","Balansa","POACEAE Ctenium polystachyum Balansa","SPSF00039688","Splink","SPSF","Baitello, J.B.","2050","Native","Bronze","Estação Ecológica","Não"
"ESTAÇÃO ECOLÓGICA ITAPEVA","Angiosperms","Poaceae","Eustachys","retusa","(Lag.) Kunth","POACEAE Eustachys retusa (Lag.) Kunth","SPF00193190","Splink","SPF","Cielo Filho, R.","847","Native","Bronze","Estação Ecológica de Itapeva","Não"
"ESTAÇÃO ECOLÓGICA ITAPEVA","Angiosperms","Poaceae","Oedochloa","procurrens","(Nees ex Trin.) C.Silva & R.P.Oliveira","POACEAE Oedochloa procurrens (Nees ex Trin.) C.Silva & R.P.Oliveira","SPSF00041374","Splink","SPSF","Cielo Filho, R.","848","Native","Bronze","Estação Ecológica","Não"
"ESTAÇÃO ECOLÓGICA ITAPEVA","Angiosperms","Poaceae","Panicum","olyroides","Kunth","POACEAE Panicum olyroides var. olyroides Kunth","287662","GBIF","SP","Souza, V.C.","8736","Native","Ouro","Estação Ecológica de Itapeva","Não"
"ESTAÇÃO ECOLÓGICA ITAPEVA","Angiosperms","Poaceae",,,"Barnhart","POACEAE Poaceae Barnhart","ESA023518","Reflora","ESA","Souza, V.C.","8736",,"Ouro","Estação Ecológica de Itapeva. Transição campo-cerrado.","Não"
"ESTAÇÃO ECOLÓGICA ITAPEVA","Angiosperms","Poaceae","Setaria","scabrifolia","(Nees) Kunth","POACEAE Setaria scabrifolia (Nees) Kunth","289922","GBIF","SP","Souza, V.C.","8631","Native","Ouro","Estação Ecológica de Itapeva","Não"
"ESTAÇÃO ECOLÓGICA ITAPEVA","Gymnosperms","Podocarpaceae","Podocarpus","sellowii","Klotzsch ex Endl.","PODOCARPACEAE Podocarpus sellowii Klotzsch ex Endl.","SPSF00040473","Splink","SPSF","Baitello, J.B.","2161","Native","Prata","Estação Ecológica","Não"
"ESTAÇÃO ECOLÓGICA ITAPEVA","Angiosperms","Polygalaceae","Monnina","richardiana","A.St.-Hil. & Moq.","POLYGALACEAE Monnina richardiana A.St.-Hil. & Moq.","SPSF00040278","Splink","SPSF","Baitello, J.B.","2125","Native","Bronze","Estação Ecológica","Não"
"ESTAÇÃO ECOLÓGICA ITAPEVA","Angiosperms","Polygalaceae","Senega","glochidata","(Kunth) J.F.B.Pastore","POLYGALACEAE Senega glochidata (Kunth) J.F.B.Pastore","SPSF00040137","Splink","SPSF","Baitello, J.B.","2089","Native","Bronze","Estação Experimental","Não"
"ESTAÇÃO ECOLÓGICA ITAPEVA","Ferns and Lycophytes","Polypodiaceae","Microgramma","squamulosa","(Kaulf.) de la Sota","POLYPODIACEAE Microgramma squamulosa (Kaulf.) de la Sota","SPSF00041523","Splink","SPSF","Baitello, J.B.","2296","Native","Prata","Estação Ecológica","Não"
"ESTAÇÃO ECOLÓGICA ITAPEVA","Ferns and Lycophytes","Polypodiaceae","Pleopeltis","hirsutissima","(Raddi) de la Sota","POLYPODIACEAE Pleopeltis hirsutissima (Raddi) de la Sota","SPSF00040509","Splink","SPSF","Lima, C.R.","87","Native","Bronze","Estação Ecológica","Não"
"ESTAÇÃO ECOLÓGICA ITAPEVA","Ferns and Lycophytes","Polypodiaceae","Pleopeltis","pleopeltifolia","(Raddi) Alston","POLYPODIACEAE Pleopeltis pleopeltifolia (Raddi) Alston","SPSF00040508","Splink","SPSF","Lima, C.R.","86","Native","Bronze","Estação Ecológica","Não"
"ESTAÇÃO ECOLÓGICA ITAPEVA","Angiosperms","Primulaceae","Cybianthus","densicomus","Mart.","PRIMULACEAE Cybianthus densicomus Mart.","SPSF00040500","Splink","SPSF","Lima, C.R.","78","Native","Ouro","Estação Ecológica","Não"
"ESTAÇÃO ECOLÓGICA ITAPEVA","Angiosperms","Primulaceae","Myrsine","coriacea","(Sw.) R.Br. ex Roem. & Schult.","PRIMULACEAE Myrsine coriacea (Sw.) R.Br. ex Roem. & Schult.","SPSF00039629","Splink","SPSF","Ribeiro, A.P.","18","Native","Bronze","Estação Ecológica","Não"
"ESTAÇÃO ECOLÓGICA ITAPEVA","Angiosperms","Primulaceae","Myrsine","gardneriana","A.DC.","PRIMULACEAE Myrsine gardneriana A.DC.","HUEFS0178419","Splink","HUEFS","Baitello, J.B.","2121","Native","Ouro","Estaçao Ecológica.","Não"
"ESTAÇÃO ECOLÓGICA ITAPEVA","Angiosperms","Primulaceae","Myrsine","umbellata","Mart.","PRIMULACEAE Myrsine umbellata Mart.","RB01410777","GBIF","RB","Cielo Filho, R.","685","Native","Ouro","Município de Itapeva, Estação Ecológica, trilha 01.","Não"
"ESTAÇÃO ECOLÓGICA ITAPEVA","Angiosperms","Proteaceae","Roupala","montana","(Klotzsch) K.S.Edwards","PROTEACEAE Roupala montana var. brasiliensis (Klotzsch) K.S.Edwards","251404","GBIF","SP","Romaniuc Neto, S.","1247","Native","Ouro","Estação Ecológica de Itapeva","Não"
"ESTAÇÃO ECOLÓGICA ITAPEVA","Angiosperms","Rhamnaceae","Frangula","sphaerosperma","(Sw.) Kartesz & Gandhi","RHAMNACEAE Frangula sphaerosperma (Sw.) Kartesz & Gandhi","SPSF00041104","Splink","SPSF","Baitello, J.B.","2200","Unknown","Prata","Estação Ecológica","Não"
"ESTAÇÃO ECOLÓGICA ITAPEVA","Angiosperms","Rosaceae","Prunus","myrtifolia","(L.) Urb.","ROSACEAE Prunus myrtifolia (L.) Urb.","311023","GBIF","SP","Souza, V.C.","8641","Native","Ouro","Estação Ecológica de Itapeva","Não"
"ESTAÇÃO ECOLÓGICA ITAPEVA","Angiosperms","Rosaceae","Rubus","brasiliensis","Mart.","ROSACEAE Rubus brasiliensis Mart.","SPSF00039708","Splink","SPSF","Aguiar, O.T.","843","Native","Bronze","Estação Ecológica","Não"
"ESTAÇÃO ECOLÓGICA ITAPEVA","Angiosperms","Rubiaceae","Borreria","capitata","(Ruiz & Pav.) DC.","RUBIACEAE Borreria capitata (Ruiz & Pav.) DC.","ESA023528","Reflora","ESA","Souza, V.C.","8733","Native","Ouro","Estação Ecológica de Itapeva. Transição campo-cerrado.","Não"
"ESTAÇÃO ECOLÓGICA ITAPEVA","Angiosperms","Rubiaceae","Borreria","poaya","(A.St.-Hil.) DC.","RUBIACEAE Borreria poaya (A.St.-Hil.) DC.","76045","GBIF","UEC","Souza, V.C.","7053","Native","Ouro","Estação Ecológica de Itapeva.","Não"
"ESTAÇÃO ECOLÓGICA ITAPEVA","Angiosperms","Rubiaceae","Borreria","tenella","(Kunth) Cham. & Schltdl.","RUBIACEAE Borreria tenella (Kunth) Cham. & Schltdl.","289318","GBIF","SP","Souza, V.C.","8733","Native","Bronze","Estação Ecológica de Itapeva","Não"
"ESTAÇÃO ECOLÓGICA ITAPEVA","Angiosperms","Rubiaceae","Chomelia","obtusa","Cham. & Schltdl.","RUBIACEAE Chomelia obtusa Cham. & Schltdl.","JPB0054692","Splink","JPB","Souza, V.C.","7470","Native","Ouro","Estação Ecológica de Itapeva.","Não"
"ESTAÇÃO ECOLÓGICA ITAPEVA","Angiosperms","Rubiaceae","Coccocypselum","glabrifolium","Standl.","RUBIACEAE Coccocypselum glabrifolium Standl.","SPSF00039715","Splink","SPSF","Cielo Filho, R.","677","Native","Bronze","Estação Ecológica","Não"
"ESTAÇÃO ECOLÓGICA ITAPEVA","Angiosperms","Rubiaceae","Coccocypselum","lanceolatum","(Ruiz & Pav.) Pers.","RUBIACEAE Coccocypselum lanceolatum (Ruiz & Pav.) Pers.","SPSF00039729","Splink","SPSF","Cielo Filho, R.","691","Native","Bronze",,"Não"
"ESTAÇÃO ECOLÓGICA ITAPEVA","Angiosperms","Rubiaceae","Cordiera","concolor","(Cham.) Kuntze","RUBIACEAE Cordiera concolor (Cham.) Kuntze","SPF00101583","Splink","SPF","Tamashiro, J.Y.","1326","Native","Ouro","Estação Experimental de Itapeva","Não"
"ESTAÇÃO ECOLÓGICA ITAPEVA","Angiosperms","Rubiaceae","Cordiera","elliptica","(Cham.) Kuntze","RUBIACEAE Cordiera elliptica (Cham.) Kuntze","HUEFS0076604","GBIF","HUEFS","Souza, V.C.","8700","Native","Ouro","Estação Ecológica de Itapeva.","Não"
"ESTAÇÃO ECOLÓGICA ITAPEVA","Angiosperms","Rubiaceae","Declieuxia","cordigera","Mart. & Zucc. ex Schult. & Schult.f.","RUBIACEAE Declieuxia cordigera Mart. & Zucc. ex Schult. & Schult.f.","SPSF00039850","Splink","SPSF","Cielo Filho, R.","713","Native","Bronze","Estação Experimental","Não"
"ESTAÇÃO ECOLÓGICA ITAPEVA","Angiosperms","Rubiaceae","Declieuxia","cordigera","(Pohl ex DC.) J.H.Kirkbr.","RUBIACEAE Declieuxia cordigera var. divergentiflora (Pohl ex DC.) J.H.Kirkbr.","SPSF00041318","Splink","SPSF","Baitello, J.B.","2229","Native","Bronze","Estação Ecológica","Não"
"ESTAÇÃO ECOLÓGICA ITAPEVA","Angiosperms","Rubiaceae","Hexasepalum","radula","(Willd.) Delprete & J.H.Kirkbr.","RUBIACEAE Hexasepalum radula (Willd.) Delprete & J.H.Kirkbr.","SPSF00040138","Splink","SPSF","Baitello, J.B.","2090","Native","Bronze","Estação Experimental","Não"
"ESTAÇÃO ECOLÓGICA ITAPEVA","Angiosperms","Rubiaceae","Manettia","pubescens","Cham. & Schltdl.","RUBIACEAE Manettia pubescens Cham. & Schltdl.","SPSF00040179","Splink","SPSF","Cielo Filho, R.","744","Native","Bronze","Estação Ecológica","Não"
"ESTAÇÃO ECOLÓGICA ITAPEVA","Angiosperms","Rubiaceae","Palicourea","croceoides","Ham.","RUBIACEAE Palicourea croceoides Ham.","SPSF00039690","Splink","SPSF","Baitello, J.B.","2052","Native","Bronze","Estação Ecológica","Não"
"ESTAÇÃO ECOLÓGICA ITAPEVA","Angiosperms","Rubiaceae","Palicourea","hoffmannseggiana","(Roem. & Schult.) Borhidi","RUBIACEAE Palicourea hoffmannseggiana (Roem. & Schult.) Borhidi","UEC116993","Splink","UEC","Tamashiro, J.Y.","1322","Native","Ouro","Estação Experimental de Itapeva, Engenheiro Maia.","Não"
"ESTAÇÃO ECOLÓGICA ITAPEVA","Angiosperms","Rubiaceae","Palicourea","rigida","Kunth","RUBIACEAE Palicourea rigida Kunth","SPSF00041121","Splink","SPSF","Lima, C.R.","120","Native","Bronze","Estação Ecológica","Não"
"ESTAÇÃO ECOLÓGICA ITAPEVA","Angiosperms","Rubiaceae","Palicourea","sessilis","(Vell.) C.M.Taylor","RUBIACEAE Palicourea sessilis (Vell.) C.M.Taylor","SPSF00041090","Splink","SPSF","Baitello, J.B.","2186","Native","Bronze","Estação Ecológica","Não"
"ESTAÇÃO ECOLÓGICA ITAPEVA","Angiosperms","Rubiaceae","Palicourea","tenerior","(Cham.) Delprete & J.H.Kirkbr.","RUBIACEAE Palicourea tenerior (Cham.) Delprete & J.H.Kirkbr.","SP0300604","Splink","SP","Tamashiro, J.Y.","1322","Native","Bronze","Estação Experimental de Itapeva. Engenheiro Maia","Não"
"ESTAÇÃO ECOLÓGICA ITAPEVA","Angiosperms","Rubiaceae","Psychotria","carthagenensis","Jacq.","RUBIACEAE Psychotria carthagenensis Jacq.","HUEFS0178420","Reflora","HUEFS","Lima, C.R.","76","Native","Ouro","Estaçao Ecológica.","Não"
"ESTAÇÃO ECOLÓGICA ITAPEVA","Angiosperms","Rubiaceae","Psychotria","leiocarpa","Cham. & Schltdl.","RUBIACEAE Psychotria leiocarpa Cham. & Schltdl.","UPCB00039924","Reflora","UPCB","Baitello, J.B.","2197","Native","Ouro","Estação Ecológica, trilha 1.","Não"
"ESTAÇÃO ECOLÓGICA ITAPEVA","Angiosperms","Rubiaceae","Rudgea","jasminoides","(Cham.) Müll.Arg.","RUBIACEAE Rudgea jasminoides (Cham.) Müll.Arg.","SPSF00041155","Splink","SPSF","Cielo Filho, R.","804","Native","Bronze","Estação Ecológica","Não"
"ESTAÇÃO ECOLÓGICA ITAPEVA","Angiosperms","Rutaceae","Esenbeckia","grandiflora","Mart.","RUTACEAE Esenbeckia grandiflora Mart.","290270","Splink","SP","Souza, V.C.","7446-A","Native","Ouro","Estação Ecológica de Itapeva","Não"
"ESTAÇÃO ECOLÓGICA ITAPEVA","Angiosperms","Rutaceae","Helietta","apiculata","Benth.","RUTACEAE Helietta apiculata Benth.","HUEFS177457","Reflora","HUEFS","Baitello, J.B.","2472","Native","Ouro","Estação Ecológica, borda de talhão de Pinus e valeta.","Não"
