"UC","Grupos","Família","Gênero","Espécie","Autor","Táxon_completo","Barcode","BD_Origem","Herbário","Coletor","Número_da_Coleta","Origem_FFBr","ConfiançaID","ConfiançaLoc","Localidade","Já listada"
"PARQUE ESTADUAL XIXOVÁ-JAPUÍ","Angiosperms","Poaceae","Echinochloa","polystachya","(Kunth) Hitchc.","POACEAE Echinochloa polystachya (Kunth) Hitchc.","197216","Splink","SP","Sendulsky, T.","1328","Naturalized","Ouro","Low","Balneário Florida","Não"
"PARQUE ESTADUAL XIXOVÁ-JAPUÍ","Angiosperms","Poaceae","Eleusine","indica","(L.) Gaertn.","POACEAE Eleusine indica (L.) Gaertn.","113870","Splink","SP","Sendulsky, T.","1088","Naturalized","Ouro","Low","Florida","Não"
"PARQUE ESTADUAL XIXOVÁ-JAPUÍ","Angiosperms","Poaceae","Eragrostis","cataclasta","Nicora","POACEAE Eragrostis cataclasta Nicora","SP043839","Splink","SP","Sendulsky, T.","1083","Native","Ouro","Low","Florida.","Não"
"PARQUE ESTADUAL XIXOVÁ-JAPUÍ","Angiosperms","Poaceae","Eragrostis","ciliaris","(L.) R.Br.","POACEAE Eragrostis ciliaris (L.) R.Br.","113861","Splink","SP","Sendulsky, T.","1076","Naturalized","Ouro","Low","Flórida.","Não"
"PARQUE ESTADUAL XIXOVÁ-JAPUÍ","Angiosperms","Poaceae","Eustachys","retusa","(Lag.) Kunth","POACEAE Eustachys retusa (Lag.) Kunth","HUSC015784","Splink","HUSC","Sampaio, P.S.P.","2070","Native","Bronze","Low","Rua José Lins do Rego x Rua Paulo Cokely.","Não"
"PARQUE ESTADUAL XIXOVÁ-JAPUÍ","Angiosperms","Poaceae","Ichnanthus","lancifolius","Mez","POACEAE Ichnanthus lancifolius Mez","SP010046","Splink","SP","Loefgren, A.","CGG4069","Native","Bronze","Low","Boqueirão.","Não"
"PARQUE ESTADUAL XIXOVÁ-JAPUÍ","Angiosperms","Poaceae","Ischaemum","minus","J.Presl","POACEAE Ischaemum minus J.Presl","SP033884","Splink","SP","Sendulsky, T.","1072","Native","Ouro","Low","Florida.","Não"
"PARQUE ESTADUAL XIXOVÁ-JAPUÍ","Angiosperms","Poaceae","Ocellochloa","stolonifera","(Poir.) Zuloaga & Morrone","POACEAE Ocellochloa stolonifera (Poir.) Zuloaga & Morrone","SPSF00027530","Splink","SPSF","Pastore, J.A.","894","Native","Latão","High","Parque Estadual Xixová-Japuí","Não"
"PARQUE ESTADUAL XIXOVÁ-JAPUÍ","Angiosperms","Poaceae","Olyra","glaberrima","Raddi","POACEAE Olyra glaberrima Raddi","SPSF00027528","Splink","SPSF","Pastore, J.A.","892","Native","Latão","High","Parque Estadual Xixová-Japuí","Não"
"PARQUE ESTADUAL XIXOVÁ-JAPUÍ","Angiosperms","Poaceae","Oplismenus","hirtellus","(Lam.) Mez ex Ekman","POACEAE Oplismenus hirtellus subsp. setarius (Lam.) Mez ex Ekman","SPSF00028170","Splink","SPSF","Pastore, J.A.","1034","Native","Latão","High","Parque Estadual Xixová-Japuí","Não"
"PARQUE ESTADUAL XIXOVÁ-JAPUÍ","Angiosperms","Poaceae","Panicum","pedersenii","Zuloaga","POACEAE Panicum pedersenii Zuloaga","SP035735","Splink","SP","Sendulsky, T.","1078","Native","Bronze","Low","Florida.","Não"
"PARQUE ESTADUAL XIXOVÁ-JAPUÍ","Angiosperms","Poaceae","Paspalum","arenarium","Schrad.","POACEAE Paspalum arenarium Schrad.","SP036188","Splink","SP","Sendulsky, T.","1070","Native","Ouro","Low","Flórida.","Não"
"PARQUE ESTADUAL XIXOVÁ-JAPUÍ","Angiosperms","Poaceae","Paspalum","conjugatum","P.J.Bergius","POACEAE Paspalum conjugatum P.J.Bergius","113895","Splink","SP","Sendulsky, T.","1082","Native","Ouro","Low","Florida.","Não"
"PARQUE ESTADUAL XIXOVÁ-JAPUÍ","Angiosperms","Poaceae","Paspalum","densum","Poir.","POACEAE Paspalum densum Poir.","SP036381","Splink","SP","Sendulsky, T.","1089","Native","Ouro","Low","Flórida.","Não"
"PARQUE ESTADUAL XIXOVÁ-JAPUÍ","Angiosperms","Poaceae","Paspalum","notatum","Flüggé","POACEAE Paspalum notatum Flüggé","367791","Splink","SP","Sendulsky, T.","1754a","Native","Ouro","Low",,"Não"
"PARQUE ESTADUAL XIXOVÁ-JAPUÍ","Angiosperms","Poaceae","Paspalum","pilosum","Lam.","POACEAE Paspalum pilosum Lam.","113894","Splink","SP","Sendulsky, T.","1077","Native","Ouro","Low","Praia Grande (Florida)","Não"
"PARQUE ESTADUAL XIXOVÁ-JAPUÍ","Angiosperms","Poaceae","Paspalum","pumilum","Nees","POACEAE Paspalum pumilum Nees","197228","Splink","SP","Sendulsky, T.","1326","Native","Ouro","Low","Praia Grande Balniário Florida.","Não"
"PARQUE ESTADUAL XIXOVÁ-JAPUÍ","Angiosperms","Poaceae","Paspalum","urvillei","Steud.","POACEAE Paspalum urvillei Steud.","SP037170","Splink","SP","Sendulsky, T.","1086","Native","Ouro","Low","Florida.","Não"
"PARQUE ESTADUAL XIXOVÁ-JAPUÍ","Angiosperms","Poaceae","Paspalum","vaginatum","Sw.","POACEAE Paspalum vaginatum Sw.","SPF00162175","Splink","SPF","Pastore, J.A.","1143","Native","Latão","High","Parque Estadual Xixová-Japuí, Coordenadas: 23°58'37'' - 24°02'06''S, e 46°22'19'' - 46°24'42''W.","Não"
"PARQUE ESTADUAL XIXOVÁ-JAPUÍ","Angiosperms","Poaceae","Pharus","latifolius","L.","POACEAE Pharus latifolius L.","SPF00162176","Splink","SPF","Pastore, J.A.","1113","Native","Latão","High","Parque Estadual Xixová-Japuí, Coordenadas: 23°58'37'' - 24°02'06''S, e 46°22'19'' - 46°24'42''W.","Não"
"PARQUE ESTADUAL XIXOVÁ-JAPUÍ","Angiosperms","Poaceae",,,"Barnhart","POACEAE Poaceae Barnhart","HUSC015788","Splink","HUSC","Sampaio, P.S.P.","2059",,"Bronze","Low","Faceado ao fronte da Praça Duque de Caixias.","Não"
"PARQUE ESTADUAL XIXOVÁ-JAPUÍ","Angiosperms","Poaceae","Rugoloa","pilosa","(Sw.) Zuloaga","POACEAE Rugoloa pilosa (Sw.) Zuloaga","SPSF00027571","Splink","SPSF","Pastore, J.A.","927","Native","Latão","High","Parque Estadual Xixová-Japuí","Não"
"PARQUE ESTADUAL XIXOVÁ-JAPUÍ","Angiosperms","Poaceae","Saccharum","asperum","(Nees) Steud.","POACEAE Saccharum asperum (Nees) Steud.","197227","Splink","SP","Sendulsky, T.","1327","Native","Bronze","Low","Balneário Flórida.","Não"
"PARQUE ESTADUAL XIXOVÁ-JAPUÍ","Angiosperms","Poaceae","Saccharum","villosum","Steud.","POACEAE Saccharum villosum Steud.","113887","Splink","SP","Sendulsky, T.","1093","Native","Ouro","Low","Florida.","Não"
"PARQUE ESTADUAL XIXOVÁ-JAPUÍ","Angiosperms","Poaceae","Schizachyrium","condensatum","(Kunth) Nees","POACEAE Schizachyrium condensatum (Kunth) Nees","113868","Splink","SP","Sendulsky, T.","1090","Native","Ouro","Low","Florida.","Não"
"PARQUE ESTADUAL XIXOVÁ-JAPUÍ","Angiosperms","Poaceae","Schizachyrium","microstachyum","(Desv. ex Ham.) Roseng., B.R.Arrill. & Izag.","POACEAE Schizachyrium microstachyum (Desv. ex Ham.) Roseng., B.R.Arrill. & Izag.","112240","Splink","ICN","Sendulsky, T.","1090","Native","Ouro","Low","Florida","Não"
"PARQUE ESTADUAL XIXOVÁ-JAPUÍ","Angiosperms","Poaceae","Setaria","parviflora","(Poir.) Kerguélen","POACEAE Setaria parviflora (Poir.) Kerguélen","118937","Splink","SP","Sendulsky, T.","1218","Native","Ouro","Low","Praia Grande, Florida.","Não"
"PARQUE ESTADUAL XIXOVÁ-JAPUÍ","Angiosperms","Poaceae","Spartina","ciliata","Brongn.","POACEAE Spartina ciliata Brongn.","118520","Splink","SP","Sendulsky, T.","1117","Native","Bronze","Low","Florida.","Não"
"PARQUE ESTADUAL XIXOVÁ-JAPUÍ","Angiosperms","Poaceae","Sporobolus","indicus","(L.) R.Br.","POACEAE Sporobolus indicus (L.) R.Br.","SPF00162177","Splink","SPF","Pastore, J.A.","1154","Native","Latão","High","Parque Estadual Xixová-Japuí, Coordenadas: 23°58'37'' - 24°02'06''S, e 46°22'19'' - 46°24'42''W.","Não"
"PARQUE ESTADUAL XIXOVÁ-JAPUÍ","Angiosperms","Poaceae","Sporobolus","pseudairoides","Parodi","POACEAE Sporobolus pseudairoides Parodi","SP038693","Splink","SP","Sendulsky, T.","1075","Native","Bronze","Low","Florida.","Não"
"PARQUE ESTADUAL XIXOVÁ-JAPUÍ","Angiosperms","Poaceae","Steinchisma","laxum","(Sw.) Zuloaga","POACEAE Steinchisma laxum (Sw.) Zuloaga","113859","Splink","SP","Sendulsky, T.","1069","Native","Bronze","Low","Florida.","Não"
"PARQUE ESTADUAL XIXOVÁ-JAPUÍ","Angiosperms","Poaceae","Stenotaphrum","secundatum","(Walter) Kuntze","POACEAE Stenotaphrum secundatum (Walter) Kuntze","PEUFR007009","Splink","PEUFR","Sendulsky, T.","1087","Native","Ouro","Low",,"Não"
"PARQUE ESTADUAL XIXOVÁ-JAPUÍ","Angiosperms","Poaceae","Taquara","micrantha","(Kunth) I.L.C.Oliveira & R.P.Oliveira","POACEAE Taquara micrantha (Kunth) I.L.C.Oliveira & R.P.Oliveira","SPSF00028310","Splink","SPSF","Pastore, J.A.","1053","Native","Latão","High","Parque Estadual Xixová-Japuí","Não"
"PARQUE ESTADUAL XIXOVÁ-JAPUÍ","Angiosperms","Polygalaceae","Caamembeca","salicifolia","(Poir.) J.F.B.Pastore","POLYGALACEAE Caamembeca salicifolia (Poir.) J.F.B.Pastore","SP007697","Splink","SP","Loefgren, A.","CGG4164","Native","Bronze","Low","Mata, cam. Porto.","Não"
"PARQUE ESTADUAL XIXOVÁ-JAPUÍ","Angiosperms","Polygalaceae","Caamembeca","spectabilis","(DC.) J.F.B.Pastore","POLYGALACEAE Caamembeca spectabilis (DC.) J.F.B.Pastore","SPSF00027924","Splink","SPSF","Pastore, J.A.","990","Native","Latão","High","Parque Estadual Xixová-Japuí","Não"
"PARQUE ESTADUAL XIXOVÁ-JAPUÍ","Angiosperms","Polygalaceae","Senega","cyparissias","(A. St.-Hil. & Moq.) J.F.B.Pastore & Agust. Martinez","POLYGALACEAE Senega cyparissias (A. St.-Hil. & Moq.) J.F.B.Pastore & Agust. Martinez","NY00634533","Splink","NY","Gehrt, A.",,"Native","Ouro","Low","Suarao","Não"
"PARQUE ESTADUAL XIXOVÁ-JAPUÍ","Angiosperms","Polygalaceae","Senega","paniculata","(L.) J.F.B.Pastore & J.R.Abbott","POLYGALACEAE Senega paniculata (L.) J.F.B.Pastore & J.R.Abbott","164705149","GBIF","Observations","Dominguez, Y.",,"Native","Bronze","Low","Japuí, São Vicente - SP, Brazil","Não"
"PARQUE ESTADUAL XIXOVÁ-JAPUÍ","Angiosperms","Polygonaceae","Coccoloba","glaziovii","Lindau","POLYGONACEAE Coccoloba glaziovii Lindau","SPSF00027567","Splink","SPSF","Pastore, J.A.","923","Native","Latão","High","Parque Estadual Xixová-Japuí","Não"
"PARQUE ESTADUAL XIXOVÁ-JAPUÍ","Angiosperms","Polygonaceae","Polygonum",,"L.","POLYGONACEAE Polygonum L.","ESA150880","Splink","ESA","Souza, V.C.","44179",,"Latão","Low","Rodovia Pe. Manoel da Nóbrega, km 300. Balneário Flórida. Floresta de restinga.","Não"
"PARQUE ESTADUAL XIXOVÁ-JAPUÍ","Ferns and Lycophytes","Polypodiaceae","Microgramma","crispata","(Fée) R.M.Tryon & A.F.Tryon","POLYPODIACEAE Microgramma crispata (Fée) R.M.Tryon & A.F.Tryon","FUEL002201","Splink","FUEL","Moura, C.","60","Native","Bronze","High","Parque Estadual Xixová-Japuí, trilha para o Morro, margem do caminho","Não"
"PARQUE ESTADUAL XIXOVÁ-JAPUÍ","Ferns and Lycophytes","Polypodiaceae","Microgramma","geminata","(Schrad.) R.M.Tryon & A.F.Tryon","POLYPODIACEAE Microgramma geminata (Schrad.) R.M.Tryon & A.F.Tryon","SPSF00028168","Splink","SPSF","Pastore, J.A.","1032","Native","Latão","High","Parque Estadual Xixová-Japuí","Não"
"PARQUE ESTADUAL XIXOVÁ-JAPUÍ","Ferns and Lycophytes","Polypodiaceae","Pleopeltis","angusta","Humb. & Bonpl. ex Willd.","POLYPODIACEAE Pleopeltis angusta Humb. & Bonpl. ex Willd.","SPSF00028179","Splink","SPSF","Pastore, J.A.","1043","Unknown","Latão","High","Parque Estadual Xixová-Japuí","Não"
"PARQUE ESTADUAL XIXOVÁ-JAPUÍ","Angiosperms","Primulaceae","Ardisia","guianensis","(Aubl.) Mez","PRIMULACEAE Ardisia guianensis (Aubl.) Mez","SPSF00027556","Splink","SPSF","Pastore, J.A.","911","Native","Latão","High","Parque Estadual Xixová-Japuí","Não"
"PARQUE ESTADUAL XIXOVÁ-JAPUÍ","Angiosperms","Primulaceae","Cybianthus","brasiliensis","(Mez) G.Agostini","PRIMULACEAE Cybianthus brasiliensis (Mez) G.Agostini","SP001409","Splink","SP","Loefgren, A.","CGG4183","Native","Ouro","Low",,"Não"
"PARQUE ESTADUAL XIXOVÁ-JAPUÍ","Angiosperms","Primulaceae","Cybianthus","densicomus","Mart.","PRIMULACEAE Cybianthus densicomus Mart.","RB00658289","GBIF","RB","Pastore, J.A.","1185","Native","Ouro","Low","Parque Estadual Xivová- Japuí, região de Paranapuã, trilha da caixa dágua, margem do caminho. .","Não"
"PARQUE ESTADUAL XIXOVÁ-JAPUÍ","Angiosperms","Primulaceae","Myrsine","balansae","(Mez) Otegui","PRIMULACEAE Myrsine balansae (Mez) Otegui","31498","Splink","FUEL","Pastore, J.A.","939","Native","Ouro","High","Parque Estadual Xixová-Japuí, Japuí","Não"
"PARQUE ESTADUAL XIXOVÁ-JAPUÍ","Angiosperms","Primulaceae","Myrsine","coriacea","(Sw.) R.Br. ex Roem. & Schult.","PRIMULACEAE Myrsine coriacea (Sw.) R.Br. ex Roem. & Schult.","352019","Splink","SP","Pastore, J.A.","1024","Native","Bronze","High","Parque Estadual Xixová-Japuí, estrada de acesso à região de Paranapuã","Não"
"PARQUE ESTADUAL XIXOVÁ-JAPUÍ","Angiosperms","Primulaceae","Myrsine","guianensis","(Aubl.) Kuntze","PRIMULACEAE Myrsine guianensis (Aubl.) Kuntze","359848","Splink","SP","Pastore, J.A.","1022","Native","Bronze","High","Parque Estadual Xixová-Japuí, estrada de acesso à região de Paranapuã","Não"
"PARQUE ESTADUAL XIXOVÁ-JAPUÍ","Angiosperms","Primulaceae","Stylogyne","lhotzkyana","(A.DC.) Mez","PRIMULACEAE Stylogyne lhotzkyana (A.DC.) Mez","33910","Splink","FUEL","Pastore, J.A.","1078","Native","Latão","High","Parque Estadual Xixová-Japuí, Japuí","Não"
"PARQUE ESTADUAL XIXOVÁ-JAPUÍ","Angiosperms","Primulaceae","Stylogyne","pauciflora","Mez","PRIMULACEAE Stylogyne pauciflora Mez","359849","Splink","SP","Pastore, J.A.","911","Native","Ouro","High","Parque Estadual Xixová-Japuí, região de Paranapuã","Não"
"PARQUE ESTADUAL XIXOVÁ-JAPUÍ","Ferns and Lycophytes","Pteridaceae","Adiantum","latifolium","Lam.","PTERIDACEAE Adiantum latifolium Lam.","123396414","GBIF","Observations","Dominguez, Y.",,"Native","Bronze","Low","Praia Grande, SP, Brazil","Não"
"PARQUE ESTADUAL XIXOVÁ-JAPUÍ","Angiosperms","Rhizophoraceae","Rhizophora","mangle","L.","RHIZOPHORACEAE Rhizophora mangle L.","SPF00161285","Splink","SPF","Hoehne, F.C.","s.n.","Native","Prata","Low",,"Não"
"PARQUE ESTADUAL XIXOVÁ-JAPUÍ","Angiosperms","Rubiaceae","Alseis","floribunda","Schott","RUBIACEAE Alseis floribunda Schott","SP008076","Splink","SP","Loefgren, A.","CGG4212","Native","Bronze","Low","Mata, Morro do Xixová, São Vicente.","Não"
"PARQUE ESTADUAL XIXOVÁ-JAPUÍ","Angiosperms","Rubiaceae","Bathysa","australis","(A.St.-Hil.) K.Schum.","RUBIACEAE Bathysa australis (A.St.-Hil.) K.Schum.","33425","Splink","FUEL","Pastore, J.A.","1108","Native","Bronze","High","Parque Estadual Xixová-Japuí, Japuí","Não"
"PARQUE ESTADUAL XIXOVÁ-JAPUÍ","Angiosperms","Rubiaceae","Bathysa","gymnocarpa","K.Schum.","RUBIACEAE Bathysa gymnocarpa K.Schum.","MBM320033","Splink","MBM","Pastore, J.A.","889","Native","Bronze","High","Parque Estadual Xixová-Japuí, Região de Paranapuã.","Não"
"PARQUE ESTADUAL XIXOVÁ-JAPUÍ","Angiosperms","Rubiaceae","Bathysa","mendoncaei","K.Schum.","RUBIACEAE Bathysa mendoncaei K.Schum.","358360","GBIF","SP","Pastore, J.A.","1108","Native","Ouro","High","Parque Estadual Xixová-Japuí, Trilha da pedreira, segundo acesso sentindo costeira, caminho para o Morro Japuí","Não"
"PARQUE ESTADUAL XIXOVÁ-JAPUÍ","Angiosperms","Rubiaceae","Chiococca","alba","(L.) Hitchc.","RUBIACEAE Chiococca alba (L.) Hitchc.","SP0358358","Splink","SP","Pastore, J.A.","976","Native","Ouro","High","Parque Estadual Xixová-Japuí, Estrada de acesso á região de Paranapuã, em barranco frente ao mar","Não"
"PARQUE ESTADUAL XIXOVÁ-JAPUÍ","Angiosperms","Rubiaceae","Coccocypselum","condalia","Pers.","RUBIACEAE Coccocypselum condalia Pers.","SP008097","Splink","SP","Loefgren, A.","CGG4140","Native","Bronze","Low",,"Não"
"PARQUE ESTADUAL XIXOVÁ-JAPUÍ","Angiosperms","Rubiaceae","Coccocypselum","cordifolium","Nees & Mart.","RUBIACEAE Coccocypselum cordifolium Nees & Mart.","SP0359067","Splink","SP","Pastore, J.A.","931-B","Native","Bronze","High","Parque Estadual Xixová-Japuí, Trilha da Pedreira, margem do caminho para o morro Japuí","Não"
"PARQUE ESTADUAL XIXOVÁ-JAPUÍ","Angiosperms","Rubiaceae","Coccocypselum","geophiloides","Wawra","RUBIACEAE Coccocypselum geophiloides Wawra","SPSF00028176","Splink","SPSF","Pastore, J.A.","1040","Native","Latão","High","Parque Estadual Xixová-Japuí","Não"
"PARQUE ESTADUAL XIXOVÁ-JAPUÍ","Angiosperms","Rubiaceae","Coussarea","contracta","(Walp.) Müll.Arg.","RUBIACEAE Coussarea contracta (Walp.) Müll.Arg.","35568","Splink","FUEL","Pastore, J.A.","1163","Native","Ouro","High","Parque Estadual Xixová-Japuí","Não"
"PARQUE ESTADUAL XIXOVÁ-JAPUÍ","Angiosperms","Rubiaceae","Coutarea","hexandra","(Jacq.) K.Schum.","RUBIACEAE Coutarea hexandra (Jacq.) K.Schum.","SP0359066","Splink","SP","Pastore, J.A.","953","Native","Ouro","High","Parque Estadual Xixová-Japuí, Estrada de acesso á região de Paranapuã, em barranco frente ao mar","Não"
"PARQUE ESTADUAL XIXOVÁ-JAPUÍ","Angiosperms","Rubiaceae","Emmeorhiza","umbellata","(Spreng.) K.Schum.","RUBIACEAE Emmeorhiza umbellata (Spreng.) K.Schum.","32008","Splink","FUEL","Pastore, J.A.","1049","Native","Bronze","High","Parque Estadual Xixová-Japuí, Japuí","Não"
"PARQUE ESTADUAL XIXOVÁ-JAPUÍ","Angiosperms","Rubiaceae","Eumachia","cymuligera","(Müll. Arg.) C.M. Taylor & Razafim.","RUBIACEAE Eumachia cymuligera (Müll. Arg.) C.M. Taylor & Razafim.","40189","Splink","FUEL","Pastore, J.A.","1213","Native","Ouro","High","Parque Estadual Xixová-Japuí, Região de Paranapuã.","Não"
"PARQUE ESTADUAL XIXOVÁ-JAPUÍ","Angiosperms","Rubiaceae","Faramea","tetragona","Müll.Arg.","RUBIACEAE Faramea tetragona Müll.Arg.","SP008122","Splink","SP","Loefgren, A.","CGG4143","Native","Bronze","Low","Mata úmida, Morro de Xixová.","Não"
"PARQUE ESTADUAL XIXOVÁ-JAPUÍ","Angiosperms","Rubiaceae","Hexasepalum","apiculatum","(Willd.) Delprete & J.H.Kirkbr.","RUBIACEAE Hexasepalum apiculatum (Willd.) Delprete & J.H.Kirkbr.","SP008112","Splink","SP","Loefgren, A.","CGG4141","Native","Bronze","Low","Em areia.","Não"
"PARQUE ESTADUAL XIXOVÁ-JAPUÍ","Angiosperms","Rubiaceae","Hexasepalum","radula","(Willd.) Delprete & J.H.Kirkbr.","RUBIACEAE Hexasepalum radula (Willd.) Delprete & J.H.Kirkbr.","SP008114","Splink","SP","Loefgren, A.","CGG4142","Native","Bronze","Low","Beira praia.","Não"
"PARQUE ESTADUAL XIXOVÁ-JAPUÍ","Angiosperms","Rubiaceae","Hillia","illustris","(Vell.) K.Schum.","RUBIACEAE Hillia illustris (Vell.) K.Schum.","SP0253980","Splink","SP","Kawall, M.","171","Native","Bronze","Low","Área na beira da rodovia Pedro Taques. Base da serra","Não"
"PARQUE ESTADUAL XIXOVÁ-JAPUÍ","Angiosperms","Rubiaceae","Malanea","forsteronioides","Müll.Arg.","RUBIACEAE Malanea forsteronioides Müll.Arg.","SP008154","Splink","SP","Loefgren, A.","CGG4147","Native","Bronze","Low","Boqueirão.","Não"
"PARQUE ESTADUAL XIXOVÁ-JAPUÍ","Angiosperms","Rubiaceae","Palicourea","brachypoda","(Müll.Arg.) L.B.Sm. & Downs","RUBIACEAE Palicourea brachypoda (Müll.Arg.) L.B.Sm. & Downs","SP0358359","Splink","SP","Pastore, J.A.","895","Native","Bronze","High","Parque Estadual Xixová-Japuí, Região de Paranapuã na mata","Não"
"PARQUE ESTADUAL XIXOVÁ-JAPUÍ","Angiosperms","Rubiaceae","Palicourea","deflexa","(DC.) Borhidi","RUBIACEAE Palicourea deflexa (DC.) Borhidi","SP0358357","Splink","SP","Pastore, J.A.","1117","Native","Bronze","High","Parque Estadual Xixová-Japuí, Trilha da Pedreira, segundo acesso sentido costeira, caminho para o Morro Japuí","Não"
"PARQUE ESTADUAL XIXOVÁ-JAPUÍ","Angiosperms","Rubiaceae","Palicourea","hoffmannseggiana","(Roem. & Schult.) Borhidi","RUBIACEAE Palicourea hoffmannseggiana (Roem. & Schult.) Borhidi","SP0361384","Splink","SP","Pastore, J.A.","1213","Native","Bronze","High","Parque Estadual Xixová-Japuí, Região de Paranapuã","Não"
"PARQUE ESTADUAL XIXOVÁ-JAPUÍ","Angiosperms","Rubiaceae","Psychotria","leiocarpa","Cham. & Schltdl.","RUBIACEAE Psychotria leiocarpa Cham. & Schltdl.","35537","Splink","FUEL","Pastore, J.A.","1212","Native","Ouro","High","Parque Estadual Xixová-Japuí, restinga de Paranapu, restinga de Paranapuã Japuí","Não"
"PARQUE ESTADUAL XIXOVÁ-JAPUÍ","Angiosperms","Rubiaceae","Psychotria","nemorosa","Gardner","RUBIACEAE Psychotria nemorosa Gardner","44083","Splink","IAC","Pastore, J.A.","870","Native","Bronze","High","Parque Estadual Xixová-Japuí, região de Paranapuã","Não"
"PARQUE ESTADUAL XIXOVÁ-JAPUÍ","Angiosperms","Rubiaceae","Psychotria","nuda","(Cham. & Schltdl.) Wawra","RUBIACEAE Psychotria nuda (Cham. & Schltdl.) Wawra","HUSC011440","Splink","HUSC","Almeida, O.J.G.","20","Native","Bronze","High","Parque Estadual Xixová-Japuí, Trilha do Cortume.","Não"
"PARQUE ESTADUAL XIXOVÁ-JAPUÍ","Angiosperms","Rubiaceae","Psychotria","pubigera","Schltdl.","RUBIACEAE Psychotria pubigera Schltdl.","SPSF00028177","Splink","SPSF","Pastore, J.A.","1041","Native","Latão","High","Parque Estadual Xixová-Japuí","Não"
"PARQUE ESTADUAL XIXOVÁ-JAPUÍ","Angiosperms","Rubiaceae","Psychotria","suterella","Müll.Arg.","RUBIACEAE Psychotria suterella Müll.Arg.","SP0253695","Splink","SP","Kawall, M.A.","176","Native","Ouro","Low","Área na beira da rod. Pedro Taques","Não"
"PARQUE ESTADUAL XIXOVÁ-JAPUÍ","Angiosperms","Rubiaceae","Richardia","brasiliensis","Gomes","RUBIACEAE Richardia brasiliensis Gomes","HUSC015799","Splink","HUSC","Sampaio, P.S.P.","2055","Native","Bronze","Low","Praia do Guilhermina. De frente a Rua Guatemala.","Não"
"PARQUE ESTADUAL XIXOVÁ-JAPUÍ","Angiosperms","Rubiaceae",,,"Juss.","RUBIACEAE Rubiaceae Juss.","44085","Splink","IAC","Pastore, J.A.","1211",,"Bronze","High","Parque Estadual Xixová-Japuí","Não"
"PARQUE ESTADUAL XIXOVÁ-JAPUÍ","Angiosperms","Rubiaceae","Rudgea","coriacea","(Spreng.) K.Schum.","RUBIACEAE Rudgea coriacea (Spreng.) K.Schum.","MBM256492","Splink","MBM","Pastore, J.A.","865","Native","Bronze","High","Parque Estadual Xixová-Japuí.","Não"
"PARQUE ESTADUAL XIXOVÁ-JAPUÍ","Angiosperms","Rubiaceae","Rudgea","coronata","(Vell.) Müll.Arg.","RUBIACEAE Rudgea coronata (Vell.) Müll.Arg.","SPSF00027569","Splink","SPSF","Pastore, J.A.","925","Native","Bronze","High","Parque Estadual Xixová-Japuí","Não"
"PARQUE ESTADUAL XIXOVÁ-JAPUÍ","Angiosperms","Rubiaceae","Rudgea","coronata","(Vell.) Müll.Arg.","RUBIACEAE Rudgea coronata subsp. coronata (Vell.) Müll.Arg.","SP0358350","Splink","SP","Pastore, J.A.","925","Native","Ouro","High","Parque Estadual Xixová-Japuí, Região Paranapuã na mata","Não"
"PARQUE ESTADUAL XIXOVÁ-JAPUÍ","Angiosperms","Rubiaceae","Rudgea","recurva","Müll.Arg.","RUBIACEAE Rudgea recurva Müll.Arg.","SP0358362","Splink","SP","Pastore, J.A.","910","Native","Ouro","High","Parque Estadual Xixová-Japuí, Região de Paranapuã","Não"
"PARQUE ESTADUAL XIXOVÁ-JAPUÍ","Angiosperms","Rubiaceae","Rustia","formosa","(Cham. & Schltdl.) Klotzsch","RUBIACEAE Rustia formosa (Cham. & Schltdl.) Klotzsch","40190","Splink","FUEL","Pastore, J.A.","9674","Native","Prata","High","Parque Estadual Xixová-Japuí, Estrada de acesso à região de Paranapuã.","Não"
"PARQUE ESTADUAL XIXOVÁ-JAPUÍ","Angiosperms","Rubiaceae","Schizocalyx","cuspidatus","(A.St.-Hil.) Kainul. & B. Bremer","RUBIACEAE Schizocalyx cuspidatus (A.St.-Hil.) Kainul. & B. Bremer","SP0377094","Splink","SP","Pastore, J.A.","1209","Native","Bronze","High","Parque Estadual Xixová-Japuí, Restinga de Paranapuã, na mata","Não"
"PARQUE ESTADUAL XIXOVÁ-JAPUÍ","Angiosperms","Rubiaceae","Tocoyena","formosa","(Cham. & Schltdl.) K.Schum.","RUBIACEAE Tocoyena formosa (Cham. & Schltdl.) K.Schum.","SP0359073","Splink","SP","Pastore, J.A.","1129","Native","Bronze","High","Parque Estadual Xixová-Japuí, Praia de Paranapuã baixa encosta, mata","Não"
"PARQUE ESTADUAL XIXOVÁ-JAPUÍ","Angiosperms","Rutaceae","Metrodorea","nigra","A.St.-Hil.","RUTACEAE Metrodorea nigra A.St.-Hil.","35567","Splink","FUEL","Pastore, J.A.","1263","Native","Bronze","High","Parque Estadual Xixová-Japuí, Japuí","Não"
"PARQUE ESTADUAL XIXOVÁ-JAPUÍ","Angiosperms","Rutaceae","Pilocarpus","giganteus","Engl.","RUTACEAE Pilocarpus giganteus Engl.","SP008350","Splink","SP","Loefgren, A.","CGG4178","Native","Ouro","Low","Beira costão, Itaipu.","Não"
"PARQUE ESTADUAL XIXOVÁ-JAPUÍ","Angiosperms","Salicaceae","Casearia","sylvestris","Sw.","SALICACEAE Casearia sylvestris Sw.","351822","Splink","SP","Pastore, J.A.","893","Native","Bronze","High","Parque Estadual Xixová-Japuí, região de Paranapuã","Não"
"PARQUE ESTADUAL XIXOVÁ-JAPUÍ","Angiosperms","Santalaceae","Phoradendron","chrysocladon","A. Gray","SANTALACEAE Phoradendron chrysocladon A. Gray","UB1010110","Splink","UB","Lofgren, A.","Herb12817","Native","Ouro","Low","Mata da fonte.","Não"
"PARQUE ESTADUAL XIXOVÁ-JAPUÍ","Angiosperms","Santalaceae","Phoradendron","piperoides","(Kunth) Trel.","SANTALACEAE Phoradendron piperoides (Kunth) Trel.","351830","Splink","SP","Pastore, J.A.","993","Native","Bronze","High","Parque Estadual Xixová-Japuí, região de Paranapuã, em frente ao Chapéu de Sol","Não"
"PARQUE ESTADUAL XIXOVÁ-JAPUÍ","Angiosperms","Sapindaceae","Allophylus","petiolulatus","Radlk.","SAPINDACEAE Allophylus petiolulatus Radlk.","33427","Splink","FUEL","Pastore, J.A.","1137","Native","Prata","High","Parque Estadual Xixová-Japuí, Japuí","Não"
"PARQUE ESTADUAL XIXOVÁ-JAPUÍ","Angiosperms","Sapindaceae","Cupania","oblongifolia","Mart.","SAPINDACEAE Cupania oblongifolia Mart.","352020","Splink","SP","Pastore, J.A.","1025","Native","Bronze","High","Parque Estadual Xixová-Japuí, Estrada de acesso à região de Paranapuã.","Não"
"PARQUE ESTADUAL XIXOVÁ-JAPUÍ","Angiosperms","Sapindaceae","Matayba","guianensis","Aubl.","SAPINDACEAE Matayba guianensis Aubl.","SP008382","Splink","SP","Loefgren, A.","CGG4171","Native","Ouro","Low","Mat, beira Piassabussu.","Não"
"PARQUE ESTADUAL XIXOVÁ-JAPUÍ","Angiosperms","Sapindaceae","Paullinia","meliifolia","Juss.","SAPINDACEAE Paullinia meliifolia Juss.","SP008394","Splink","SP","Loefgren, A.","CGG4170","Native","Ouro","Low","Mata, cam. do Porto.","Não"
"PARQUE ESTADUAL XIXOVÁ-JAPUÍ","Angiosperms","Sapindaceae","Paullinia","micrantha","Cambess.","SAPINDACEAE Paullinia micrantha Cambess.","SP046814","Splink","SP","Barbiellini, A.A.","s.n.","Native","Bronze","Low",,"Não"
