"UC","Grupos","Família","Gênero","Espécie","Autor","Táxon_completo","Barcode","BD_Origem","Herbário","Coletor","Número_da_Coleta","Origem_FFBr","ConfiançaID","ConfiançaLoc","Localidade","Já listada"
"PARQUE ESTADUAL XIXOVÁ-JAPUÍ","Angiosperms","Acanthaceae",,,"Juss.","ACANTHACEAE Acanthaceae Juss.","FUEL029897","Splink","FUEL","Vieira, A.O.S.","237",,"Latão","Low","Rod. Pedro Taques - Vila Caiçara, Vila Caiçara Pedro Taques","Não"
"PARQUE ESTADUAL XIXOVÁ-JAPUÍ","Angiosperms","Acanthaceae","Aphelandra","ornata","(Nees) T.Anderson","ACANTHACEAE Aphelandra ornata (Nees) T.Anderson","65832","Splink","SP","Joly, A.B.","1100","Native","Ouro","Low","Vila Atlântica","Não"
"PARQUE ESTADUAL XIXOVÁ-JAPUÍ","Angiosperms","Acanthaceae","Aphelandra","prismatica","(Vell.) Hiern","ACANTHACEAE Aphelandra prismatica (Vell.) Hiern","MBM317723","Splink","MBM","Pastore, J.A.","881","Native","Bronze","High","Parque Estadual Xixová-Japuí, Região da Ilha de Paranapuã.","Não"
"PARQUE ESTADUAL XIXOVÁ-JAPUÍ","Angiosperms","Acanthaceae","Aphelandra","squarrosa","Nees","ACANTHACEAE Aphelandra squarrosa Nees","SP022277","Splink","SP","Loefgren, A.","CGG5972","Native","Latão","Low","Piassaguera. Mata virgem.","Não"
"PARQUE ESTADUAL XIXOVÁ-JAPUÍ","Angiosperms","Acanthaceae","Avicennia","schaueriana","Stapf & Leechm. ex Moldenke","ACANTHACEAE Avicennia schaueriana Stapf & Leechm. ex Moldenke","FUEL021425","Splink","FUEL","Pastore, J.A.","1140","Native","Prata","High","Parque Estadual Xixová-Japuí, Praia de Paranapuã, próximo ao mar","Não"
"PARQUE ESTADUAL XIXOVÁ-JAPUÍ","Angiosperms","Acanthaceae","Brillantaisia","lamium","(Nees) Benth.","ACANTHACEAE Brillantaisia lamium (Nees) Benth.","HUSC015814","Splink","HUSC","Vilaca, L.F.","16","Naturalized","Bronze","Low","No bairro Japuí na entrada principal da Unidade de Conservação, próximo aencosta do morro, Parque Estadual Xixova Japuí - núcleo Japuí, Solo - Gleissolos, Textura - Indiscriminada, Relevo - Plano","Não"
"PARQUE ESTADUAL XIXOVÁ-JAPUÍ","Angiosperms","Acanthaceae","Pachystachys","lutea","Nees","ACANTHACEAE Pachystachys lutea Nees","192748886","GBIF","Observations","Cunha_sup",,"Native","Ouro","Low","Japui, São Vicente, SP, BR","Não"
"PARQUE ESTADUAL XIXOVÁ-JAPUÍ","Angiosperms","Acanthaceae","Sanchezia","parvibracteata","Sprague & Hutch.","ACANTHACEAE Sanchezia parvibracteata Sprague & Hutch.","218203813","GBIF","Observations","Hanate, P.",,"Cultivated","Bronze","Low","Japuí, São Vicente - SP, Brasil","Não"
"PARQUE ESTADUAL XIXOVÁ-JAPUÍ","Angiosperms","Acanthaceae","Thunbergia","alata","Bojer ex Sims","ACANTHACEAE Thunbergia alata Bojer ex Sims","123350841","GBIF","Observations","Dominguez, Y.",,"Naturalized","Bronze","Low","Japuí, São Vicente - SP, Brazil","Não"
"PARQUE ESTADUAL XIXOVÁ-JAPUÍ","Angiosperms","Acanthaceae|Rubiaceae","Gonzalagunia",,"Ruiz & Pav.","ACANTHACEAE|RUBIACEAE Gonzalagunia Ruiz & Pav.","SP022292","Splink","SP","Loefgren, A.","CGG4206",,"Latão","Low","Posto do Rei","Não"
"PARQUE ESTADUAL XIXOVÁ-JAPUÍ","Angiosperms","Adoxaceae","Sambucus","nigra","L.","ADOXACEAE Sambucus nigra L.","HUSC008261","Splink","HUSC","C. Junior","s.n.","Naturalized","Bronze","Low","Jardim Samambaia, R.4","Não"
"PARQUE ESTADUAL XIXOVÁ-JAPUÍ","Angiosperms","Alstroemeriaceae","Bomarea","edulis","(Tussac) Herb.","ALSTROEMERIACEAE Bomarea edulis (Tussac) Herb.","192485274","GBIF","Observations","Martins, V.",,"Native","Bronze","High","Parque Estadual Xixová-Japuí, São Paulo","Não"
"PARQUE ESTADUAL XIXOVÁ-JAPUÍ","Angiosperms","Amaranthaceae","Alternanthera","littoralis","P.Beauv.","AMARANTHACEAE Alternanthera littoralis P.Beauv.","SP022317","Splink","SP","Loefgren, A.","CGG4209","Native","Bronze","Low","Praia, Porto Pequeno","Não"
"PARQUE ESTADUAL XIXOVÁ-JAPUÍ","Angiosperms","Amaranthaceae","Alternanthera","philoxeroides","(Mart.) Griseb.","AMARANTHACEAE Alternanthera philoxeroides (Mart.) Griseb.","45547","Splink","SP","Rawitscher, F.","7","Native","Bronze","Low",,"Não"
"PARQUE ESTADUAL XIXOVÁ-JAPUÍ","Angiosperms","Amaranthaceae","Alternanthera","praelonga","A.St.-Hil.","AMARANTHACEAE Alternanthera praelonga A.St.-Hil.","SP022318","Splink","SP","Loefgren, A.","CGG4210","Native","Ouro","Low",,"Não"
"PARQUE ESTADUAL XIXOVÁ-JAPUÍ","Angiosperms","Amaranthaceae","Blutaparon","portulacoides","(A.St.-Hil.) Mears","AMARANTHACEAE Blutaparon portulacoides (A.St.-Hil.) Mears","HUSC015793","Splink","HUSC","Sampaio, P.S.P.","2067","Native","Bronze","Low","Faceado ao fronte da Praça Duque de Caixias.","Não"
"PARQUE ESTADUAL XIXOVÁ-JAPUÍ","Angiosperms","Amaranthaceae","Gomphrena","vaga","Mart.","AMARANTHACEAE Gomphrena vaga Mart.","SPSF00029945","Splink","SPSF","Pastore, J.A.","1168","Native","Latão","High","Parque Estadual Xixová-Japuí","Não"
"PARQUE ESTADUAL XIXOVÁ-JAPUÍ","Angiosperms","Amaryllidaceae","Hippeastrum","reticulatum","(L'Hér.) Herb.","AMARYLLIDACEAE Hippeastrum reticulatum (L'Hér.) Herb.","219318344","GBIF","Observations","Luizao",,"Native","Bronze","Low","Japuí, São Vicente - SP, Brasil","Não"
"PARQUE ESTADUAL XIXOVÁ-JAPUÍ","Angiosperms","Anacardiaceae","Anacardium","occidentale","L.","ANACARDIACEAE Anacardium occidentale L.","24488","Splink","SP","Gehrt, A.","s.n.","Native","Bronze","Low",,"Não"
"PARQUE ESTADUAL XIXOVÁ-JAPUÍ","Ferns and Lycophytes","Anemiaceae","Anemia","phyllitidis","(L.) Sw.","ANEMIACEAE Anemia phyllitidis (L.) Sw.","SPSF00027573","Splink","SPSF","Pastore, J.A.","929","Native","Bronze","High","Parque Estadual Xixová-Japuí","Não"
"PARQUE ESTADUAL XIXOVÁ-JAPUÍ","Angiosperms","Annonaceae","Annona",,"L.","ANNONACEAE Annona L.","SPSF00033062","Splink","SPSF","Moura, C.","64",,"Latão","Low","P.E.Xixova-Japui","Não"
"PARQUE ESTADUAL XIXOVÁ-JAPUÍ","Angiosperms","Annonaceae","Guatteria","australis","A.St.-Hil.","ANNONACEAE Guatteria australis A.St.-Hil.","FUEL029036","Splink","FUEL","Pastore, J.A.","s.n.","Native","Bronze","High","Parque Estadual Xixová-Japuí, Japuí","Não"
"PARQUE ESTADUAL XIXOVÁ-JAPUÍ","Angiosperms","Apocynaceae","Condylocarpon",,"Desf.","APOCYNACEAE Condylocarpon Desf.","253677","Splink","SP","Kawall, M.","155",,"Latão","Low","Área na beira da rodovia Pedro Taques","Não"
"PARQUE ESTADUAL XIXOVÁ-JAPUÍ","Angiosperms","Apocynaceae","Oxypetalum","tomentosum","(E. Fourn.) Fontella & E.A. Schwarz","APOCYNACEAE Oxypetalum tomentosum var. parvifolium (E. Fourn.) Fontella & E.A. Schwarz","HBR0055745","Splink","HBR","Klein, R.M.","10239","Native","Bronze","Low","Suarão","Não"
"PARQUE ESTADUAL XIXOVÁ-JAPUÍ","Angiosperms","Apocynaceae","Oxypetalum","tomentosum","Wight ex Hook. & Arn.","APOCYNACEAE Oxypetalum tomentosum Wight ex Hook. & Arn.","30852","Splink","SP","Hoehne, F.C.","s.n.","Native","Bronze","Low",,"Não"
"PARQUE ESTADUAL XIXOVÁ-JAPUÍ","Angiosperms","Apocynaceae","Tabernaemontana","catharinensis","A.DC.","APOCYNACEAE Tabernaemontana catharinensis A.DC.","SP022489","Splink","SP","Loefgren, A.","CGG4093","Native","Ouro","Low","Boqueirão","Não"
"PARQUE ESTADUAL XIXOVÁ-JAPUÍ","Angiosperms","Apocynaceae","Tabernaemontana","laeta","Mart.","APOCYNACEAE Tabernaemontana laeta Mart.","SPSF00027500","Splink","SPSF","Pastore, J.A.","873","Native","Latão","High","Parque Estadual Xixová-Japuí","Não"
"PARQUE ESTADUAL XIXOVÁ-JAPUÍ","Angiosperms","Aquifoliaceae","Ilex","dumosa","Reissek","AQUIFOLIACEAE Ilex dumosa Reissek","SP022496","Splink","SP","Loefgren, A.","CGG4218","Native","Bronze","Low","Porto pequeno","Não"
"PARQUE ESTADUAL XIXOVÁ-JAPUÍ","Angiosperms","Aquifoliaceae","Ilex","pseudobuxus","Reissek","AQUIFOLIACEAE Ilex pseudobuxus Reissek","119650","Splink","SP","Grotta, A.S.","s.n.","Native","Bronze","Low","Mongaguá. Santos","Não"
"PARQUE ESTADUAL XIXOVÁ-JAPUÍ","Angiosperms","Araceae","Alocasia","macrorrhizos","(L.) G.Don","ARACEAE Alocasia macrorrhizos (L.) G.Don","183357454","GBIF","Observations","Dandamasc",,"Cultivated","Bronze","Low","Japuí, São Vicente - SP, Brasil","Não"
"PARQUE ESTADUAL XIXOVÁ-JAPUÍ","Angiosperms","Araceae","Anthurium","loefgrenii","Engl.","ARACEAE Anthurium loefgrenii Engl.","SP049226","Splink","SP","Handro, O.","572","Native","Ouro","Low",,"Não"
"PARQUE ESTADUAL XIXOVÁ-JAPUÍ","Angiosperms","Araceae","Anthurium","pentaphyllum","(Aubl.) G.Don","ARACEAE Anthurium pentaphyllum (Aubl.) G.Don","SPSF00027561","Splink","SPSF","Pastore, J.A.","917","Native","Latão","High","Parque Estadual Xixová-Japuí","Não"
"PARQUE ESTADUAL XIXOVÁ-JAPUÍ","Angiosperms","Araceae","Anthurium","sellowianum","Kunth","ARACEAE Anthurium sellowianum Kunth","SPSF00028178","Splink","SPSF","Pastore, J.A.","1042","Native","Latão","High","Parque Estadual Xixová-Japuí","Não"
"PARQUE ESTADUAL XIXOVÁ-JAPUÍ","Angiosperms","Araceae","Colocasia","esculenta","(L.) Schott","ARACEAE Colocasia esculenta (L.) Schott","105161169","GBIF","Observations","Sarahrocam",,"Cultivated","Bronze","Low","Japuí, São Vicente - SP, Brasil","Não"
"PARQUE ESTADUAL XIXOVÁ-JAPUÍ","Angiosperms","Araceae","Dieffenbachia","seguine","(Jacq.) Schott","ARACEAE Dieffenbachia seguine (Jacq.) Schott","170260217","GBIF","Observations","Leticiamassolini",,"Native","Bronze","Low","Av. Tupiniquins, 1064 - Japuí, São Vicente - SP, 11325-000, Brasil","Não"
"PARQUE ESTADUAL XIXOVÁ-JAPUÍ","Angiosperms","Araceae","Monstera","adansonii","Schott","ARACEAE Monstera adansonii Schott","SPSF00028330","Splink","SPSF","Pastore, J.A.","1068","Native","Ouro","High","Parque Estadual Xixová-Japuí","Não"
"PARQUE ESTADUAL XIXOVÁ-JAPUÍ","Angiosperms","Araceae","Philodendron","cordatum","Kunth ex Schott","ARACEAE Philodendron cordatum Kunth ex Schott","SP049662","Splink","SP","Handro, O.","751","Native","Bronze","Low",,"Não"
"PARQUE ESTADUAL XIXOVÁ-JAPUÍ","Angiosperms","Araceae","Philodendron","obliquifolium","Engl.","ARACEAE Philodendron obliquifolium Engl.","SP001731","Splink","SP","Loefgren, A.","CGG4064","Native","Ouro","Low","costão de Itaipu","Não"
"PARQUE ESTADUAL XIXOVÁ-JAPUÍ","Angiosperms","Araceae","Philodendron","propinquum","Schott","ARACEAE Philodendron propinquum Schott","SPSF00027554","Splink","SPSF","Pastore, J.A.","909","Native","Ouro","High","Parque Estadual Xixová-Japuí","Não"
"PARQUE ESTADUAL XIXOVÁ-JAPUÍ","Angiosperms","Araceae","Spathiphyllum","cannifolium","(Dryand. ex Sims) Schott","ARACEAE Spathiphyllum cannifolium (Dryand. ex Sims) Schott","SPSF00028326","Splink","SPSF","Pastore, J.A.","1064","Native","Ouro","High","Parque Estadual Xixová-Japuí","Não"
"PARQUE ESTADUAL XIXOVÁ-JAPUÍ","Angiosperms","Araceae","Syngonium","podophyllum","Schott","ARACEAE Syngonium podophyllum Schott","170477770","GBIF","Observations","Sh_rodes",,"Unknown","Bronze","Low","Japui, São Vicente, SP, BR","Não"
"PARQUE ESTADUAL XIXOVÁ-JAPUÍ","Angiosperms","Araceae","Thaumatophyllum","bipinnatifidum","(Schott ex Endl.) Sakur., Calazans & Mayo","ARACEAE Thaumatophyllum bipinnatifidum (Schott ex Endl.) Sakur., Calazans & Mayo","192485385","GBIF","Observations","Martins, V.",,"Native","Bronze","High","Parque Estadual Xixová-Japuí, São Paulo","Não"
"PARQUE ESTADUAL XIXOVÁ-JAPUÍ","Angiosperms","Araliaceae","Dendropanax","exilis","(Toledo) S.L.Jung","ARALIACEAE Dendropanax exilis (Toledo) S.L.Jung","SPSF00029195","Splink","SPSF","Pastore, J.A.","1104","Native","Ouro","High","Parque Estadual Xixová-Japuí","Não"
"PARQUE ESTADUAL XIXOVÁ-JAPUÍ","Angiosperms","Araliaceae","Dendropanax","monogynus","(Vell.) Seem.","ARALIACEAE Dendropanax monogynus (Vell.) Seem.","34493","Splink","FUEL","Pastore, J.A.","s.n.","Native","Bronze","High","Parque Estadual Xixová-Japuí, Japuí","Não"
"PARQUE ESTADUAL XIXOVÁ-JAPUÍ","Angiosperms","Araliaceae","Hydrocotyle","bonariensis","Lam.","ARALIACEAE Hydrocotyle bonariensis Lam.","HUSC015802","Splink","HUSC","Sampaio, P.S.P.","2054","Native","Bronze","Low","AV. João André Quintale x Rua Dorivaldo Francisco Loria.","Não"
"PARQUE ESTADUAL XIXOVÁ-JAPUÍ","Angiosperms","Arecaceae","Astrocaryum","aculeatissimum","(Schott) Burret","ARECACEAE Astrocaryum aculeatissimum (Schott) Burret","SPSF00028342","Splink","SPSF","Pastore, J.A.","1080","Native","Ouro","High","Parque Estadual Xixová-Japuí","Não"
"PARQUE ESTADUAL XIXOVÁ-JAPUÍ","Angiosperms","Arecaceae","Cocos","nucifera","L.","ARECACEAE Cocos nucifera L.","HUSC015972","Splink","HUSC","Sena, I.A.B.","s.n.","Naturalized","Bronze","Low","Praia do Boqueirão","Não"
"PARQUE ESTADUAL XIXOVÁ-JAPUÍ","Angiosperms","Arecaceae","Geonoma","elegans","Mart.","ARECACEAE Geonoma elegans Mart.","58191","Splink","SP","Joly, A.B.","1092","Native","Bronze","Low","Vila Atlântica","Não"
"PARQUE ESTADUAL XIXOVÁ-JAPUÍ","Angiosperms","Arecaceae","Geonoma","gamiova","Barb.Rodr.","ARECACEAE Geonoma gamiova Barb.Rodr.","SPSF00027934","Splink","SPSF","Pastore, J.A.","1000","Native","Prata","High","Parque Estadual Xixová-Japuí","Não"
"PARQUE ESTADUAL XIXOVÁ-JAPUÍ","Angiosperms","Arecaceae","Geonoma","schottiana","Mart.","ARECACEAE Geonoma schottiana Mart.","SP009714","Splink","SP","Loefgren, A.","CGG4067","Native","Ouro","Low",,"Não"
"PARQUE ESTADUAL XIXOVÁ-JAPUÍ","Angiosperms","Aristolochiaceae","Aristolochia","trilobata","L.","ARISTOLOCHIACEAE Aristolochia trilobata L.","HBR0037659","Splink","HBR","Klein, R.M.","10243","Native","Bronze","Low","Suarão","Não"
"PARQUE ESTADUAL XIXOVÁ-JAPUÍ","Ferns and Lycophytes","Aspleniaceae","Asplenium","serratum","L.","ASPLENIACEAE Asplenium serratum L.","SP010436","Splink","SP","Loefgren, A.","CGG4611","Native","Bronze","Low","Mata, Morro do Itaipu.","Não"
"PARQUE ESTADUAL XIXOVÁ-JAPUÍ","Angiosperms","Asteraceae","Acmella","brachyglossa","Cass.","ASTERACEAE Acmella brachyglossa Cass.","HUSC008350","Splink","HUSC","Bueno, V.C.","15","Native","Bronze","High","Parque Estadual Xixová-Japuí, Setor Cortume-Itaquitanduva","Não"
"PARQUE ESTADUAL XIXOVÁ-JAPUÍ","Angiosperms","Asteraceae","Adenostemma","brasilianum","(Pers.) Cass.","ASTERACEAE Adenostemma brasilianum (Pers.) Cass.","HUSC008351","Splink","HUSC","Bueno, V.C.","18","Native","Bronze","High","Parque Estadual Xixová-Japuí, Setor Cortume-Itaquitanduva","Não"
"PARQUE ESTADUAL XIXOVÁ-JAPUÍ","Angiosperms","Asteraceae","Ageratum","conyzoides","L.","ASTERACEAE Ageratum conyzoides L.","HUSC008353","Splink","HUSC","Bueno, V.C.","3","Native","Bronze","High","Parque Estadual Xixová-Japuí, Setor Cortume-Itaquitanduva","Não"
"PARQUE ESTADUAL XIXOVÁ-JAPUÍ","Angiosperms","Asteraceae","Ambrosia","artemisiifolia","L.","ASTERACEAE Ambrosia artemisiifolia L.","HUSC015803","Splink","HUSC","Sampaio, P.S.P.","2057","Native","Bronze","Low","AV. João André Quintale x Rua Dorivaldo Francisco Loria.","Não"
"PARQUE ESTADUAL XIXOVÁ-JAPUÍ","Angiosperms","Asteraceae","Artemisia","absinthium","L.","ASTERACEAE Artemisia absinthium L.","HUSC008360","Splink","HUSC","Farmacia, A.","s.n.","Cultivated","Bronze","Low","cultivada quintal de casa","Não"
"PARQUE ESTADUAL XIXOVÁ-JAPUÍ","Angiosperms","Asteraceae",,,"Bercht. & J.Presl","ASTERACEAE Asteraceae Bercht. & J.Presl","ESA150868","Splink","ESA","Souza, V.C.","44167",,"Latão","Low","Rodovia Pe. Manoel da Nóbrega, km 300. Balneário Flórida. Floresta de restinga.","Não"
"PARQUE ESTADUAL XIXOVÁ-JAPUÍ","Angiosperms","Asteraceae","Baccharis","crispa","Spreng.","ASTERACEAE Baccharis crispa Spreng.","HUSC008365","Splink","HUSC","Bueno, V.C.","22","Native","Bronze","High","Parque Estadual Xixová-Japuí, Setor Cortume-Itaquitanduva","Não"
"PARQUE ESTADUAL XIXOVÁ-JAPUÍ","Angiosperms","Asteraceae","Bidens","pilosa","L.","ASTERACEAE Bidens pilosa L.","HUSC008379","Splink","HUSC","Bueno, V.C.","5","Naturalized","Bronze","High","Parque Estadual Xixová-Japuí, Setor Cortume-Itaquitanduva","Não"
"PARQUE ESTADUAL XIXOVÁ-JAPUÍ","Angiosperms","Asteraceae","Chaptalia","nutans","(L.) Pol.","ASTERACEAE Chaptalia nutans (L.) Pol.","HUSC008384","Splink","HUSC","Bueno, V.C.","2","Native","Bronze","High","Parque Estadual Xixová-Japuí, Setor Cortune-Itaquitanduva.","Não"
"PARQUE ESTADUAL XIXOVÁ-JAPUÍ","Angiosperms","Asteraceae","Chromolaena","laevigata","(Lam.) R.M.King & H.Rob.","ASTERACEAE Chromolaena laevigata (Lam.) R.M.King & H.Rob.","HUSC008391","Splink","HUSC","Bueno, V.C.","21","Native","Bronze","High","Parque Estadual Xixová-Japuí, Setor Cortume-Itaquitanduva.","Não"
"PARQUE ESTADUAL XIXOVÁ-JAPUÍ","Angiosperms","Asteraceae","Conyza","canadensis","(L.) Cronquist","ASTERACEAE Conyza canadensis (L.) Cronquist","HUSC008385","Splink","HUSC","Bueno, V.C.","6","Native","Bronze","High","Parque Estadual Xixová-Japuí, Setor Cortume-Itaquitanduva","Não"
"PARQUE ESTADUAL XIXOVÁ-JAPUÍ","Angiosperms","Asteraceae","Critoniopsis","quinqueflora","(Less.) H.Rob.","ASTERACEAE Critoniopsis quinqueflora (Less.) H.Rob.","UEC181231","Splink","UEC","Hoehne, F.C.","s.n.","Native","Ouro","Low",,"Não"
"PARQUE ESTADUAL XIXOVÁ-JAPUÍ","Angiosperms","Asteraceae","Cyrtocymura","scorpioides","(Lam.) H.Rob.","ASTERACEAE Cyrtocymura scorpioides (Lam.) H.Rob.","HUSC008426","Splink","HUSC","Bueno, V.C.","4","Native","Bronze","High","Parque Estadual Xixová-Japuí, Setor Cortune-Itaquitanduva.","Não"
"PARQUE ESTADUAL XIXOVÁ-JAPUÍ","Angiosperms","Asteraceae","Eclipta","prostrata","(L.) L.","ASTERACEAE Eclipta prostrata (L.) L.","HUSC008386","Splink","HUSC","Bueno, V.C.","8","Native","Bronze","High","Parque Estadual Xixová-Japuí, Setor Cortume-Itaquitanduva","Não"
"PARQUE ESTADUAL XIXOVÁ-JAPUÍ","Angiosperms","Asteraceae","Elephantopus","mollis","Kunth","ASTERACEAE Elephantopus mollis Kunth","HUSC008387","Splink","HUSC","Bueno, V.C.","7","Native","Bronze","High","Parque Estadual Xixová-Japuí, Setor Cortume-Itaquitanduva.","Não"
"PARQUE ESTADUAL XIXOVÁ-JAPUÍ","Angiosperms","Asteraceae","Emilia","fosbergii","Nicolson","ASTERACEAE Emilia fosbergii Nicolson","HUSC015785","Splink","HUSC","Sampaio, P.S.P.","2053","Naturalized","Bronze","Low","Praia do Canto do Forte, faceado na lateral da Praça Duque de Caixias.","Não"
"PARQUE ESTADUAL XIXOVÁ-JAPUÍ","Angiosperms","Asteraceae","Emilia","sonchifolia","(L.) DC.","ASTERACEAE Emilia sonchifolia (L.) DC.","HUSC008388","Splink","HUSC","Bueno, V.C.","11","Naturalized","Bronze","High","Parque Estadual Xixová-Japuí, Setor Cortume-Itaquitanduva.","Não"
"PARQUE ESTADUAL XIXOVÁ-JAPUÍ","Angiosperms","Asteraceae","Galinsoga","quadriradiata","Ruiz & Pav.","ASTERACEAE Galinsoga quadriradiata Ruiz & Pav.","HUSC008393","Splink","HUSC","Bueno, V.C.","128","Naturalized","Bronze","High","Parque Estadual Xixová-Japuí, Setor Cortume-Itaquitanduva.","Não"
"PARQUE ESTADUAL XIXOVÁ-JAPUÍ","Angiosperms","Asteraceae","Gamochaeta",,"Wedd.","ASTERACEAE Gamochaeta Wedd.","NY01080691","Splink","NY","Fosberg, F.R.","45993",,"Bronze","Low","about 10 km SW of São Vicente (SW of Santos).","Não"
"PARQUE ESTADUAL XIXOVÁ-JAPUÍ","Angiosperms","Asteraceae","Mikania","argyreiae","DC.","ASTERACEAE Mikania argyreiae DC.","ESA069385","Splink","ESA","Oliveira, F.","65","Native","Bronze","Low",,"Não"
"PARQUE ESTADUAL XIXOVÁ-JAPUÍ","Angiosperms","Asteraceae","Mikania","biformis","DC.","ASTERACEAE Mikania biformis DC.","169622","Splink","SP","Oliveira, F.","55","Native","Latão","Low",,"Não"
"PARQUE ESTADUAL XIXOVÁ-JAPUÍ","Angiosperms","Asteraceae","Mikania","involucrata","Hook. & Arn.","ASTERACEAE Mikania involucrata Hook. & Arn.","SP023666","Splink","SP","Loefgren, A.","CGG4107","Native","Ouro","Low","Santos","Não"
"PARQUE ESTADUAL XIXOVÁ-JAPUÍ","Angiosperms","Asteraceae","Mikania","lundiana","DC.","ASTERACEAE Mikania lundiana DC.","SPSF00028307","Splink","SPSF","Pastore, J.A.","1050","Native","Bronze","High","Parque Estadual Xixová-Japuí","Não"
"PARQUE ESTADUAL XIXOVÁ-JAPUÍ","Angiosperms","Asteraceae","Mikania","micrantha","Kunth","ASTERACEAE Mikania micrantha Kunth","ICN00061965","Splink","ICN","Vieira, A.O.S.","419","Native","Ouro","Low","Rodovia Pedro Taques retorno para Itanhaem","Não"
"PARQUE ESTADUAL XIXOVÁ-JAPUÍ","Angiosperms","Asteraceae","Mikania","paniculata","DC.","ASTERACEAE Mikania paniculata DC.","352017","Splink","SP","Pastore, J.A.","1027","Native","Bronze","High","Parque Estadual Xixová-Japuí, Estrada de acesso à região de Paranapuã, em frente ao costão","Não"
"PARQUE ESTADUAL XIXOVÁ-JAPUÍ","Angiosperms","Asteraceae","Mikania","trinervis","Hook. & Arn.","ASTERACEAE Mikania trinervis Hook. & Arn.","UB1223600","Splink","UB","Kuhlmann, M.","2969","Native","Ouro","Low",,"Não"
"PARQUE ESTADUAL XIXOVÁ-JAPUÍ","Angiosperms","Asteraceae","Orthopappus","angustifolius","(Sw.) Gleason","ASTERACEAE Orthopappus angustifolius (Sw.) Gleason","HUSC008406","Splink","HUSC","Bueno, V.C.","29","Native","Bronze","High","Parque estadual xixová-japuí, setor cortume-itaquitanduva","Não"
"PARQUE ESTADUAL XIXOVÁ-JAPUÍ","Angiosperms","Asteraceae","Piptocarpha","axillaris","(Less.) Baker","ASTERACEAE Piptocarpha axillaris (Less.) Baker","SPSF00016293","Splink","SPSF","Hatschbach, G.","57883","Native","Ouro","Low","Serra do Faxinal","Não"
"PARQUE ESTADUAL XIXOVÁ-JAPUÍ","Angiosperms","Asteraceae","Pterocaulon","virgatum","(L.) DC.","ASTERACEAE Pterocaulon virgatum (L.) DC.","HUSC008394","Splink","HUSC","Bueno, V.C.","9","Native","Bronze","High","Parque Estadual Xixová-Japuí, Setor Cortume-Itaquitanduva.","Não"
"PARQUE ESTADUAL XIXOVÁ-JAPUÍ","Angiosperms","Asteraceae","Sonchus","oleraceus","L.","ASTERACEAE Sonchus oleraceus L.","HUSC008415","Splink","HUSC","Bueno, V.C.","25","Native","Bronze","High","Parque Estadual Xixová-Japuí, Setor Cortume-Itaquitanduva","Não"
"PARQUE ESTADUAL XIXOVÁ-JAPUÍ","Angiosperms","Asteraceae","Sphagneticola","trilobata","(L.) Pruski","ASTERACEAE Sphagneticola trilobata (L.) Pruski","FUEL030323","Splink","FUEL","Pastore, J.A.","1057","Native","Ouro","High","Parque Estadual Xixová-Japuí, Japuí","Não"
"PARQUE ESTADUAL XIXOVÁ-JAPUÍ","Angiosperms","Asteraceae","Symphyotrichum","squamatum","(Spreng.) G.L.Nesom","ASTERACEAE Symphyotrichum squamatum (Spreng.) G.L.Nesom","HUSC008363","Splink","HUSC","Bueno, V.C.","20","Native","Bronze","High","Parque Estadual Xixová-Japuí, Setor Cortume-Itaquitanduva","Não"
"PARQUE ESTADUAL XIXOVÁ-JAPUÍ","Angiosperms","Asteraceae","Synedrella","nodiflora","(L.) Gaertn.","ASTERACEAE Synedrella nodiflora (L.) Gaertn.","HUSC008414","Splink","HUSC","Bueno, V.C.","27","Native","Bronze","High","Parque Estadual Xixová-Japuí, Setor Cortume-Itaquitanduva","Não"
"PARQUE ESTADUAL XIXOVÁ-JAPUÍ","Angiosperms","Asteraceae","Trixis","antimenorrhoea","(Schrank) Kuntze","ASTERACEAE Trixis antimenorrhoea (Schrank) Kuntze","SP023726","Splink","SP","Loefgren, A.","CGG4105","Native","Ouro","Low","Boqueirão","Não"
"PARQUE ESTADUAL XIXOVÁ-JAPUÍ","Angiosperms","Asteraceae","Vernonanthura","brasiliana","(L.) H.Rob.","ASTERACEAE Vernonanthura brasiliana (L.) H.Rob.","HUSC008425","Splink","HUSC","Bueno, V.C.","33","Native","Bronze","High","Parque Estadual Xixová-Japuí, Setor Cortune-Itaquitanduva.","Não"
"PARQUE ESTADUAL XIXOVÁ-JAPUÍ","Angiosperms","Asteraceae","Vernonanthura","discolor","(Spreng.) H.Rob.","ASTERACEAE Vernonanthura discolor (Spreng.) H.Rob.","160038","GBIF","UEC","Pastore, J.A.","1267","Native","Ouro","High","parque estadual Xixová-Japui.Estrada de acesso á região de Paranapuã, em barranco.","Não"
"PARQUE ESTADUAL XIXOVÁ-JAPUÍ","Angiosperms","Asteraceae","Vernonanthura","lindbergii","(Baker) H.Rob.","ASTERACEAE Vernonanthura lindbergii (Baker) H.Rob.","253678","Splink","SP","Kawall, M.","156","Native","Bronze","Low","Área na beira da Rodovia Pedro Taques","Não"
"PARQUE ESTADUAL XIXOVÁ-JAPUÍ","Angiosperms","Asteraceae","Vernonia",,"Schreb.","ASTERACEAE Vernonia Schreb.","FUEL017228","Splink","FUEL","Vieira, A.O.S.","233",,"Latão","Low","Aeroporto","Não"
"PARQUE ESTADUAL XIXOVÁ-JAPUÍ","Angiosperms","Balsaminaceae","Impatiens","walleriana","Hook.f.","BALSAMINACEAE Impatiens walleriana Hook.f.","253474955","GBIF","Observations","Valboots",,"Naturalized","Bronze","Low","Japuí, São Vicente - SP, Brasil","Não"
"PARQUE ESTADUAL XIXOVÁ-JAPUÍ","Angiosperms","Begoniaceae","Begonia","cucullata","Willd.","BEGONIACEAE Begonia cucullata Willd.","HUSC011429","Splink","HUSC","Almeida, O.J.G.","31","Native","Ouro","High","Parque Estadual Xixová-Japuí.","Não"
"PARQUE ESTADUAL XIXOVÁ-JAPUÍ","Angiosperms","Begoniaceae","Begonia","fischeri","Schrank","BEGONIACEAE Begonia fischeri Schrank","SMDB020803","Splink","SMDB","Pastore, J.A.","1259","Native","Bronze","High","parque Estadual Xixová-Japuí, região de Pananapuã, caminho para o CECOF,","Não"
"PARQUE ESTADUAL XIXOVÁ-JAPUÍ","Angiosperms","Begoniaceae","Begonia","hirtella","Link","BEGONIACEAE Begonia hirtella Link","170454905","GBIF","Observations","Dominguez, Y.",,"Native","Bronze","Low","Japuí, São Vicente - SP, Brasil","Não"
"PARQUE ESTADUAL XIXOVÁ-JAPUÍ","Angiosperms","Begoniaceae","Begonia","radicans","Vell.","BEGONIACEAE Begonia radicans Vell.","MBM256476","Splink","MBM","Pastore, J.A.","863","Native","Bronze","High","Parque Estadual Xixová-Japuí.","Não"
"PARQUE ESTADUAL XIXOVÁ-JAPUÍ","Angiosperms","Bignoniaceae","Adenocalymma","comosum","(Cham.) DC.","BIGNONIACEAE Adenocalymma comosum (Cham.) DC.","SP058034","Splink","SP","Loefgren, A.","s.n.",,"Ouro","Low","Caminho do Porto","Não"
"PARQUE ESTADUAL XIXOVÁ-JAPUÍ","Angiosperms","Bignoniaceae","Amphilophium","crucigerum","(L.) L.G.Lohmann","BIGNONIACEAE Amphilophium crucigerum (L.) L.G.Lohmann","SPSF00027907","Splink","SPSF","Pastore, J.A.","984","Native","Latão","High","Parque Estadual Xixová-Japuí","Não"
"PARQUE ESTADUAL XIXOVÁ-JAPUÍ","Angiosperms","Bignoniaceae","Anemopaegma","chamberlaynii","(Sims) Bureau & K.Schum.","BIGNONIACEAE Anemopaegma chamberlaynii (Sims) Bureau & K.Schum.","HRCB041155","Splink","HRCB","Pastore, J.A.","1019","Native","Ouro","High","Parque Estadual Xixová-Japuí estrada de acesso à reginøa de Paranapuã em barranco em frente ao mar","Não"
