"UC","Grupos","Família","Gênero","Espécie","Autor","Táxon_completo","Barcode","BD_Origem","Herbário","Coletor","Número_da_Coleta","Origem_FFBr","ConfiançaID","ConfiançaLoc","Localidade","Já listada"
"PARQUE ESTADUAL INTERVALES","Angiosperms","Picramniaceae","Picramnia","glazioviana","Engl.","PICRAMNIACEAE Picramnia glazioviana Engl.","33934","GBIF","SPSF","Aguiar, A.C.","129","Native","Latão","High","Parque Estadual Intervales, Trilha da Cachoeira das Pedrinhas.","Não"
"PARQUE ESTADUAL INTERVALES","Angiosperms","Picramniaceae","Picramnia","ramiflora","Planch.","PICRAMNIACEAE Picramnia ramiflora Planch.","33689","GBIF","SPSF","Araki, D.F.","112","Native","Ouro","High","Parque Estadual Intervales","Não"
"PARQUE ESTADUAL INTERVALES","Angiosperms","Piperaceae","Manekia","obtusa","(Miq.) T. Arias, Callejas & Bornst.","PIPERACEAE Manekia obtusa (Miq.) T. Arias, Callejas & Bornst.","RB00714132","GBIF","RB","Ziparro, V.B.","2045","Native","Ouro","High","Parque Estadual Intervales Base Saibadela; Trilha do Rio, após o rio Saibadela, ambiente iluminado.","Não"
"PARQUE ESTADUAL INTERVALES","Angiosperms","Piperaceae","Peperomia","arifolia","Miq.","PIPERACEAE Peperomia arifolia Miq.","110829","GBIF","HUEFS","Kirizawa, M.","2879","Native","Ouro","High","Fazenda Intervales, Base Saibadela. Na parte baixa do morro, perto do rio Saibadela, forrando o chão.","Não"
"PARQUE ESTADUAL INTERVALES","Angiosperms","Piperaceae","Peperomia","catharinae","Miq.","PIPERACEAE Peperomia catharinae Miq.","RB01196695","GBIF","RB","Zipparro, V.B.","1967","Native","Ouro","High","Parque Estadual Intervales. Base Saibadela.","Não"
"PARQUE ESTADUAL INTERVALES","Angiosperms","Piperaceae","Peperomia","corcovadensis","Gardner","PIPERACEAE Peperomia corcovadensis Gardner","084943","GBIF","ESA","Urbanetz, C.","125","Native","Prata","High","Parque Estadual Intervales. Núcleo Bulha D'água, Trilha da caverna do Sr. Bento. Vegetação Secundária de Floresta Ombrófila Densa Montana/Submontana, com trechos remanescentes de floresta com extrativismo seletivo (madeira e palmito) e trechos regenerados","Não"
"PARQUE ESTADUAL INTERVALES","Angiosperms","Piperaceae","Peperomia","glabella","(Sw.) A.Dietr.","PIPERACEAE Peperomia glabella (Sw.) A.Dietr.","213429","GBIF","UB","Kawasaki, M.L.","657","Native","Ouro","High","Fazenda Intervales. Base Guapiruvu.","Não"
"PARQUE ESTADUAL INTERVALES","Angiosperms","Piperaceae","Peperomia","hispidula","(Miq.) Dahlst.","PIPERACEAE Peperomia hispidula subsp. sellowiana (Miq.) Dahlst.","33898","GBIF","SPSF","Urbanetz, C.","77","Native","Ouro","High","Parque Estadual Intervales, Trilha saindo 500m antes da sede do Núcleo Barra Grande em direção à E.E.Xituê. Vegetação bem conservada de Floresta Ombrófila Densa Montana, com escorregamentos naturais e com exploração de palmito","Não"
"PARQUE ESTADUAL INTERVALES","Angiosperms","Piperaceae","Peperomia","martiana","Miq.","PIPERACEAE Peperomia martiana Miq.","084945","GBIF","ESA","Urbanetz, C.","131","Native","Prata","High","Parque Estadual Intervales. Núcleo Bulha D'água, Trilha da caverna do Sr. Bento. Vegetação Secundária de Floresta Ombrófila Densa Montana/Submontana, com trechos remanescentes de floresta com extrativismo seletivo (madeira e palmito) e trechos regenerados","Não"
"PARQUE ESTADUAL INTERVALES","Angiosperms","Piperaceae","Peperomia","obtusifolia","(L.) A.Dietr.","PIPERACEAE Peperomia obtusifolia (L.) A.Dietr.","259704","GBIF","SP","Kirizawa, M.","2820","Native","Ouro","High","Fazenda Intervales, Sede Saibadela. Trilha para Quilombo.","Não"
"PARQUE ESTADUAL INTERVALES","Angiosperms","Piperaceae","Peperomia","pereskiaefolia","(Jacq.) Kunth","PIPERACEAE Peperomia pereskiaefolia (Jacq.) Kunth","134997","GBIF","UEC","Viani, R.A.G.","120","Native","Prata","High","Parque Estadual Intervales, Trilha da Bocaina em direção à gruta da Mãozinha e gruta do Minotauro; vegetação secundária de Floresta Ombrófila Densa Montana","Não"
"PARQUE ESTADUAL INTERVALES","Angiosperms","Piperaceae","Peperomia","pseudoestrellensis","C.DC.","PIPERACEAE Peperomia pseudoestrellensis C.DC.","RB00274124","GBIF","RB","Wanderley, M.G.L.","2040","Native","Ouro","High","Fazenda Intervales, Saibadela. Trilha.","Não"
"PARQUE ESTADUAL INTERVALES","Angiosperms","Piperaceae","Peperomia","rotundifolia","(L.) Kunth","PIPERACEAE Peperomia rotundifolia (L.) Kunth","RB00714119","GBIF","RB","Guilherme, F.A.G.","316","Native","Ouro","High","Parque Estadual Intervales - Base Saibadela Arredores do alojamento.","Não"
"PARQUE ESTADUAL INTERVALES","Angiosperms","Piperaceae","Peperomia","rubricaulis","(Nees) A.Dietr.","PIPERACEAE Peperomia rubricaulis (Nees) A.Dietr.","262341","GBIF","SP","Aragaki, S.","58","Native","Ouro","High","Fazenda Intervales, Base Saibadela, Cachoeira Saibadela.","Não"
"PARQUE ESTADUAL INTERVALES","Angiosperms","Piperaceae","Peperomia","tetraphylla","(G.Forst.) Hook. & Arn.","PIPERACEAE Peperomia tetraphylla (G.Forst.) Hook. & Arn.","084952","GBIF","ESA","Viani, R.A.G.","126","Native","Latão","High","Parque Estadual Intervales, Trilha da Bocaina em direção à gruta da Mãozinha e gruta do Minotauro; vegetação secundária de Floresta Ombrófila Densa Montana","Não"
"PARQUE ESTADUAL INTERVALES","Angiosperms","Piperaceae","Peperomia","urocarpa","Fisch. & C.A.Mey.","PIPERACEAE Peperomia urocarpa Fisch. & C.A.Mey.","33863","GBIF","SPSF","Aguiar, A.C.","189","Native","Ouro","High","Parque Estadual Intervales","Não"
"PARQUE ESTADUAL INTERVALES","Angiosperms","Piperaceae","Piper","aduncum","L.","PIPERACEAE Piper aduncum L.","RB01180380","GBIF","RB","Medeiros, D.A.","38","Native","Ouro","High","Parque estadual intervales. Borda da estrada de São Pedro, próximo a entrada da Trolha da Cachoeira das Pedrinhas","Não"
"PARQUE ESTADUAL INTERVALES","Angiosperms","Piperaceae","Piper","arboreum","Yunck.","PIPERACEAE Piper arboreum var. hirtellum Yunck.","MO0100832254","Splink","MO","Kirizawa, M.","2931","Native","Ouro","High","Fazenda Intervales, Base Guapiruvu, trilha para Saibadela, perto da Base.","Não"
"PARQUE ESTADUAL INTERVALES","Angiosperms","Piperaceae","Piper","caldense","C.DC.","PIPERACEAE Piper caldense C.DC.","118908","GBIF","CEPEC","Wanderley, M.G.L.","2048","Native","Ouro","High","Faz. Intervales, Saibadela. Trilha para a Cachoeira Saibadela.","Não"
"PARQUE ESTADUAL INTERVALES","Angiosperms","Piperaceae","Piper","cernuum","Vell.","PIPERACEAE Piper cernuum Vell.","44259","GBIF","SPSF","Miashike, R.L.","92","Native","Prata","High","Parque Estadual de Intervales","Não"
"PARQUE ESTADUAL INTERVALES","Angiosperms","Piperaceae","Piper","chimonanthifolium","Kunth","PIPERACEAE Piper chimonanthifolium Kunth","233257","GBIF","SPF","Kato, M.J.","2300","Native","Bronze","High","Parque Estadual Intervales","Não"
"PARQUE ESTADUAL INTERVALES","Angiosperms","Piperaceae","Piper","dilatatum","Rich.","PIPERACEAE Piper dilatatum Rich.","200888","GBIF","UB","Viani, R.A.G.","161","Native","Ouro","High","Parque Estadual Intervales, trilha saindo 500m antes da sede do núcleo Barra Grande, em direção E.E. Xituê.","Não"
"PARQUE ESTADUAL INTERVALES","Angiosperms","Piperaceae","Piper","fuligineum","Kunth","PIPERACEAE Piper fuligineum Kunth","358921","GBIF","SP","Kato, M.J.","102","Native","Ouro","High","Parque Estadual Intervales","Não"
"PARQUE ESTADUAL INTERVALES","Angiosperms","Piperaceae","Piper","gaudichaudianum","Kunth","PIPERACEAE Piper gaudichaudianum Kunth","RB01180185","GBIF","RB","Araki, D.F.","16","Native","Ouro","High","Riberão Grande. Parque estadual intervales- trilha caçadinha.","Não"
"PARQUE ESTADUAL INTERVALES","Angiosperms","Piperaceae","Piper","glabratum","Kunth","PIPERACEAE Piper glabratum Kunth","200900","GBIF","UB","Urbanetz, C.","138","Native","Latão","High","Parque Estadual Intervales, Trilha de acesso à Estação Ecológica Xitué. Vegetação Secundária de Floresta Ombrófila Densa Montana, com intenso histórico de degradação, a partir de extrativismo seletivo de palmito e madeira, com vários trechos dominados por","Não"
"PARQUE ESTADUAL INTERVALES","Angiosperms","Piperaceae","Piper","hispidum","Sw.","PIPERACEAE Piper hispidum Sw.","97890","GBIF","SPF","Zipparro, V.B.","403","Native","Ouro","High","Fazenda Intervales, Base Saibadela, trilha do betão, beira da mata.","Não"
"PARQUE ESTADUAL INTERVALES","Angiosperms","Piperaceae","Piper","lepturum","Kunth","PIPERACEAE Piper lepturum Kunth","RB01335281","GBIF","RB","Araki, D.F.","9","Native","Ouro","High","Parque Estadual Intervales - trilha caçadinha, Floresta Ombrófila Densa alto-montana, vegetação secundária","Não"
"PARQUE ESTADUAL INTERVALES","Angiosperms","Piperaceae","Piper","lucaeanum","Yunck.","PIPERACEAE Piper lucaeanum var. grandifolium Yunck.","RB00303784","GBIF","RB","Almeida-Scabbia, R.J.",,"Native","Ouro","High","Faz. Intervales, Base Saibadela, trilha do rio.","Não"
"PARQUE ESTADUAL INTERVALES","Angiosperms","Piperaceae","Piper","malacophyllum","(C.Presl) C.DC.","PIPERACEAE Piper malacophyllum (C.Presl) C.DC.","358923","GBIF","SP","Kato, M.J.","100","Native","Ouro","High","Parque Estadual Intervales","Não"
"PARQUE ESTADUAL INTERVALES","Angiosperms","Piperaceae","Piper","mosenii","C.DC.","PIPERACEAE Piper mosenii C.DC.","RB00516543","GBIF","RB","Almeida-Scabbia, R.J.","84","Native","Ouro","High","Fazenda Intervales. Base Saibadela, trilha do rio","Não"
"PARQUE ESTADUAL INTERVALES","Angiosperms","Piperaceae","Piper","rivinoides","Kunth","PIPERACEAE Piper rivinoides Kunth","176286","GBIF","SPF","Kirizawa, M.","2943","Native","Ouro","High","Fazenda Intervales, Sede Quilombo, trilha para a cachoeira, início da subida do morro.","Não"
"PARQUE ESTADUAL INTERVALES","Angiosperms","Piperaceae","Piper","scabrellum","Yunck.","PIPERACEAE Piper scabrellum Yunck.","292534","GBIF","SP","Zipparro, V.B.","Saibadela321","Native","Latão","High","Fazenda Intervales, Base Saibadela, trilha do rio.","Não"
"PARQUE ESTADUAL INTERVALES","Angiosperms","Piperaceae","Piper","setebarraense","E.F.Guim. & L.H.P.Costa","PIPERACEAE Piper setebarraense E.F.Guim. & L.H.P.Costa","UEC150027","Splink","UEC","Medeiros, D.A.","114","Native","Ouro","High","Parque Estadual Intervales","Não"
"PARQUE ESTADUAL INTERVALES","Angiosperms","Piperaceae","Piper","solmsianum","C.DC.","PIPERACEAE Piper solmsianum C.DC.","24821","GBIF","SPSF","Batista, E.R.","131","Native","Latão","High","Núcleo Saibadela, Fazenda Intervales, Na trilha da encosta, atrás da casa de pesquisa, Floresta Ombrófila Densa. Terras baixas e baixo montana.","Não"
"PARQUE ESTADUAL INTERVALES","Angiosperms","Plantaginaceae","Plantago","australis","Lam.","PLANTAGINACEAE Plantago australis Lam.","33693","GBIF","SPSF","Urbanetz, C.","92","Native","Ouro","High","Parque Estadual Intervales","Não"
"PARQUE ESTADUAL INTERVALES","Angiosperms","Poaceae","Arundinella","deppeana","Nees ex Steud.","POACEAE Arundinella deppeana Nees ex Steud.","271471","GBIF","SP","Sugiyama, M.","1261","Native","Ouro","High","Fazenda Intervales, Base do Quilombo. Sobre pedras na cachoeira do Quilombo.","Não"
"PARQUE ESTADUAL INTERVALES","Angiosperms","Poaceae","Chusquea","capituliflora","Trin.","POACEAE Chusquea capituliflora Trin.","171711","GBIF","UEC","Santos, A.G.","611","Native","Bronze","High","Parque Estadual Intervales.","Não"
"PARQUE ESTADUAL INTERVALES","Angiosperms","Poaceae","Chusquea","ibiramae","McClure & L.B.Sm.","POACEAE Chusquea ibiramae McClure & L.B.Sm.","269373","GBIF","SP","Kirizawa, M.","2887","Native","Ouro","High","Fazenda Intervales, base Quilombo","Não"
"PARQUE ESTADUAL INTERVALES","Angiosperms","Poaceae","Chusquea","longispiculata","L.G.Clark","POACEAE Chusquea longispiculata L.G.Clark","269043","GBIF","SP","Sugiyama, M.","1211","Native","Ouro","High","Faz. Intervales, Base da Saibadela, Muito frequente na Trilha do Quilombo","Não"
"PARQUE ESTADUAL INTERVALES","Angiosperms","Poaceae","Chusquea","oligophylla","Rupr.","POACEAE Chusquea oligophylla Rupr.","476348","GBIF","SP","Garcia, R.J.F.","1914","Native","Bronze","High","Parque Estadual de Intervales, Núcleo Barra Grande, trilha para o mirante","Não"
"PARQUE ESTADUAL INTERVALES","Angiosperms","Poaceae","Chusquea","oxylepis","(Hack.) Ekman","POACEAE Chusquea oxylepis (Hack.) Ekman","171708","GBIF","UEC","Santos, A.G.","607","Native","Bronze","High","Parque Estadual Intervales.","Não"
"PARQUE ESTADUAL INTERVALES","Angiosperms","Poaceae","Guadua","tagoara","(Nees) Kunth","POACEAE Guadua tagoara (Nees) Kunth","33846","GBIF","SPSF","Viani, R.A.G.","70","Native","Ouro","High","Parque Estadual Intervales","Não"
"PARQUE ESTADUAL INTERVALES","Angiosperms","Poaceae","Hildaea","pallens","(Sw.) C.Silva & R.P.Oliveira","POACEAE Hildaea pallens (Sw.) C.Silva & R.P.Oliveira","SPSF00033832","Splink","SPSF","Urbanetz, C.","76","Native","Ouro","High","Parque Estadual Intervales","Não"
"PARQUE ESTADUAL INTERVALES","Angiosperms","Poaceae","Ichnanthus","leiocarpus","(Spreng.) Kunth","POACEAE Ichnanthus leiocarpus (Spreng.) Kunth","ESA084978","GBIF","ESA","Viani, R.A.G.","176","Native","Ouro","High","Parque Estadual Intervales, trilha da caçadinha com início na estrada do Carmo, vegetação secundária (capoeirão) de Floresta Ombrófila Densa Montana com intensa exploração de palmito e madeira","Não"
"PARQUE ESTADUAL INTERVALES","Angiosperms","Poaceae","Lasiacis","sorghoidea","(Desv. ex Ham.) Hitchc. & Chase","POACEAE Lasiacis sorghoidea (Desv. ex Ham.) Hitchc. & Chase","135000","GBIF","UEC","Araki, D.F.","127","Native","Bronze","High","Parque Estadual de Intervales","Não"
"PARQUE ESTADUAL INTERVALES","Angiosperms","Poaceae","Merostachys",,"Spreng.","POACEAE Merostachys Spreng.","171712","GBIF","UEC","Santos, A.G.","613",,"Bronze","High","Parque Estadual Intervales.","Não"
"PARQUE ESTADUAL INTERVALES","Angiosperms","Poaceae","Ocellochloa","stolonifera","(Poir.) Zuloaga & Morrone","POACEAE Ocellochloa stolonifera (Poir.) Zuloaga & Morrone","062721","GBIF","ESA","Kozera, C.","858","Native","Bronze","High","Parque Estadual Intervales","Não"
"PARQUE ESTADUAL INTERVALES","Angiosperms","Poaceae","Panicum",,"L.","POACEAE Panicum L.","2437057","GBIF","Bioversity","Urbanetz, C.D.F.G.","84991",,"Latão","High",,"Não"
"PARQUE ESTADUAL INTERVALES","Angiosperms","Poaceae","Pseudechinolaena","polystachya","(Kunth) Stapf","POACEAE Pseudechinolaena polystachya (Kunth) Stapf","43713","GBIF","CESJ","Viani, R.A.G.","69","Native","Bronze","High","Parque Estadual Intervales","Não"
"PARQUE ESTADUAL INTERVALES","Angiosperms","Poaceae","Rugoloa","pilosa","(Sw.) Zuloaga","POACEAE Rugoloa pilosa (Sw.) Zuloaga","ESA084989","GBIF","ESA","Aguiar, A.C.","168","Native","Ouro","High","Parque Estadual Intervales, trilha do Rio do Carmo Acima, com saída no núcleo do Carmo em direção aos três córegos, Vegetação muito degradada com estrativismo seletivo de palmito e madeira, com poucos indivíduos das espécies finais de sucessão, com sensív","Não"
"PARQUE ESTADUAL INTERVALES","Angiosperms","Poaceae","Saccharum","asperum","(Nees) Steud.","POACEAE Saccharum asperum (Nees) Steud.","45608","GBIF","SPSF","Arzolla, F.A.R.D.P.","1506","Native","Ouro","High","entorno do Parque Estadual Intervales","Não"
"PARQUE ESTADUAL INTERVALES","Angiosperms","Poaceae","Setaria",,"P. Beauv.","POACEAE Setaria P. Beauv.","33767","GBIF","SPSF","Urbanetz, C.","100",,"Latão","High","Parque Estadual Intervales","Não"
"PARQUE ESTADUAL INTERVALES","Gymnosperms","Podocarpaceae","Podocarpus","sellowii","Klotzsch ex Endl.","PODOCARPACEAE Podocarpus sellowii Klotzsch ex Endl.","135017","GBIF","UEC","Aguiar, A.C.","145","Native","Latão","High","Parque Estadual Intervales, Trilha da cachoeira das pedrinhas. Próximo ao rio.","Não"
"PARQUE ESTADUAL INTERVALES","Angiosperms","Polygalaceae","Polygala",,"L.","POLYGALACEAE Polygala L.","270053","GBIF","SP","Kirizawa, M.","2932",,"Latão","High","Fazenda Intervales, Base Guapiruvu, trilha para Saibadela","Não"
"PARQUE ESTADUAL INTERVALES","Angiosperms","Polygalaceae","Senega","lancifolia","(A.St.-Hil. & Moq.) J.F.B.Pastore","POLYGALACEAE Senega lancifolia (A.St.-Hil. & Moq.) J.F.B.Pastore","084996","GBIF","ESA","Viani, R.A.G.","179","Native","Prata","High","Parque Estadual Intervales, trilha do Cipó em direção à gruta do Cipó, vegetação secundária (capoeirão) de Floresta Ombrófila Densa Montana com intensa exploração agrícola, de palmito e de madeira","Não"
"PARQUE ESTADUAL INTERVALES","Angiosperms","Polygalaceae","Senega","paniculata","(L.) J.F.B.Pastore & J.R.Abbott","POLYGALACEAE Senega paniculata (L.) J.F.B.Pastore & J.R.Abbott","ESA00084997","GBIF","ESA","Urbanetz, C.","88","Native","Ouro","High","Parque Estadual Intervales, Trilha saindo 500m antes da sede do Núcleo Barra Grande em direção à E.E.Xituê. Vegetação bem conservada de Floresta Ombrófila Densa Montana, com escorregamentos naturais e com exploração de palmito","Não"
"PARQUE ESTADUAL INTERVALES","Angiosperms","Polygonaceae","Polygonum","hydropiperoides","Michx.","POLYGONACEAE Polygonum hydropiperoides Michx.","RB01133990","GBIF","RB","Oriani, A.","520","Native","Bronze","Low","Núcleo Caverna do Diabo, trilha do Rolado. Parque Estadual de Jacupiranga","Não"
"PARQUE ESTADUAL INTERVALES","Angiosperms","Polygonaceae","Ruprechtia","laurifolia","(Cham. & Schltdl.) A.C.Meyer","POLYGONACEAE Ruprechtia laurifolia (Cham. & Schltdl.) A.C.Meyer","87430","GBIF","UEC","Almeida-Scabbia, R.J.","749","Native","Ouro","High","Faz. Intervales, Base Saibadela., Trilha do cano d'água.","Não"
"PARQUE ESTADUAL INTERVALES","Ferns and Lycophytes","Polypodiaceae","Alansmia","reclinata","(Brack) Moguel & M. Kessler","POLYPODIACEAE Alansmia reclinata (Brack) Moguel & M. Kessler","81049","GBIF","BHCB","Salino, A.","8523","Native","Bronze","High","Parque Estadual Intervales, Núcleo Barra Grande, Trilha da Cachoeira das Pedrinhas, Estrada de São Pedro, Rio Carmo.","Não"
"PARQUE ESTADUAL INTERVALES","Ferns and Lycophytes","Polypodiaceae","Campyloneurum","aphanophlebium","(Kunze) T.Moore","POLYPODIACEAE Campyloneurum aphanophlebium (Kunze) T.Moore","80995","GBIF","BHCB","Salino, A.","8468","Native","Bronze","High","Parque Estadual Intervales, Trilha da Caçadinha, com início na estrada do Carmo. Vegetação Secundária de Floresta Ombrófila Densa Alto Montana.","Não"
"PARQUE ESTADUAL INTERVALES","Ferns and Lycophytes","Polypodiaceae","Campyloneurum","austrobrasilianum","(Alston) de la Sota","POLYPODIACEAE Campyloneurum austrobrasilianum (Alston) de la Sota","81167","GBIF","BHCB","Salino, A.","8641","Native","Bronze","High","Parque Estadual Intervales, Trilha do Cipó em direção à gruta do Cipó. Vegetação Secundária (Capoeirão) de Floresta Ombrófila Densa Montana com intensa exploração de madeira e palmito.","Não"
"PARQUE ESTADUAL INTERVALES","Ferns and Lycophytes","Polypodiaceae","Campyloneurum","lapathifolium","(Poir.) Ching","POLYPODIACEAE Campyloneurum lapathifolium (Poir.) Ching","29374","GBIF","BHCB","Salino, A.","2005","Native","Bronze","High","Fazenda Intervales; Base de Saibadela, Floresta Atlântica.","Não"
"PARQUE ESTADUAL INTERVALES","Ferns and Lycophytes","Polypodiaceae","Campyloneurum","nitidum","(Kaulf.) C.Presl","POLYPODIACEAE Campyloneurum nitidum (Kaulf.) C.Presl","74288","GBIF","BHCB","Dittrich, V.A.O.","1024","Native","Bronze","High","Parque Estadual Intervales, Base de Saibadela, Trilha do Rio Saibadela. Floresta Ombrófila Densa.","Não"
"PARQUE ESTADUAL INTERVALES","Ferns and Lycophytes","Polypodiaceae","Campyloneurum","rigidum","Sm.","POLYPODIACEAE Campyloneurum rigidum Sm.","81117","GBIF","BHCB","Salino, A.","8591","Native","Bronze","High","Parque Estadual Intervales, Base do Carmo. Trilha do rio Carmo em direção aos três córregos. Vegetação muito degradada por extrativismo seletivo de palmito e madeiras com poucos indivíduos das espécies finais.","Não"
"PARQUE ESTADUAL INTERVALES","Ferns and Lycophytes","Polypodiaceae","Ceradenia","spixiana","(Mart. ex Mett.) L.E.Bishop","POLYPODIACEAE Ceradenia spixiana (Mart. ex Mett.) L.E.Bishop","81039","GBIF","BHCB","Salino, A.","8513","Native","Bronze","High","Parque Estadual Intervales, Núcleo Barra Grande, Trilha da Cachoeira das Pedrinhas, Estrada de São Pedro, Rio Carmo.","Não"
"PARQUE ESTADUAL INTERVALES","Ferns and Lycophytes","Polypodiaceae","Cochlidium","punctatum","(Raddi) L.E.Bishop","POLYPODIACEAE Cochlidium punctatum (Raddi) L.E.Bishop","81054","GBIF","BHCB","Salino, A.","8528","Native","Bronze","High","Parque Estadual Intervales, Núcleo Barra Grande, Trilha da Cachoeira das Pedrinhas, Estrada de São Pedro, Rio Carmo.","Não"
"PARQUE ESTADUAL INTERVALES","Ferns and Lycophytes","Polypodiaceae","Cochlidium","serrulatum","(Sw.) L.E.Bishop","POLYPODIACEAE Cochlidium serrulatum (Sw.) L.E.Bishop","81044","GBIF","BHCB","Salino, A.","8518","Native","Bronze","High","Parque Estadual Intervales, Núcleo Barra Grande, Trilha da Cachoeira das Pedrinhas, Estrada de São Pedro, Rio Carmo.","Não"
"PARQUE ESTADUAL INTERVALES","Ferns and Lycophytes","Polypodiaceae","Lellingeria","brevistipes","(Mett. ex Kuhn) A.R.Sm. & R.C.Moran","POLYPODIACEAE Lellingeria brevistipes (Mett. ex Kuhn) A.R.Sm. & R.C.Moran","81047","GBIF","BHCB","Salino, A.","8521","Native","Bronze","High","Parque Estadual Intervales, Núcleo Barra Grande, Trilha da Cachoeira das Pedrinhas, Estrada de São Pedro, Rio Carmo.","Não"
"PARQUE ESTADUAL INTERVALES","Ferns and Lycophytes","Polypodiaceae","Microgramma","crispata","(Fée) R.M.Tryon & A.F.Tryon","POLYPODIACEAE Microgramma crispata (Fée) R.M.Tryon & A.F.Tryon","35315","GBIF","HRCB","Dittrich, V.A.O.","1045","Native","Bronze","High","Parque Estadual Intervales, Trilha do Rio Saibadela. Floresta Ombrófila Densa das Terras Baixas.","Não"
"PARQUE ESTADUAL INTERVALES","Ferns and Lycophytes","Polypodiaceae","Microgramma","percussa","(Cav.) de la Sota","POLYPODIACEAE Microgramma percussa (Cav.) de la Sota","81124","GBIF","BHCB","Salino, A.","8598","Native","Bronze","High","Parque Estadual Intervales, Base do Carmo. Trilha do rio Carmo em direção aos três córregos. Vegetação muito degradada por extrativismo seletivo de palmito e madeiras com poucos indivíduos das espécies finais.","Não"
"PARQUE ESTADUAL INTERVALES","Ferns and Lycophytes","Polypodiaceae","Microgramma","squamulosa","(Kaulf.) de la Sota","POLYPODIACEAE Microgramma squamulosa (Kaulf.) de la Sota","80999","GBIF","BHCB","Salino, A.","8472","Native","Bronze","High","Parque Estadual Intervales, Trilha Autoguiada em frente a pousada Onça Pintada.","Não"
"PARQUE ESTADUAL INTERVALES","Ferns and Lycophytes","Polypodiaceae","Microgramma","tecta","(Kaulf.) Alston","POLYPODIACEAE Microgramma tecta (Kaulf.) Alston","81143","GBIF","BHCB","Salino, A.","8617","Native","Bronze","High","Parque Estadual Intervales, Trilha saindo 500m antes da sede da Base de Barra Grande em direção à Estação Ecológica de Xituê.","Não"
"PARQUE ESTADUAL INTERVALES","Ferns and Lycophytes","Polypodiaceae","Microgramma","vacciniifolia","(Langsd. & Fisch.) Copel.","POLYPODIACEAE Microgramma vacciniifolia (Langsd. & Fisch.) Copel.","81000","GBIF","BHCB","Salino, A.","8473","Native","Bronze","High","Parque Estadual Intervales, Trilha Autoguiada em frente a pousada Onça Pintada.","Não"
"PARQUE ESTADUAL INTERVALES","Ferns and Lycophytes","Polypodiaceae","Moranopteris","achilleifolia","(Kaulf.) R.Y. Hirai & J. Prado","POLYPODIACEAE Moranopteris achilleifolia (Kaulf.) R.Y. Hirai & J. Prado","81199","GBIF","BHCB","Salino, A.","8673","Native","Bronze","High","Parque Estadual Intervales, Trilha de acesso a Estação Ecológica de Xituê, saindo da Base Barra Grande. Vegetação Secundária de Floresta Ombrófila Densa Montana, com intenso histórico de degradação com exploração seletiva de madeira e palmito, com vá","Não"
"PARQUE ESTADUAL INTERVALES","Ferns and Lycophytes","Polypodiaceae","Moranopteris","gradata","(Baker) R.Y. Hirai & J. Prado","POLYPODIACEAE Moranopteris gradata (Baker) R.Y. Hirai & J. Prado","81046","GBIF","BHCB","Salino, A.","8520","Native","Bronze","High","Parque Estadual Intervales, Núcleo Barra Grande, Trilha da Cachoeira das Pedrinhas, Estrada de São Pedro, Rio Carmo.","Não"
"PARQUE ESTADUAL INTERVALES","Ferns and Lycophytes","Polypodiaceae","Niphidium","crassifolium","(L.) Lellinger","POLYPODIACEAE Niphidium crassifolium (L.) Lellinger","CESJ057533","Splink","CESJ","Salino, A.","8559","Native","Bronze","High","Parque Estadual Intervales, Trilha Bocaina em direção à Gruta da Mãozinha e do Minotauro. Vegetação secundária de Floresta Ombrófila Densa Montana com extensa exploração, porém com trechos mais preservados sobre rochas cársticas (calcáreas).","Não"
"PARQUE ESTADUAL INTERVALES","Ferns and Lycophytes","Polypodiaceae","Pecluma","chnoophora","(Kunze) Salino & Costa Assis","POLYPODIACEAE Pecluma chnoophora (Kunze) Salino & Costa Assis","57825","GBIF","CESJ","Salino, A.","8596","Native","Bronze","High","Parque Estadual Intervales, Base do Carmo, trilha do rio do Carmo em direção aos três córregos. 530m de altitude; 24º18'24' S, 48º24'45' W.","Não"
"PARQUE ESTADUAL INTERVALES","Ferns and Lycophytes","Polypodiaceae","Pecluma","pectinatiformis","(Lindm.) M.G.Price","POLYPODIACEAE Pecluma pectinatiformis (Lindm.) M.G.Price","81164","GBIF","BHCB","Salino, A.","8638","Native","Bronze","High","Parque Estadual Intervales, Trilha da Caçadinha com início na estrada do Carmo. Vegetação secundária (Capoeirão) de Floresta Ombrófila Densa Montana com intensa exploraçào de madeira e palmito.","Não"
"PARQUE ESTADUAL INTERVALES","Ferns and Lycophytes","Polypodiaceae","Pecluma","recurvata","(Kaulf.) M.G.Price","POLYPODIACEAE Pecluma recurvata (Kaulf.) M.G.Price","81024","GBIF","BHCB","Salino, A.","8498","Native","Bronze","High","Parque Estadual Intervales, Núcleo Barra Grande, Trilha da Cachoeira das Pedrinhas, Estrada de São Pedro, Rio Carmo.","Não"
