"UC","Grupos","Família","Gênero","Espécie","Autor","Táxon_completo","Barcode","BD_Origem","Herbário","Coletor","Número_da_Coleta","Origem_FFBr","ConfiançaID","ConfiançaLoc","Localidade","Já listada"
"PARQUE ESTADUAL INTERVALES","Ferns and Lycophytes","Marattiaceae","Danaea","geniculata","Raddi","MARATTIACEAE Danaea geniculata Raddi","11918","GBIF","SPSF","Cozera, C.","864","Native","Bronze","High","Núcleo Saibadela (Fazenda Intervales), trilha da encosta, atrás da casa de pesquisa.","Não"
"PARQUE ESTADUAL INTERVALES","Ferns and Lycophytes","Marattiaceae","Danaea","moritziana","C.Presl","MARATTIACEAE Danaea moritziana C.Presl","57529","GBIF","CESJ","Salino, A.","8491","Native","Bronze","High","Parque Estadual Intervales, Núcleo Barra Grande, Trilha da Cachoeira das Pedrinhas, Estrada de São Pedro, Rio do Carmo.","Não"
"PARQUE ESTADUAL INTERVALES","Ferns and Lycophytes","Marattiaceae","Danaea","nodosa","(L.) Sm.","MARATTIACEAE Danaea nodosa (L.) Sm.","57828","GBIF","CESJ","Salino, A.","8602","Native","Bronze","High","Parque Estadual Intervales, Base do Carmo, trilha do rio do Carmo em direção aos três córregos.","Não"
"PARQUE ESTADUAL INTERVALES","Ferns and Lycophytes","Marattiaceae","Eupodium","kaulfussii","(J.Sm.) J.Sm.","MARATTIACEAE Eupodium kaulfussii (J.Sm.) J.Sm.","57564","GBIF","CESJ","Salino, A.","8609","Native","Bronze","High","Parque Estadual Intervales, trilha saindo 500m ant, Vegetação bem conservada de Floresta Ombrófila Densa Montana,com escorregamentos naturais e exploração de palmito","Não"
"PARQUE ESTADUAL INTERVALES","Angiosperms","Marcgraviaceae","Marcgravia",,"L.","MARCGRAVIACEAE Marcgravia L.","85706","GBIF","UEC","Almeida-Scabbia, R.J.","711",,"Latão","High","Faz. Intervales, Base Saibadela, trilha do rio.","Não"
"PARQUE ESTADUAL INTERVALES","Angiosperms","Marcgraviaceae","Schwartzia","brasiliensis","(Choisy) Bedell ex Gir.-Cañas","MARCGRAVIACEAE Schwartzia brasiliensis (Choisy) Bedell ex Gir.-Cañas","145365415","GBIF","Observations","Igual, E.C.",,"Native","Bronze","Low","Ribeirão Grande - SP, 18315-000, Brasil","Não"
"PARQUE ESTADUAL INTERVALES","Angiosperms","Melastomataceae","Aciotis","paludosa","(Mart. ex DC.) Triana","MELASTOMATACEAE Aciotis paludosa (Mart. ex DC.) Triana","6729","GBIF","SORO","Urbanetz, C.","93","Native","Ouro","High","Parque Estadual Intervales, trilha saindo 500m antes da sede do Núcleo barra Grande em direção à E.E.Xituê. Vegetação bem conservada de Floresta Ombrófila Densa Montana, com escorregamentos naturais e com exploração de palmito.","Não"
"PARQUE ESTADUAL INTERVALES","Angiosperms","Melastomataceae","Bertolonia","acuminata","Gardner","MELASTOMATACEAE Bertolonia acuminata Gardner","ESA084772","GBIF","ESA","Urbanetz, C.","80","Native","Ouro","High","Parque Estadual Intervales, Trilha saindo 500m antes da sede do Núcleo Barra Grande em direção à E.E.Xituê. Vegetação bem conservada de Floresta Ombrófila Densa Montana, com escorregamentos naturais e com exploração de palmito","Não"
"PARQUE ESTADUAL INTERVALES","Angiosperms","Melastomataceae","Bertolonia","margaritacea","Naudin","MELASTOMATACEAE Bertolonia margaritacea Naudin","33828","GBIF","SPSF","Urbanetz, C.","81","Native","Ouro","High","Parque Estadual Intervales","Não"
"PARQUE ESTADUAL INTERVALES","Angiosperms","Melastomataceae","Bertolonia","mosenii","Cogn.","MELASTOMATACEAE Bertolonia mosenii Cogn.","HVC00005245","Splink","HVC","Garcia, R.J.F.","2279","Native","Ouro","High","Parque Estadual Intervales, Base Saibadela, ca. 95msm.","Não"
"PARQUE ESTADUAL INTERVALES","Angiosperms","Melastomataceae","Chaetogastra","clinopodifolia","DC.","MELASTOMATACEAE Chaetogastra clinopodifolia DC.","38912","GBIF","UPCB","Kozera, C.","872","Native","Ouro","High","Núcleo Saibadela, Faz. Intervales, trilha de encosta, atrás da casa de pesquisa.","Não"
"PARQUE ESTADUAL INTERVALES","Angiosperms","Melastomataceae","Chaetogastra","herbacea","(DC.) P.J.F.Guim. & Michelang.","MELASTOMATACEAE Chaetogastra herbacea (DC.) P.J.F.Guim. & Michelang.","33692","GBIF","SPSF","Urbanetz, C.","94","Native","Ouro","High","Parque Estadual Intervales","Não"
"PARQUE ESTADUAL INTERVALES","Angiosperms","Melastomataceae","Clidemia","capitellata","(Bonpl.) D.Don","MELASTOMATACEAE Clidemia capitellata (Bonpl.) D.Don","5025","GBIF","SORO","Araki, D.F.","22","Native","Latão","High","Parque Estadual Intervales - trilha auto-guiada (pousada Onça Pintada)Floresta Ombrófila Densa alto montana vegetação secundária","Não"
"PARQUE ESTADUAL INTERVALES","Angiosperms","Melastomataceae","Clidemia","hirta","(L.) D.Don","MELASTOMATACEAE Clidemia hirta (L.) D.Don","301855","GBIF","SP","Galleti, M.","Saibadela198","Native","Bronze","High","Faz. Intervales, Base Saibadela, trilha do betão, antes do ponto 0","Não"
"PARQUE ESTADUAL INTERVALES","Angiosperms","Melastomataceae","Leandra","acutiflora","(Naudin) Cogn.","MELASTOMATACEAE Leandra acutiflora (Naudin) Cogn.","SPSF00018377","Splink","SPSF","Ziparro, V.B.","324","Native","Ouro","High","Parque Estadual Intervales, Base Saibadela.","Não"
"PARQUE ESTADUAL INTERVALES","Angiosperms","Melastomataceae","Leandra","amplexicaulis","DC.","MELASTOMATACEAE Leandra amplexicaulis DC.","ESA084784","GBIF","ESA","Viani, R.A.G.","175","Native","Ouro","High","Parque Estadual Intervales, trilha da caçadinha com início na estrada do Carmo, vegetação secundária (capoeirão) de Floresta Ombrófila Densa Montana com intensa exploração de palmito e madeira","Não"
"PARQUE ESTADUAL INTERVALES","Angiosperms","Melastomataceae","Leandra","australis","(Cham.) Cogn.","MELASTOMATACEAE Leandra australis (Cham.) Cogn.","RB00856523","GBIF","RB","Viani, R.A.G.","95","Native","Ouro","High","Parque Estadual Intervales, Trilha Auto-guiada.","Não"
"PARQUE ESTADUAL INTERVALES","Angiosperms","Melastomataceae","Leandra","brackenridgei","(A.Gray) Cogn.","MELASTOMATACEAE Leandra brackenridgei (A.Gray) Cogn.","73085","GBIF","UPCB","Miashike, R.L.","96","Native","Ouro","High","Parque Estadual de Intervales","Não"
"PARQUE ESTADUAL INTERVALES","Angiosperms","Melastomataceae","Leandra","diffusa","Cogn.","MELASTOMATACEAE Leandra diffusa Cogn.","2316","GBIF","SORO","Medeiros, D.A.","31","Native","Ouro","High","Parque Estadual Intervales","Não"
"PARQUE ESTADUAL INTERVALES","Angiosperms","Melastomataceae","Leandra","echinata","Cogn.","MELASTOMATACEAE Leandra echinata Cogn.","158269","GBIF","UEC","Machado, C.G.","s.n.","Native","Ouro","High","Parque Estadual de Intervales Região da Sede - entrada da gruta Colorida.","Não"
"PARQUE ESTADUAL INTERVALES","Angiosperms","Melastomataceae","Leandra","gracilis","Cogn.","MELASTOMATACEAE Leandra gracilis Cogn.","RB00830192","GBIF","RB","Medeiros, D.A.","32","Native","Ouro","High","Parque Estadual Intervales. Trilha da Cachoeira das Pedrinhas com início na Estrada de São Pedro até a Cachoeira do rio do Carmo, 790m alt. Floresta Ombrófila Densa Montana com intensa exploração seletiva.","Não"
"PARQUE ESTADUAL INTERVALES","Angiosperms","Melastomataceae","Leandra","laevigata","(Triana) Cogn.","MELASTOMATACEAE Leandra laevigata (Triana) Cogn.","56962","Splink","PAMG","Urbanetz, C.","46","Native","Ouro","High","Parque Estadual Intervales, Trilha da Bocaina em direção à gruta da Mãozinha e do Minotauro.Vegetação Secundária de Floresta Ombrófila Densa Montana, com trechos mais preservados sobre rochas cársticas (calcáreas)","Não"
"PARQUE ESTADUAL INTERVALES","Angiosperms","Melastomataceae","Leandra","melastomoides","Raddi","MELASTOMATACEAE Leandra melastomoides Raddi","ESA084792","GBIF","ESA","Urbanetz, C.","85","Native","Ouro","High","Parque Estadual Intervales, Trilha saindo 500m antes da sede do Núcleo Barra Grande em direção à E.E.Xituê. Vegetação bem conservada de Floresta Ombrófila Densa Montana, com escorregamentos naturais e com exploração de palmito","Não"
"PARQUE ESTADUAL INTERVALES","Angiosperms","Melastomataceae","Leandra","reversa","(DC.) Cogn.","MELASTOMATACEAE Leandra reversa (DC.) Cogn.","327179","GBIF","SP","Galleti, M.","Saibadela200","Native","Ouro","High","Faz. Intervales. Base Saibadela, trilha do betão, antes do ponto 5","Não"
"PARQUE ESTADUAL INTERVALES","Angiosperms","Melastomataceae","Leandra","variabilis","Raddi","MELASTOMATACEAE Leandra variabilis Raddi","SPSF00018365","Splink","SPSF","Almeida-Scabbia, R.J.","282","Native","Ouro","High","Parque Estadual Intervales, Base Saibadela.","Não"
"PARQUE ESTADUAL INTERVALES","Angiosperms","Melastomataceae","Miconia","brasiliensis","(Spreng.) Triana","MELASTOMATACEAE Miconia brasiliensis (Spreng.) Triana","286347","GBIF","SP","Galleti, M.","Saibadela724","Native","Ouro","High","Fazenda Intervales, Base Saibadela, trilha do betão","Não"
"PARQUE ESTADUAL INTERVALES","Angiosperms","Melastomataceae","Miconia","cinnamomifolia","(DC.) Naudin","MELASTOMATACEAE Miconia cinnamomifolia (DC.) Naudin","63537","GBIF","UPCB","Viani, R.A.G.","153","Native","Ouro","High","Parque Estadual de Intervales","Não"
"PARQUE ESTADUAL INTERVALES","Angiosperms","Melastomataceae","Miconia","cubatanensis","Hoehne","MELASTOMATACEAE Miconia cubatanensis Hoehne","MG191202","GBIF","MG","Kirizawa, M.","2886","Native","Ouro","High","Fazenda Intervales, base Quilombo. Trilha para a cachoeira de Quilombo.","Não"
"PARQUE ESTADUAL INTERVALES","Angiosperms","Melastomataceae","Miconia","dodecandra","Cogn.","MELASTOMATACEAE Miconia dodecandra Cogn.","25627","GBIF","MAC","Kirizawa, M.","2828","Native","Ouro","High","Fazenda Intervales, sede Quilombo. Mata Atlântica, trilha para cachoeira de Quilombo","Não"
"PARQUE ESTADUAL INTERVALES","Angiosperms","Melastomataceae","Miconia","fasciculata","Gardner","MELASTOMATACEAE Miconia fasciculata Gardner","73096","GBIF","UPCB","Miashike, R.L.","100","Native","Prata","Low","Parque Estadual Turístico do Alto Ribeira, Base do Carmo, Trilha do Carmo Acima.","Não"
"PARQUE ESTADUAL INTERVALES","Angiosperms","Melastomataceae","Miconia","latecrenata","(DC.) Naudin","MELASTOMATACEAE Miconia latecrenata (DC.) Naudin","83401","GBIF","UPCB","Medeiros, D.A.","150","Native","Ouro","High","Parque Estadual Intervales. Trilha do Cipó em direção à gruta do Cipó.","Não"
"PARQUE ESTADUAL INTERVALES","Angiosperms","Melastomataceae","Miconia","minutiflora","(Bonpl.) DC.","MELASTOMATACEAE Miconia minutiflora (Bonpl.) DC.","RB00855494","GBIF","RB","Aguiar, A.C.","149","Native","Bronze","High","Parque Estadual Intervales, trilha da cachoeira das pedrinhas.","Não"
"PARQUE ESTADUAL INTERVALES","Angiosperms","Melastomataceae","Miconia","paniculata","(DC.) Naudin","MELASTOMATACEAE Miconia paniculata (DC.) Naudin","89855","GBIF","UEC","Galetti, M.","724","Native","Ouro","High","Fazenda Intervales - Base Saibadela - Tr","Não"
"PARQUE ESTADUAL INTERVALES","Angiosperms","Melastomataceae","Miconia","paucidens","DC.","MELASTOMATACEAE Miconia paucidens DC.","RB00856780","GBIF","RB","Viani, R.A.G.","156","Native","Ouro","High","Parque Estadual Intervales, Trilha do Carmo Acima, em direção aos Três Córregos, trecho com intensa extração seletiva de palmito e madeira, com poucas espécies finais da sucessão com melhora no final da trilha (2km).","Não"
"PARQUE ESTADUAL INTERVALES","Angiosperms","Melastomataceae","Miconia","pusilliflora","(DC.) Naudin","MELASTOMATACEAE Miconia pusilliflora (DC.) Naudin","297269","GBIF","MBM",,"119","Native","Ouro","High","Parque Estadual Intervales.","Não"
"PARQUE ESTADUAL INTERVALES","Angiosperms","Melastomataceae","Miconia","racemifera","(DC.) Triana","MELASTOMATACEAE Miconia racemifera (DC.) Triana","83373","GBIF","UPCB","Urbanetz, C.","69","Native","Ouro","High","Parque Estadual Intervales - Trilha do Rio do Carmo acima, com saída no núcleo do Carmo em direção aos Três Córregos. Altitude de 530m. Floresta Ombrófila Densa Montana. Vegetação muito degradada por extrativismo seletivo de madeira e palmito com poucos indivíduos das espécies finais, com sensível melhora desta condição ao final da trilha (2km). .","Não"
"PARQUE ESTADUAL INTERVALES","Angiosperms","Melastomataceae","Miconia","tristis","Spring","MELASTOMATACEAE Miconia tristis Spring","SPSF00018366","Splink","SPSF","Almeida-Scabbia, R.J.","214","Native","Ouro","High","Fazenda Intervales - Base Saibadela.","Não"
"PARQUE ESTADUAL INTERVALES","Angiosperms","Melastomataceae","Miconia","valtheri","Naudin","MELASTOMATACEAE Miconia valtheri Naudin","73084","GBIF","UPCB","Miashike, R.L.","103","Native","Ouro","High","Parque Estadual de Intervales, Base do Alecrim, estrada entre Rio dos Feixes e Base do Alecrim.","Não"
"PARQUE ESTADUAL INTERVALES","Angiosperms","Melastomataceae","Ossaea","confertiflora","(DC.) Triana","MELASTOMATACEAE Ossaea confertiflora (DC.) Triana","59383","GBIF","FLOR","Sugiyama, M.","1245","Native","Ouro","High","Fazenda Intervales, Base do Guapiruvú","Não"
"PARQUE ESTADUAL INTERVALES","Angiosperms","Melastomataceae","Ossaea","sanguinea","Cogn.","MELASTOMATACEAE Ossaea sanguinea Cogn.","SPSF00024819","Splink","SPSF","Batista, E.R.","128","Native","Ouro","High","Núcleo Saibadela, Faz. Intervales, trilha da encosta atrás da casa de pesquisa.","Não"
"PARQUE ESTADUAL INTERVALES","Angiosperms","Melastomataceae","Pleiochiton","ebracteatum","Triana","MELASTOMATACEAE Pleiochiton ebracteatum Triana","ESA084818","GBIF","ESA","Urbanetz, C.","23","Native","Ouro","High","Parque Estadual Intervales, Trilha da Cachoeira das Pedrinhas com início na Estrada de São Pedro, até a cachoeira do Rio Carmo, Floresta Ombrófila Densa Montana, com extrativismo seletivo","Não"
"PARQUE ESTADUAL INTERVALES","Angiosperms","Melastomataceae","Pleroma","fothergillii","(Schrank et Mart. ex DC.) Triana","MELASTOMATACEAE Pleroma fothergillii (Schrank et Mart. ex DC.) Triana","78745","GBIF","UPCB","Araki, D.F.","117","Native","Ouro","High","Parque Estadual Intervales; trilha da caçadinha, com início na est. do Carmo.","Não"
"PARQUE ESTADUAL INTERVALES","Angiosperms","Melastomataceae","Pleroma","hatschbachii","(Wurdack) P.J.F.Guim.&Michelang.","MELASTOMATACEAE Pleroma hatschbachii (Wurdack) P.J.F.Guim.&Michelang.","F.R.Maia 84","GBIF",,,,"Native","Latão","Low","SaoPaulo, PETAR-NucleoSantana","Não"
"PARQUE ESTADUAL INTERVALES","Angiosperms","Melastomataceae","Pleroma","heteromallum","(D.Don) D.Don","MELASTOMATACEAE Pleroma heteromallum (D.Don) D.Don","ESA084828","GBIF","ESA","Araki, D.F.","24","Native","Ouro","High","Parque Estadual Intervales - trilha auto-guiada (pousada Onça Pintada)Floresta Ombrófila Densa alto montana vegetação secundária","Não"
"PARQUE ESTADUAL INTERVALES","Angiosperms","Melastomataceae","Pleroma","sellowianum","(Cham.) P.J.F.Guim. & Michelang.","MELASTOMATACEAE Pleroma sellowianum (Cham.) P.J.F.Guim. & Michelang.","78735","GBIF","UPCB","Aguiar, A.C.","219","Native","Ouro","High","Parque Estadual Intervales, 550m altitude, Nucleo Bulha D´água, trilha da Caverna do Sr. Bento.","Não"
"PARQUE ESTADUAL INTERVALES","Angiosperms","Meliaceae","Cabralea","canjerana","(Vell.) Mart.","MELIACEAE Cabralea canjerana subsp. canjerana (Vell.) Mart.","156590","GBIF","SPF","Morellato, L.P.C.","1","Native","Prata","High","Faz. Intervales - Saibadela.","Não"
"PARQUE ESTADUAL INTERVALES","Angiosperms","Meliaceae","Cedrela","fissilis","Vell.","MELIACEAE Cedrela fissilis Vell.","084832","GBIF","ESA","Medeiros, D.A.","6","Native","Prata","High","Parque Estadual Intervales","Não"
"PARQUE ESTADUAL INTERVALES","Angiosperms","Meliaceae","Guarea","macrophylla","(Vell.) T.D.Penn.","MELIACEAE Guarea macrophylla subsp. tuberculata (Vell.) T.D.Penn.","286398","GBIF","SP","Zipparro, V.B.","Saibadela322","Native","Ouro","High","Fazenda Intervales, Base Saibadela, trilha do Aleixo","Não"
"PARQUE ESTADUAL INTERVALES","Angiosperms","Meliaceae","Trichilia","clausseni","C.DC.","MELIACEAE Trichilia clausseni C.DC.","154603","GBIF","CEPEC","Assis, L.C.S.","1238","Native","Bronze","High","Parque Estadual Intervales","Não"
"PARQUE ESTADUAL INTERVALES","Angiosperms","Meliaceae","Trichilia","lepidota","Mart.","MELIACEAE Trichilia lepidota Mart.","20053","Splink","CPAP","Galetti, M.","1044","Native","Prata","High","Fazenda Intervales, Base Saibadela","Não"
"PARQUE ESTADUAL INTERVALES","Angiosperms","Meliaceae","Trichilia","pallens","C.DC.","MELIACEAE Trichilia pallens C.DC.","44258","GBIF","SPSF","Miashike, R.L.","91","Native","Ouro","High","Parque Estadual de Intervales","Não"
"PARQUE ESTADUAL INTERVALES","Angiosperms","Menispermaceae","Abuta","selloana","Eichler","MENISPERMACEAE Abuta selloana Eichler","290373","GBIF","SP","Scabbia, R.J.A.","Saibadela284","Native","Bronze","High","Faz. Intervales. Base Saibadela.","Não"
"PARQUE ESTADUAL INTERVALES","Angiosperms","Menispermaceae","Cissampelos","andromorpha","DC.","MENISPERMACEAE Cissampelos andromorpha DC.","11763","GBIF","HUESB","Aguiar, A.C.","114","Native","Ouro","High","Parque Estadual Intervales, trilha da Caçadinha, com início na estrada do Carmo.Vegetação Secundária de Floresta Ombrófila Densa Alto Montana","Não"
"PARQUE ESTADUAL INTERVALES","Angiosperms","Menispermaceae","Hyperbaena","domingensis","(DC.) Benth.","MENISPERMACEAE Hyperbaena domingensis (DC.) Benth.","290370","GBIF","SP","Galleti, M.","Saibadela721","Native","Bronze","High","Fazenda Intervales, Base Saibadela","Não"
"PARQUE ESTADUAL INTERVALES","Angiosperms","Monimiaceae","Hennecartia","omphalandra","J.Poiss.","MONIMIACEAE Hennecartia omphalandra J.Poiss.","202670","GBIF","SPF","Assis, L.C.S.","1217","Native","Bronze","High","Parque Estadual Intervales","Não"
"PARQUE ESTADUAL INTERVALES","Angiosperms","Monimiaceae","Mollinedia","oligantha","Perkins","MONIMIACEAE Mollinedia oligantha Perkins","RBR00057635","GBIF","RBR","Galetti","1058","Native","Latão","High","Fazenda intervales, base Saibadela. Parque Estadual Intervales","Não"
"PARQUE ESTADUAL INTERVALES","Angiosperms","Monimiaceae","Mollinedia","schottiana","(Spreng.) Perkins","MONIMIACEAE Mollinedia schottiana (Spreng.) Perkins","184414","Splink","ICN","Aguiar, A.C.","162","Native","Ouro","High","Parque Estadual Intervales","Não"
"PARQUE ESTADUAL INTERVALES","Angiosperms","Monimiaceae","Mollinedia","uleana","Perkins","MONIMIACEAE Mollinedia uleana Perkins","44279","GBIF","SPSF","Miashike, R.L.","839","Native","Ouro","High","Parque Estadual Intervales","Não"
"PARQUE ESTADUAL INTERVALES","Angiosperms","Moraceae","Dorstenia","bowmanniana","Baker","MORACEAE Dorstenia bowmanniana Baker","269048","GBIF","SP","Sugiyama, M.","1216","Native","Bronze","High","Fazenda Intervales, Base Saibadela, subida para a Cachoeira do Mono","Não"
"PARQUE ESTADUAL INTERVALES","Angiosperms","Moraceae","Dorstenia","carautae","C.C.Berg","MORACEAE Dorstenia carautae C.C.Berg","44260","GBIF","SPSF","Miashike, R.L.","93","Native","Bronze","High","Parque Estadual de Intervales","Não"
"PARQUE ESTADUAL INTERVALES","Angiosperms","Moraceae","Dorstenia","hirta","Desv.","MORACEAE Dorstenia hirta Desv.","240087","GBIF","MBM","Godoy, J.R.L.","109","Native","Ouro","High","Fazenda Intervales, Núcleo Saibadela, na trilha da encosta atrás da casa de pesquisa. Floresta Ombrófila Densa. Encosta.","Não"
"PARQUE ESTADUAL INTERVALES","Angiosperms","Moraceae","Dorstenia","setosa","Moric.","MORACEAE Dorstenia setosa Moric.","373698","GBIF","SP","Amorim, A.M.","3307","Native","Bronze","High","Parque Estadual Intervales, trilha para a Cachoeira da Água Comprida","Não"
"PARQUE ESTADUAL INTERVALES","Angiosperms","Moraceae","Ficus","adhatodifolia","Schott in Spreng.","MORACEAE Ficus adhatodifolia Schott in Spreng.","SPSF00018310","Splink","SPSF","Almeida-Scabbia, R.J.","210","Native","Ouro","High","Fazenda Intervales","Não"
"PARQUE ESTADUAL INTERVALES","Angiosperms","Moraceae","Ficus","enormis","Mart. ex Miq.","MORACEAE Ficus enormis Mart. ex Miq.","SPSF00033685","Splink","SPSF","Araki, D.F.","76","Native","Ouro","High","Parque Estadual Intervales","Não"
"PARQUE ESTADUAL INTERVALES","Angiosperms","Moraceae","Ficus","eximia","Schott","MORACEAE Ficus eximia Schott","RB01290526","GBIF","RB","Ziparro, V.B.","773","Native","Ouro","High","Faz. Intervales, Base Saibadela, trilho do rio","Não"
"PARQUE ESTADUAL INTERVALES","Angiosperms","Moraceae","Ficus","gomelleira","Kunth","MORACEAE Ficus gomelleira Kunth","163988","GBIF","HUEFS","Galleti, M.","1104","Native","Ouro","High","Faz. Intervales, Base Saibadela, trilha","Não"
"PARQUE ESTADUAL INTERVALES","Angiosperms","Moraceae","Ficus","insipida","Willd.","MORACEAE Ficus insipida Willd.","SPSF00018311","Splink","SPSF","Galetti, M.","112","Native","Bronze","High","Fazenda Intervales, Base Saibadela, trilha do rio, mata.","Não"
"PARQUE ESTADUAL INTERVALES","Angiosperms","Moraceae","Ficus","luschnathiana","(Miq.) Miq.","MORACEAE Ficus luschnathiana (Miq.) Miq.","HFC007519","Splink","HFC","Medeiros, D.A.","22","Native","Ouro","High","Parque Estadual Intervales, Trilha Auto-Guiada, em frente à Pousada Onça Pintada, 810m alt.","Não"
"PARQUE ESTADUAL INTERVALES","Angiosperms","Musaceae","Musa",,"L.","MUSACEAE Musa L.","259696","GBIF","SP","Kirizawa, M.","2811",,"Latão","High","Fazenda Intervales, Base Saibadela, trilha para a cachoeira de Saibadela, próximo do rio Saibadela","Não"
"PARQUE ESTADUAL INTERVALES","Angiosperms","Myristicaceae","Virola","bicuhyba","(Schott ex Spreng.) Warb.","MYRISTICACEAE Virola bicuhyba (Schott ex Spreng.) Warb.","30781","GBIF","UPCB","Zipparro, V.B.","1423","Native","Ouro","High","Faz. Intervales, Base Saibadela, trilha azul.","Não"
"PARQUE ESTADUAL INTERVALES","Angiosperms","Myristicaceae","Virola","gardneri","(A.DC.) Warb.","MYRISTICACEAE Virola gardneri (A.DC.) Warb.","UPCB00076080","GBIF","UPCB","Zipparro, V.B.",,"Native","Ouro","High","Fazenda Intervales, Base Saibadela, trilha do quilombo.","Não"
"PARQUE ESTADUAL INTERVALES","Angiosperms","Myrtaceae","Campomanesia","laurifolia","Gardner","MYRTACEAE Campomanesia laurifolia Gardner","73585","GBIF","UEC","Galetti, M.","s.n.","Native","Ouro","High","Fazenda Intervales, Base Saibadela, trilha do rio, mata.","Não"
"PARQUE ESTADUAL INTERVALES","Angiosperms","Myrtaceae","Campomanesia","neriiflora","(O.Berg) Nied.","MYRTACEAE Campomanesia neriiflora (O.Berg) Nied.","357965","GBIF","SP","Fiaschi, P.","455","Native","Bronze","High","Parque Estadual Intervales","Não"
"PARQUE ESTADUAL INTERVALES","Angiosperms","Myrtaceae","Campomanesia","schlechtendaliana","(O.Berg) Nied.","MYRTACEAE Campomanesia schlechtendaliana (O.Berg) Nied.","SPSF00018394","Splink","SPSF","Galetti, M.","109","Native","Ouro","High","Fazenda Intervales, Base Saibadela, trlha do rio.","Não"
"PARQUE ESTADUAL INTERVALES","Angiosperms","Myrtaceae","Eugenia","acutata","Miq.","MYRTACEAE Eugenia acutata Miq.","178527","Splink","ICN","Zipparro, V.B.","2034","Native","Ouro","High","Parque Estadual Intervales, Base Saibadela, trilha Azul, entre pontos 18 e 19, ambiente iluminado","Não"
"PARQUE ESTADUAL INTERVALES","Angiosperms","Myrtaceae","Eugenia","beaurepairiana","(Kiaersk.) D.Legrand","MYRTACEAE Eugenia beaurepairiana (Kiaersk.) D.Legrand","348573","GBIF","SP","Zipparro, V.B.","1973","Native","Ouro","High","Parque Estadual Intervales, Base Saibadela, trilha Azul, para frente do ponto 5, ambiente sombreado","Não"
"PARQUE ESTADUAL INTERVALES","Angiosperms","Myrtaceae","Eugenia","bunchosiifolia","Nied.","MYRTACEAE Eugenia bunchosiifolia Nied.","321792","GBIF","SP","Scabbia, R.J.A.","Saibadela638","Native","Bronze","High","Fazenda Intervales, trilha amarela","Não"
"PARQUE ESTADUAL INTERVALES","Angiosperms","Myrtaceae","Eugenia","burkartiana","(D.Legrand) D.Legrand","MYRTACEAE Eugenia burkartiana (D.Legrand) D.Legrand","4566","GBIF","HUFSJ","Zipparro, V.B.","1784","Native","Ouro","High","Parque Estadual Intervales, Base Saibadela, trilha do Quilombo, ponto 1.","Não"
"PARQUE ESTADUAL INTERVALES","Angiosperms","Myrtaceae","Eugenia","cereja","D.Legrand","MYRTACEAE Eugenia cereja D.Legrand","92985","GBIF","BHCB","Zipparro, V.B.","2183","Native","Latão","High","Fazenda Intervales, Base de Saibadela","Não"
"PARQUE ESTADUAL INTERVALES","Angiosperms","Myrtaceae","Eugenia","disperma","Vell.","MYRTACEAE Eugenia disperma Vell.","SPSF00018392","Splink","SPSF","Almeida-Scabbia, R.J.","281","Native","Ouro","High","Fazenda Intervales","Não"
"PARQUE ESTADUAL INTERVALES","Angiosperms","Myrtaceae","Eugenia","expansa","Spring ex Mart.","MYRTACEAE Eugenia expansa Spring ex Mart.","161466","GBIF","BHCB","Bunger, M.O.","622","Native","Ouro","High","Parque Estadual Intervales, Trilha amarela","Não"
"PARQUE ESTADUAL INTERVALES","Angiosperms","Myrtaceae","Eugenia","handroana","D.Legrand","MYRTACEAE Eugenia handroana D.Legrand","92989","GBIF","BHCB","Galetti, M.","758","Native","Ouro","High","Fazenda Intervales, Base Saibadela. Trilha azul, a...","Não"
"PARQUE ESTADUAL INTERVALES","Angiosperms","Myrtaceae","Eugenia","magnibracteolata","Mattos & D.Legrand","MYRTACEAE Eugenia magnibracteolata Mattos & D.Legrand","277605","GBIF","SP","Kawasaki, M.L.","655","Native","Ouro","High","Parque Estadual Intervales, Base Guapiruvu, próx. ao rio Guapiruvu, baixada","Não"
"PARQUE ESTADUAL INTERVALES","Angiosperms","Myrtaceae","Eugenia","melanogyna","(D.Legrand) Sobral","MYRTACEAE Eugenia melanogyna (D.Legrand) Sobral","73587","GBIF","UEC","Almeida-Scabbia, R.J.","290","Native","Ouro","High","Fazenda Intervales, BAse Saibadela, trilha do quilombo, beira rio.","Não"
"PARQUE ESTADUAL INTERVALES","Angiosperms","Myrtaceae","Eugenia","mosenii","(Kausel) Sobral","MYRTACEAE Eugenia mosenii (Kausel) Sobral","313232","GBIF","SP","Galleti, M.","Saibadela184","Native","Ouro","High","Parque Estadual Intervales, Base Saibadela, trilha Azul, proximo ao ponto 8, Coleção Saibadela 184","Não"
