"UC","Grupos","Família","Gênero","Espécie","Autor","Táxon_completo","Barcode","BD_Origem","Herbário","Coletor","Número_da_Coleta","Origem_FFBr","ConfiançaID","Localidade","Já listada"
"ESTAÇÃO ECOLÓGICA JURÉIA-ITATINS","Angiosperms","Orchidaceae","Gomesa","ramosa","(Lindl.) M.W.Chase & N.H.Williams","ORCHIDACEAE Gomesa ramosa (Lindl.) M.W.Chase & N.H.Williams","237647","GBIF",,,"538","Native","Latão","Estação Ecológica Juréia-Itatins, Campo Alto do Morro próximo a Ponta da Juréia","Não"
"ESTAÇÃO ECOLÓGICA JURÉIA-ITATINS","Angiosperms","Apocynaceae","Gonioanthela","axillaris","(Vell.) Fontella & E.A.Schwarz","APOCYNACEAE Gonioanthela axillaris (Vell.) Fontella & E.A.Schwarz","268691","GBIF",,,"376",,"Latão","Estação Ecológica Juréia-Itatins, Serra da Juréia, caminho do Imperador em direção a Praia da Juréia","Não"
"ESTAÇÃO ECOLÓGICA JURÉIA-ITATINS","Ferns and Lycophytes","Thelypteridaceae","Goniopteris","cuneata","(C.Chr.) Brade","THELYPTERIDACEAE Goniopteris cuneata (C.Chr.) Brade","168775","GBIF",,,"55","Native","Latão","Estação Ecológica Juréia-Itatins, Serra da Juréia, trilha para a Figueira Grande. Mata de Encosta.","Não"
"ESTAÇÃO ECOLÓGICA JURÉIA-ITATINS","Ferns and Lycophytes","Thelypteridaceae","Goniopteris","paranaensis","(Salino) Salino & T.E. Almeida","THELYPTERIDACEAE Goniopteris paranaensis (Salino) Salino & T.E. Almeida","168780","GBIF",,,"329","Native","Latão","Estação Ecológica Juréia-Itatins, Serra da Juréia, trilha do Imperador.","Não"
"ESTAÇÃO ECOLÓGICA JURÉIA-ITATINS","Angiosperms","Malvaceae","Gossypium","barbadense","L.","MALVACEAE Gossypium barbadense L.","329586","GBIF",,,"504","Naturalized","Latão","Estação Ecológica Juréia-Itatins, Rio verde, na casa de Dona Benedita","Não"
"ESTAÇÃO ECOLÓGICA JURÉIA-ITATINS","Angiosperms","Nyctaginaceae","Guapira","areolata","(Heimerl) Lundell","NYCTAGINACEAE Guapira areolata (Heimerl) Lundell","247893","GBIF",,,"173","Native","Latão","Estação Ecológica Juréia-Itatins, Serra da Juréia, cachoeira do Senhor ('Chuveiro')","Não"
"ESTAÇÃO ECOLÓGICA JURÉIA-ITATINS","Angiosperms","Meliaceae","Guarea","macrophylla","Vahl","MELIACEAE Guarea macrophylla Vahl","309230","GBIF",,,"1184","Native","Latão","Estação Ecológica Juréia-Itatins, Margens do rio Verde, próximo ao alojamento","Não"
"ESTAÇÃO ECOLÓGICA JURÉIA-ITATINS","Angiosperms","Meliaceae","Guarea","macrophylla","(Vell.) T.D.Penn.","MELIACEAE Guarea macrophylla subsp. tuberculata (Vell.) T.D.Penn.","245798","GBIF",,,"62","Native","Latão","Estação Ecológica Juréia-Itatins, Serra da Juréia, trilha para a Figueira Grande, mata de encosta","Não"
"ESTAÇÃO ECOLÓGICA JURÉIA-ITATINS","Angiosperms","Annonaceae","Guatteria","punctata","(Aubl.) R.A.Howard","ANNONACEAE Guatteria punctata (Aubl.) R.A.Howard","14486","GBIF",,,"s.n.","Native","Latão","Estação Ecológica Juréia-Itatins, Estrada da margem do Rio Una para o Rio Verde","Não"
"ESTAÇÃO ECOLÓGICA JURÉIA-ITATINS","Angiosperms","Rubiaceae","Guettarda","viburnoides","Cham. & Schltdl.","RUBIACEAE Guettarda viburnoides Cham. & Schltdl.","247886","GBIF",,,"180","Native","Latão","Estação Ecológica Juréia-Itatins, Serra da Juréia, trilha do Imperador, próximo a Cachoeira do Senhor","Não"
"ESTAÇÃO ECOLÓGICA JURÉIA-ITATINS","Angiosperms","Asteraceae","Gymnanthemum","amygdalinum","(Delile) Sch.Bip. ex Walp.","ASTERACEAE Gymnanthemum amygdalinum (Delile) Sch.Bip. ex Walp.","309144","GBIF",,,"232","Naturalized","Latão","Estação Ecológica Juréia-Itatins, Rio Comprido, no quintal da casa do Sr. Adriano","Não"
"ESTAÇÃO ECOLÓGICA JURÉIA-ITATINS","Angiosperms","Burmanniaceae","Gymnosiphon","divaricatus","(Benth.) Benth. & Hook.f.","BURMANNIACEAE Gymnosiphon divaricatus (Benth.) Benth. & Hook.f.","299180A","GBIF",,,"1057","Native","Latão","Estação Ecológica Juréia-Itatins, Serra da Juréia, trilha para o pocinho","Não"
"ESTAÇÃO ECOLÓGICA JURÉIA-ITATINS","Angiosperms","Orchidaceae","Habenaria","josephensis","Barb.Rodr.","ORCHIDACEAE Habenaria josephensis Barb.Rodr.","244602","GBIF",,,"1387","Native","Latão","Estação Ecológica Juréia-Itatins, Proximidades do maciço da Juréia, morro á direita na bifurcação da trilha no alto da encosta próxima ao alojamento do IBAMA, campo sujo com densa cobertura de gramíneas e pteridófitas","Não"
"ESTAÇÃO ECOLÓGICA JURÉIA-ITATINS","Angiosperms","Orchidaceae","Habenaria","pleiophylla","Hoehne & Schltr.","ORCHIDACEAE Habenaria pleiophylla Hoehne & Schltr.","244632","GBIF",,,"1378","Native","Latão","Estação Ecológica Juréia-Itatins, Proximidades do maciço da Juréia, morro á esquerda da bifurcação da trilha no alto da encosta, próxima ao alojamento do IBAMA","Não"
"ESTAÇÃO ECOLÓGICA JURÉIA-ITATINS","Angiosperms","Bignoniaceae","Handroanthus","bureavii","(Sandwith) S.Grose","BIGNONIACEAE Handroanthus bureavii (Sandwith) S.Grose","275291","GBIF",,,"1485","Native","Latão","Estação Ecológica Juréia-Itatins, Alto da Cachoeira Grande, mata de encosta","Não"
"ESTAÇÃO ECOLÓGICA JURÉIA-ITATINS","Angiosperms","Bignoniaceae","Handroanthus","chrysotrichus","(Mart. ex DC.) Mattos","BIGNONIACEAE Handroanthus chrysotrichus (Mart. ex DC.) Mattos","309053","GBIF",,,"609","Native","Latão","Estação Ecológica Juréia-Itatins, Cachoeira do Guilherme no caminho para a Cachoeira Preta","Não"
"ESTAÇÃO ECOLÓGICA JURÉIA-ITATINS","Angiosperms","Bignoniaceae","Handroanthus","serratifolius","(Vahl) S.Grose","BIGNONIACEAE Handroanthus serratifolius (Vahl) S.Grose","247563","GBIF",,,"782","Native","Latão","Estação Ecológica Juréia-Itatins, Alto do morro próximo ao alojamento, mata baixa de topo de morro","Não"
"ESTAÇÃO ECOLÓGICA JURÉIA-ITATINS","Angiosperms","Bignoniaceae","Handroanthus","umbellatus","(Sond.) Mattos","BIGNONIACEAE Handroanthus umbellatus (Sond.) Mattos","254400","GBIF",,,"966","Native","Latão","Estação Ecológica Juréia-Itatins, Margem do Rio Verde","Não"
"ESTAÇÃO ECOLÓGICA JURÉIA-ITATINS","Angiosperms","Zingiberaceae","Hedychium","coronarium","J.Koenig","ZINGIBERACEAE Hedychium coronarium J.Koenig","329515","GBIF",,,"200","Naturalized","Latão","Estação Ecológica Juréia-Itatins","Não"
"ESTAÇÃO ECOLÓGICA JURÉIA-ITATINS","Angiosperms","Chloranthaceae","Hedyosmum","brasiliense","Mart. ex Miq.","CHLORANTHACEAE Hedyosmum brasiliense Mart. ex Miq.","244641","GBIF",,,"645","Native","Latão","Estação Ecológica Juréia-Itatins, Proximidades do maciço da Juréia, morro à direita na bifurcação da trilha no alto da encosta, próxima ao alojamento do IBAMA, capões de mata do alto do morro","Não"
"ESTAÇÃO ECOLÓGICA JURÉIA-ITATINS","Angiosperms","Erythropalaceae","Heisteria","silvianii","Schwacke","ERYTHROPALACEAE Heisteria silvianii Schwacke","246576","GBIF",,,"706","Native","Latão","Estação Ecológica Juréia-Itatins, Serra da Juréia, trilha para o campo próximo ao alojamento do IBAMA, mata de encosta","Não"
"ESTAÇÃO ECOLÓGICA JURÉIA-ITATINS","Angiosperms","Heliconiaceae","Heliconia","farinosa","Raddi","HELICONIACEAE Heliconia farinosa Raddi","254473","GBIF",,,"496","Native","Latão","Estação Ecológica Juréia-Itatins, Serra da Juréia, Caminho do Imperador em direção à praia da Juréia","Não"
"ESTAÇÃO ECOLÓGICA JURÉIA-ITATINS","Angiosperms","Heliconiaceae","Heliconia","pendula","Wawra","HELICONIACEAE Heliconia pendula Wawra","344551","GBIF",,,"1762","Native","Latão","Estação Ecológica Juréia-Itatins","Não"
"ESTAÇÃO ECOLÓGICA JURÉIA-ITATINS","Angiosperms","Malvaceae","Helicteres","ovata","Lam.","MALVACEAE Helicteres ovata Lam.","156019","GBIF",,,"2725","Native","Latão","Estação Ecológica Juréia-Itatins","Não"
"ESTAÇÃO ECOLÓGICA JURÉIA-ITATINS","Angiosperms","Heliotropiaceae","Heliotropium","funkiae","Feuillet","HELIOTROPIACEAE Heliotropium funkiae Feuillet","247696","GBIF",,,"819","Native","Latão","Estação Ecológica Juréia-Itatins, Serra da Juréia, mata de planície nos arredores do alojamento do IBAMA","Não"
"ESTAÇÃO ECOLÓGICA JURÉIA-ITATINS","Angiosperms","Melastomataceae","Henriettea","umbelluliflora","(Triana) M.A.Yamam., J.F.B.Pastore & R.Goldenb.","MELASTOMATACEAE Henriettea umbelluliflora (Triana) M.A.Yamam., J.F.B.Pastore & R.Goldenb.","269441","GBIF",,,"1175",,"Latão","Estação Ecológica Juréia-Itatins, Serra da Juréia, trilha da Figueira","Não"
"ESTAÇÃO ECOLÓGICA JURÉIA-ITATINS","Angiosperms","Acanthaceae","Herpetacanthus",,"Nees","ACANTHACEAE Herpetacanthus Nees","252544","GBIF",,,"s.n.",,"Latão","Estação Ecológica Juréia-Itatins, Mata de Restinga da Praia do Arpoador, Juréia- Guaraú","Não"
"ESTAÇÃO ECOLÓGICA JURÉIA-ITATINS","Angiosperms","Asteraceae","Heterocondylus","alatus","(Vell.) R.M.King & H.Rob.","ASTERACEAE Heterocondylus alatus (Vell.) R.M.King & H.Rob.","250020","GBIF",,,"908","Native","Latão","Estação Ecológica Juréia-Itatins, Trilha para o alto do morro, mata de encosta","Não"
"ESTAÇÃO ECOLÓGICA JURÉIA-ITATINS","Angiosperms","Araceae","Heteropsis","rigidifolia","Engl.","ARACEAE Heteropsis rigidifolia Engl.","277171","GBIF",,,"1468","Native","Latão","Estação Ecológica Juréia-Itatins, Mata de planície do Rio Verde, junto ao alojamento da Secretaria do Meio Ambiente","Não"
"ESTAÇÃO ECOLÓGICA JURÉIA-ITATINS","Angiosperms","Araceae","Heteropsis","salicifolia","Kunth","ARACEAE Heteropsis salicifolia Kunth","276563","GBIF",,,"385","Native","Latão","Estação Ecológica Juréia-Itatins, Centro Paulus, mata região sul do municipio de São Paulo","Não"
"ESTAÇÃO ECOLÓGICA JURÉIA-ITATINS","Angiosperms","Malpighiaceae","Heteropterys","aenea","Griseb.","MALPIGHIACEAE Heteropterys aenea Griseb.","247561","GBIF",,,"761","Native","Latão","Estação Ecológica Juréia-Itatins, Estrada da margem do Rio Una para o Rio Verde","Não"
"ESTAÇÃO ECOLÓGICA JURÉIA-ITATINS","Angiosperms","Malpighiaceae","Heteropterys","chrysophylla","(Lam.) Kunth","MALPIGHIACEAE Heteropterys chrysophylla (Lam.) Kunth","272343","GBIF",,,"1058","Native","Latão","Estação Ecológica Juréia-Itatins, Guarauzinho, praia do Arpoador","Não"
"ESTAÇÃO ECOLÓGICA JURÉIA-ITATINS","Angiosperms","Malpighiaceae","Heteropterys","intermedia","(A.Juss.) Griseb.","MALPIGHIACEAE Heteropterys intermedia (A.Juss.) Griseb.","251756","GBIF",,,"80","Native","Latão","Estação Ecológica Juréia-Itatins, Às margens do Pocinho","Não"
"ESTAÇÃO ECOLÓGICA JURÉIA-ITATINS","Angiosperms","Malpighiaceae","Heteropterys","nitida","(Lam.) DC.","MALPIGHIACEAE Heteropterys nitida (Lam.) DC.","263465","GBIF",,,"1286","Native","Latão","Estação Ecológica Juréia-Itatins, Ilha de areia em frente ao alojamento","Não"
"ESTAÇÃO ECOLÓGICA JURÉIA-ITATINS","Angiosperms","Rubiaceae","Hexasepalum","apiculatum","(Willd.) Delprete & J.H.Kirkbr.","RUBIACEAE Hexasepalum apiculatum (Willd.) Delprete & J.H.Kirkbr.","291601","GBIF",,,"659","Native","Latão","Estação Ecológica Juréia-Itatins, Serra da Juréia, praia do Rio Verde, em direção ao Rio verde","Não"
"ESTAÇÃO ECOLÓGICA JURÉIA-ITATINS","Angiosperms","Rubiaceae","Hexasepalum","radula","(Willd.) Delprete & J.H.Kirkbr.","RUBIACEAE Hexasepalum radula (Willd.) Delprete & J.H.Kirkbr.","262804","GBIF",,,"314","Native","Latão","Estação Ecológica Juréia-Itatins, Serra da Juréia, praia do Rio Verde","Não"
"ESTAÇÃO ECOLÓGICA JURÉIA-ITATINS","Angiosperms","Malvaceae","Hibiscus","sabdariffa","L.","MALVACEAE Hibiscus sabdariffa L.","329587","GBIF",,,"612","Naturalized","Latão","Estação Ecológica Juréia-Itatins, Próximo à Cachoeira do Guilherme, no quintal da Dona Maricota","Não"
"ESTAÇÃO ECOLÓGICA JURÉIA-ITATINS","Angiosperms","Phyllanthaceae","Hieronyma","alchorneoides","Allemão","PHYLLANTHACEAE Hieronyma alchorneoides Allemão","247551","GBIF",,,"766","Native","Latão","Estação Ecológica Juréia-Itatins, Serra da Juréia. Trilha para o Pocinho","Não"
"ESTAÇÃO ECOLÓGICA JURÉIA-ITATINS","Angiosperms","Poaceae","Hildaea","pallens","(Sw.) C.Silva & R.P.Oliveira","POACEAE Hildaea pallens (Sw.) C.Silva & R.P.Oliveira","248278","GBIF",,,"838","Native","Latão","Estação Ecológica Juréia-Itatins, Proximidades da cachoeira do salto","Não"
"ESTAÇÃO ECOLÓGICA JURÉIA-ITATINS","Angiosperms","Rubiaceae","Hillia","illustris","(Vell.) K.Schum.","RUBIACEAE Hillia illustris (Vell.) K.Schum.","249113","GBIF",,,"876","Native","Latão","Estação Ecológica Juréia-Itatins, Proximidades da Cachoeira do Salto","Não"
"ESTAÇÃO ECOLÓGICA JURÉIA-ITATINS","Angiosperms","Rubiaceae","Hillia","parasitica","Jacq.","RUBIACEAE Hillia parasitica Jacq.","247641","GBIF",,,"776","Native","Latão","Estação Ecológica Juréia-Itatins, Subida para o morro próximo ao alojamento","Não"
"ESTAÇÃO ECOLÓGICA JURÉIA-ITATINS","Angiosperms","Amaryllidaceae","Hippeastrum","aulicum","(Ker Gawl.) Herb.","AMARYLLIDACEAE Hippeastrum aulicum (Ker Gawl.) Herb.","262668","GBIF",,,"541","Native","Latão","Estação Ecológica Juréia-Itatins, Serra da Juréia, mata no alto da cachoeira do Salto","Não"
"ESTAÇÃO ECOLÓGICA JURÉIA-ITATINS","Angiosperms","Amaryllidaceae","Hippeastrum","blossfeldiae","(Traub & J.L.Doran) Van Scheepen","AMARYLLIDACEAE Hippeastrum blossfeldiae (Traub & J.L.Doran) Van Scheepen","251766","GBIF",,,"476","Native","Latão","Estação Ecológica Juréia-Itatins, Serra da Juréia, caminho do Imperador, ca. 5km da balsa do Rio Una, restinga","Não"
"ESTAÇÃO ECOLÓGICA JURÉIA-ITATINS","Angiosperms","Amaryllidaceae","Hippeastrum","reticulatum","(L'Hér.) Herb.","AMARYLLIDACEAE Hippeastrum reticulatum (L'Hér.) Herb.","249240","GBIF",,,"5","Native","Latão","Estação Ecológica Juréia-Itatins, Serra da Juréia, trilha do Imperador em direção a Praia da Juréia","Não"
"ESTAÇÃO ECOLÓGICA JURÉIA-ITATINS","Angiosperms","Campanulaceae","Hippobroma","longiflora","(L.) G.Don","CAMPANULACEAE Hippobroma longiflora (L.) G.Don","329608","GBIF",,,"741","Native","Latão","Estação Ecológica Juréia-Itatins, trilha do Aguapeú para a cachoeira do Guilherme","Não"
"ESTAÇÃO ECOLÓGICA JURÉIA-ITATINS","Angiosperms","Celastraceae","Hippocratea","volubilis","L.","CELASTRACEAE Hippocratea volubilis L.","254408","GBIF",,,"1054","Native","Latão","Estação Ecológica Juréia-Itatins, Margens do Rio Verde","Não"
"ESTAÇÃO ECOLÓGICA JURÉIA-ITATINS","Angiosperms","Malpighiaceae","Hiraea","fagifolia","(DC.) A.Juss.","MALPIGHIACEAE Hiraea fagifolia (DC.) A.Juss.","318832","GBIF",,,"1487","Native","Latão","Estação Ecológica Juréia-Itatins, Serra da Juréia, próximo à Praia da Juréia","Não"
"ESTAÇÃO ECOLÓGICA JURÉIA-ITATINS","Angiosperms","Chrysobalanaceae","Hirtella","hebeclada","Moric. ex DC.","CHRYSOBALANACEAE Hirtella hebeclada Moric. ex DC.","246582","GBIF",,,"751","Native","Latão","Estação Ecológica Juréia-Itatins, Serra da Juréia, trilha para o Pocinho","Não"
"ESTAÇÃO ECOLÓGICA JURÉIA-ITATINS","Angiosperms","Orchidaceae","Houlletia","brocklehurstiana","Lindl.","ORCHIDACEAE Houlletia brocklehurstiana Lindl.","248390","GBIF",,,"1580","Native","Latão","Estação Ecológica Juréia-Itatins, Alto do morro","Não"
"ESTAÇÃO ECOLÓGICA JURÉIA-ITATINS","Angiosperms","Humiriaceae","Humiriastrum","dentatum","(Casar.) Cuatrec.","HUMIRIACEAE Humiriastrum dentatum (Casar.) Cuatrec.","329573","GBIF",,,"748","Native","Latão","Estação Ecológica Juréia-Itatins, Aguapeú","Não"
"ESTAÇÃO ECOLÓGICA JURÉIA-ITATINS","Angiosperms","Orchidaceae","Huntleya","meleagris","Lindl.","ORCHIDACEAE Huntleya meleagris Lindl.","248077","GBIF",,,"1521","Native","Latão","Estação Ecológica Juréia-Itatins, Mata sobre restinga, beira da estrada após travessia do Rio Una","Não"
"ESTAÇÃO ECOLÓGICA JURÉIA-ITATINS","Ferns and Lycophytes","Lycopodiaceae","Huperzia",,"Bernh.","LYCOPODIACEAE Huperzia Bernh.","917","GBIF",,,"1762",,"Latão","Guarauzinho, Riacho Água-fria, Estação ecológica Juréia-Itatins.","Não"
"ESTAÇÃO ECOLÓGICA JURÉIA-ITATINS","Angiosperms","Fabaceae","Hydrochorea","pedicellaris","(DC.) M.V.B.Soares, Iganci & M.P.Morim","FABACEAE Hydrochorea pedicellaris (DC.) M.V.B.Soares, Iganci & M.P.Morim","390309","GBIF",,,"100","Native","Latão","Iguape, Estaçao Ecológica Juréia-Itatins, Serra da Juréei-Trilha para a cachoeira do Salto, mata de Planície","Não"
"ESTAÇÃO ECOLÓGICA JURÉIA-ITATINS","Angiosperms","Araliaceae","Hydrocotyle","bonariensis","Lam.","ARALIACEAE Hydrocotyle bonariensis Lam.","298936","GBIF",,,"4471","Native","Latão","Estação Ecológica Juréia-Itatins, Ca. 5km S do Rio Grajauna na estrada para o Rio Verde","Não"
"ESTAÇÃO ECOLÓGICA JURÉIA-ITATINS","Angiosperms","Araliaceae","Hydrocotyle","leucocephala","Cham. & Schltdl.","ARALIACEAE Hydrocotyle leucocephala Cham. & Schltdl.","329526","GBIF",,,"599","Native","Latão","Estação Ecológica Juréia-Itatins, Próximo à Cachoeira do Guilherme, no quintal de Dona Maricota","Não"
"ESTAÇÃO ECOLÓGICA JURÉIA-ITATINS","Angiosperms","Fabaceae","Hymenaea","courbaril","L.","FABACEAE Hymenaea courbaril L.","251741","GBIF",,,"65","Native","Latão","Estação Ecológica Juréia-Itatins, Trilha para o Pocinho","Não"
"ESTAÇÃO ECOLÓGICA JURÉIA-ITATINS","Angiosperms","Fabaceae","Hymenolobium","janeirense","Kuhlm.","FABACEAE Hymenolobium janeirense Kuhlm.","275139","GBIF",,,"1039","Native","Latão","Estação Ecológica Juréia-Itatins, Mata de planície, às margens do Rio Verde, próximo ao alojamento","Não"
"ESTAÇÃO ECOLÓGICA JURÉIA-ITATINS","Ferns and Lycophytes","Hymenophyllaceae",,,"Gaudich.","HYMENOPHYLLACEAE Hymenophyllaceae Gaudich.","386719","GBIF",,,"1345",,"Latão","Estação Ecológica Juréia-Itatins, trilha da Figueira.","Não"
"ESTAÇÃO ECOLÓGICA JURÉIA-ITATINS","Ferns and Lycophytes","Hymenophyllaceae","Hymenophyllum","asplenioides","(Sw.) Sw.","HYMENOPHYLLACEAE Hymenophyllum asplenioides (Sw.) Sw.","P01032586","GBIF",,,,"Native","Latão","Estação Ecológica Juréia-Itatins, trilha para Figueira Grande","Não"
"ESTAÇÃO ECOLÓGICA JURÉIA-ITATINS","Ferns and Lycophytes","Hymenophyllaceae","Hymenophyllum","caudiculatum","Mart.","HYMENOPHYLLACEAE Hymenophyllum caudiculatum Mart.","77709","GBIF",,,"335","Native","Latão","Estação Ecológica Juréia-Itatins, Serra da Juréia, trilha da Figueira.","Não"
"ESTAÇÃO ECOLÓGICA JURÉIA-ITATINS","Ferns and Lycophytes","Hymenophyllaceae","Hymenophyllum","hirsutum","(L.) Sw.","HYMENOPHYLLACEAE Hymenophyllum hirsutum (L.) Sw.","77769","GBIF",,,"1005","Native","Latão","Estação Ecológica Juréia-Itatins, trilha para a Figueira Grande, mata de encosta.","Não"
"ESTAÇÃO ECOLÓGICA JURÉIA-ITATINS","Ferns and Lycophytes","Hymenophyllaceae","Hymenophyllum","polyanthos","(Sw.) Sw.","HYMENOPHYLLACEAE Hymenophyllum polyanthos (Sw.) Sw.","P01032619","GBIF",,,,"Native","Latão","Estação Ecológica Juréia-Itatins, trilha para Figueira Grande","Não"
"ESTAÇÃO ECOLÓGICA JURÉIA-ITATINS","Angiosperms","Menispermaceae","Hyperbaena","domingensis","(DC.) Benth.","MENISPERMACEAE Hyperbaena domingensis (DC.) Benth.","123908","GBIF",,,"1069","Native","Latão","Estação Ecológica Juréia-Itatins","Não"
"ESTAÇÃO ECOLÓGICA JURÉIA-ITATINS","Angiosperms","Cyperaceae","Hypolytrum","schraderianum","Nees","CYPERACEAE Hypolytrum schraderianum Nees","NY00637054","GBIF",,,"51","Native","Latão","Estaçao Ecológica Juréia-Itatins, trilha do Fundao.","Não"
"ESTAÇÃO ECOLÓGICA JURÉIA-ITATINS","Angiosperms","Hypoxidaceae","Hypoxis","decumbens","L.","HYPOXIDACEAE Hypoxis decumbens L.","329572","GBIF",,,"593","Native","Latão","Estação Ecológica Juréia-Itatins, Trilha do Grajaúna para a Cachoeira do Guilherme","Não"
"ESTAÇÃO ECOLÓGICA JURÉIA-ITATINS","Angiosperms","Poaceae","Ichnanthus","leiocarpus","(Spreng.) Kunth","POACEAE Ichnanthus leiocarpus (Spreng.) Kunth","344000","GBIF",,,"6","Native","Latão","Estação Ecológica Juréia-Itatins, Núcleo Arpoador Guarauzinho, floresta atlântica de encosta","Não"
"ESTAÇÃO ECOLÓGICA JURÉIA-ITATINS","Angiosperms","Poaceae","Ichnanthus","nemoralis","(Schrad. ex Schult.) Hitchc. & Chase","POACEAE Ichnanthus nemoralis (Schrad. ex Schult.) Hitchc. & Chase","244644","GBIF",,,"1400","Native","Latão","Estação Ecológica Juréia-Itatins, Proximidades do maciço da Juréia, junto ao paredão rochoso próximo ao alojamento.","Não"
"ESTAÇÃO ECOLÓGICA JURÉIA-ITATINS","Angiosperms","Aquifoliaceae","Ilex","diuretica","Mart. ex Reissek","AQUIFOLIACEAE Ilex diuretica Mart. ex Reissek","251828","GBIF",,,"1016","Native","Latão","Estação Ecológica Juréia-Itatins, Alto do maciço da Juréia, mata baixa de topo de morro","Não"
"ESTAÇÃO ECOLÓGICA JURÉIA-ITATINS","Angiosperms","Aquifoliaceae","Ilex","dumosa","Reissek","AQUIFOLIACEAE Ilex dumosa Reissek","247797","GBIF",,,"151","Native","Latão","Estação Ecológica Juréia-Itatins, Serra da Juréia, trilha do Imperador","Não"
"ESTAÇÃO ECOLÓGICA JURÉIA-ITATINS","Angiosperms","Aquifoliaceae","Ilex","integerrima","(Vell.) Reissek","AQUIFOLIACEAE Ilex integerrima (Vell.) Reissek","247892","GBIF",,,"172","Native","Latão","Estação Ecológica Juréia-Itatins, Serra da Juréia, Cachoeira do Senhor ('Chuveiro')","Não"
"ESTAÇÃO ECOLÓGICA JURÉIA-ITATINS","Angiosperms","Aquifoliaceae","Ilex","theezans","Mart. ex Reissek","AQUIFOLIACEAE Ilex theezans Mart. ex Reissek","244557","GBIF",,,"1372","Native","Latão","Estação Ecológica Juréia-Itatins, Proximidades da Serra da Juréia, beira da estrada de acesso ao Rio Verde","Não"
"ESTAÇÃO ECOLÓGICA JURÉIA-ITATINS","Angiosperms","Fabaceae","Inga","bullata","Benth.","FABACEAE Inga bullata Benth.","253037","GBIF",,,"3","Native","Latão","Estação Ecológica Juréia-Itatins, Mata ao redor do alojamento","Não"
"ESTAÇÃO ECOLÓGICA JURÉIA-ITATINS","Angiosperms","Fabaceae","Inga","capitata","Desv.","FABACEAE Inga capitata Desv.","249636","GBIF",,,"53","Native","Latão","Estação Ecológica Juréia-Itatins, Serra da Juréia, margens do Rio Verde","Não"
"ESTAÇÃO ECOLÓGICA JURÉIA-ITATINS","Angiosperms","Fabaceae","Inga","globularis","T.D.Penn.","FABACEAE Inga globularis T.D.Penn.","247801","GBIF",,,"148","Native","Latão","Estação Ecológica Juréia-Itatins, Serra da Juréia, trilha do alojamento, restinga","Não"
"ESTAÇÃO ECOLÓGICA JURÉIA-ITATINS","Angiosperms","Fabaceae","Inga","sellowiana","Benth.","FABACEAE Inga sellowiana Benth.","329483","GBIF",,,"692","Native","Latão","Estação Ecológica Juréia-Itatins, Trilha para o rio Verde pelo morro do Grajaúna","Não"
"ESTAÇÃO ECOLÓGICA JURÉIA-ITATINS","Angiosperms","Fabaceae","Inga","sessilis","(Vell.) Mart.","FABACEAE Inga sessilis (Vell.) Mart.","249805","GBIF",,,"195","Native","Latão","Estação Ecológica Juréia-Itatins, Serra da Juréia, margem do Rio Verde","Não"
"ESTAÇÃO ECOLÓGICA JURÉIA-ITATINS","Angiosperms","Fabaceae","Inga","subnuda","(Benth.) T.D.Penn.","FABACEAE Inga subnuda subsp. luschnathiana (Benth.) T.D.Penn.","UNIP04881","GBIF",,,"9281","Native","Latão","Estação Ecológica Juréia-Itatins. Foz do Rio Guaraú, mata próxima à margem esquerda.","Não"
"ESTAÇÃO ECOLÓGICA JURÉIA-ITATINS","Angiosperms","Convolvulaceae","Ipomoea","batatas","(L.) Lam.","CONVOLVULACEAE Ipomoea batatas (L.) Lam.","309132","GBIF",,,"159","Naturalized","Latão","Estação Ecológica Juréia-Itatins, Cachoeira do Guilherme, no quintal da casa da Dona Carmem","Não"
"ESTAÇÃO ECOLÓGICA JURÉIA-ITATINS","Angiosperms","Convolvulaceae","Ipomoea","bonariensis","Hook.","CONVOLVULACEAE Ipomoea bonariensis Hook.","250042","GBIF",,,"958","Native","Latão","Estação Ecológica Juréia-Itatins, Serra da Juréia, às margens do Rio Verde, em direção à foz, mata","Não"
"ESTAÇÃO ECOLÓGICA JURÉIA-ITATINS","Angiosperms","Convolvulaceae","Ipomoea","imperati","(Vahl) Griseb.","CONVOLVULACEAE Ipomoea imperati (Vahl) Griseb.","311221","GBIF",,,"112","Native","Latão","Estação Ecológica Juréia-Itatins, Serra da Juréia, vegetação psamófila, praia do Rio Verde","Não"
"ESTAÇÃO ECOLÓGICA JURÉIA-ITATINS","Angiosperms","Convolvulaceae","Ipomoea","tiliacea","(Willd.) Choisy","CONVOLVULACEAE Ipomoea tiliacea (Willd.) Choisy","291958","GBIF",,,"526","Native","Latão","Estação Ecológica Juréia-Itatins","Não"
"ESTAÇÃO ECOLÓGICA JURÉIA-ITATINS","Angiosperms","Rubiaceae","Ixora","burchelliana","Müll.Arg.","RUBIACEAE Ixora burchelliana Müll.Arg.","253038","GBIF",,,"4","Native","Latão","Estação Ecológica Juréia-Itatins, Mata ao redor do alojamento","Não"
"ESTAÇÃO ECOLÓGICA JURÉIA-ITATINS","Angiosperms","Rubiaceae","Ixora","gardneriana","Benth.","RUBIACEAE Ixora gardneriana Benth.","NY00397765","GBIF",,,"1031","Native","Latão","Estaçao Ecológica Juréia-Itatins, trilha entre o caminho do Imperador e a margem do Rio Verde","Não"
"ESTAÇÃO ECOLÓGICA JURÉIA-ITATINS","Angiosperms","Bignoniaceae","Jacaranda","puberula","Cham.","BIGNONIACEAE Jacaranda puberula Cham.","246967","GBIF",,,"746","Native","Latão","Estação Ecológica Juréia-Itatins, Serra da Juréia, Trilha do Imperador entre o Rio Una do Prelado e Rio Verde, restinga","Não"
"ESTAÇÃO ECOLÓGICA JURÉIA-ITATINS","Angiosperms","Convolvulaceae","Jacquemontia","ferruginea","Choisy","CONVOLVULACEAE Jacquemontia ferruginea Choisy","248427","GBIF",,,"419","Native","Latão","Estação Ecológica Juréia-Itatins, Trilha do Imperador, em direção à praia da Juréia, mata","Não"
"ESTAÇÃO ECOLÓGICA JURÉIA-ITATINS","Angiosperms","Convolvulaceae","Jacquemontia","holosericea","(Weinm.) O'Donell","CONVOLVULACEAE Jacquemontia holosericea (Weinm.) O'Donell","291964","GBIF",,,"149","Native","Latão","Estação Ecológica Juréia-Itatins","Não"
