"","data_source","barcode","collectionCode","catalogNumber","scientificName","kingdom","family","genus","year","month","day","country","stateProvince","county","locality","institutionCode","basisOfRecord","identifiedBy","yearIdentified","monthIdentified","dayIdentified","verbatimLatitude","verbatimLongitude","collectionID","specificepithet","recordedBy","decimalLongitude","decimalLatitude","modified","scientificNameAuthorship","recordNumber","minimumelevationinmeters","maximumelevationinmeters","occurrenceRemarks","coordinatePrecision","phylum","order","individualcount","continentocean","class","infraspecificepithet","typeStatus","previouscatalognumber","minimumdepthinmeters","maximumdepthinmeters","preparationtype","fieldnumber","relationshiptype","relatedcatalogitem","downloadedFrom","municipality","dateIdentified","acceptedScientificName","bibliographicCitation","countryCode","datasetID","datasetName","eventDate","fieldNotes","habitat","identificationRemarks","latitude","longitude","taxonomicStatus","taxonRank","type","verbatimElevation","verbatimEventDate","verbatimLocality","collectionCode.new","collectionObs","recordedBy.new","recordNumber.new","year.new","identifiedBy.new","yearIdentified.new","recordedBy.aux","last.name","identifiedBy.aux","country.new","stateProvince.new","municipality.new","locality.new","locality.scrap","resol.orig","loc","loc.correct","latitude.gazetteer","longitude.gazetteer","resolution.gazetteer","X","gbifID","accessRights","language","license","publisher","references","rightsHolder","institutionID","ownerInstitutionCode","informationWithheld","dataGeneralizations","dynamicProperties","occurrenceID","recordedByID","individualCount","organismQuantity","organismQuantityType","sex","lifeStage","reproductiveCondition","caste","behavior","vitality","establishmentMeans","degreeOfEstablishment","pathway","georeferenceVerificationStatus","occurrenceStatus","preparations","disposition","associatedOccurrences","associatedReferences","associatedSequences","associatedTaxa","otherCatalogNumbers","organismID","organismName","organismScope","associatedOrganisms","previousIdentifications","organismRemarks","materialEntityID","materialEntityRemarks","verbatimLabel","materialSampleID","eventID","parentEventID","eventType","fieldNumber","eventTime","startDayOfYear","endDayOfYear","samplingProtocol","sampleSizeValue","sampleSizeUnit","samplingEffort","eventRemarks","locationID","higherGeographyID","higherGeography","continent","waterBody","islandGroup","island","verticalDatum","verbatimDepth","minimumDistanceAboveSurfaceInMeters","maximumDistanceAboveSurfaceInMeters","locationAccordingTo","locationRemarks","coordinateUncertaintyInMeters","pointRadiusSpatialFit","verbatimCoordinateSystem","verbatimSRS","footprintWKT","footprintSRS","footprintSpatialFit","georeferencedBy","georeferencedDate","georeferenceProtocol","georeferenceSources","georeferenceRemarks","geologicalContextID","earliestEonOrLowestEonothem","latestEonOrHighestEonothem","earliestEraOrLowestErathem","latestEraOrHighestErathem","earliestPeriodOrLowestSystem","latestPeriodOrHighestSystem","earliestEpochOrLowestSeries","latestEpochOrHighestSeries","earliestAgeOrLowestStage","latestAgeOrHighestStage","lowestBiostratigraphicZone","highestBiostratigraphicZone","lithostratigraphicTerms","group","formation","member","bed","identificationID","verbatimIdentification","identificationQualifier","identifiedByID","identificationReferences","identificationVerificationStatus","taxonID","scientificNameID","acceptedNameUsageID","parentNameUsageID","originalNameUsageID","nameAccordingToID","namePublishedInID","taxonConceptID","acceptedNameUsage","parentNameUsage","originalNameUsage","nameAccordingTo","namePublishedIn","namePublishedInYear","higherClassification","superfamily","subfamily","tribe","subtribe","genericName","subgenus","infragenericEpithet","specificEpithet","infraspecificEpithet","cultivarEpithet","verbatimTaxonRank","vernacularName","nomenclaturalCode","nomenclaturalStatus","taxonRemarks","datasetKey","publishingCountry","lastInterpreted","elevation","elevationAccuracy","depth","depthAccuracy","distanceFromCentroidInMeters","issue","mediaType","hasCoordinate","hasGeospatialIssues","taxonKey","acceptedTaxonKey","kingdomKey","phylumKey","classKey","orderKey","familyKey","genusKey","subgenusKey","speciesKey","species","verbatimScientificName","typifiedName","protocol","lastParsed","lastCrawled","repatriated","relativeOrganismQuantity","projectId","isSequenced","gbifRegion","publishedByGbifRegion","level0Gid","level0Name","level1Gid","level1Name","level2Gid","level2Name","level3Gid","level3Name","iucnRedListCategory","associatedMedia","minimumElevationInMeters","maximumElevationInMeters","minimumDepthInMeters","maximumDepthInMeters","geodeticDatum","verbatimCoordinates","scientificNameAuthorship.y","imageCollectionCode","virtualDuplicates","duplicates","DeterminationQualifier","recordedByExtra","dateCollected","dateCollectedMax","verbatimElevationMax","measurementUnit","verbatimLatitudeMax","verbatimLongitudeMax","updatedBy","dateUpdated","right","modified_incomplete","Clado","loc.correct.mun","NAME_0","NAME_1","NAME_2","NAME_3","source","loc.correct.mun.1","NAME_0.1","NAME_1.1","NAME_2.1","NAME_3.1","source.1","loc.correct.mun.2","NAME_0.2","NAME_1.2","NAME_2.2","NAME_3.2","source.2","loc.check","scientificName.new","scientificNameAuthorship.new","scientificNameStatus","suggestedFamily","suggestedName","suggestedAuthorship","taxon.rank","tax.notes","id","accepted.tax.name","accepted.tax.authorship","scientificNameFull","genus.new","family.new","tax.check","species.new"
"Acacia","gbif",,"SPFW","6230","Acacia Mill.","Plantae","Fabaceae","Acacia","2013","12","17","Brasil","São Paulo",,"Parque Estadual de Vassununga","USP-IB","PRESERVED_SPECIMEN","da Silva, F.P 2017",,,,,,"https://specieslink.net/col/20",,"Ceccantini, G.C.T. Becman, E.C.; Altobelli, N.A.; Coelho, F.; Sabatini, V.","-47.596056","-21.723833","2021-05-14 17:00:14",,"4073",,,,,"Tracheophyta","Fabales",,,"Magnoliopsida",,,,,,,,,,"GBIF","Santa Rita do Passa Quatro",,"Acacia Mill.",,"BR",,,"2013-12-17",,,,,,"ACCEPTED","GENUS",,,,,,,,,,,,,,,"brazil","sao paulo","santa rita do passa quatro","parque estadual de vassununga",,"locality","brazil_sao paulo_santa rita passa quatro_parque estadual vassununga","brazil_sao paulo_santa rita passa quatro_pe vassununga",-21.639694,-47.613521,"locality","536208","2873455379",,,"CC_BY_4_0","Universidade de São Paulo","https://specieslink.net/guid/20/6230","Xiloteca do Instituto de Biociências da Universidade de São Paulo",,"Instituto de Biociências da Universidade de São Paulo",,,,"https://specieslink.net/guid/20/6230",,,,,,,,,,,,,,,"PRESENT",,,,,,,,,,,,,,,,,,,,,,,"351","351",,,,,,,,,"SOUTH_AMERICA",,,,,,,,,,,,,,,,,,,,,,,,,,,,,,,,,,,,,,,,,,,,,,,,"2978223",,,,,,,,,,,,,,,,,"Acacia",,,,,,,,,,,"03929cfc-82e3-4f21-97e3-7be4de285584","BR","2025-01-05 15:25:53.799","601","0",,,,"CONTINENT_DERIVED_FROM_COORDINATES;INSTITUTION_MATCH_NONE",,TRUE,FALSE,"2978223","2978223","6","7707728","220","1370","5386","2978223",,,,"Acacia",,"EML","2025-01-05 15:25:53.799","2025-01-05 15:25:39.082",FALSE,,"null",FALSE,"LATIN_AMERICA","LATIN_AMERICA","BRA","Brazil","BRA.25_1","São Paulo","BRA.25.531_2","Santa Rita do Passa Quatro",,,"NE",,"601","601",,,"WGS84",,,,,,,,,,,,,,,,,,,"brazil_sao paulo_santa rita passa quatro","Brazil","São Paulo","Santa Rita do Passa Quatro",,"ibge","brazil_sao paulo_santa rita passa quatro","Brazil","São Paulo","Santa Rita do Passa Quatro",,"ibge","brazil_sao paulo_santa rita passa quatro","Brazil","São Paulo","Santa Rita do Passa Quatro",,"ibge","ok_same_resolution","Acacia","Mill.","name_w_authors","Fabaceae","Acacia","Mill.","genus","name accepted","bfo-22766",,,"Acacia Mill.","Acacia","Fabaceae","unknown",
"Acalypha macrostachya","gbif",,"UEC","4550","Acalypha macrostachya Jacq.","Plantae","Euphorbiaceae","Acalypha","1978","10","16","Brazil","São Paulo",,"Parque estadual de Vassununga, Mata Cape","UNICAMP","PRESERVED_SPECIMEN","Webster, GL",,,,,,"https://specieslink.net/col/2",,"Martins, FR",,,"2023-03-09 11:31:44","Jacq.","1008",,,"flor, Árvore 10 m, flores verdes",,"Tracheophyta","Malpighiales",,,"Magnoliopsida",,,,,,,,,,"GBIF","Santa Rita do Passa Quatro","1984-09-01","Acalypha macrostachya Jacq.",,"BR",,,"1978-10-16",,,,,,"ACCEPTED","SPECIES",,,,,,,,,,,,,,,"brazil","sao paulo","santa rita do passa quatro","parque estadual de vassununga, mata cape",,"locality","brazil_sao paulo_santa rita passa quatro","brazil_sao paulo_santa rita passa quatro",-21.68195672,-47.50780122,"county","55143","1088983204",,,"CC_BY_4_0","Universidade Estadual de Campinas - Instituto de Biologia","https://specieslink.net/guid/2/4550","Herbário da Universidade Estadual de Campinas",,"Universidade Estadual de Campinas",,,,"https://specieslink.net/guid/2/4550",,,,,,,,,,,"native",,,,"PRESENT",,,,,,,,,,,,,,,,,,,,,,,"289","289",,,,,,,,,"SOUTH_AMERICA",,,,,,,,,,,,,,,,,,,,,,,,,,,,,,,,,,,,,,,,,,,,,,,,"3056437",,,,,,,,,,,,,,,,,"Acalypha",,,"macrostachya",,,,,,,,"7741a517-ab3d-4b85-ae58-56322e44c8ce","BR","2025-01-05 15:38:14.568",,,,,,"CONTINENT_DERIVED_FROM_COUNTRY;INSTITUTION_MATCH_NONE",,FALSE,FALSE,"3056437","3056437","6","7707728","220","1414","4691","3055964",,"3056437","Acalypha macrostachya","Acalypha macrostachya",,"EML","2025-01-05 15:38:14.568","2025-01-05 15:31:00.136",FALSE,,"null",FALSE,"LATIN_AMERICA","LATIN_AMERICA",,,,,,,,,"LC","https://images.cria.org.br/viewer/UEC139410",,,,,"WGS84",,,,,,,,,,,,,,,,,,,"brazil_sao paulo_santa rita passa quatro","Brazil","São Paulo","Santa Rita do Passa Quatro",,"ibge","brazil_sao paulo_santa rita passa quatro","Brazil","São Paulo","Santa Rita do Passa Quatro",,"ibge","brazil_sao paulo_santa rita passa quatro","Brazil","São Paulo","Santa Rita do Passa Quatro",,"ibge","check_local.2municip.","Acalypha macrostachya","Jacq.","name_w_authors","Euphorbiaceae","Acalypha macrostachya","Jacq.","species","name accepted","bfo-22668",,,"Acalypha macrostachya Jacq.","Acalypha","Euphorbiaceae","unknown","Acalypha macrostachya"
"Actinostemon concolor","gbif",,"UEC","4522","Actinostemon oligandrus (Müll.Arg.) Baill.","Plantae","Euphorbiaceae","Actinostemon","1978","10","25","Brazil","São Paulo",,"Parque estadual de Vassununga, Mata Cape","UNICAMP","PRESERVED_SPECIMEN","Webster, GL",,,,,,"https://specieslink.net/col/2",,"Martins, FR",,,"2023-03-09 11:31:46","(Müll.Arg.) Baill.","10004",,,"flor, Arvoreta 2 m, flores amarelas",,"Tracheophyta","Malpighiales",,,"Magnoliopsida",,,,,,,,,,"GBIF","Santa Rita do Passa Quatro","1984-09-01","Actinostemon concolor (Spreng.) Müll.Arg.",,"BR",,,"1978-10-25",,,,,,"SYNONYM","SPECIES",,,,,,,,,,,,,,,"brazil","sao paulo","santa rita do passa quatro","parque estadual de vassununga, mata cape",,"locality","brazil_sao paulo_santa rita passa quatro","brazil_sao paulo_santa rita passa quatro",-21.68195672,-47.50780122,"county","55127","1088983179",,,"CC_BY_4_0","Universidade Estadual de Campinas - Instituto de Biologia","https://specieslink.net/guid/2/4522","Herbário da Universidade Estadual de Campinas",,"Universidade Estadual de Campinas",,,,"https://specieslink.net/guid/2/4522",,,,,,,,,,,,,,,"PRESENT",,,,,,,,,,,,,,,,,,,,,,,"298","298",,,,,,,,,"SOUTH_AMERICA",,,,,,,,,,,,,,,,,,,,,,,,,,,,,,,,,,,,,,,,,,,,,,,,"3063147",,,,,,,,,,,,,,,,,"Actinostemon",,,"oligandrus",,,,,,,,"7741a517-ab3d-4b85-ae58-56322e44c8ce","BR","2025-01-05 15:38:15.058",,,,,,"CONTINENT_DERIVED_FROM_COUNTRY;INSTITUTION_MATCH_NONE",,FALSE,FALSE,"3063306","3063147","6","7707728","220","1414","4691","8265757",,"3063147","Actinostemon concolor","Actinostemon oligandrus",,"EML","2025-01-05 15:38:15.058","2025-01-05 15:31:00.136",FALSE,,"null",FALSE,"LATIN_AMERICA","LATIN_AMERICA",,,,,,,,,"NE","https://images.cria.org.br/viewer/UEC128187",,,,,"WGS84",,,,,,,,,,,,,,,,,,,"brazil_sao paulo_santa rita passa quatro","Brazil","São Paulo","Santa Rita do Passa Quatro",,"ibge","brazil_sao paulo_santa rita passa quatro","Brazil","São Paulo","Santa Rita do Passa Quatro",,"ibge","brazil_sao paulo_santa rita passa quatro","Brazil","São Paulo","Santa Rita do Passa Quatro",,"ibge","check_local.2municip.","Actinostemon concolor","(Spreng.) Müll.Arg.","name_w_authors","Euphorbiaceae","Actinostemon concolor","(Spreng.) Müll.Arg.","species","replaced synonym","bfo-17448","Actinostemon concolor","(Spreng.) Müll.Arg.","Actinostemon concolor (Spreng.) Müll.Arg.","Actinostemon","Euphorbiaceae","unknown","Actinostemon concolor"
"Actinostemon klotzschii","gbif",,"UEC","4525","Actinostemon estrellensis (Müll.Arg.) Pax","Plantae","Euphorbiaceae","Actinostemon","1978","4","12","Brazil","São Paulo",,"Parque estadual de Vassununga, Mata Cape","UNICAMP","PRESERVED_SPECIMEN",,,,,,,"https://specieslink.net/col/2",,"Martins, FR",,,"2023-03-09 11:31:46","(Müll.Arg.) Pax","10005",,,"flor, Arvoreta 3 m, flores amarelo-esverdeadas",,"Tracheophyta","Malpighiales",,,"Magnoliopsida",,,,,,,,,,"GBIF","Santa Rita do Passa Quatro","1993-01-01","Actinostemon klotzschii (Didr.) Pax",,"BR",,,"1978-04-12",,,,,,"SYNONYM","SPECIES",,,,,,,,,,,,,,,"brazil","sao paulo","santa rita do passa quatro","parque estadual de vassununga, mata cape",,"locality","brazil_sao paulo_santa rita passa quatro","brazil_sao paulo_santa rita passa quatro",-21.68195672,-47.50780122,"county","55140","1088983199",,,"CC_BY_4_0","Universidade Estadual de Campinas - Instituto de Biologia","https://specieslink.net/guid/2/4525","Herbário da Universidade Estadual de Campinas",,"Universidade Estadual de Campinas",,,,"https://specieslink.net/guid/2/4525",,,,,,,,,,,,,,,"PRESENT",,,,,,,,,,,,,,,,,,,,,,,"102","102",,,,,,,,,"SOUTH_AMERICA",,,,,,,,,,,,,,,,,,,,,,,,,,,,,,,,,,,,,,,,,,,,,,,,"3063242",,,,,,,,,,,,,,,,,"Actinostemon",,,"estrellensis",,,,,,,,"7741a517-ab3d-4b85-ae58-56322e44c8ce","BR","2025-01-05 15:38:14.568",,,,,,"CONTINENT_DERIVED_FROM_COUNTRY;INSTITUTION_MATCH_NONE",,FALSE,FALSE,"3063253","3063242","6","7707728","220","1414","4691","8265757",,"3063242","Actinostemon klotzschii","Actinostemon estrellensis",,"EML","2025-01-05 15:38:14.568","2025-01-05 15:31:00.136",FALSE,,"null",FALSE,"LATIN_AMERICA","LATIN_AMERICA",,,,,,,,,"NE","https://images.cria.org.br/viewer/UEC134355",,,,,"WGS84",,,,,,,,,,,,,,,,,,,"brazil_sao paulo_santa rita passa quatro","Brazil","São Paulo","Santa Rita do Passa Quatro",,"ibge","brazil_sao paulo_santa rita passa quatro","Brazil","São Paulo","Santa Rita do Passa Quatro",,"ibge","brazil_sao paulo_santa rita passa quatro","Brazil","São Paulo","Santa Rita do Passa Quatro",,"ibge","check_local.2municip.","Actinostemon klotzschii","(Didr.) Pax","name_w_authors","Euphorbiaceae","Actinostemon klotzschii","(Didr.) Pax","species","replaced synonym","bfo-25459","Actinostemon klotzschii","(Didr.) Pax","Actinostemon klotzschii (Didr.) Pax","Actinostemon","Euphorbiaceae","unknown","Actinostemon klotzschii"
"Adenocalymma bracteatum","gbif",,"UEC","540","Adenocalymma bracteatum (Cham.) DC.","Plantae","Bignoniaceae","Adenocalymma","1978","10","16","Brazil","São Paulo",,"Parque estadual de Vassununga, Mata Cape","UNICAMP","PRESERVED_SPECIMEN","Assis, MA; Semir, J",,,,,,"https://specieslink.net/col/2",,"Martins, FR",,,"2023-03-09 11:29:29","(Cham.) A.DC.","9981",,,"Flor, Trepadeira de flores amarelas",,"Tracheophyta","Lamiales",,,"Magnoliopsida",,,,,,,,,,"GBIF","Santa Rita do Passa Quatro","1997-01-01","Adenocalymma bracteatum (Cham.) DC.",,"BR",,,"1978-10-16",,,,,,"ACCEPTED","SPECIES",,,,,,,,,,,,,,,"brazil","sao paulo","santa rita do passa quatro","parque estadual de vassununga, mata cape",,"locality","brazil_sao paulo_santa rita passa quatro","brazil_sao paulo_santa rita passa quatro",-21.68195672,-47.50780122,"county","54661","1088981597",,,"CC_BY_4_0","Universidade Estadual de Campinas - Instituto de Biologia","https://specieslink.net/guid/2/540","Herbário da Universidade Estadual de Campinas",,"Universidade Estadual de Campinas",,,,"https://specieslink.net/guid/2/540",,,,,,,,,,,"native",,,,"PRESENT",,,,,,,,,,,,,,,,,,,,,,,"289","289",,,,,,,,,"SOUTH_AMERICA",,,,,,,,,,,,,,,,,,,,,,,,,,,,,,,,,,,,,,,,,,,,,,,,"7298558",,,,,,,,,,,,,,,,,"Adenocalymma",,,"bracteatum",,,,,,,,"7741a517-ab3d-4b85-ae58-56322e44c8ce","BR","2025-01-05 15:38:14.442",,,,,,"CONTINENT_DERIVED_FROM_COUNTRY;INSTITUTION_MATCH_NONE",,FALSE,FALSE,"7298558","7298558","6","7707728","220","408","6655","10767005",,"7298558","Adenocalymma bracteatum","Adenocalymma bracteatum",,"EML","2025-01-05 15:38:14.442","2025-01-05 15:31:00.136",FALSE,,"null",FALSE,"LATIN_AMERICA","LATIN_AMERICA",,,,,,,,,"NE","https://images.cria.org.br/viewer/UEC139343",,,,,"WGS84",,,,,,,,,,,,,,,,,,,"brazil_sao paulo_santa rita passa quatro","Brazil","São Paulo","Santa Rita do Passa Quatro",,"ibge","brazil_sao paulo_santa rita passa quatro","Brazil","São Paulo","Santa Rita do Passa Quatro",,"ibge","brazil_sao paulo_santa rita passa quatro","Brazil","São Paulo","Santa Rita do Passa Quatro",,"ibge","check_local.2municip.","Adenocalymma bracteatum","(Cham.) DC.","name_w_authors","Bignoniaceae","Adenocalymma bracteatum","(Cham.) DC.","species","name accepted","bfo-112322",,,"Adenocalymma bracteatum (Cham.) DC.","Adenocalymma","Bignoniaceae","unknown","Adenocalymma bracteatum"
"Adenocalymma marginatum","gbif",,"HRCB","41786","Adenocalymma marginatum (Cham.) DC.","Plantae","Bignoniaceae","Adenocalymma","2003","1","19","Brasil","São Paulo",,"Parque Estadual de Vassununga Gleba Maravilha","UNESP-RC","PRESERVED_SPECIMEN","Assis, M.A.",,,,,,"https://specieslink.net/col/15",,"Tibiriçá, Y.J.A.","-47.566667","-21.683333","2024-12-18 09:14:15","(Cham.) DC.","60",,,"Liana com gavinha, flor amarela.Habitat: Floresta Estacional Semidecidual, borda da mata",,"Tracheophyta","Lamiales",,,"Magnoliopsida",,,,,,,,,,"GBIF","Santa Rita do Passa Quatro",,"Adenocalymma marginatum (Cham.) DC.",,"BR",,,"2003-01-19",,,,,,"ACCEPTED","SPECIES",,,,,,,,,,,,,,,"brazil","sao paulo","santa rita do passa quatro","parque estadual de vassununga gleba maravilha",,"locality","brazil_sao paulo_santa rita passa quatro","brazil_sao paulo_santa rita passa quatro",-21.68195672,-47.50780122,"county","157108","1090691580",,,"CC_BY_4_0","Universidade Estadual Paulista","https://specieslink.net/guid/15/41786","Herbário Rioclarense",,"Universidade Estadual Paulista - Campus de Rio Claro",,,,"https://specieslink.net/guid/15/41786",,,,,,,,,,,"native",,,,"PRESENT",,,,,,,,,,,,,,,,,,,,,,,"19","19",,,,,,,,,"SOUTH_AMERICA",,,,,,,,,,,,,,,,,,,,,,,,,,,,,,,,,,,,,,,,,,,,,,,,"7298393",,,,,,,,,,,,,,,,,"Adenocalymma",,,"marginatum",,,,,,,,"fdf55163-54d8-4bc7-862d-7e41068589e3","BR","2025-01-05 14:53:02.699",,,,,,"CONTINENT_DERIVED_FROM_COORDINATES;INSTITUTION_MATCH_NONE",,TRUE,FALSE,"7298393","7298393","6","7707728","220","408","6655","10767005",,"7298393","Adenocalymma marginatum","Adenocalymma marginatum",,"EML","2025-01-05 14:53:02.699","2025-01-05 14:52:23.551",FALSE,,"null",FALSE,"LATIN_AMERICA","LATIN_AMERICA","BRA","Brazil","BRA.25_1","São Paulo","BRA.25.531_2","Santa Rita do Passa Quatro",,,"NE",,,,,,"WGS84",,,,,,,,,,,,,,,,,,,"brazil_sao paulo_santa rita passa quatro","Brazil","São Paulo","Santa Rita do Passa Quatro",,"ibge","brazil_sao paulo_santa rita passa quatro","Brazil","São Paulo","Santa Rita do Passa Quatro",,"ibge","brazil_sao paulo_santa rita passa quatro","Brazil","São Paulo","Santa Rita do Passa Quatro",,"ibge","check_local.2municip.","Adenocalymma marginatum","(Cham.) DC.","name_w_authors","Bignoniaceae","Adenocalymma marginatum","(Cham.) DC.","species","name accepted","bfo-112390",,,"Adenocalymma marginatum (Cham.) DC.","Adenocalymma","Bignoniaceae","unknown","Adenocalymma marginatum"
"Adenocalymma paulistarum","gbif",,"PMSP","PMSP011185","Adenocalymma paulistarum Bureau ex K.Schum.","Plantae","Bignoniaceae","Adenocalymma",,,,"Brasil","São Paulo",,"Parque Estadual de Vassununga. Gleba Maravilha (borda da mata), floresta estacional semidecidual. Coor. S 21°41' a 21°44' W 47°34' a 47°39'.","PMSP","PRESERVED_SPECIMEN","M.A.Assis",,,,,,,,"Y.J.A.Tibiriçá;Y.J.A. Tibiriçá,L.F.M. Coelho,L.F.M.Coelho",,,,"Bureau & K.Schum.",,,,"Liana com gavinha; flores amarelas.",,"Tracheophyta","Lamiales",,,"Magnoliopsida",,,,,,,,,,"GBIF","Santa Rita do Passa Quatro",,"Adenocalymma paulistarum Bureau ex K.Schum.","Herbário Virtual REFLORA Disponível em: http://herbariovirtualreflora.jbrj.gov.br/reflora/herbarioVirtual/ConsultaPublicoHVUC/ConsultaPublicoHVUC.do?idTestemunho=4660807","BR",,,,,,,,,"ACCEPTED","SPECIES",,,"1899-12-30",,,,,,,,,,,,"brazil","sao paulo","santa rita do passa quatro","parque estadual de vassununga",,"locality","brazil_sao paulo_santa rita passa quatro_parque estadual vassununga","brazil_sao paulo_santa rita passa quatro_pe vassununga",-21.639694,-47.613521,"locality","395893","2302344825",,,"CC_BY_4_0","Instituto de Pesquisas Jardim Botanico do Rio de Janeiro",,"PMSP",,,,,,"4660807",,,,,,,,,,,,,,,"PRESENT",,,,,,,,,,,,,,,,,,,,,,,,,,,,,,,,,"SOUTH_AMERICA",,,,,,,,,,,,,,,,,,,,,,,,,,,,,,,,,,,,,,,,,,,,,,,,"4091554",,,,,,,,,,,,,,,,,"Adenocalymma",,,"paulistarum",,,,,,,,"4012b76b-7f81-4bd9-b887-6fd3e6a5588c","BR","2025-01-01 15:28:18.788",,,,,,"IDENTIFIED_DATE_INVALID;CONTINENT_DERIVED_FROM_COUNTRY;INSTITUTION_MATCH_FUZZY;COLLECTION_MATCH_FUZZY","StillImage;StillImage",FALSE,FALSE,"4091554","4091554","6","7707728","220","408","6655","10767005",,"4091554","Adenocalymma paulistarum","Adenocalymma paulistarum Bureau & K.Schum.",,"EML","2025-01-01 15:28:18.788","2025-01-01 12:06:25.946",FALSE,,"null",FALSE,"LATIN_AMERICA","LATIN_AMERICA",,,,,,,,,"NE","jbrj-public.s3.amazonaws.com/fsi/server?type=image&source=DZI/pmsp/pmsp/0/1/11/85/pmsp00011185_1.dzi|jbrj-public.s3.amazonaws.com/fsi/server?type=image&source=DZI/pmsp/pmsp/0/1/11/85/pmsp00011185.dzi",,,,,,,,,,,,,,,,,,,,,,,,"brazil_sao paulo_santa rita passa quatro","Brazil","São Paulo","Santa Rita do Passa Quatro",,"ibge","brazil_sao paulo_santa rita passa quatro","Brazil","São Paulo","Santa Rita do Passa Quatro",,"ibge","brazil_sao paulo_santa rita passa quatro","Brazil","São Paulo","Santa Rita do Passa Quatro",,"ibge","ok_same_resolution","Adenocalymma paulistarum","Bureau & K.Schum.","name_w_authors","Bignoniaceae","Adenocalymma paulistarum","Bureau & K.Schum.","species","author misspelled","bfo-112407",,,"Adenocalymma paulistarum Bureau & K.Schum.","Adenocalymma","Bignoniaceae","unknown","Adenocalymma paulistarum"
"Adenocalymma peregrinum","gbif",,"SPF","180622","Adenocalymma peregrinum (Miers) L.G.Lohmann","Plantae","Bignoniaceae","Adenocalymma","2000","10","25","Brasil","São Paulo",,"Parque Estadual Vassununga, Gleba Cerrado Pé-de-gigante.","USP-IB","PRESERVED_SPECIMEN","Lohmann, LG",,,,,,"https://specieslink.net/col/7",,"Mechi, MR",,,"2023-12-20 15:56:07","(Miers) L.G.Lohmann","28",,,"Cipó; flores tubuliformes amarelo-alaranjadas; sem cheiro; sem látex.",,"Tracheophyta","Lamiales",,,"Magnoliopsida",,,,,,,,,,"GBIF","Santa Rita do Passa Quatro","2006-01-01","Adenocalymma peregrinum (Miers) L.G.Lohmann",,"BR",,,"2000-10-25",,,,,,"ACCEPTED","SPECIES",,,,,,,,,,,,,,,"brazil","sao paulo","santa rita do passa quatro","parque estadual vassununga",,"locality","brazil_sao paulo_santa rita passa quatro_parque estadual vassununga","brazil_sao paulo_santa rita passa quatro_pe vassununga",-21.639694,-47.613521,"locality","506998","2521063626",,,"CC_BY_4_0","Universidade de São Paulo","https://specieslink.net/guid/7/180622","Herbário da Universidade de São Paulo",,"Instituto de Biociências da Universidade de São Paulo",,,,"https://specieslink.net/guid/7/180622",,,,,,,,,,,"native",,,,"PRESENT",,,,,,,,,,,,,,,,,,,,,,,"299","299",,,,,,,,,"SOUTH_AMERICA",,,,,,,,,,,,,,,,,,,,,,,,,,,,,,,,,,,,,,,,,,,,,,,,"7961545",,,,,,,,,,,,,,,,,"Adenocalymma",,,"peregrinum",,,,,,,,"1bb3cae3-b91f-4109-8a2d-a1f05f2d6fd3","BR","2025-01-05 15:34:26.471",,,,,,"CONTINENT_DERIVED_FROM_COUNTRY;INSTITUTION_MATCH_NONE",,FALSE,FALSE,"7961545","7961545","6","7707728","220","408","6655","10767005",,"7961545","Adenocalymma peregrinum","Adenocalymma peregrinum",,"EML","2025-01-05 15:34:26.471","2025-01-05 15:24:14.62",FALSE,,"null",FALSE,"LATIN_AMERICA","LATIN_AMERICA",,,,,,,,,"NE","https://images.cria.org.br/viewer/SPF00180622",,,,,"WGS84",,,,,,,,,,,,,,,,,,,"brazil_sao paulo_santa rita passa quatro","Brazil","São Paulo","Santa Rita do Passa Quatro",,"ibge","brazil_sao paulo_santa rita passa quatro","Brazil","São Paulo","Santa Rita do Passa Quatro",,"ibge","brazil_sao paulo_santa rita passa quatro","Brazil","São Paulo","Santa Rita do Passa Quatro",,"ibge","ok_same_resolution","Adenocalymma peregrinum","(Miers) L.G.Lohmann","name_w_authors","Bignoniaceae","Adenocalymma peregrinum","(Miers) L.G.Lohmann","species","name accepted","bfo-112409",,,"Adenocalymma peregrinum (Miers) L.G.Lohmann","Adenocalymma","Bignoniaceae","unknown","Adenocalymma peregrinum"
