"UC","Grupos","Família","Gênero","Espécie","Autor","Táxon_completo","Barcode","BD_Origem","Herbário","Coletor","Número_da_Coleta","Origem_FFBr","ConfiançaID","Localidade","Já listada"
"ESTAÇÃO ECOLÓGICA JURÉIA-ITATINS","Angiosperms","Orchidaceae","Phymatidium","falcifolium","Lindl.","ORCHIDACEAE Phymatidium falcifolium Lindl.","272229","GBIF",,,"1054","Native","Latão","Estação Ecológica Juréia-Itatins, Mata de planície ás margens do Rio Verde, próximo ao alojamento da S.M.A.","Não"
"ESTAÇÃO ECOLÓGICA JURÉIA-ITATINS","Angiosperms","Phytolaccaceae","Phytolacca","thyrsiflora","Fenzl. ex J.A.Schmidt","PHYTOLACCACEAE Phytolacca thyrsiflora Fenzl. ex J.A.Schmidt","329636","GBIF",,,"327","Native","Latão","Estação Ecológica Juréia-Itatins","Não"
"ESTAÇÃO ECOLÓGICA JURÉIA-ITATINS","Angiosperms","Picramniaceae","Picramnia","ramiflora","Planch.","PICRAMNIACEAE Picramnia ramiflora Planch.","251462","GBIF",,,"921","Native","Latão","Estação Ecológica Juréia-Itatins, Proximidades do alojamento, trilha para o caminho do Imperador","Não"
"ESTAÇÃO ECOLÓGICA JURÉIA-ITATINS","Angiosperms","Urticaceae","Pilea","pubescens","Liebm.","URTICACEAE Pilea pubescens Liebm.","238545","GBIF",,,"578","Native","Latão","Estação Ecológica Juréia-Itatins","Não"
"ESTAÇÃO ECOLÓGICA JURÉIA-ITATINS","Angiosperms","Rutaceae","Pilocarpus","pauciflorus","A.St.-Hil.","RUTACEAE Pilocarpus pauciflorus A.St.-Hil.","382383","GBIF",,,"116","Native","Latão","Iguape, Estaçao Ecológica Juréia-Itatins, Serra da Juréia, mata ao redor da cachoeira do Salto.","Não"
"ESTAÇÃO ECOLÓGICA JURÉIA-ITATINS","Angiosperms","Rutaceae","Pilocarpus","pauciflorus","A.St.-Hil.","RUTACEAE Pilocarpus pauciflorus subsp. pauciflorus A.St.-Hil.","46655","GBIF",,,"s.n.","Native","Latão","Estação Ecológica Juréia-Itatins","Não"
"ESTAÇÃO ECOLÓGICA JURÉIA-ITATINS","Angiosperms","Piperaceae","Piper","cernuum","Vell.","PIPERACEAE Piper cernuum Vell.","277203","GBIF",,,"1518","Native","Latão","Estação Ecológica Juréia-Itatins, Trilha através do Morro do Arpoador","Não"
"ESTAÇÃO ECOLÓGICA JURÉIA-ITATINS","Angiosperms","Piperaceae","Piper","cernuum","Vell.","PIPERACEAE Piper cernuum var. cernuum Vell.","272191","GBIF",,,"613","Native","Latão","Estação Ecológica Juréia-Itatins, Trilha da Figueira, mata de encosta","Não"
"ESTAÇÃO ECOLÓGICA JURÉIA-ITATINS","Angiosperms","Piperaceae","Piper","chimonanthifolium","Kunth","PIPERACEAE Piper chimonanthifolium Kunth","249243","GBIF",,,"2","Native","Latão","Estação Ecológica Juréia-Itatins, Serra da Juréia, trilha do Imperador em direção á Praia da Juréia","Não"
"ESTAÇÃO ECOLÓGICA JURÉIA-ITATINS","Angiosperms","Piperaceae","Piper","fluminense","Raddi","PIPERACEAE Piper fluminense Raddi","81061","GBIF",,,"53","Native","Latão","Estacao Ecológica Juréia-Itatins, Serra da Juréia, trilha do Imperador, em direcao a Praia da Juréia","Não"
"ESTAÇÃO ECOLÓGICA JURÉIA-ITATINS","Angiosperms","Piperaceae","Piper","mosenii","C.DC.","PIPERACEAE Piper mosenii C.DC.","277206","GBIF",,,"1521","Native","Latão","Estação Ecológica Juréia-Itatins, Trilha através do Morro do Arpoador, mata pluvial tropical de encosta","Não"
"ESTAÇÃO ECOLÓGICA JURÉIA-ITATINS","Angiosperms","Piperaceae","Piper","rivinoides","Kunth","PIPERACEAE Piper rivinoides Kunth","RB00302184",,"RB","Anunciacao, E.A.","346","Native","Latão","Estação Ecológica Juréia-Itatins, Serra da Juréia, Alto do Maciço da Juréia. Estação Ecológica Juréia","Não"
"ESTAÇÃO ECOLÓGICA JURÉIA-ITATINS","Angiosperms","Piperaceae","Piper","umbellatum","L.","PIPERACEAE Piper umbellatum L.","329647","GBIF",,,"150","Native","Latão","Estação Ecológica Juréia-Itatins, Cachoeira do Guilherme, em frente à casa do Sr. Sátiro","Não"
"ESTAÇÃO ECOLÓGICA JURÉIA-ITATINS","Angiosperms","Fabaceae","Piptadenia","gonoacantha","(Mart.) J.F.Macbr.","FABACEAE Piptadenia gonoacantha (Mart.) J.F.Macbr.","205566","GBIF",,,"922","Native","Latão","Estação Ecológica Juréia-Itatins, proximidades do alojamento, trilha para o caminho do Imperador.","Não"
"ESTAÇÃO ECOLÓGICA JURÉIA-ITATINS","Angiosperms","Asteraceae","Piptocarpha","leprosa","(Less.) Baker","ASTERACEAE Piptocarpha leprosa (Less.) Baker","311212","GBIF",,,"59","Native","Latão","Estação Ecológica Juréia-Itatins, Restinga em direção ao Imperador","Não"
"ESTAÇÃO ECOLÓGICA JURÉIA-ITATINS","Angiosperms","Asteraceae","Piptocarpha","notata","(Less.) Baker","ASTERACEAE Piptocarpha notata (Less.) Baker","108636","GBIF",,,"59","Native","Latão","Estação Ecológica Juréia-Itatins.","Não"
"ESTAÇÃO ECOLÓGICA JURÉIA-ITATINS","Angiosperms","Asteraceae","Piptocarpha","oblonga","(Gardner) Baker","ASTERACEAE Piptocarpha oblonga (Gardner) Baker","US 3264791","GBIF",,,"74","Native","Latão","Brasil, São Paulo, Iguape, Estação Ecológica Juréia-Itatins, margem do Rio Verde.","Não"
"ESTAÇÃO ECOLÓGICA JURÉIA-ITATINS","Angiosperms","Asteraceae","Piptocarpha","oblonga","(Sch.Bip.) G.Lom.Sm.","ASTERACEAE Piptocarpha oblonga subsp. lepidota (Sch.Bip.) G.Lom.Sm.","249637","GBIF",,,"54","Native","Latão","Estação Ecológica Juréia-Itatins, Serra da Juréia, margens do Rio Verde","Não"
"ESTAÇÃO ECOLÓGICA JURÉIA-ITATINS","Angiosperms","Asteraceae","Piptocarpha","reitziana","Cabrera","ASTERACEAE Piptocarpha reitziana Cabrera","108642","GBIF",,,"74","Native","Latão","Estação ecológica Juréia-Itatins, margens do Rio Verde.","Não"
"ESTAÇÃO ECOLÓGICA JURÉIA-ITATINS","Angiosperms","Bromeliaceae","Pitcairnia","flammea","Lindl.","BROMELIACEAE Pitcairnia flammea Lindl.","250036","GBIF",,,"946","Native","Latão","Estação Ecológica Juréia-Itatins, Serra da Juréia, ás margens do Rio Verde em direção à Foz, mata","Não"
"ESTAÇÃO ECOLÓGICA JURÉIA-ITATINS","Angiosperms","Bromeliaceae","Pitcairnia","flammea","L.B.Sm.","BROMELIACEAE Pitcairnia flammea var. glabrior L.B.Sm.","218938","GBIF",,,"1932","Native","Latão","Estação Ecológica Juréia-Itatins, Morro de Juréia, altitude +- 3,00 m.s.m., bordo de uma cachoeira, perto de um paredão rochoso","Não"
"ESTAÇÃO ECOLÓGICA JURÉIA-ITATINS","Angiosperms","Fabaceae","Pityrocarpa","leptostachya","(Benth.) L.P.Queiroz & P.G.Ribeiro","FABACEAE Pityrocarpa leptostachya (Benth.) L.P.Queiroz & P.G.Ribeiro","205567","GBIF",,,"138",,"Latão","Estação Ecológica Juréia-Itatins, Serra da Juréia, mata próximo ao alojamento.","Não"
"ESTAÇÃO ECOLÓGICA JURÉIA-ITATINS","Fungi","Plantaginaceae",,,,"PLANTAGINACEAE Plantae sp.","244683","GBIF",,,"279",,"Latão","Estação Ecológica Juréia-Itatins","Não"
"ESTAÇÃO ECOLÓGICA JURÉIA-ITATINS","Angiosperms","Plantaginaceae","Plantago","catharinea","Decne.","PLANTAGINACEAE Plantago catharinea Decne.","248059","GBIF",,,"1497","Native","Latão","Estação Ecológica Juréia-Itatins, Barra do Una","Não"
"ESTAÇÃO ECOLÓGICA JURÉIA-ITATINS","Angiosperms","Lamiaceae","Plectranthus","barbatus","Andr.","LAMIACEAE Plectranthus barbatus Andr.","329460","GBIF",,,"257",,"Latão","Estação Ecológica Juréia-Itatins","Não"
"ESTAÇÃO ECOLÓGICA JURÉIA-ITATINS","Angiosperms","Melastomataceae","Pleiochiton","blepharodes","(DC.) Reginato et al.","MELASTOMATACEAE Pleiochiton blepharodes (DC.) Reginato et al.","247552","GBIF",,,"768","Native","Latão","Estação Ecológica Juréia-Itatins, Serra da Juréia, trilha para o Pocinho","Não"
"ESTAÇÃO ECOLÓGICA JURÉIA-ITATINS","Ferns and Lycophytes","Polypodiaceae","Pleopeltis","pleopeltifolia","(Raddi) Alston","POLYPODIACEAE Pleopeltis pleopeltifolia (Raddi) Alston","234053","GBIF",,,"2508","Native","Latão","Estação Ecológica Juréia-Itatins","Não"
"ESTAÇÃO ECOLÓGICA JURÉIA-ITATINS","Angiosperms","Melastomataceae","Pleroma","andersregnellii","P.J.F.Guim. & Michelang.","MELASTOMATACEAE Pleroma andersregnellii P.J.F.Guim. & Michelang.","249244","GBIF",,,"1","Native","Latão","Estação Ecológica Juréia-Itatins, Serra da Juréia, trilha do Imperador em direção à Praia da Juréia","Não"
"ESTAÇÃO ECOLÓGICA JURÉIA-ITATINS","Angiosperms","Melastomataceae","Pleroma","clavatum","(Pers.) P.J.F.Guim. & Michelang.","MELASTOMATACEAE Pleroma clavatum (Pers.) P.J.F.Guim. & Michelang.","329585","GBIF",,,"527","Native","Latão","Estação Ecológica Juréia-Itatins, Estrada da praia do Una para o Grajaúna","Não"
"ESTAÇÃO ECOLÓGICA JURÉIA-ITATINS","Angiosperms","Melastomataceae","Pleroma","floribundum","(Cogn.) P.J.F.Guim.&Michelang.","MELASTOMATACEAE Pleroma floribundum (Cogn.) P.J.F.Guim.&Michelang.","172272","GBIF",,,"105","Native","Latão","Estação ecológica Juréia-Itatins, Serra da Jureia, mata ao redor da cachoeira do Salto.","Não"
"ESTAÇÃO ECOLÓGICA JURÉIA-ITATINS","Angiosperms","Melastomataceae","Pleroma","fothergillii","(Schrank et Mart. ex DC.) Triana","MELASTOMATACEAE Pleroma fothergillii (Schrank et Mart. ex DC.) Triana","245319","GBIF",,,"1359","Native","Latão","Estação Ecológica Juréia-Itatins, Proximidades da Serra da Juréia, caminho do Imperador","Não"
"ESTAÇÃO ECOLÓGICA JURÉIA-ITATINS","Angiosperms","Melastomataceae","Pleroma","trichopodum","DC.","MELASTOMATACEAE Pleroma trichopodum DC.","247700","GBIF",,,"815","Native","Latão","Estação Ecológica Juréia-Itatins, Serra da Juréia, campo próximo ao aloajamento","Não"
"ESTAÇÃO ECOLÓGICA JURÉIA-ITATINS","Angiosperms","Cyperaceae","Pleurostachys","millegrana","(Nees) Steud.","CYPERACEAE Pleurostachys millegrana (Nees) Steud.","218943","GBIF",,,"1963",,"Latão","Estação Ecológica Juréia-Itatins, Trilha para cachoeira grande","Não"
"ESTAÇÃO ECOLÓGICA JURÉIA-ITATINS","Angiosperms","Orchidaceae","Pleurothallis",,"R.Br.","ORCHIDACEAE Pleurothallis R.Br.","24620","GBIF",,,"4523",,"Latão","Estação Ecológica Juréia-Itatins.","Não"
"ESTAÇÃO ECOLÓGICA JURÉIA-ITATINS","Angiosperms","Myrtaceae","Plinia","edulis","(Vell.) Sobral","MYRTACEAE Plinia edulis (Vell.) Sobral","309910","GBIF",,,"1284","Native","Latão","Estação Ecológica Juréia-Itatins, Margens do rio Verde, próximo ao alojamento","Não"
"ESTAÇÃO ECOLÓGICA JURÉIA-ITATINS","Angiosperms","Myrtaceae","Plinia","rivularis","(Cambess.) Rotman","MYRTACEAE Plinia rivularis (Cambess.) Rotman","272378","GBIF",,,"7230","Native","Latão","Estação Ecológica Juréia-Itatins, região de mata atlãntica.","Não"
"ESTAÇÃO ECOLÓGICA JURÉIA-ITATINS","Angiosperms","Asteraceae","Pluchea","sagittalis","(Lam.) Cabrera","ASTERACEAE Pluchea sagittalis (Lam.) Cabrera","15738","GBIF",,,"7250","Native","Latão","Estação Ecológica Juréia-Itatins","Não"
"ESTAÇÃO ECOLÓGICA JURÉIA-ITATINS","Angiosperms","Apocynaceae","Plumeria","rubra","L.","APOCYNACEAE Plumeria rubra L.","309065","GBIF",,,"711","Cultivated","Latão","Estação Ecológica Juréia-Itatins, Despraiado, no terreno da Diva","Não"
"ESTAÇÃO ECOLÓGICA JURÉIA-ITATINS","Ferns and Lycophytes","Dryopteridaceae","Polybotrya","cylindrica","Kaulf.","DRYOPTERIDACEAE Polybotrya cylindrica Kaulf.","02425766","GBIF",,,"1492","Native","Latão","Estação Ecológica Juréia-Itatins, Serra da Juréia, trilha da Figueira","Não"
"ESTAÇÃO ECOLÓGICA JURÉIA-ITATINS","Ferns and Lycophytes","Dryopteridaceae","Polybotrya","semipinnata","Fée","DRYOPTERIDACEAE Polybotrya semipinnata Fée","NY02425705","GBIF",,,"342","Native","Latão","Estação Ecológica Jureia-Itatins, Serra da Jureia, trilha da Figueira","Não"
"ESTAÇÃO ECOLÓGICA JURÉIA-ITATINS","Angiosperms","Polygalaceae",,,"Hoffmanns. & Link","POLYGALACEAE Polygalaceae Hoffmanns. & Link","340616","GBIF",,,"1872",,"Latão","Estação Ecológica Juréia-Itatins, Trilha do Imperador, mata de encosta","Não"
"ESTAÇÃO ECOLÓGICA JURÉIA-ITATINS","Angiosperms","Polygonaceae","Polygonum","punctatum","Elliott","POLYGONACEAE Polygonum punctatum Elliott","329644","GBIF",,,"167","Native","Latão","Estação Ecológica Juréia-Itatins","Não"
"ESTAÇÃO ECOLÓGICA JURÉIA-ITATINS","Ferns and Lycophytes","Polypodiaceae",,,"J.Presl","POLYPODIACEAE Polypodiaceae J.Presl","899","GBIF",,,"1744",,"Latão","Estação Ecológica Juréia-Itatins, Praia do Arpoador, local para camping sobre afloramento rochoso","Não"
"ESTAÇÃO ECOLÓGICA JURÉIA-ITATINS","Ferns and Lycophytes","Polypodiaceae","Polypodium",,"L.","POLYPODIACEAE Polypodium L.","950","GBIF",,,"1771",,"Latão","Guarauzinho, Riacho Água fria, Estação ecológica Juréia-Itatins.","Não"
"ESTAÇÃO ECOLÓGICA JURÉIA-ITATINS","Angiosperms","Orchidaceae","Polystachya","concreta","(Jacq.) Garay & Sweet","ORCHIDACEAE Polystachya concreta (Jacq.) Garay & Sweet","247699","GBIF",,,"817","Native","Latão","Estação Ecológica Juréia-Itatins, Serra da Juréia, campo próximo ao alojamento","Não"
"ESTAÇÃO ECOLÓGICA JURÉIA-ITATINS","Ferns and Lycophytes","Pteridaceae","Polytaenium","cajenense","(Desv.) Benedict","PTERIDACEAE Polytaenium cajenense (Desv.) Benedict","168817","GBIF",,,"342","Native","Latão","Estação Ecológica Juréia-Itatins, Trilha na margem do rio verde.","Não"
"ESTAÇÃO ECOLÓGICA JURÉIA-ITATINS","Angiosperms","Pontederiaceae","Pontederia","cordata","L.","PONTEDERIACEAE Pontederia cordata L.","329639","GBIF",,,"225","Native","Latão","Estação Ecológica Juréia-Itatins, Rio Comprido, próximo ao Sítio Marroto de Fora","Não"
"ESTAÇÃO ECOLÓGICA JURÉIA-ITATINS","Angiosperms","Annonaceae","Porcelia","macrocarpa","(Warm.) R.E.Fr.","ANNONACEAE Porcelia macrocarpa (Warm.) R.E.Fr.","14483","GBIF",,,"359","Native","Latão","Estação Ecológica Juréia-Itatins, Trilha do Imperador, Maciço da Juréia","Não"
"ESTAÇÃO ECOLÓGICA JURÉIA-ITATINS","Angiosperms","Portulacaceae","Portulaca","mucronata","Link","PORTULACACEAE Portulaca mucronata Link","269915","GBIF",,,"1142","Native","Latão","Estação Ecológica Juréia-Itatins, Serra da Juréia, nas Dunas da praia do Rio Verde","Não"
"ESTAÇÃO ECOLÓGICA JURÉIA-ITATINS","Angiosperms","Portulacaceae","Portulaca","oleracea","L.","PORTULACACEAE Portulaca oleracea L.","329641","GBIF",,,"286","Naturalized","Latão","Estação Ecológica Juréia-Itatins","Não"
"ESTAÇÃO ECOLÓGICA JURÉIA-ITATINS","Angiosperms","Rubiaceae","Posoqueria","acutifolia","Mart.","RUBIACEAE Posoqueria acutifolia Mart.","258549","GBIF",,,"188","Native","Latão","Estação Ecológica Juréia-Itatins, Serra da Juréia, pocinho do Rio Verde","Não"
"ESTAÇÃO ECOLÓGICA JURÉIA-ITATINS","Angiosperms","Rubiaceae","Posoqueria","latifolia","(Rudge) Schult.","RUBIACEAE Posoqueria latifolia (Rudge) Schult.","256463","GBIF",,,"7336","Native","Latão","Estação Ecológica Juréia-Itatins, Junto ao Rio Guilherme","Não"
"ESTAÇÃO ECOLÓGICA JURÉIA-ITATINS","Angiosperms","Urticaceae","Pourouma","guianensis","Aubl.","URTICACEAE Pourouma guianensis Aubl.","247671","GBIF",,,"805","Native","Latão","Estação Ecológica Juréia-Itatins, Trilha para o pocinho, mata à margem do rio","Não"
"ESTAÇÃO ECOLÓGICA JURÉIA-ITATINS","Angiosperms","Sapotaceae","Pouteria","beaurepairei","(Glaz. & Raunk.) Baehni","SAPOTACEAE Pouteria beaurepairei (Glaz. & Raunk.) Baehni","247799","GBIF",,,"149","Native","Latão","Estação Ecológica Juréia-Itatins, Serra da Juréia, trilha do alojamento, restinga","Não"
"ESTAÇÃO ECOLÓGICA JURÉIA-ITATINS","Angiosperms","Sapotaceae","Pouteria","caimito","(Ruiz & Pav.) Radlk.","SAPOTACEAE Pouteria caimito (Ruiz & Pav.) Radlk.","245441","GBIF",,,"676","Native","Latão","Estação Ecológica Juréia-Itatins, Trilha para o alto do morro próximo ao alojamento","Não"
"ESTAÇÃO ECOLÓGICA JURÉIA-ITATINS","Angiosperms","Sapotaceae","Pouteria","psammophila","(Mart.) Radlk.","SAPOTACEAE Pouteria psammophila (Mart.) Radlk.","250029","GBIF",,,"939","Native","Latão","Estação Ecológica Juréia-Itatins, Serra da Juréia, trilha do Imperador em direção à Praia de Juréia, mata","Não"
"ESTAÇÃO ECOLÓGICA JURÉIA-ITATINS","Angiosperms","Sapotaceae","Pouteria","venosa","T.D.Penn.","SAPOTACEAE Pouteria venosa subsp. amazonica T.D.Penn.","263383","GBIF",,,"1251","Native","Latão","Estação Ecológica Juréia-Itatins, Trilha do alojamento em direção ao caminho do Imperador","Não"
"ESTAÇÃO ECOLÓGICA JURÉIA-ITATINS","Angiosperms","Sapotaceae","Pradosia","lactescens","(Vell.) Radlk.","SAPOTACEAE Pradosia lactescens (Vell.) Radlk.","249096","GBIF",,,"65","Native","Latão","Estação Ecológica Juréia-Itatins, Caminho do Imperador","Não"
"ESTAÇÃO ECOLÓGICA JURÉIA-ITATINS","Angiosperms","Apocynaceae","Prestonia","dusenii","(Malme) Woodson","APOCYNACEAE Prestonia dusenii (Malme) Woodson","15695","GBIF",,,"7276","Native","Latão","Estação Ecológica Juréia-Itatins Interior da mata","Não"
"ESTAÇÃO ECOLÓGICA JURÉIA-ITATINS","Angiosperms","Primulaceae",,,"Batsch ex Borkh.","PRIMULACEAE Primulaceae Batsch ex Borkh.","272088","GBIF",,,"1387",,"Latão","Estação Ecológica Juréia-Itatins, Alto da Serra dos Itatins, mata alta bem preservada, com dossel irregular","Não"
"ESTAÇÃO ECOLÓGICA JURÉIA-ITATINS","Angiosperms","Orchidaceae","Prosthechea","aemula","(Lindl.) W.E.Higgins","ORCHIDACEAE Prosthechea aemula (Lindl.) W.E.Higgins","247664","GBIF",,,"810","Native","Latão","Estação Ecológica Juréia-Itatins, Trilha para o Pocinho, mata á margem do rio","Não"
"ESTAÇÃO ECOLÓGICA JURÉIA-ITATINS","Angiosperms","Orchidaceae","Prosthechea","glumacea","(Lindl.) W.E.Higgins","ORCHIDACEAE Prosthechea glumacea (Lindl.) W.E.Higgins","248384","GBIF",,,"1576","Native","Latão","Estação Ecológica Juréia-Itatins, Alto do morro","Não"
"ESTAÇÃO ECOLÓGICA JURÉIA-ITATINS","Angiosperms","Orchidaceae","Prosthechea","pachysepala","(Klotzsch) Chiron & V.P.Castro","ORCHIDACEAE Prosthechea pachysepala (Klotzsch) Chiron & V.P.Castro","251829","GBIF",,,"1017","Native","Latão","Estação Ecológica Juréia-Itatins, Alto do maciço da Juréia, mata baixa de topo do morro","Não"
"ESTAÇÃO ECOLÓGICA JURÉIA-ITATINS","Angiosperms","Orchidaceae","Prosthechea","vespa","(Vell.) W.E.Higgins","ORCHIDACEAE Prosthechea vespa (Vell.) W.E.Higgins","252889","GBIF",,,"1548","Native","Latão","Estação Ecológica Juréia-Itatins. Mata beira de alto de morro.","Não"
"ESTAÇÃO ECOLÓGICA JURÉIA-ITATINS","Angiosperms","Proteaceae",,,"Juss.","PROTEACEAE Proteaceae Juss.","272231","GBIF",,,"1304",,"Latão","Estação Ecológica Juréia-Itatins, Trilha do alojamento em direção a praia do Rio Verde","Não"
"ESTAÇÃO ECOLÓGICA JURÉIA-ITATINS","Angiosperms","Burseraceae","Protium","kleinii","Cuatrec.","BURSERACEAE Protium kleinii Cuatrec.","123901","GBIF",,,"52","Native","Latão","Estação Ecológica Juréia-Itatins, Serra da Juréia, trilha para a Figueira Grande. Mata de encosta.","Não"
"ESTAÇÃO ECOLÓGICA JURÉIA-ITATINS","Angiosperms","Burseraceae","Protium","widgrenii","Engl.","BURSERACEAE Protium widgrenii Engl.","309329","GBIF",,,"1122","Native","Latão","Estação Ecológica Juréia-Itatins, Margens do rio Verde, próximo ao alojamento","Não"
"ESTAÇÃO ECOLÓGICA JURÉIA-ITATINS","Angiosperms","Rosaceae","Prunus","myrtifolia","(L.) Urb.","ROSACEAE Prunus myrtifolia (L.) Urb.","268551","GBIF",,,"485","Native","Latão","Estação Ecológica Juréia-Itatins, Serra da Juréia, praia do Una, área de restinga entre os rios Verde e Una do prelado, mata pluvial de planície","Não"
"ESTAÇÃO ECOLÓGICA JURÉIA-ITATINS","Angiosperms","Poaceae","Pseudechinolaena","polystachya","(Kunth) Stapf","POACEAE Pseudechinolaena polystachya (Kunth) Stapf","258588","GBIF",,,"163","Native","Latão","Estação Ecológica Juréia-Itatins, Serra da Juréia, caminho do Imperador em direção a Praia da Juréia","Não"
"ESTAÇÃO ECOLÓGICA JURÉIA-ITATINS","Angiosperms","Malvaceae","Pseudobombax","majus","(A.Robyns) Carv.-Sobr.","MALVACEAE Pseudobombax majus (A.Robyns) Carv.-Sobr.","249820","GBIF",,,"216","Native","Latão","Estação Ecológica Juréia-Itatins, Serra da Juréia, trilha do Imperador, próximo da casa do vigia","Não"
"ESTAÇÃO ECOLÓGICA JURÉIA-ITATINS","Ferns and Lycophytes","Lycopodiaceae","Pseudolycopodiella","meridionalis","(Underw. & Loyd) Holub","LYCOPODIACEAE Pseudolycopodiella meridionalis (Underw. & Loyd) Holub","234051","GBIF",,,"311","Native","Latão","Estação Ecológica Juréia-Itatins","Não"
"ESTAÇÃO ECOLÓGICA JURÉIA-ITATINS","Angiosperms","Fabaceae","Pseudopiptadenia","leptostachya","(Benth.) Rauschert","FABACEAE Pseudopiptadenia leptostachya (Benth.) Rauschert","NY00459508","GBIF",,,"138","Native","Latão","Estaçao Ecologica Jureia-Itatins, Serra da Jureia","Não"
"ESTAÇÃO ECOLÓGICA JURÉIA-ITATINS","Angiosperms","Myrtaceae","Psidium","guajava","L.","MYRTACEAE Psidium guajava L.","329431","GBIF",,,"606","Naturalized","Latão","Estação Ecológica Juréia-Itatins, Próximo à Cachoeira do Guilherme, no quintal de Dona Maricota","Não"
"ESTAÇÃO ECOLÓGICA JURÉIA-ITATINS","Angiosperms","Loranthaceae","Psittacanthus","dichroos","(Mart.) Mart.","LORANTHACEAE Psittacanthus dichroos (Mart.) Mart.","252439","GBIF",,,"122","Native","Latão","Estação Ecológica Juréia-Itatins, Serra da Juréia, trilha para o caminho do Imperador","Não"
"ESTAÇÃO ECOLÓGICA JURÉIA-ITATINS","Angiosperms","Rubiaceae","Psychotria","brachyceras","Müll.Arg.","RUBIACEAE Psychotria brachyceras Müll.Arg.","247646","GBIF",,,"755","Native","Latão","Estação Ecológica Juréia-Itatins, Estrada da margem do Rio Una para o Rio Verde","Não"
"ESTAÇÃO ECOLÓGICA JURÉIA-ITATINS","Angiosperms","Rubiaceae","Psychotria","carthagenensis","Jacq.","RUBIACEAE Psychotria carthagenensis Jacq.","247884","GBIF",,,"178","Native","Latão","Estação Ecológica Juréia-Itatins, Serra da Juréia, trilha do Imperador, próximo à Cachoeira do Senhor","Não"
"ESTAÇÃO ECOLÓGICA JURÉIA-ITATINS","Angiosperms","Rubiaceae","Psychotria","hastisepala","Müll.Arg.","RUBIACEAE Psychotria hastisepala Müll.Arg.","247873","GBIF",,,"134","Native","Latão","Estação Ecológica Juréia-Itatins, Serra da Juréia, mata próximo ao alojamento","Não"
"ESTAÇÃO ECOLÓGICA JURÉIA-ITATINS","Angiosperms","Rubiaceae","Psychotria","laciniata","Vell.","RUBIACEAE Psychotria laciniata Vell.","245698","GBIF",,,"674","Native","Latão","Estação Ecológica Juréia-Itatins, Serra da Juréia, trilha para o campo próximo ao alojamento do IBAMA","Não"
"ESTAÇÃO ECOLÓGICA JURÉIA-ITATINS","Angiosperms","Rubiaceae","Psychotria","leiocarpa","Cham. & Schltdl.","RUBIACEAE Psychotria leiocarpa Cham. & Schltdl.","250037","GBIF",,,"953","Native","Latão","Estação Ecológica Juréia-Itatins, Serra da Juréia, ás margens do Rio Verde em direção à foz, final da trilha para a Cachoeira do Salto","Não"
"ESTAÇÃO ECOLÓGICA JURÉIA-ITATINS","Angiosperms","Rubiaceae","Psychotria","leitana","C.M.Taylor","RUBIACEAE Psychotria leitana C.M.Taylor","3205582","GBIF",,,"633","Native","Latão","Iguape, estacao Ecologica Jureia-Itatins. Serra da Jureia, trilha em direcao a Foz do rio Verde, mata pluvial de planicie.","Não"
"ESTAÇÃO ECOLÓGICA JURÉIA-ITATINS","Angiosperms","Rubiaceae","Psychotria","nuda","(Cham. & Schltdl.) Wawra","RUBIACEAE Psychotria nuda (Cham. & Schltdl.) Wawra","272275","GBIF",,,"519","Native","Latão","Estação Ecológica Juréia-Itatins, Alto da Serra dos Itatins, encosta voltada para o mar, mata alta bem preservada, com dossel irregular","Não"
"ESTAÇÃO ECOLÓGICA JURÉIA-ITATINS","Angiosperms","Rubiaceae","Psychotria","pedunculosa","Rich.","RUBIACEAE Psychotria pedunculosa Rich.","247899","GBIF",,,"165","Native","Latão","Estação Ecológica Juréia-Itatins, Serra da Juréia, trilha do Imperador","Não"
"ESTAÇÃO ECOLÓGICA JURÉIA-ITATINS","Angiosperms","Rubiaceae","Psychotria","pubigera","Schltdl.","RUBIACEAE Psychotria pubigera Schltdl.","244574","GBIF",,,"613","Native","Latão","Estação Ecológica Juréia-Itatins, Proximdiades do maciço da Juréia, trilha do alojamento do IBAMA até o pocinho do Rio Verde, mata das margens do rio","Não"
"ESTAÇÃO ECOLÓGICA JURÉIA-ITATINS","Angiosperms","Rubiaceae","Psychotria","stachyoides","Benth.","RUBIACEAE Psychotria stachyoides Benth.","247651","GBIF",,,"784","Native","Latão","Estação Ecológica Juréia-Itatins, Alto do morro próximo ao alojamento, mata baixa de topo de morro","Não"
"ESTAÇÃO ECOLÓGICA JURÉIA-ITATINS","Angiosperms","Rubiaceae","Psychotria","suterella","Müll.Arg.","RUBIACEAE Psychotria suterella Müll.Arg.","272277","GBIF",,,"524","Native","Latão","Estação Ecológica Juréia-Itatins, Alto da Serra dos Itatins, encosta voltada para o mar, mata alta, bem preservada, com dossel irregular","Não"
"ESTAÇÃO ECOLÓGICA JURÉIA-ITATINS","Ferns and Lycophytes","Pteridaceae",,,"E.D.M.Kirchn.","PTERIDACEAE Pteridaceae E.D.M.Kirchn.","UPCB0033683","GBIF",,,"1983",,"Latão","Estação ecologica Juréia-Itatins, Nucleo Guarau. Trilha do Fundão.","Não"
"ESTAÇÃO ECOLÓGICA JURÉIA-ITATINS","Ferns and Lycophytes","Dennstaedtiaceae","Pteridium","esculentum","(Kaulf.) Thomson","DENNSTAEDTIACEAE Pteridium esculentum subsp. arachnoideum (Kaulf.) Thomson","901","GBIF",,,"1746","Native","Latão","Estação Ecológica Juréia-Itatins, Foz do Rio Guaraú, sobre rochas","Não"
"ESTAÇÃO ECOLÓGICA JURÉIA-ITATINS","Angiosperms","Melastomataceae","Pterolepis",,"(DC.) Miq.","MELASTOMATACEAE Pterolepis (DC.) Miq.","95600","GBIF",,,"1983",,"Latão","Estação ecologica Juréia-Itatins, Nucleo Guarau. Trilha do Fundão.","Não"
"ESTAÇÃO ECOLÓGICA JURÉIA-ITATINS","Angiosperms","Lythraceae","Punica","granatum","L.","LYTHRACEAE Punica granatum L.","329642","GBIF",,,"700","Cultivated","Latão","Estação Ecológica Juréia-Itatins","Não"
"ESTAÇÃO ECOLÓGICA JURÉIA-ITATINS","Angiosperms","Malvaceae","Quararibea","bovinii","C.D.M. Ferreira","MALVACEAE Quararibea bovinii C.D.M. Ferreira","249295","GBIF",,,"68","Native","Latão","Estação Ecológica Juréia-Itatins, Serra da Juréia, trilha da Figueira","Não"
