"Cordiera humilis var. humilis","gbif",,"RB","RB00611631","Cordiera humilis var. humilis","Plantae","Rubiaceae","Cordiera","2000","10","6","Brasil","São Paulo",,"Parque Estadual de Vassununga, gleba de cerrado, pé de gigante.","JBRJ","PRESERVED_SPECIMEN","P.G. Delprete",,,,,,,,"Maria Rita Mechi; Sergio Ricardo Andena",,,"2022-11-01 16:18:10",,"13 b",,,"Arbustinho, flores brancas, bem miudas, folhas opostas, caule avermelhado, sem látex.",,"Tracheophyta","Gentianales",,,"Magnoliopsida",,,,,,,,,,"GBIF","Santa Rita do Passa Quatro","2022-10-01","Cordiera humilis var. humilis",,"BR",,"RB - Rio de Janeiro Botanical Garden Herbarium Collection","2000-10-06",,,,,,"ACCEPTED","VARIETY",,,,,,,,,,,,,,,"brazil","sao paulo","santa rita do passa quatro","parque estadual de vassununga",,"locality","brazil_sao paulo_santa rita passa quatro_parque estadual vassununga","brazil_sao paulo_santa rita passa quatro_pe vassununga",-21.639694,-47.613521,"locality","273114","1424321590",,,"CC_BY_4_0","Instituto de Pesquisas Jardim Botanico do Rio de Janeiro",,"Rio de Janeiro Botanical Garden","04.936.616/0001-20",,,,,"urn:catalog:JBRJ:RB:611631",,,,,,,,,,,,,,,"PRESENT",,,,,,,"RB 294724",,,,,,,,,,,,,,,,"280","280",,,,,,,,,"SOUTH_AMERICA",,,,,,,,,,,,,,,,,,,,,,,,,,,,,,,,,,,,,,,,,,,,,,,,"6288433",,,,,,,,,,,,,,,,,"Cordiera",,,"humilis","humilis",,,,,,,"4300f8d5-1ae5-49e5-a101-63894b005868","BR","2025-01-01 12:23:50.977",,,,,,"CONTINENT_DERIVED_FROM_COUNTRY;INSTITUTION_MATCH_FUZZY;COLLECTION_MATCH_FUZZY","StillImage;StillImage",FALSE,FALSE,"6288433","6288433","6","7707728","220","412","8798","2903362",,"5335656","Cordiera humilis","Cordiera humilis (K.Schum.) Kuntze var. humilis",,"EML","2025-01-01 12:23:50.977","2025-01-01 12:06:14.731",FALSE,,"null",FALSE,"LATIN_AMERICA","LATIN_AMERICA",,,,,,,,,,"jbrj-public-img.s3-sa-east-1.amazonaws.com/JPG/rb/0/61/16/31/00611631.jpg",,,,,,,,,,,,,,,,,,,,,,,,"brazil_sao paulo_santa rita passa quatro","Brazil","São Paulo","Santa Rita do Passa Quatro",,"ibge","brazil_sao paulo_santa rita passa quatro","Brazil","São Paulo","Santa Rita do Passa Quatro",,"ibge","brazil_sao paulo_santa rita passa quatro","Brazil","São Paulo","Santa Rita do Passa Quatro",,"ibge","ok_same_resolution","Cordiera humilis var. humilis",,"variety",,"Cordiera humilis var. humilis",,"subspecies","not found",,,,"Cordiera humilis var. humilis","Cordiera","Rubiaceae","unknown","Cordiera humilis var. humilis"
"Cordiera sessilis","gbif",,"SPFR","10160","Cordiera sessilis (Vell.) Kuntze","Plantae","Rubiaceae","Cordiera","2000","10","6","Brasil","São Paulo",,"Parque Estadual de Vassununga - Gleba de Cerrado Pé-de-Gigante","FFCLRP","PRESERVED_SPECIMEN","Seccani, L.E.",,,,,,"https://specieslink.net/col/455",,"Mechi, M.R.; Andena, S.R.","-47.616667","-21.616667","2024-06-15 09:42:54","(Vell.) Kuntze","13B",,,"Arbustinho; flores brancas miúdas; folhas opostas; caule avermelhado; sem látex",,"Tracheophyta","Gentianales",,,"Magnoliopsida",,,,,,,,,,"GBIF","Santa Rita do Passa Quatro","2024-02-28","Cordiera sessilis (Vell.) Kuntze",,"BR",,,"2000-10-06",,,,,,"ACCEPTED","SPECIES",,,,,,,,,,,,,,,"brazil","sao paulo","santa rita do passa quatro","parque estadual de vassununga - gleba de cerrado pe-de-gigante",,"locality","brazil_sao paulo_santa rita passa quatro","brazil_sao paulo_santa rita passa quatro",-21.68195672,-47.50780122,"county","794513","4536519538",,,"CC_BY_4_0","Faculdade de Filosofia, Ciências e Letras de Ribeirão Preto (FFCLRP), Universidade de São Paulo (USP)","https://specieslink.net/guid/455/10160","Herbário do Departamento de Biologia da FFCLRP-USP",,"Faculdade de Filosofia, Ciências e Letras de Ribeirão Preto",,,,"https://specieslink.net/guid/455/10160",,,,,,,,,,,"native",,,,"PRESENT",,,,,,,,,,,,,,,,,,,,,,,"280","280",,,,,,,,,"SOUTH_AMERICA",,,,,,,,,,,,,,,,,,,,,,,,,,,,,,,,,,,,,,,,,,,,,,,,"5335669",,,,,,,,,,,,,,,,,"Cordiera",,,"sessilis",,,,,,,,"7b203230-ba55-4da6-9274-e1d7b1b95987","BR","2025-01-05 15:26:29.998",,,,,,"CONTINENT_DERIVED_FROM_COORDINATES;INSTITUTION_MATCH_NONE",,TRUE,FALSE,"5335669","5335669","6","7707728","220","412","8798","2903362",,"5335669","Cordiera sessilis","Cordiera sessilis",,"EML","2025-01-05 15:26:29.998","2025-01-05 15:26:01.878",FALSE,,"null",FALSE,"LATIN_AMERICA","LATIN_AMERICA","BRA","Brazil","BRA.25_1","São Paulo","BRA.25.531_2","Santa Rita do Passa Quatro",,,"NE",,,,,,"WGS84",,,,,,,,,,,,,,,,,,,"brazil_sao paulo_santa rita passa quatro","Brazil","São Paulo","Santa Rita do Passa Quatro",,"ibge","brazil_sao paulo_santa rita passa quatro","Brazil","São Paulo","Santa Rita do Passa Quatro",,"ibge","brazil_sao paulo_santa rita passa quatro","Brazil","São Paulo","Santa Rita do Passa Quatro",,"ibge","check_local.2municip.","Cordiera sessilis","(Vell.) Kuntze","name_w_authors","Rubiaceae","Cordiera sessilis","(Vell.) Kuntze","species","name accepted","bfo-20721",,,"Cordiera sessilis (Vell.) Kuntze","Cordiera","Rubiaceae","unknown","Cordiera sessilis"
"Couepia grandiflora","speciesLink","SPSF00012981","SPSF","12981","Couepia grandiflora","Plantae","Chrysobalanaceae","Couepia","1985","08","01","Brasil","SP","Santa Rita do Passa Quatro","Parque Estadual Vassununga","IF","PreservedSpecimen",,,,,,,"13","grandiflora","A.A.I.F.Castro","-47.6","-21.633333","2024-08-06T09:13:39",,"19713","690","710","<nO>COLETA: XLS: SPSFAntigo;</nO>",,"Magnoliophyta","Fabales",,"América do Sul","Magnoliopsida",,,,,,,,,,"SPLINK","Santa Rita do Passa Quatro",,,,,,,,,,,,,,,,,,,"SPSF",,"Castro, A.A.I.F.","19713","1985","s.n.","n.d.",,"Castro",,"brazil","sao paulo","santa rita do passa quatro","parque estadual vassununga",,"locality","brazil_sao paulo_santa rita passa quatro_parque estadual vassununga","brazil_sao paulo_santa rita passa quatro_pe vassununga",-21.639694,-47.613521,"locality",,,,,,,,,,,,,,,,,,,,,,,,,,,,,,,,,,,,,,,,,,,,,,,,,,,,,,,,,,,,,,,,,,,,,,,,,,,,,,,,,,,,,,,,,,,,,,,,,,,,,,,,,,,,,,,,,,,,,,,,,,,,,,,,,,,,,,,,,,,,,,,,,,,,,,,,,,,,,,,,,,,,,,,,,,,,,,,,,,,,,,,,,,,,,,,,,,,,,,,,,,,,,,,,,,,,,,,,,,,,,,,"ok_same_resolution","Couepia grandiflora","(Mart. & Zucc.) Benth.","possibly_ok","Chrysobalanaceae","Couepia grandiflora","(Mart. & Zucc.) Benth.","species","name accepted","bfo-16765",,,"Couepia grandiflora (Mart. & Zucc.) Benth.","Couepia","Chrysobalanaceae","unknown","Couepia grandiflora"
"Coussarea hydrangeifolia","speciesLink","SPSF00037936","SPSF","37936","Coussarea hydrangeifolia","Plantae","Rubiaceae","Coussarea","2007","01","17","Brasil","SP","Santa Rita do Passa Quatro","Parque Estadual Vassununga","IF","PreservedSpecimen","S.L.Jung-Mendaçoli","2007","10","03",,,"13","hydrangeifolia","R.L.R.Santos & R.T. Polisel & G.A.D.C. Franco & G.Durigan & M.T.Z.Togniato & E.Furlan & N.M.Ivanauskas","-48.746667","-23.535278","2024-08-06T09:16:30","(Benth.) M.Arg.","8",,,"<nO>COLETA: Arvoreta 2m, frutos imaturos verdes.; GEOGRAFIA: Gleba Brejo;</nO>",,"Magnoliophyta","Rubiales",,"América do Sul","Magnoliopsida",,,,,,,,,,"SPLINK","Santa Rita do Passa Quatro","2007-10-03",,,,,,,,,,,,,,,,,,"SPSF",,"Santos, R.L.R.","8","2007","Jung-Mendacoli, S.L.","2007","Polisel, R.T.; Franco, G.A.D.C.; Durigan, G.; Togniato, M.T.Z.; Furlan, E.; Ivanauskas, N.M.","Santos",,"brazil","sao paulo","santa rita do passa quatro","parque estadual vassununga",,"locality","brazil_sao paulo_santa rita passa quatro_parque estadual vassununga","brazil_sao paulo_santa rita passa quatro_pe vassununga",-21.639694,-47.613521,"locality",,,,,,,,,,,,,,,,,,,,,,,,,,,,,,,,,,,,,,,,,,,,,,,,,,,,,,,,,,,,,,,,,,,,,,,,,,,,,,,,,,,,,,,,,,,,,,,,,,,,,,,,,,,,,,,,,,,,,,,,,,,,,,,,,,,,,,,,,,,,,,,,,,,,,,,,,,,,,,,,,,,,,,,,,,,,,,,,,,,,,,,,,,,,,,,,,,,,,,,,,,,,,,,,,,,,,,,,,,,,,,,"ok_same_resolution","Coussarea hydrangeifolia","(Benth.) Müll.Arg.","possibly_ok","Rubiaceae","Coussarea hydrangeifolia","(Benth.) Müll.Arg.","species","author misspelled","bfo-13902",,,"Coussarea hydrangeifolia (Benth.) Müll.Arg.","Coussarea","Rubiaceae","low","Coussarea hydrangeifolia"
"Crotalaria vitellina","user",,"RB","RB00608402","Crotalaria vitellina Ker Gawl.","Plantae","Leguminosae","Crotalaria","2001","1","8","Brasil","São Paulo",,"Parque Estadual de Vassununga.","JBRJ","Preserved Specimen","Maria Rita",,,,,,,,"Maria Rita; Sérgio Ricardo",,,,"Ker Gawl.","71",,,"Herbácea, 60 cm de altura; flores amarelas; sem cheiro; sem látex.",,,,,,,,,,,,,,,,,"São Paulo",,,,"BR",,,"2001-01-08",,,,,,,"sp.","Physical Object",,,,"RB",,"Rita, M.","71","2001","Rita, M.","n.d.","Ricardo, S.","Rita",,"brazil","sao paulo","sao paulo","parque estadual de vassununga",,"locality","brazil_sao paulo_sao paulo","brazil_sao paulo_sao paulo",-23.65041685,-46.64802516,"county",,,,,,,,"USP",,,,,,"urn:catalog:JBRJ:RB:608402",,,,,,,,,,,,,,,,,,,,,,"RB 506981",,,,,,,,,,,,,,,,,,,,,,,,,,,,,,,,,,,,,,,,,,,,,,,,,,,,,,,,,,,,,,,,,,,,,,,,,,,,,,,,,,,,,,,,,,,,,,"vitellina",,,,,,,,,,,,,,,,,,,,,,,,,,,,,,,,,,,,,,,,,,,,,,,,,,,"jbrj-public-img.s3-sa-east-1.amazonaws.com/JPG/rb/0/60/84/2/00608402.jpg",,,,,,,,,,,,,,,,,,,,,,"2014-07-07 20:22:36+00","Angiospermas","brazil_sao paulo_sao paulo","Brazil","São Paulo","São Paulo",,"ibge","brazil_sao paulo_sao paulo","Brazil","São Paulo","São Paulo",,"ibge","brazil_sao paulo_sao paulo","Brazil","São Paulo","São Paulo",,"ibge","check_local.2municip.","Crotalaria vitellina","Ker Gawl.","name_w_authors","Fabaceae","Crotalaria vitellina","Ker Gawl.","species","name accepted","bfo-29584",,,"Crotalaria vitellina Ker Gawl.","Crotalaria","Fabaceae","low","Crotalaria vitellina"
"Croton floribundus","user",,"UEC","IBGE00010902","Croton floribundus Spreng.",,"Euphorbiaceae","Croton","1976","01","20","Brasil","São Paulo",,"Parque Estadual de Vassununga. Orla da Mata.","UEC",,"Martins, FR",,,,,,,,"Martins, FR","0","0",,"Spreng.","285",,,,,,,,,,,"não",,,,,,,,"REFLORA","Santa Rita do Passa Quatro","20/01/1976",,,,,,,"Árvore com 4 a 5 m de altura. Flores de cor creme, não latescente. Habitat: Mata, Orla de mata Habito: árvore",,,,,,"SPECIES",,,,,,,,,,,,,,,"brazil","sao paulo","santa rita do passa quatro","parque estadual de vassununga",,"locality","brazil_sao paulo_santa rita passa quatro_parque estadual vassununga","brazil_sao paulo_santa rita passa quatro_pe vassununga",-21.639694,-47.613521,"locality",,,,,,,,,,,,,,,,,,,,,,,,,,,,,,,,,,,,,,,,,,,,,,,,,,,,,,,,,,,,,,,,,,,,,,,,,,,,,,,,,,,,,,,,,,,,,,,,,,,,,,,,,,,,,,,,,,,,,,,,,,,,,,,,,,,,,,,,,,,,,,,,,,,,,,,,,,,,,,,,"floribundus","EUPHORBIACEAE Croton floribundus Spreng.",,,,,,,,,,,,,,,,,,,,,,,,,,,,"IBGE",,"IBGE 10902",,,"20/01/1976",,,"METRO",,,,,,,,"brazil_sao paulo_santa rita passa quatro","Brazil","São Paulo","Santa Rita do Passa Quatro",,"ibge","brazil_sao paulo_santa rita passa quatro","Brazil","São Paulo","Santa Rita do Passa Quatro",,"ibge","brazil_sao paulo_santa rita passa quatro","Brazil","São Paulo","Santa Rita do Passa Quatro",,"ibge","ok_same_resolution","Croton floribundus","Spreng.","name_w_authors","Euphorbiaceae","Croton floribundus","Spreng.","species","name accepted","bfo-17512",,,"Croton floribundus Spreng.","Croton","Euphorbiaceae","high","Croton floribundus"
"Croton piptocalyx","gbif",,"UEC","4642","Croton piptocalyx Müll.Arg.","Plantae","Euphorbiaceae","Croton","1978","9","12","Brazil","São Paulo",,"Parque Estadual de Vassununga, Mata Capetinga.","UNICAMP","PRESERVED_SPECIMEN","Riina, R",,,,,,"https://specieslink.net/col/2",,"Martins, FR",,,"2024-11-25 11:20:23","Müll.Arg.","10006",,,"Árvore 12m, flores cremes.",,"Tracheophyta","Malpighiales",,,"Magnoliopsida",,,,,,,,,,"GBIF","Santa Rita do Passa Quatro","2004-03-01","Croton piptocalyx Müll.Arg.",,"BR",,,"1978-09-12",,,,,,"ACCEPTED","SPECIES",,,,,,,,,,,,,,,"brazil","sao paulo","santa rita do passa quatro","parque estadual de vassununga, mata capetinga",,"locality","brazil_sao paulo_santa rita passa quatro","brazil_sao paulo_santa rita passa quatro",-21.68195672,-47.50780122,"county","55183","1088983309",,,"CC_BY_4_0","Universidade Estadual de Campinas - Instituto de Biologia","https://specieslink.net/guid/2/4642","Herbário da Universidade Estadual de Campinas",,"Universidade Estadual de Campinas",,,,"https://specieslink.net/guid/2/4642",,,,,,,,,,,"native",,,,"PRESENT",,,,,,,,,,,,,,,,,,,,,,,"255","255",,,,,,,,,"SOUTH_AMERICA",,,,,,,,,,,,,,,,,,,,,,,,,,,,,,,,,,,,,,,,,,,,,,,,"3060464",,,,,,,,,,,,,,,,,"Croton",,,"piptocalyx",,,,,,,,"7741a517-ab3d-4b85-ae58-56322e44c8ce","BR","2025-01-05 15:38:14.57",,,,,,"CONTINENT_DERIVED_FROM_COUNTRY;INSTITUTION_MATCH_NONE",,FALSE,FALSE,"3060464","3060464","6","7707728","220","1414","4691","3057454",,"3060464","Croton piptocalyx","Croton piptocalyx",,"EML","2025-01-05 15:38:14.57","2025-01-05 15:31:00.136",FALSE,,"null",FALSE,"LATIN_AMERICA","LATIN_AMERICA",,,,,,,,,"LC","https://images.cria.org.br/viewer/UEC144014",,,,,"WGS84",,,,,,,,,,,,,,,,,,,"brazil_sao paulo_santa rita passa quatro","Brazil","São Paulo","Santa Rita do Passa Quatro",,"ibge","brazil_sao paulo_santa rita passa quatro","Brazil","São Paulo","Santa Rita do Passa Quatro",,"ibge","brazil_sao paulo_santa rita passa quatro","Brazil","São Paulo","Santa Rita do Passa Quatro",,"ibge","check_local.2municip.","Croton piptocalyx","Müll.Arg.","name_w_authors","Euphorbiaceae","Croton piptocalyx","Müll.Arg.","species","name accepted","bfo-17532",,,"Croton piptocalyx Müll.Arg.","Croton","Euphorbiaceae","unknown","Croton piptocalyx"
"Ctenitis distans var. distans","gbif",,"BHCB-SL","69395","Ctenitis distans var. distans","Plantae","Dryopteridaceae","Ctenitis","2001","10","13","Brasil","São Paulo",,"Parque Estadual da Vassununga","UFMG","PRESERVED_SPECIMEN","Viveros, RS",,,,,,"https://specieslink.net/col/453",,"Colli, AT",,,"2022-12-26 10:30:49","(Brack.) Ching","24",,,"Terrestre em barranco, perto de rio.",,"Tracheophyta","Polypodiales",,,"Polypodiopsida",,,,,,,,,,"GBIF","Porto Ferreira","2015-11-01","Ctenitis distans (Brack.) Ching",,"BR",,,"2001-10-13",,,,,,"SYNONYM","VARIETY",,,,,,,,,,,,,,,"brazil","sao paulo","porto ferreira","parque estadual da vassununga",,"locality","brazil_sao paulo_porto ferreira","brazil_sao paulo_porto ferreira",-21.84143673,-47.44653435,"county","315272","1802854282",,,"CC_BY_4_0","Universidade Federal de Minas Gerais","https://specieslink.net/guid/453/69395","Herbário da UFMG - Samambaias e Licófitas",,"Universidade Federal de Minas Gerais",,,,"https://specieslink.net/guid/453/69395",,,,,,,,,,,"native",,,,"PRESENT",,,,,,,,,,,,,,,,,,,,,,,"286","286",,,,,,,,,"SOUTH_AMERICA",,,,,,,,,,,,,,,,,,,,,,,,,,,,,,,,,,,,,,,,,,,,,,,,"4042190",,,,,,,,,,,,,,,,,"Ctenitis",,,"distans","distans",,,,,,,"ed8e1590-62b5-48a8-8654-4ecc13554f57","BR","2025-01-05 15:00:35.34",,,,,,"CONTINENT_DERIVED_FROM_COUNTRY;CONTINENT_INVALID;INSTITUTION_MATCH_NONE",,FALSE,FALSE,"9679569","4042190","6","7707728","7228684","392","2373","2650908",,"4042190","Ctenitis distans","Ctenitis distans distans",,"EML","2025-01-05 15:00:35.34","2025-01-05 15:00:09.954",FALSE,,"null",FALSE,"LATIN_AMERICA","LATIN_AMERICA",,,,,,,,,,,,,,,"WGS84",,,,,,,,,,,,,,,,,,,"brazil_sao paulo_porto ferreira","Brazil","São Paulo","Porto Ferreira",,"ibge","brazil_sao paulo_porto ferreira","Brazil","São Paulo","Porto Ferreira",,"ibge","brazil_sao paulo_porto ferreira","Brazil","São Paulo","Porto Ferreira",,"ibge","check_local.2municip.","Ctenitis distans var. distans","(Brack.) Ching","variety","Dryopteridaceae","Ctenitis distans var. distans","(Brack.) Ching","variety","name accepted","bfo-615411",,,"Ctenitis distans var. distans (Brack.) Ching","Ctenitis","Dryopteridaceae","unknown","Ctenitis distans"
"Cucurbita","gbif",,"COR","COR00005591","Cucurbitaceae","Plantae","Cucurbitaceae",,"2002","10","1","Brasil","São Paulo",,"Parque Estadual de Vassununga, Gleba Maravilha (borda da mata). Floresta Estacional Semidecidual; ;.","COR","PRESERVED_SPECIMEN","Tibiriçá, Y.J.A.",,,,,,,,"Tibiriçá, Y.J.A.;Coelho, L.F.",,,,"L.",,,,"Liana com gavinha.; Com Flor: amarela; Com fruto:laranja com polpa vermelha",,"Tracheophyta","Cucurbitales",,,"Magnoliopsida",,,,,,,,,,"GBIF","Santa Rita do Passa Quatro",,"Cucurbitaceae","Herbário Virtual REFLORA Disponível em: http://herbariovirtualreflora.jbrj.gov.br/reflora/herbarioVirtual/ConsultaPublicoHVUC/ConsultaPublicoHVUC.do?idTestemunho=4623396","BR",,,"2002-10-01",,,,,,"ACCEPTED","FAMILY",,,"2002-10-01",,,,,,,,,,,,"brazil","sao paulo","santa rita do passa quatro","parque estadual de vassununga",,"locality","brazil_sao paulo_santa rita passa quatro_parque estadual vassununga","brazil_sao paulo_santa rita passa quatro_pe vassununga",-21.639694,-47.613521,"locality","409115","2302407695",,,"CC_BY_4_0","Instituto de Pesquisas Jardim Botanico do Rio de Janeiro",,"COR",,,,,,"4623396",,,,,,,,,,,,,,,"PRESENT",,,,,,,"COR 12513",,,,,,,,,,,,,,,,"274","274",,,,,,,,,"SOUTH_AMERICA",,,,,,,,,,,,,,,,,,,,,,,,,,,,,,,,,,,,,,,,,,,,,,,,"6634",,,,,,,,,,,,,,,,,,,,,,,,,,,,"6cf2d179-0e25-49e1-af67-ff2571293c63","BR","2025-01-01 12:43:56.813",,,,,,"RECORDED_DATE_INVALID;IDENTIFIED_DATE_INVALID;CONTINENT_DERIVED_FROM_COUNTRY;TAXON_MATCH_HIGHERRANK;INSTITUTION_MATCH_FUZZY;COLLECTION_MATCH_FUZZY",,FALSE,FALSE,"6634","6634","6","7707728","220","7224005","6634",,,,,"mormodica charantia l.",,"EML","2025-01-01 12:43:56.813","2025-01-01 12:02:55.343",FALSE,,"null",FALSE,"LATIN_AMERICA","LATIN_AMERICA",,,,,,,,,"NE","jbrj-public.s3-sa-east-1.amazonaws.com/fsi/server?type=image&source=DZI/cor/cor/0/0/55/91/cor00005591.dzi",,,,,,,,,,,,,,,,,,,,,,,,"brazil_sao paulo_santa rita passa quatro","Brazil","São Paulo","Santa Rita do Passa Quatro",,"ibge","brazil_sao paulo_santa rita passa quatro","Brazil","São Paulo","Santa Rita do Passa Quatro",,"ibge","brazil_sao paulo_santa rita passa quatro","Brazil","São Paulo","Santa Rita do Passa Quatro",,"ibge","ok_same_resolution","Cucurbita","L.","family_as_genus","Cucurbitaceae","Cucurbita","L.","genus","name misspelled","bfo-82118",,,"Cucurbita L.","Cucurbita","Cucurbitaceae","unknown",
"Cuphea micrantha","gbif",,"SPSF","55708","Cuphea micrantha Kunth","Plantae","Lythraceae","Cuphea","2021","2","15","Brasil","Sp",,"Parque Estadual de Vassununga","IF","PRESERVED_SPECIMEN","M.C.Martins da Silva",,,,,,"https://specieslink.net/col/13",,"M.C.Martins da Silva & R.R.Cezário & L.A.Joaquim","-47.642222","-21.644722","2024-08-06 09:15:22","Kunth","9",,,"COLETA: Erva de 25 cm de altura, caule e folhas, principalmente na margem, com pelos glandulosos longos e esparsos; flores róseas.&nf;SISBio: 75085-4; GEOGRAFIA: Gleba Cerrado Pé-de-Gigante, face Sul, Cerrado stricto sensu em borda com a estrada, solo aren",,"Tracheophyta","Myrtales",,,"Magnoliopsida",,,,,,,,,,"GBIF","Santa Rita do Passa Quatro","2021-12-03","Cuphea micrantha Kunth",,"BR",,,"2021-02-15",,,,,,"ACCEPTED","SPECIES",,,,,,,,,,,,,,,"brazil","sao paulo","santa rita do passa quatro","parque estadual de vassununga",,"locality","brazil_sao paulo_santa rita passa quatro_parque estadual vassununga","brazil_sao paulo_santa rita passa quatro_pe vassununga",-21.639694,-47.613521,"locality","688265","3761238349",,,"CC_BY_4_0","Instituto Florestal","https://specieslink.net/guid/13/55708","Herbário Dom Bento José Pickel",,"Instituto Florestal",,,,"https://specieslink.net/guid/13/55708",,,,,,,,,,,"native",,,,"PRESENT",,,,,,,,,,,,,,,,,,,,,,,"46","46",,,,,,,,,"SOUTH_AMERICA",,,,,,,,,,,,,,,,,,,,,,,,,,,,,,,,,,,,,,,,,,,,,,,,"3188696",,,,,,,,,,,,,,,,,"Cuphea",,,"micrantha",,,,,,,,"16ed67e5-fd70-4fd4-85c3-70ea2da627fe","BR","2025-01-05 15:03:01.788","620","0",,,,"INSTITUTION_MATCH_FUZZY;DIFFERENT_OWNER_INSTITUTION;INSTITUTION_COLLECTION_MISMATCH",,TRUE,FALSE,"3188696","3188696","6","7707728","220","690","6684","3188676",,"3188696","Cuphea micrantha","Cuphea micrantha",,"EML","2025-01-05 15:03:01.788","2025-01-05 15:02:28.694",FALSE,,"null",FALSE,"LATIN_AMERICA","LATIN_AMERICA","BRA","Brazil","BRA.25_1","São Paulo","BRA.25.531_2","Santa Rita do Passa Quatro",,,"NE","https://images.cria.org.br/viewer/SPSF00055708","620","620",,,"WGS84",,,,,,,,,,,,,,,,,,,"brazil_sao paulo_santa rita passa quatro","Brazil","São Paulo","Santa Rita do Passa Quatro",,"ibge","brazil_sao paulo_santa rita passa quatro","Brazil","São Paulo","Santa Rita do Passa Quatro",,"ibge","brazil_sao paulo_santa rita passa quatro","Brazil","São Paulo","Santa Rita do Passa Quatro",,"ibge","ok_same_resolution","Cuphea micrantha","Kunth","name_w_authors","Lythraceae","Cuphea micrantha","Kunth","species","name accepted","bfo-8757",,,"Cuphea micrantha Kunth","Cuphea","Lythraceae","unknown","Cuphea micrantha"
"Cuspidaria floribunda","gbif",,"HRCB","41716","Cuspidaria floribunda (DC.) A.H.Gentry","Plantae","Bignoniaceae","Cuspidaria","2003","1","19","Brasil","São Paulo",,"Parque Estadual de Vassununga Gleba Maravilha","UNESP-RC","PRESERVED_SPECIMEN","Assis, M.A.",,,,,,"https://specieslink.net/col/15",,"Tibiriçá, Y.J.A.","-47.566667","-21.683333","2024-12-18 09:14:19","(DC.) A.H.Gentry","53",,,"Liana com gavinhas; flor rosa e branca.Habitat: Floresta Estacional Semidecidual (borda da mata)",,"Tracheophyta","Lamiales",,,"Magnoliopsida",,,,,,,,,,"GBIF","Santa Rita do Passa Quatro","2003-01-01","Cuspidaria floribunda (DC.) A.H.Gentry",,"BR",,,"2003-01-19",,,,,,"ACCEPTED","SPECIES",,,,,,,,,,,,,,,"brazil","sao paulo","santa rita do passa quatro","parque estadual de vassununga gleba maravilha",,"locality","brazil_sao paulo_santa rita passa quatro","brazil_sao paulo_santa rita passa quatro",-21.68195672,-47.50780122,"county","157075","1090691518",,,"CC_BY_4_0","Universidade Estadual Paulista","https://specieslink.net/guid/15/41716","Herbário Rioclarense",,"Universidade Estadual Paulista - Campus de Rio Claro",,,,"https://specieslink.net/guid/15/41716",,,,,,,,,,,"native",,,,"PRESENT",,,,,,,,,,,,,,,,,,,,,,,"19","19",,,,,,,,,"SOUTH_AMERICA",,,,,,,,,,,,,,,,,,,,,,,,,,,,,,,,,,,,,,,,,,,,,,,,"5668649",,,,,,,,,,,,,,,,,"Cuspidaria",,,"floribunda",,,,,,,,"fdf55163-54d8-4bc7-862d-7e41068589e3","BR","2025-01-05 14:53:02.795",,,,,,"CONTINENT_DERIVED_FROM_COORDINATES;INSTITUTION_MATCH_NONE",,TRUE,FALSE,"5668649","5668649","6","7707728","220","408","6655","3233545",,"5668649","Cuspidaria floribunda","Cuspidaria floribunda",,"EML","2025-01-05 14:53:02.795","2025-01-05 14:52:23.551",FALSE,,"null",FALSE,"LATIN_AMERICA","LATIN_AMERICA","BRA","Brazil","BRA.25_1","São Paulo","BRA.25.531_2","Santa Rita do Passa Quatro",,,"NE",,,,,,"WGS84",,,,,,,,,,,,,,,,,,,"brazil_sao paulo_santa rita passa quatro","Brazil","São Paulo","Santa Rita do Passa Quatro",,"ibge","brazil_sao paulo_santa rita passa quatro","Brazil","São Paulo","Santa Rita do Passa Quatro",,"ibge","brazil_sao paulo_santa rita passa quatro","Brazil","São Paulo","Santa Rita do Passa Quatro",,"ibge","check_local.2municip.","Cuspidaria floribunda","(DC.) A.H.Gentry","name_w_authors","Bignoniaceae","Cuspidaria floribunda","(DC.) A.H.Gentry","species","name accepted","bfo-113222",,,"Cuspidaria floribunda (DC.) A.H.Gentry","Cuspidaria","Bignoniaceae","unknown","Cuspidaria floribunda"
"Cyanocephalus rugosus","gbif",,"SPSF","55712","Cyanocephalus rugosus (Benth.) Harley & J.F.B.Pastore","Plantae","Lamiaceae","Cyanocephalus","2021","6","9","Brasil","Sp",,"Parque Estadual de Vassununga","IF","PRESERVED_SPECIMEN","M.G.Buchoski",,,,,,"https://specieslink.net/col/13",,"M.C.Martins da Silva & R.R.Cezário & L.A.Joaquim","-47.629722","-21.610278","2024-08-06 09:14:19","((Benth.)) Harley & J.F.B.Pastore","33",,,"COLETA: Subarbusto com aprox. 1 m de altura; flores liláses a roxas em capítulo globoso.&nf;SISBio: 75085-4; GEOGRAFIA: Gleba Cerrado Pé-de-Gigante, face Norte, em Cerrado stricto sensu à 60 m da borda.;",,"Tracheophyta","Lamiales",,,"Magnoliopsida",,,,,,,,,,"GBIF","Santa Rita do Passa Quatro","2021-12-09","Cyanocephalus rugosus (Benth.) Harley & J.F.B.Pastore",,"BR",,,"2021-06-09",,,,,,"ACCEPTED","SPECIES",,,,,,,,,,,,,,,"brazil","sao paulo","santa rita do passa quatro","parque estadual de vassununga",,"locality","brazil_sao paulo_santa rita passa quatro_parque estadual vassununga","brazil_sao paulo_santa rita passa quatro_pe vassununga",-21.639694,-47.613521,"locality","688275","3761238359",,,"CC_BY_4_0","Instituto Florestal","https://specieslink.net/guid/13/55712","Herbário Dom Bento José Pickel",,"Instituto Florestal",,,,"https://specieslink.net/guid/13/55712",,,,,,,,,,,"native",,,,"PRESENT",,,,,,,,,,,,,,,,,,,,,,,"160","160",,,,,,,,,"SOUTH_AMERICA",,,,,,,,,,,,,,,,,,,,,,,,,,,,,,,,,,,,,,,,,,,,,,,,"7418066",,,,,,,,,,,,,,,,,"Cyanocephalus",,,"rugosus",,,,,,,,"16ed67e5-fd70-4fd4-85c3-70ea2da627fe","BR","2025-01-05 15:03:01.777","620","0",,,,"INSTITUTION_MATCH_FUZZY;DIFFERENT_OWNER_INSTITUTION;INSTITUTION_COLLECTION_MISMATCH",,TRUE,FALSE,"7418066","7418066","6","7707728","220","408","2497","8020297",,"7418066","Cyanocephalus rugosus","Cyanocephalus rugosus",,"EML","2025-01-05 15:03:01.777","2025-01-05 15:02:28.694",FALSE,,"null",FALSE,"LATIN_AMERICA","LATIN_AMERICA","BRA","Brazil","BRA.25_1","São Paulo","BRA.25.531_2","Santa Rita do Passa Quatro",,,"NE","https://images.cria.org.br/viewer/SPSF00055712","620","620",,,"WGS84",,,,,,,,,,,,,,,,,,,"brazil_sao paulo_santa rita passa quatro","Brazil","São Paulo","Santa Rita do Passa Quatro",,"ibge","brazil_sao paulo_santa rita passa quatro","Brazil","São Paulo","Santa Rita do Passa Quatro",,"ibge","brazil_sao paulo_santa rita passa quatro","Brazil","São Paulo","Santa Rita do Passa Quatro",,"ibge","ok_same_resolution","Cyanocephalus rugosus","(Benth.) Harley & J.F.B.Pastore","name_w_authors","Lamiaceae","Cyanocephalus rugosus","(Benth.) Harley & J.F.B.Pastore","species","name accepted","bfo-132591",,,"Cyanocephalus rugosus (Benth.) Harley & J.F.B.Pastore","Cyanocephalus","Lamiaceae","unknown","Cyanocephalus rugosus"
