"gbif","HISA","11863","Fridericia Mart.","Plantae","Bignoniaceae","Fridericia","2021","6","17","Brasil","São Paulo",,"Parque Estadual do Aguapeí","UNESP-IS","Tracheophyta","PRESERVED_SPECIMEN",,"https://specieslink.net/col/18",,"S.Y.Sawakuchi; A.A.Rezende; A.Rios","-51.618611","-21.1525","2024-08-16 10:54:08",,,,,"197",,,,,,,,,"Magnoliopsida","Lamiales",,,,,,,,"GBIF","Nova Independência",,"Fridericia Mart.",,"BR",,,"2021-06-17",,,,,,"ACCEPTED","GENUS",,,,,,,,,,,,,,,"brazil","sao paulo","nova independencia","parque estadual do aguapei",,"locality","brazil_sao paulo_nova independencia","brazil_sao paulo_nova independencia",-21.13528339,-51.50516051,"county","4874480521",,,,"https://specieslink.net/guid/18/11863",,,,,"PRESENT",,,,,,,,,,,,,,,,,,,,,,,,,,,,,,"Fridericia",,,,,,"a14ea064-1abf-45ef-85ce-669a979815d7",,,TRUE,FALSE,,"Fridericia","null",FALSE,"LATIN_AMERICA","LATIN_AMERICA",,,"WGS84",,,,,,,,,,,,,,,,,,"brazil_sao paulo_nova independencia","Brazil","São Paulo","Nova Independência",,"check_local.2municip.","Fridericia speciosa","Mart.","name_w_authors","Bignoniaceae","Fridericia speciosa","Mart.","species","name misspelled","bfo-113406",,,"Fridericia speciosa Mart.","Fridericia","Bignoniaceae","unknown","Fridericia speciosa"
"gbif","HISA","11871","Fridericia triplinervia (Mart. ex DC.) L.G.Lohmann","Plantae","Bignoniaceae","Fridericia","2021","6","17","Brasil","São Paulo",,"Parque Estadual do Aguapeí","UNESP-IS","Tracheophyta","PRESERVED_SPECIMEN",,"https://specieslink.net/col/18","triplinervia","S.Y.Sawakuchi; A.A.Rezende; A.Rios","-51.618611","-21.1525","2024-08-16 10:54:10","(Mart. ex DC.) L.G.Lohmann",,,,"206",,,,,,,,,"Magnoliopsida","Lamiales",,,,,,,,"GBIF","Nova Independência",,"Fridericia triplinervia (Mart. ex DC.) L.G.Lohmann",,"BR",,,"2021-06-17",,,,,,"ACCEPTED","SPECIES",,,,,,,,,,,,,,,"brazil","sao paulo","nova independencia","parque estadual do aguapei",,"locality","brazil_sao paulo_nova independencia","brazil_sao paulo_nova independencia",-21.13528339,-51.50516051,"county","4874480489",,,,"https://specieslink.net/guid/18/11871",,,,,"PRESENT",,,,,,,,,,,,,,,,,,,,,,,,,,,,,,"Fridericia",,,,,,"a14ea064-1abf-45ef-85ce-669a979815d7",,,TRUE,FALSE,"Fridericia triplinervia","Fridericia triplinervia","null",FALSE,"LATIN_AMERICA","LATIN_AMERICA","NE",,"WGS84",,,,,,,,,,,,,,,,,,"brazil_sao paulo_nova independencia","Brazil","São Paulo","Nova Independência",,"check_local.2municip.","Fridericia triplinervia","(Mart. ex DC.) L.G.Lohmann","name_w_authors","Bignoniaceae","Fridericia triplinervia","(Mart. ex DC.) L.G.Lohmann","species","name accepted","bfo-113412",,,"Fridericia triplinervia (Mart. ex DC.) L.G.Lohmann","Fridericia","Bignoniaceae","unknown","Fridericia triplinervia"
"gbif","HISA","11883","Gouania polygama (Jacq.) Urb.","Plantae","Rhamnaceae","Gouania","2021","6","17","Brasil","São Paulo",,"Parque Estadual do Aguapeí","UNESP-IS","Tracheophyta","PRESERVED_SPECIMEN","A.A.Rezende","https://specieslink.net/col/18","polygama","S.Y.Sawakuchi; A.A.Rezende; A.Rios","-51.618611","-21.1525","2024-08-16 10:54:42","(Jacq.) Urb.",,,,"218",,,,,,,,,"Magnoliopsida","Rosales",,,,,,,,"GBIF","Nova Independência","2021-06-17","Gouania polygama (Jacq.) Urb.",,"BR",,,"2021-06-17",,,,,,"ACCEPTED","SPECIES",,,,,,,,,,,,,,,"brazil","sao paulo","nova independencia","parque estadual do aguapei",,"locality","brazil_sao paulo_nova independencia","brazil_sao paulo_nova independencia",-21.13528339,-51.50516051,"county","4874480455",,,,"https://specieslink.net/guid/18/11883",,,,,"PRESENT",,,,,,,,,,,,,,,,,,,,,,,,,,,,,,"Gouania",,,,,,"a14ea064-1abf-45ef-85ce-669a979815d7",,,TRUE,FALSE,"Gouania polygama","Gouania polygama","null",FALSE,"LATIN_AMERICA","LATIN_AMERICA","NE",,"WGS84",,,,,,,,,,,,,,,,,,"brazil_sao paulo_nova independencia","Brazil","São Paulo","Nova Independência",,"check_local.2municip.","Gouania polygama","(Jacq.) Urb.","name_w_authors","Rhamnaceae","Gouania polygama","(Jacq.) Urb.","species","name accepted","bfo-87416",,,"Gouania polygama (Jacq.) Urb.","Gouania","Rhamnaceae","unknown","Gouania polygama"
"gbif",,"859","Guapira opposita (Vell.) Reitz","Plantae","Nyctaginaceae","Guapira","2000",,,"Brazil","Sp",,"Fazenda Sant'Ana - área pertencente ao Parque Estadual do Aguapeí","Instituto Florestal","Tracheophyta","OCCURRENCE",,,"opposita","Giselda Durigan","-51.380325","-21.2360582","2008-02-08",,,,,,,,,,,,,,"Magnoliopsida","Caryophyllales",,,,,,,,"GBIF","Guaraçaí",,"Guapira opposita (Vell.) Reitz","Durigan, G.; Franco, G.A.D.C. & Siqueira, M.F. 2004. A vegetação dos remanescentes de cerrado no Estado de São Paulo. In: Bitencourt, M.D. & Mendonça, R.R. (orgs.) Viabilidade da Conservação dos Remanescentes de Cerrado no Estado de São Paulo. São Paulo: Annablume; FAPESP. Pp. 29-56. Durigan, G.; Baitello, J.B.; Franco, G.A.D.C. & Siqueira, M.F. 2004. Plantas do Cerrado Paulista: imagens de uma paisagem ameaçada. São Paulo: Páginas & Letras Editora e Gráfica, 475p. Durigan, G.; Siqueira, M.F.; Franco, G.A.D.C.; Bridgewater, S. & Ratter, J.A.2003. The vegetation of priority areas for cerrado conservation in São Paulo State, Brazil. Edinburgh Journal of Botany 60(2):217-241. Durigan, G.; Ratter, J.A.; Bridgewater, S.; Siqueira, M.F. & Franco, G.A.D.C. 2003. Padrões fitogeográficos do cerrado paulista sob uma perspectiva regional. Hoehnea, São Paulo, 30(1):39-51.","BR",,"SinBIOTA","2000",,,,,,"ACCEPTED","SPECIES","Dataset",,,"Fazenda Sant'Ana - área pertencente ao Parque Estadual do Aguapeí",,,,,,,,,,,"brazil","sao paulo","guaracai","fazenda sant'ana - area pertencente ao parque estadual do aguapei",,"locality","brazil_sao paulo_guaracai","brazil_sao paulo_guaracai",-21.08689973,-51.28003353,"county","3967718390","147",,,"8590031","256",,,,"PRESENT",,,,,"Levantamento Botânico Expedito. Método de levantamento florístico rápido cuja unidade amostral é o tempo    que, neste caso, é de 15 minutos. O tempo total de coleta é definido pela curva     espécie x tempo. O tempo mínimo de coleta é de 60 minutos.",,"17699",,,,,,,,,,,,"9400498",,,,,,,,,,,"Guapira",,,,,,"c1c5ef4b-8309-4f04-9247-3f7644260c85",,,TRUE,FALSE,"Guapira opposita","Guapira opposita","null",FALSE,"LATIN_AMERICA","LATIN_AMERICA","NE",,"EPSG:4291",,,,,,,,,,,,,,,,,,"brazil_sao paulo_guaracai","Brazil","São Paulo","Guaraçaí",,"check_local.2municip.","Guapira opposita","(Vell.) Reitz","name_w_authors","Nyctaginaceae","Guapira opposita","(Vell.) Reitz","species","name accepted","bfo-10913",,,"Guapira opposita (Vell.) Reitz","Guapira","Nyctaginaceae","unknown","Guapira opposita"
"gbif",,"859","Guarea guidonia (L.) Sleumer","Plantae","Meliaceae","Guarea","2000",,,"Brazil","Sp",,"Fazenda Sant'Ana - área pertencente ao Parque Estadual do Aguapeí","Instituto Florestal","Tracheophyta","OCCURRENCE",,,"guidonia","Giselda Durigan","-51.380325","-21.2360582","2008-02-08",,,,,,,,,,,,,,"Magnoliopsida","Sapindales",,,,,,,,"GBIF","Guaraçaí",,"Guarea guidonia (L.) Sleumer","Durigan, G.; Franco, G.A.D.C. & Siqueira, M.F. 2004. A vegetação dos remanescentes de cerrado no Estado de São Paulo. In: Bitencourt, M.D. & Mendonça, R.R. (orgs.) Viabilidade da Conservação dos Remanescentes de Cerrado no Estado de São Paulo. São Paulo: Annablume; FAPESP. Pp. 29-56. Durigan, G.; Baitello, J.B.; Franco, G.A.D.C. & Siqueira, M.F. 2004. Plantas do Cerrado Paulista: imagens de uma paisagem ameaçada. São Paulo: Páginas & Letras Editora e Gráfica, 475p. Durigan, G.; Siqueira, M.F.; Franco, G.A.D.C.; Bridgewater, S. & Ratter, J.A.2003. The vegetation of priority areas for cerrado conservation in São Paulo State, Brazil. Edinburgh Journal of Botany 60(2):217-241. Durigan, G.; Ratter, J.A.; Bridgewater, S.; Siqueira, M.F. & Franco, G.A.D.C. 2003. Padrões fitogeográficos do cerrado paulista sob uma perspectiva regional. Hoehnea, São Paulo, 30(1):39-51.","BR",,"SinBIOTA","2000",,,,,,"ACCEPTED","SPECIES","Dataset",,,"Fazenda Sant'Ana - área pertencente ao Parque Estadual do Aguapeí",,,,,,,,,,,"brazil","sao paulo","guaracai","fazenda sant'ana - area pertencente ao parque estadual do aguapei",,"locality","brazil_sao paulo_guaracai","brazil_sao paulo_guaracai",-21.08689973,-51.28003353,"county","3967721393","147",,,"8590032","256",,,,"PRESENT",,,,,"Levantamento Botânico Expedito. Método de levantamento florístico rápido cuja unidade amostral é o tempo    que, neste caso, é de 15 minutos. O tempo total de coleta é definido pela curva     espécie x tempo. O tempo mínimo de coleta é de 60 minutos.",,"17699",,,,,,,,,,,,"7042654",,,,,,,,,,,"Guarea",,,,,,"c1c5ef4b-8309-4f04-9247-3f7644260c85",,,TRUE,FALSE,"Guarea guidonia","Guarea guidonia","null",FALSE,"LATIN_AMERICA","LATIN_AMERICA","LC",,"EPSG:4291",,,,,,,,,,,,,,,,,,"brazil_sao paulo_guaracai","Brazil","São Paulo","Guaraçaí",,"check_local.2municip.","Guarea guidonia","(L.) Sleumer","name_w_authors","Meliaceae","Guarea guidonia","(L.) Sleumer","species","name accepted","bfo-9995",,,"Guarea guidonia (L.) Sleumer","Guarea","Meliaceae","unknown","Guarea guidonia"
"gbif",,"859","Helietta apiculata Benth.","Plantae","Rutaceae","Helietta","2000",,,"Brazil","Sp",,"Fazenda Sant'Ana - área pertencente ao Parque Estadual do Aguapeí","Instituto Florestal","Tracheophyta","OCCURRENCE",,,"apiculata","Giselda Durigan","-51.380325","-21.2360582","2008-02-08",,,,,,,,,,,,,,"Magnoliopsida","Sapindales",,,,,,,,"GBIF","Guaraçaí",,"Helietta apiculata Benth.","Durigan, G.; Franco, G.A.D.C. & Siqueira, M.F. 2004. A vegetação dos remanescentes de cerrado no Estado de São Paulo. In: Bitencourt, M.D. & Mendonça, R.R. (orgs.) Viabilidade da Conservação dos Remanescentes de Cerrado no Estado de São Paulo. São Paulo: Annablume; FAPESP. Pp. 29-56. Durigan, G.; Baitello, J.B.; Franco, G.A.D.C. & Siqueira, M.F. 2004. Plantas do Cerrado Paulista: imagens de uma paisagem ameaçada. São Paulo: Páginas & Letras Editora e Gráfica, 475p. Durigan, G.; Siqueira, M.F.; Franco, G.A.D.C.; Bridgewater, S. & Ratter, J.A.2003. The vegetation of priority areas for cerrado conservation in São Paulo State, Brazil. Edinburgh Journal of Botany 60(2):217-241. Durigan, G.; Ratter, J.A.; Bridgewater, S.; Siqueira, M.F. & Franco, G.A.D.C. 2003. Padrões fitogeográficos do cerrado paulista sob uma perspectiva regional. Hoehnea, São Paulo, 30(1):39-51.","BR",,"SinBIOTA","2000",,,,,,"ACCEPTED","SPECIES","Dataset",,,"Fazenda Sant'Ana - área pertencente ao Parque Estadual do Aguapeí",,,,,,,,,,,"brazil","sao paulo","guaracai","fazenda sant'ana - area pertencente ao parque estadual do aguapei",,"locality","brazil_sao paulo_guaracai","brazil_sao paulo_guaracai",-21.08689973,-51.28003353,"county","3967722387","147",,,"8590033","256",,,,"PRESENT",,,,,"Levantamento Botânico Expedito. Método de levantamento florístico rápido cuja unidade amostral é o tempo    que, neste caso, é de 15 minutos. O tempo total de coleta é definido pela curva     espécie x tempo. O tempo mínimo de coleta é de 60 minutos.",,"17699",,,,,,,,,,,,"9400552",,,,,,,,,,,"Helietta",,,,,,"c1c5ef4b-8309-4f04-9247-3f7644260c85",,,TRUE,FALSE,"Helietta apiculata","Helietta apiculata","null",FALSE,"LATIN_AMERICA","LATIN_AMERICA","NE",,"EPSG:4291",,,,,,,,,,,,,,,,,,"brazil_sao paulo_guaracai","Brazil","São Paulo","Guaraçaí",,"check_local.2municip.","Helietta apiculata","Benth.","name_w_authors","Rutaceae","Helietta apiculata","Benth.","species","name accepted","bfo-774",,,"Helietta apiculata Benth.","Helietta","Rutaceae","unknown","Helietta apiculata"
"gbif","HISA","11877","Heteropterys Kunth","Plantae","Malpighiaceae","Heteropterys","2021","6","17","Brasil","São Paulo",,"Parque Estadual do Aguapeí","UNESP-IS","Tracheophyta","PRESERVED_SPECIMEN",,"https://specieslink.net/col/18",,"S.Y.Sawakuchi; A.A.Rezende; A.Rios","-51.618611","-21.1525","2024-08-16 10:54:25",,,,,"212",,,,,,,,,"Magnoliopsida","Malpighiales",,,,,,,,"GBIF","Nova Independência",,"Heteropterys Kunth",,"BR",,,"2021-06-17",,,,,,"ACCEPTED","GENUS",,,,,,,,,,,,,,,"brazil","sao paulo","nova independencia","parque estadual do aguapei",,"locality","brazil_sao paulo_nova independencia","brazil_sao paulo_nova independencia",-21.13528339,-51.50516051,"county","4874480476",,,,"https://specieslink.net/guid/18/11877",,,,,"PRESENT",,,,,,,,,,,,,,,,,,,,,,,,,,,,,,"Heteropterys",,,,,,"a14ea064-1abf-45ef-85ce-669a979815d7",,,TRUE,FALSE,,"Heteropterys","null",FALSE,"LATIN_AMERICA","LATIN_AMERICA",,,"WGS84",,,,,,,,,,,,,,,,,,"brazil_sao paulo_nova independencia","Brazil","São Paulo","Nova Independência",,"check_local.2municip.","Heteropterys","Kunth","indet","Malpighiaceae","Heteropterys","Kunth","genus","name accepted","bfo-8865",,,"Heteropterys Kunth","Heteropterys","Malpighiaceae","unknown",
"gbif",,"859","Hymenaea courbaril L.","Plantae","Fabaceae","Hymenaea","2000",,,"Brazil","Sp",,"Fazenda Sant'Ana - área pertencente ao Parque Estadual do Aguapeí","Instituto Florestal","Tracheophyta","OCCURRENCE",,,"courbaril","Giselda Durigan","-51.380325","-21.2360582","2008-02-08",,,,,,,,,,,,,,"Magnoliopsida","Fabales",,,,,,,,"GBIF","Guaraçaí",,"Hymenaea courbaril L.","Durigan, G.; Franco, G.A.D.C. & Siqueira, M.F. 2004. A vegetação dos remanescentes de cerrado no Estado de São Paulo. In: Bitencourt, M.D. & Mendonça, R.R. (orgs.) Viabilidade da Conservação dos Remanescentes de Cerrado no Estado de São Paulo. São Paulo: Annablume; FAPESP. Pp. 29-56. Durigan, G.; Baitello, J.B.; Franco, G.A.D.C. & Siqueira, M.F. 2004. Plantas do Cerrado Paulista: imagens de uma paisagem ameaçada. São Paulo: Páginas & Letras Editora e Gráfica, 475p. Durigan, G.; Siqueira, M.F.; Franco, G.A.D.C.; Bridgewater, S. & Ratter, J.A.2003. The vegetation of priority areas for cerrado conservation in São Paulo State, Brazil. Edinburgh Journal of Botany 60(2):217-241. Durigan, G.; Ratter, J.A.; Bridgewater, S.; Siqueira, M.F. & Franco, G.A.D.C. 2003. Padrões fitogeográficos do cerrado paulista sob uma perspectiva regional. Hoehnea, São Paulo, 30(1):39-51.","BR",,"SinBIOTA","2000",,,,,,"ACCEPTED","SPECIES","Dataset",,,"Fazenda Sant'Ana - área pertencente ao Parque Estadual do Aguapeí",,,,,,,,,,,"brazil","sao paulo","guaracai","fazenda sant'ana - area pertencente ao parque estadual do aguapei",,"locality","brazil_sao paulo_guaracai","brazil_sao paulo_guaracai",-21.08689973,-51.28003353,"county","3967725408","147",,,"8590034","256",,,,"PRESENT",,,,,"Levantamento Botânico Expedito. Método de levantamento florístico rápido cuja unidade amostral é o tempo    que, neste caso, é de 15 minutos. O tempo total de coleta é definido pela curva     espécie x tempo. O tempo mínimo de coleta é de 60 minutos.",,"17699",,,,,,,,,,,,"621238",,,,,,,,,,,"Hymenaea",,,,,,"c1c5ef4b-8309-4f04-9247-3f7644260c85",,,TRUE,FALSE,"Hymenaea courbaril","Hymenaea courbaril","null",FALSE,"LATIN_AMERICA","LATIN_AMERICA","LC",,"EPSG:4291",,,,,,,,,,,,,,,,,,"brazil_sao paulo_guaracai","Brazil","São Paulo","Guaraçaí",,"check_local.2municip.","Hymenaea courbaril","L.","name_w_authors","Fabaceae","Hymenaea courbaril","L.","species","name accepted","bfo-22972",,,"Hymenaea courbaril L.","Hymenaea","Fabaceae","unknown","Hymenaea courbaril"
"gbif",,"859","Inga striata Benth.","Plantae","Fabaceae","Inga","2000",,,"Brazil","Sp",,"Fazenda Sant'Ana - área pertencente ao Parque Estadual do Aguapeí","Instituto Florestal","Tracheophyta","OCCURRENCE",,,"striata","Giselda Durigan","-51.380325","-21.2360582","2008-02-08",,,,,,,,,,,,,,"Magnoliopsida","Fabales",,,,,,,,"GBIF","Guaraçaí",,"Inga striata Benth.","Durigan, G.; Franco, G.A.D.C. & Siqueira, M.F. 2004. A vegetação dos remanescentes de cerrado no Estado de São Paulo. In: Bitencourt, M.D. & Mendonça, R.R. (orgs.) Viabilidade da Conservação dos Remanescentes de Cerrado no Estado de São Paulo. São Paulo: Annablume; FAPESP. Pp. 29-56. Durigan, G.; Baitello, J.B.; Franco, G.A.D.C. & Siqueira, M.F. 2004. Plantas do Cerrado Paulista: imagens de uma paisagem ameaçada. São Paulo: Páginas & Letras Editora e Gráfica, 475p. Durigan, G.; Siqueira, M.F.; Franco, G.A.D.C.; Bridgewater, S. & Ratter, J.A.2003. The vegetation of priority areas for cerrado conservation in São Paulo State, Brazil. Edinburgh Journal of Botany 60(2):217-241. Durigan, G.; Ratter, J.A.; Bridgewater, S.; Siqueira, M.F. & Franco, G.A.D.C. 2003. Padrões fitogeográficos do cerrado paulista sob uma perspectiva regional. Hoehnea, São Paulo, 30(1):39-51.","BR",,"SinBIOTA","2000",,,,,,"ACCEPTED","SPECIES","Dataset",,,"Fazenda Sant'Ana - área pertencente ao Parque Estadual do Aguapeí",,,,,,,,,,,"brazil","sao paulo","guaracai","fazenda sant'ana - area pertencente ao parque estadual do aguapei",,"locality","brazil_sao paulo_guaracai","brazil_sao paulo_guaracai",-21.08689973,-51.28003353,"county","3967719391","147",,,"8590035","256",,,,"PRESENT",,,,,"Levantamento Botânico Expedito. Método de levantamento florístico rápido cuja unidade amostral é o tempo    que, neste caso, é de 15 minutos. O tempo total de coleta é definido pela curva     espécie x tempo. O tempo mínimo de coleta é de 60 minutos.",,"17699",,,,,,,,,,,,"573389",,,,,,,,,,,"Inga",,,,,,"c1c5ef4b-8309-4f04-9247-3f7644260c85",,,TRUE,FALSE,"Inga striata","Inga striata","null",FALSE,"LATIN_AMERICA","LATIN_AMERICA","LC",,"EPSG:4291",,,,,,,,,,,,,,,,,,"brazil_sao paulo_guaracai","Brazil","São Paulo","Guaraçaí",,"check_local.2municip.","Inga striata","Benth.","name_w_authors","Fabaceae","Inga striata","Benth.","species","name accepted","bfo-23029",,,"Inga striata Benth.","Inga","Fabaceae","unknown","Inga striata"
"gbif",,"859","Inga vera Willd.","Plantae","Fabaceae","Inga","2000",,,"Brazil","Sp",,"Fazenda Sant'Ana - área pertencente ao Parque Estadual do Aguapeí","Instituto Florestal","Tracheophyta","OCCURRENCE",,,"vera","Giselda Durigan","-51.380325","-21.2360582","2008-02-08",,,,,,,,,,,,,,"Magnoliopsida","Fabales",,,,,,,,"GBIF","Guaraçaí",,"Inga vera Willd.","Durigan, G.; Franco, G.A.D.C. & Siqueira, M.F. 2004. A vegetação dos remanescentes de cerrado no Estado de São Paulo. In: Bitencourt, M.D. & Mendonça, R.R. (orgs.) Viabilidade da Conservação dos Remanescentes de Cerrado no Estado de São Paulo. São Paulo: Annablume; FAPESP. Pp. 29-56. Durigan, G.; Baitello, J.B.; Franco, G.A.D.C. & Siqueira, M.F. 2004. Plantas do Cerrado Paulista: imagens de uma paisagem ameaçada. São Paulo: Páginas & Letras Editora e Gráfica, 475p. Durigan, G.; Siqueira, M.F.; Franco, G.A.D.C.; Bridgewater, S. & Ratter, J.A.2003. The vegetation of priority areas for cerrado conservation in São Paulo State, Brazil. Edinburgh Journal of Botany 60(2):217-241. Durigan, G.; Ratter, J.A.; Bridgewater, S.; Siqueira, M.F. & Franco, G.A.D.C. 2003. Padrões fitogeográficos do cerrado paulista sob uma perspectiva regional. Hoehnea, São Paulo, 30(1):39-51.","BR",,"SinBIOTA","2000",,,,,,"ACCEPTED","SPECIES","Dataset",,,"Fazenda Sant'Ana - área pertencente ao Parque Estadual do Aguapeí",,,,,,,,,,,"brazil","sao paulo","guaracai","fazenda sant'ana - area pertencente ao parque estadual do aguapei",,"locality","brazil_sao paulo_guaracai","brazil_sao paulo_guaracai",-21.08689973,-51.28003353,"county","3967723408","147",,,"8590036","256",,,,"PRESENT",,,,,"Levantamento Botânico Expedito. Método de levantamento florístico rápido cuja unidade amostral é o tempo    que, neste caso, é de 15 minutos. O tempo total de coleta é definido pela curva     espécie x tempo. O tempo mínimo de coleta é de 60 minutos.",,"17699",,,,,,,,,,,,"573393",,,,,,,,,,,"Inga",,,,,,"c1c5ef4b-8309-4f04-9247-3f7644260c85",,,TRUE,FALSE,"Inga vera","Inga vera","null",FALSE,"LATIN_AMERICA","LATIN_AMERICA","LC",,"EPSG:4291",,,,,,,,,,,,,,,,,,"brazil_sao paulo_guaracai","Brazil","São Paulo","Guaraçaí",,"check_local.2municip.","Inga vera","Willd.","name_w_authors","Fabaceae","Inga vera","Willd.","species","name accepted","bfo-23039",,,"Inga vera Willd.","Inga","Fabaceae","unknown","Inga vera"
"gbif","HISA","11816","Ipomoea cairica (L.) Sweet","Plantae","Convolvulaceae","Ipomoea","2021","4","28","Brasil","São Paulo",,"Parque Estadual do Aguapeí","UNESP-IS","Tracheophyta","PRESERVED_SPECIMEN","S.Y.Sawakuchi","https://specieslink.net/col/18","cairica","S.Y.Sawakuchi; O.I.M.Uzumaki; A.A.Rezende; V.F.Mansano",,,"2024-08-16 10:53:45","(L.) Sweet",,,,"146",,,,,,,,,"Magnoliopsida","Solanales",,,,,,,,"GBIF","Nova Independência","2021-04-28","Ipomoea cairica (L.) Sweet",,"BR",,,"2021-04-28",,,,,,"ACCEPTED","SPECIES",,,,,,,,,,,,,,,"brazil","sao paulo","nova independencia","parque estadual do aguapei",,"locality","brazil_sao paulo_nova independencia","brazil_sao paulo_nova independencia",-21.13528339,-51.50516051,"county","4874480638",,,,"https://specieslink.net/guid/18/11816",,,,,"PRESENT",,,,,,,,,,,,,,,,,,,,,,,,,,,,,,"Ipomoea",,,,,,"a14ea064-1abf-45ef-85ce-669a979815d7",,,FALSE,FALSE,"Ipomoea cairica","Ipomoea cairica","null",FALSE,"LATIN_AMERICA","LATIN_AMERICA","LC",,"WGS84",,,,,,,,,,,,,,,,,,"brazil_sao paulo_nova independencia","Brazil","São Paulo","Nova Independência",,"check_local.2municip.","Ipomoea cairica","(L.) Sweet","name_w_authors","Convolvulaceae","Ipomoea cairica","(L.) Sweet","species","name accepted","bfo-7030",,,"Ipomoea cairica (L.) Sweet","Ipomoea","Convolvulaceae","unknown","Ipomoea cairica"
"gbif","HISA","11894","Lauraceae","Plantae","Lauraceae",,"2021","6","18","Brasil","São Paulo",,"Parque Estadual do Aguapeí","UNESP-IS","Tracheophyta","PRESERVED_SPECIMEN",,"https://specieslink.net/col/18",,"S.Y.Sawakuchi; A.A.Rezende; A.Rios","-51.478611","-21.207778","2024-08-16 10:54:13",,,,,"230",,,,,,,,,"Magnoliopsida","Laurales",,,,,,,,"GBIF","Nova Independência",,"Lauraceae",,"BR",,,"2021-06-18",,,,,,"ACCEPTED","FAMILY",,,,,,,,,,,,,,,"brazil","sao paulo","nova independencia","parque estadual do aguapei",,"locality","brazil_sao paulo_nova independencia","brazil_sao paulo_nova independencia",-21.13528339,-51.50516051,"county","4874480425",,,,"https://specieslink.net/guid/18/11894",,,,,"PRESENT",,,,,,,,,,,,,,,,,,,,,,,,,,,,,,,,,,,,"a14ea064-1abf-45ef-85ce-669a979815d7",,,TRUE,FALSE,,,"null",FALSE,"LATIN_AMERICA","LATIN_AMERICA","NE",,"WGS84",,,,,,,,,,,,,,,,,,"brazil_sao paulo_nova independencia","Brazil","São Paulo","Nova Independência",,"check_local.2municip.","Lauraceae","Juss.","family_as_genus","Lauraceae","Lauraceae","Juss.","family","name accepted","bfo-143",,,"Lauraceae Juss.",,"Lauraceae","unknown",
"gbif",,"859","Luehea candicans Mart.","Plantae","Malvaceae","Luehea","2000",,,"Brazil","Sp",,"Fazenda Sant'Ana - área pertencente ao Parque Estadual do Aguapeí","Instituto Florestal","Tracheophyta","OCCURRENCE",,,"candicans","Giselda Durigan","-51.380325","-21.2360582","2008-02-08",,,,,,,,,,,,,,"Magnoliopsida","Malvales",,,,,,,,"GBIF","Guaraçaí",,"Luehea candicans Mart.","Durigan, G.; Franco, G.A.D.C. & Siqueira, M.F. 2004. A vegetação dos remanescentes de cerrado no Estado de São Paulo. In: Bitencourt, M.D. & Mendonça, R.R. (orgs.) Viabilidade da Conservação dos Remanescentes de Cerrado no Estado de São Paulo. São Paulo: Annablume; FAPESP. Pp. 29-56. Durigan, G.; Baitello, J.B.; Franco, G.A.D.C. & Siqueira, M.F. 2004. Plantas do Cerrado Paulista: imagens de uma paisagem ameaçada. São Paulo: Páginas & Letras Editora e Gráfica, 475p. Durigan, G.; Siqueira, M.F.; Franco, G.A.D.C.; Bridgewater, S. & Ratter, J.A.2003. The vegetation of priority areas for cerrado conservation in São Paulo State, Brazil. Edinburgh Journal of Botany 60(2):217-241. Durigan, G.; Ratter, J.A.; Bridgewater, S.; Siqueira, M.F. & Franco, G.A.D.C. 2003. Padrões fitogeográficos do cerrado paulista sob uma perspectiva regional. Hoehnea, São Paulo, 30(1):39-51.","BR",,"SinBIOTA","2000",,,,,,"ACCEPTED","SPECIES","Dataset",,,"Fazenda Sant'Ana - área pertencente ao Parque Estadual do Aguapeí",,,,,,,,,,,"brazil","sao paulo","guaracai","fazenda sant'ana - area pertencente ao parque estadual do aguapei",,"locality","brazil_sao paulo_guaracai","brazil_sao paulo_guaracai",-21.08689973,-51.28003353,"county","3967718391","147",,,"8590039","256",,,,"PRESENT",,,,,"Levantamento Botânico Expedito. Método de levantamento florístico rápido cuja unidade amostral é o tempo    que, neste caso, é de 15 minutos. O tempo total de coleta é definido pela curva     espécie x tempo. O tempo mínimo de coleta é de 60 minutos.",,"17699",,,,,,,,,,,,"9400918",,,,,,,,,,,"Luehea",,,,,,"c1c5ef4b-8309-4f04-9247-3f7644260c85",,,TRUE,FALSE,"Luehea candicans","Luehea candicans","null",FALSE,"LATIN_AMERICA","LATIN_AMERICA","LC",,"EPSG:4291",,,,,,,,,,,,,,,,,,"brazil_sao paulo_guaracai","Brazil","São Paulo","Guaraçaí",,"check_local.2municip.","Luehea candicans","Mart.","name_w_authors","Malvaceae","Luehea candicans","Mart.","species","name accepted","bfo-9092",,,"Luehea candicans Mart.","Luehea","Malvaceae","unknown","Luehea candicans"
