"user","RB","RB01131994","Lilium formosanum A. Wallace","Plantae","Liliaceae","Lilium","2014","2","26","Brasil","São Paulo",,,"JBRJ","Preserved Specimen","K. Beraldo",,,"K. Beraldo; V.G. França","-46.7658333","-23.4538889",,"A. Wallace","67",,,,,,,,,,,,"Parque Estadual do Jaraguá. Região mais alta do Parque. Próximo à antena da Tv Cultura Parque Estadual do Jaraguá","23º27´14´´","46º45´57´´W",,,,,,,"São Paulo","2014-4",,,"BR",,,"2014-02-26","Campo. Solo areno-pedregoso",,,,,,"sp.","Physical Object",,,,"RB",,"Beraldo, K.","67","2014","Beraldo, K.","2014","Franca, V.G.","Beraldo",,"brazil","sao paulo","sao paulo","parque estadual do jaragua, regiao mais alta do parque, proximo a antena da tv cultura parque estadual do jaragua",,"locality","brazil_sao paulo_sao paulo","brazil_sao paulo_sao paulo",-23.65041685,-46.64802516,"county",,,,,,,,"SPF",,,,,,"urn:catalog:JBRJ:RB:1131994",,,,,,,,,,,,,,,,,,,,,,"RB 651339",,,,,,,,,,,,,,,,,,,,,,,,,,,,,,,,,,,,,,,,,,,,,,,,,,,,,,,,,,,,,,,,,,,,,,,,,,,,,,,,,,,,,,,,,,,,,,"formosanum",,,,,,,,,,,,,,,,,,,,,,,,,,,,,,,,,,,,,,,,,,,,,,,,,,,"jbrj-public-img.s3-sa-east-1.amazonaws.com/JPG/rb/1/13/19/94/01131994.jpg","1036",,,,,,,,,,,,,,,,,,,,,"2017-10-15 11:24:33+00","Angiospermas","brazil_sao paulo_sao paulo","Brazil","São Paulo","São Paulo",,"ibge","brazil_sao paulo_sao paulo","Brazil","São Paulo","São Paulo",,"ibge","brazil_sao paulo_sao paulo","Brazil","São Paulo","São Paulo",,"ibge","check_local.2municip.","Lilium formosanum","A. Wallace","name_w_authors","Liliaceae","Lilium formosanum","A. Wallace","species","name accepted","bfo-583386",,,"Lilium formosanum A. Wallace","Lilium","Liliaceae","low","Lilium formosanum"
"gbif","SPSF","37416","Lithraea molleoides (Vell.) Engl.","Plantae","Anacardiaceae","Lithraea","2007","2","6","Brasil","Sp",,,"IF","PRESERVED_SPECIMEN","F. A. R. D. P. Arzolla","https://specieslink.net/col/13",,"F. A. R. D. P. Arzolla & C.S.Nunes & V.Gregorato","-46.763611","-23.451389","2024-08-06 09:16:42","(Vell.) Engler","1052",,,"Tracheophyta","Magnoliopsida","Sapindales",,,"COLETA: Floresta Ombrófila Densa Montana de porte baiuxo, sobre quartzito.&nf;Árvore 5m., frutos.; GEOGRAFIA: tilha do Pai Zé.;",,,,"Parque Estadual do Jaraguá",,,,,,,,"GBIF","São Paulo","2007-02-08","Lithraea molleoides (Vell.) Engl.",,"BR",,,"2007-02-06",,,,,,"ACCEPTED","SPECIES",,,,,,,,,,,,,,,"brazil","sao paulo","sao paulo","parque estadual do jaragua",,"locality","brazil_sao paulo_sao paulo_parque estadual jaragua","brazil_sao paulo_sao paulo_parque estadual jaragua",-23.462219,-46.763463,"locality","22280","1086906076",,,"CC_BY_4_0","Instituto Florestal","https://specieslink.net/guid/13/37416","Herbário Dom Bento José Pickel",,"Instituto Florestal",,,,"https://specieslink.net/guid/13/37416",,,,,,,,,,,"native",,,,"PRESENT",,,,,,,,,,,,,,,,,,,,,,,"37","37",,,,,,,,,"SOUTH_AMERICA",,,,,,,,,,,,,,,,,,,,,,,,,,,,,,,,,,,,,,,,,,,,,,,,"3660239",,,,,,,,,,,,,,,,,"Lithraea",,,"molleoides",,,,,,,,"16ed67e5-fd70-4fd4-85c3-70ea2da627fe","BR","2025-01-05 15:03:05.479","970","0",,,,"INSTITUTION_MATCH_FUZZY;DIFFERENT_OWNER_INSTITUTION;INSTITUTION_COLLECTION_MISMATCH",,TRUE,FALSE,"3660239","3660239","6","7707728","220","933","2398","7697680",,"3660239","Lithraea molleoides","Lithraea molleoides",,"EML","2025-01-05 15:03:05.479","2025-01-05 15:02:28.694",FALSE,,"null",FALSE,"LATIN_AMERICA","LATIN_AMERICA","BRA","Brazil","BRA.25_1","São Paulo","BRA.25.565_2","São Paulo",,,"LC",,"970","970",,,"WGS84",,,,,,,,,,,,,,,,,,,"brazil_sao paulo_sao paulo_parque estadual jaragua","Brazil","São Paulo","São Paulo","parque estadual jaragua","splink_jabot","brazil_sao paulo_sao paulo_parque estadual jaragua","Brazil","São Paulo","São Paulo","parque estadual jaragua","splink_jabot","brazil_sao paulo_sao paulo_parque estadual jaragua","Brazil","São Paulo","São Paulo","parque estadual jaragua","splink_jabot","ok_same_resolution","Lithraea molleoides","(Vell.) Engl.","name_w_authors","Anacardiaceae","Lithraea molleoides","(Vell.) Engl.","species","name accepted","bfo-4391",,,"Lithraea molleoides (Vell.) Engl.","Lithraea","Anacardiaceae","unknown","Lithraea molleoides"
"gbif","SPF","225763","Lucilia nitens Less.","Plantae","Asteraceae","Lucilia","2014","5","9","Brasil","São Paulo",,,"USP-IB","PRESERVED_SPECIMEN","França, VG","https://specieslink.net/col/7",,"França, VG","-46.765917","-23.457361","2024-01-30 15:19:16","Less.","57",,,"Tracheophyta","Magnoliopsida","Asterales",,,"Erva de 0,3 m alt. Heliófita. Brácteas dos capítulos verdes.; Solo areno-pedregoso.",,,,"Parque Estadual do Jaraguá",,,,,,,,"GBIF","São Paulo","2014-07-01","Lucilia nitens Less.",,"BR",,,"2014-05-09",,,,,,"ACCEPTED","SPECIES",,,,,,,,,,,,,,,"brazil","sao paulo","sao paulo","parque estadual do jaragua",,"locality","brazil_sao paulo_sao paulo_parque estadual jaragua","brazil_sao paulo_sao paulo_parque estadual jaragua",-23.462219,-46.763463,"locality","363570","1944965293",,,"CC_BY_4_0","Universidade de São Paulo","https://specieslink.net/guid/7/225763","Herbário da Universidade de São Paulo",,"Instituto de Biociências da Universidade de São Paulo",,,,"https://specieslink.net/guid/7/225763",,,,,,,,,,,"native",,,,"PRESENT",,,,,,,,,,,,,,,,,,,,,,,"129","129",,,,,,,,,"SOUTH_AMERICA",,,,,,,,,,,,,,,,,,,,,,,,,,,,,,,,,,,,,,,,,,,,,,,,"5385167",,,,,,,,,,,,,,,,,"Lucilia",,,"nitens",,,,,,,,"1bb3cae3-b91f-4109-8a2d-a1f05f2d6fd3","BR","2025-01-05 15:34:26.821","105","0",,,,"CONTINENT_DERIVED_FROM_COORDINATES;INSTITUTION_MATCH_NONE",,TRUE,FALSE,"5385167","5385167","6","7707728","220","414","3065","3092724",,"5385167","Lucilia nitens","Lucilia nitens",,"EML","2025-01-05 15:34:26.821","2025-01-05 15:24:14.62",FALSE,,"null",FALSE,"LATIN_AMERICA","LATIN_AMERICA","BRA","Brazil","BRA.25_1","São Paulo","BRA.25.565_2","São Paulo",,,"NE",,"105","105",,,"WGS84",,,,,,,,,,,,,,,,,,,"brazil_sao paulo_sao paulo_parque estadual jaragua","Brazil","São Paulo","São Paulo","parque estadual jaragua","splink_jabot","brazil_sao paulo_sao paulo_parque estadual jaragua","Brazil","São Paulo","São Paulo","parque estadual jaragua","splink_jabot","brazil_sao paulo_sao paulo_parque estadual jaragua","Brazil","São Paulo","São Paulo","parque estadual jaragua","splink_jabot","ok_same_resolution","Lucilia nitens","Less.","name_w_authors","Asteraceae","Lucilia nitens","Less.","species","name accepted","bfo-108548",,,"Lucilia nitens Less.","Lucilia","Asteraceae","unknown","Lucilia nitens"
"gbif","SPSF","39982","Luehea grandiflora Mart.","Plantae","Malvaceae","Luehea","2008","1","31","Brasil","Sp",,,"IF","PRESERVED_SPECIMEN","G.A.D.C. Franco","https://specieslink.net/col/13",,"F.M.Souza & R.C.Sousa & R.Esteves & D.Souza & C.D.Lima","-46.774722","-23.456389","2024-08-06 09:15:21","Mart.","1051",,,"Tracheophyta","Magnoliopsida","Malvales",,,"COLETA: Árvore, 14m. Flores brancas; GEOGRAFIA: Trilha do Mauro;",,,,"Parque Estadual do Jaraguá",,,,,,,,"GBIF","São Paulo","2008-04-08","Luehea grandiflora Mart.",,"BR",,,"2008-01-31",,,,,,"ACCEPTED","SPECIES",,,,,,,,,,,,,,,"brazil","sao paulo","sao paulo","parque estadual do jaragua",,"locality","brazil_sao paulo_sao paulo_parque estadual jaragua","brazil_sao paulo_sao paulo_parque estadual jaragua",-23.462219,-46.763463,"locality","24140","1086908548",,,"CC_BY_4_0","Instituto Florestal","https://specieslink.net/guid/13/39982","Herbário Dom Bento José Pickel",,"Instituto Florestal",,,,"https://specieslink.net/guid/13/39982",,,,,,,,,,,"native",,,,"PRESENT",,,,,,,,,,,,,,,,,,,,,,,"31","31",,,,,,,,,"SOUTH_AMERICA",,,,,,,,,,,,,,,,,,,,,,,,,,,,,,,,,,,,,,,,,,,,,,,,"5706135",,,,,,,,,,,,,,,,,"Luehea",,,"grandiflora",,,,,,,,"16ed67e5-fd70-4fd4-85c3-70ea2da627fe","BR","2025-01-05 15:02:58.922","895","0",,,,"INSTITUTION_MATCH_FUZZY;DIFFERENT_OWNER_INSTITUTION;INSTITUTION_COLLECTION_MISMATCH",,TRUE,FALSE,"5706135","5706135","6","7707728","220","941","6685","3152076",,"5706135","Luehea grandiflora","Luehea grandiflora",,"EML","2025-01-05 15:02:58.922","2025-01-05 15:02:28.694",FALSE,,"null",FALSE,"LATIN_AMERICA","LATIN_AMERICA","BRA","Brazil","BRA.25_1","São Paulo","BRA.25.565_2","São Paulo",,,"NE",,"895","895",,,"WGS84",,,,,,,,,,,,,,,,,,,"brazil_sao paulo_sao paulo_parque estadual jaragua","Brazil","São Paulo","São Paulo","parque estadual jaragua","splink_jabot","brazil_sao paulo_sao paulo_parque estadual jaragua","Brazil","São Paulo","São Paulo","parque estadual jaragua","splink_jabot","brazil_sao paulo_sao paulo_parque estadual jaragua","Brazil","São Paulo","São Paulo","parque estadual jaragua","splink_jabot","ok_same_resolution","Luehea grandiflora","Mart.","name_w_authors","Malvaceae","Luehea grandiflora","Mart.","species","name accepted","bfo-9095",,,"Luehea grandiflora Mart.","Luehea","Malvaceae","unknown","Luehea grandiflora"
"gbif","SPSF","39299","Machaerium aculeatum Raddi","Plantae","Fabaceae","Machaerium","2008","1","30","Brasil","Sp",,,"IF","PRESERVED_SPECIMEN","N.M.Ivanaukas","https://specieslink.net/col/13",,"F.M.Souza & R.C.Sousa & D.Souza & R.L.M.Garcia","-46.758333","-23.455556","2024-08-06 09:13:55","Raddi","1047",,,"Tracheophyta","Magnoliopsida","Fabales",,,"COLETA: Árvore, 5,5m. Espinhos no tronco e no ramo. Botões esverdeados.; GEOGRAFIA: Trilha do Pai Zé;",,,,"Parque Estadual do Jaraguá",,,,,,,,"GBIF","São Paulo","2008-02-11","Machaerium aculeatum Raddi",,"BR",,,"2008-01-30",,,,,,"ACCEPTED","SPECIES",,,,,,,,,,,,,,,"brazil","sao paulo","sao paulo","parque estadual do jaragua",,"locality","brazil_sao paulo_sao paulo_parque estadual jaragua","brazil_sao paulo_sao paulo_parque estadual jaragua",-23.462219,-46.763463,"locality","23641","1086907885",,,"CC_BY_4_0","Instituto Florestal","https://specieslink.net/guid/13/39299","Herbário Dom Bento José Pickel",,"Instituto Florestal",,,,"https://specieslink.net/guid/13/39299",,,,,,,,,,,"native",,,,"PRESENT",,,,,,,,,,,,,,,,,,,,,,,"30","30",,,,,,,,,"SOUTH_AMERICA",,,,,,,,,,,,,,,,,,,,,,,,,,,,,,,,,,,,,,,,,,,,,,,,"5354953",,,,,,,,,,,,,,,,,"Machaerium",,,"aculeatum",,,,,,,,"16ed67e5-fd70-4fd4-85c3-70ea2da627fe","BR","2025-01-05 15:02:57.665","847","0",,,,"INSTITUTION_MATCH_FUZZY;DIFFERENT_OWNER_INSTITUTION;INSTITUTION_COLLECTION_MISMATCH",,TRUE,FALSE,"5354953","5354953","6","7707728","220","1370","5386","2959589",,"5354953","Machaerium aculeatum","Machaerium aculeatum",,"EML","2025-01-05 15:02:57.665","2025-01-05 15:02:28.694",FALSE,,"null",FALSE,"LATIN_AMERICA","LATIN_AMERICA","BRA","Brazil","BRA.25_1","São Paulo","BRA.25.565_2","São Paulo",,,"NE",,"847","847",,,"WGS84",,,,,,,,,,,,,,,,,,,"brazil_sao paulo_sao paulo_parque estadual jaragua","Brazil","São Paulo","São Paulo","parque estadual jaragua","splink_jabot","brazil_sao paulo_sao paulo_parque estadual jaragua","Brazil","São Paulo","São Paulo","parque estadual jaragua","splink_jabot","brazil_sao paulo_sao paulo_parque estadual jaragua","Brazil","São Paulo","São Paulo","parque estadual jaragua","splink_jabot","ok_same_resolution","Machaerium aculeatum","Raddi","name_w_authors","Fabaceae","Machaerium aculeatum","Raddi","species","name accepted","bfo-29758",,,"Machaerium aculeatum Raddi","Machaerium","Fabaceae","unknown","Machaerium aculeatum"
"gbif","SPSF","39300","Machaerium nyctitans (Vell.) Benth.","Plantae","Fabaceae","Machaerium","2008","1","28","Brasil","Sp",,,"IF","PRESERVED_SPECIMEN","N.M.Ivanaukas","https://specieslink.net/col/13",,"R.Esteves & R.C.Sousa & D.Souza & J.M.Silva","-46.769444","-23.472222","2024-08-06 09:13:55","(Vell.) Benth.","295",,,"Tracheophyta","Magnoliopsida","Fabales",,,"COLETA: Árvore, 20m. Flores roxas. Botões e ramos da inflorescência ferrugineos.; GEOGRAFIA: Trilha das Garças;",,,,"Parque Estadual do Jaraguá",,,,,,,,"GBIF","São Paulo","2008-02-11","Machaerium nyctitans (Vell.) Benth.",,"BR",,,"2008-01-28",,,,,,"ACCEPTED","SPECIES",,,,,,,,,,,,,,,"brazil","sao paulo","sao paulo","parque estadual do jaragua",,"locality","brazil_sao paulo_sao paulo_parque estadual jaragua","brazil_sao paulo_sao paulo_parque estadual jaragua",-23.462219,-46.763463,"locality","23650","1086907896",,,"CC_BY_4_0","Instituto Florestal","https://specieslink.net/guid/13/39300","Herbário Dom Bento José Pickel",,"Instituto Florestal",,,,"https://specieslink.net/guid/13/39300",,,,,,,,,,,"native",,,,"PRESENT",,,,,,,,,,,,,,,,,,,,,,,"28","28",,,,,,,,,"SOUTH_AMERICA",,,,,,,,,,,,,,,,,,,,,,,,,,,,,,,,,,,,,,,,,,,,,,,,"5355127",,,,,,,,,,,,,,,,,"Machaerium",,,"nyctitans",,,,,,,,"16ed67e5-fd70-4fd4-85c3-70ea2da627fe","BR","2025-01-05 15:02:59.168","770","0",,,,"INSTITUTION_MATCH_FUZZY;DIFFERENT_OWNER_INSTITUTION;INSTITUTION_COLLECTION_MISMATCH",,TRUE,FALSE,"5355127","5355127","6","7707728","220","1370","5386","2959589",,"5355127","Machaerium nyctitans","Machaerium nyctitans",,"EML","2025-01-05 15:02:59.168","2025-01-05 15:02:28.694",FALSE,,"null",FALSE,"LATIN_AMERICA","LATIN_AMERICA","BRA","Brazil","BRA.25_1","São Paulo","BRA.25.565_2","São Paulo",,,"LC",,"770","770",,,"WGS84",,,,,,,,,,,,,,,,,,,"brazil_sao paulo_sao paulo_parque estadual jaragua","Brazil","São Paulo","São Paulo","parque estadual jaragua","splink_jabot","brazil_sao paulo_sao paulo_parque estadual jaragua","Brazil","São Paulo","São Paulo","parque estadual jaragua","splink_jabot","brazil_sao paulo_sao paulo_parque estadual jaragua","Brazil","São Paulo","São Paulo","parque estadual jaragua","splink_jabot","ok_same_resolution","Machaerium nyctitans","(Vell.) Benth.","name_w_authors","Fabaceae","Machaerium nyctitans","(Vell.) Benth.","species","name accepted","bfo-29774",,,"Machaerium nyctitans (Vell.) Benth.","Machaerium","Fabaceae","unknown","Machaerium nyctitans"
"gbif","SPSF","39301","Machaerium villosum Vogel","Plantae","Fabaceae","Machaerium","2007","5","8","Brasil","Sp",,,"IF","PRESERVED_SPECIMEN","N.M.Ivanaukas","https://specieslink.net/col/13",,"F.M.Souza & R.C.Sousa & M.F.Santos & S.J.Ribeiro","-46.766944","-23.4525","2024-08-06 09:13:55","Vogel","694",,,"Tracheophyta","Magnoliopsida","Fabales",,,"COLETA: Árvore, 8m. Frutos imaturos verdes.; GEOGRAFIA: Trilha do Mauro;",,,,"Parque Estadual do Jaraguá",,,,,,,,"GBIF","São Paulo","2007-11-29","Machaerium villosum Vogel",,"BR",,,"2007-05-08",,,,,,"ACCEPTED","SPECIES",,,,,,,,,,,,,,,"brazil","sao paulo","sao paulo","parque estadual do jaragua",,"locality","brazil_sao paulo_sao paulo_parque estadual jaragua","brazil_sao paulo_sao paulo_parque estadual jaragua",-23.462219,-46.763463,"locality","23655","1086907901",,,"CC_BY_4_0","Instituto Florestal","https://specieslink.net/guid/13/39301","Herbário Dom Bento José Pickel",,"Instituto Florestal",,,,"https://specieslink.net/guid/13/39301",,,,,,,,,,,"native",,,,"PRESENT",,,,,,,,,,,,,,,,,,,,,,,"128","128",,,,,,,,,"SOUTH_AMERICA",,,,,,,,,,,,,,,,,,,,,,,,,,,,,,,,,,,,,,,,,,,,,,,,"5354918",,,,,,,,,,,,,,,,,"Machaerium",,,"villosum",,,,,,,,"16ed67e5-fd70-4fd4-85c3-70ea2da627fe","BR","2025-01-05 15:02:59.168","1009","0",,,,"INSTITUTION_MATCH_FUZZY;DIFFERENT_OWNER_INSTITUTION;INSTITUTION_COLLECTION_MISMATCH",,TRUE,FALSE,"5354918","5354918","6","7707728","220","1370","5386","2959589",,"5354918","Machaerium villosum","Machaerium villosum",,"EML","2025-01-05 15:02:59.168","2025-01-05 15:02:28.694",FALSE,,"null",FALSE,"LATIN_AMERICA","LATIN_AMERICA","BRA","Brazil","BRA.25_1","São Paulo","BRA.25.565_2","São Paulo",,,"VU",,"1009","1009",,,"WGS84",,,,,,,,,,,,,,,,,,,"brazil_sao paulo_sao paulo_parque estadual jaragua","Brazil","São Paulo","São Paulo","parque estadual jaragua","splink_jabot","brazil_sao paulo_sao paulo_parque estadual jaragua","Brazil","São Paulo","São Paulo","parque estadual jaragua","splink_jabot","brazil_sao paulo_sao paulo_parque estadual jaragua","Brazil","São Paulo","São Paulo","parque estadual jaragua","splink_jabot","ok_same_resolution","Machaerium villosum","Vogel","name_w_authors","Fabaceae","Machaerium villosum","Vogel","species","name accepted","bfo-29784",,,"Machaerium villosum Vogel","Machaerium","Fabaceae","unknown","Machaerium villosum"
"gbif","SPF","220322","Macroptilium erythroloma (Mart. ex Benth.) Urb.","Plantae","Fabaceae","Macroptilium","2013","12","20","Brasil","São Paulo",,,"USP-IB","PRESERVED_SPECIMEN","Siniscalchi, CM; Beraldo, K","https://specieslink.net/col/7",,"Beraldo, K","-46.7665","-23.457667","2023-12-20 16:01:35","(Mart. ex Benth.) Urb.","56",,,"Tracheophyta","Magnoliopsida","Fabales",,,"Erva prostrada de caule volúvel, crescendo enrolada ao capim-gordura. Folhas macias. Corola vermelha, cálice verde.; Campo. Solo areno-pedregoso.",,,,"Parque Estadual do Jaraguá, Região mais alta do Parque. Próximo à antena da Tv Band.",,,,,,,,"GBIF","São Paulo","2014-05-01","Macroptilium erythroloma (Mart. ex Benth.) Urb.",,"BR",,,"2013-12-20",,,,,,"ACCEPTED","SPECIES",,,,,,,,,,,,,,,"brazil","sao paulo","sao paulo","parque estadual do jaragua, regiao mais alta do parque",,"locality","brazil_sao paulo_sao paulo","brazil_sao paulo_sao paulo",-23.65041685,-46.64802516,"county","331098","1829092360",,,"CC_BY_4_0","Universidade de São Paulo","https://specieslink.net/guid/7/220322","Herbário da Universidade de São Paulo",,"Instituto de Biociências da Universidade de São Paulo",,,,"https://specieslink.net/guid/7/220322",,,,,,,,,,,"native",,,,"PRESENT",,,,,,,,,,,,,,,,,,,,,,,"354","354",,,,,,,,,"SOUTH_AMERICA",,,,,,,,,,,,,,,,,,,,,,,,,,,,,,,,,,,,,,,,,,,,,,,,"2945076",,,,,,,,,,,,,,,,,"Macroptilium",,,"erythroloma",,,,,,,,"1bb3cae3-b91f-4109-8a2d-a1f05f2d6fd3","BR","2025-01-05 15:34:26.761","1113","0",,,,"CONTINENT_DERIVED_FROM_COORDINATES;INSTITUTION_MATCH_NONE",,TRUE,FALSE,"2945076","2945076","6","7707728","220","1370","5386","2945015",,"2945076","Macroptilium erythroloma","Macroptilium erythroloma",,"EML","2025-01-05 15:34:26.761","2025-01-05 15:24:14.62",FALSE,,"null",FALSE,"LATIN_AMERICA","LATIN_AMERICA","BRA","Brazil","BRA.25_1","São Paulo","BRA.25.565_2","São Paulo",,,"NE","https://images.cria.org.br/viewer/SPF00220322","1113","1113",,,"WGS84",,,,,,,,,,,,,,,,,,,"brazil_sao paulo_sao paulo","Brazil","São Paulo","São Paulo",,"ibge","brazil_sao paulo_sao paulo","Brazil","São Paulo","São Paulo",,"ibge","brazil_sao paulo_sao paulo","Brazil","São Paulo","São Paulo",,"ibge","check_local.2municip.","Macroptilium erythroloma","(Mart. ex Benth.) Urb.","name_w_authors","Fabaceae","Macroptilium erythroloma","(Mart. ex Benth.) Urb.","species","name accepted","bfo-29788",,,"Macroptilium erythroloma (Mart. ex Benth.) Urb.","Macroptilium","Fabaceae","unknown","Macroptilium erythroloma"
"gbif","Observations","229995933","Malvaviscus penduliflorus Moc. & Sessé ex DC.","Plantae","Malvaceae","Malvaviscus","2024","7","16","BR","São Paulo",,,"iNaturalist","HUMAN_OBSERVATION","Paula Romano",,,"Paula Romano","-46.759561","-23.455079","2024-07-27 21:57:16",,,,,"Tracheophyta","Magnoliopsida","Malvales",,,,,,,"Parque Estadual Jaraguá, São Paulo - SP, Brasil",,,,,,,,"GBIF",,"2024-07-17 23:18:12","Malvaviscus penduliflorus Moc. & Sessé ex DC.",,"BR",,"iNaturalist research-grade observations","2024-07-16T09:09",,,,,,"ACCEPTED","SPECIES",,,"2024/07/16 09:09","Parque Estadual Jaraguá, São Paulo - SP, Brasil",,,,,,,,,,,"brazil","sao paulo","parque estadual jaragua","parque estadual jaragua",,"locality","brazil_sao paulo_parque estadual jaragua","brazil_sao paulo",-22.2584562,-48.7420254,"state","813357","4919450117",,,"CC_BY_NC_4_0","iNaturalist.org","https://www.inaturalist.org/observations/229995933","Paula Romano",,,,,,"https://www.inaturalist.org/observations/229995933",,,,,,,,,,,,,,,"PRESENT",,,,,,,,,,,,,,,,,,,,,,"09:09:00-03:00","198","198",,,,,,,,,"SOUTH_AMERICA",,,,,,,,,,"31",,,,,,,,,,,,,,,,,,,,,,,,,,,,,,"515769935",,,,,,"165118",,"3152776",,,,,,,,,,,,,,,,,"Malvaviscus",,,"penduliflorus",,,,,,,,"50c9509d-22c7-4a22-a47d-8c48425ef4a7","US","2024-12-16 11:51:24.647",,,,,,"COORDINATE_ROUNDED;CONTINENT_DERIVED_FROM_COORDINATES;TAXON_MATCH_TAXON_ID_IGNORED","StillImage;StillImage",TRUE,FALSE,"3152776","3152776","6","7707728","220","941","6685","3152774",,"3152776","Malvaviscus penduliflorus","Malvaviscus penduliflorus",,"DWC_ARCHIVE","2024-12-16 11:51:24.647","2024-12-15 18:55:26.086",TRUE,,"null",FALSE,"LATIN_AMERICA","NORTH_AMERICA","BRA","Brazil","BRA.25_1","São Paulo","BRA.25.565_2","São Paulo",,,"NE",,,,,,"EPSG:4326",,,,,,,,,,,,,,,,,,,"brazil_sao paulo","Brazil","São Paulo",,,"gdam","brazil_sao paulo","Brazil","São Paulo",,,"gdam","brazil_sao paulo","Brazil","São Paulo",,,"gdam","check_local.2state","Malvaviscus penduliflorus","DC.","name_w_authors","Malvaceae","Malvaviscus penduliflorus","DC.","species","author misspelled","bfo-84952",,,"Malvaviscus penduliflorus DC.","Malvaviscus","Malvaceae","unknown","Malvaviscus penduliflorus"
"user","RB","RB01131989","Mandevilla emarginata (Vell.) C.Ezcurra","Plantae","Apocynaceae","Mandevilla","2013","12","20","Brasil","São Paulo",,,"JBRJ","Preserved Specimen","K. Beraldo",,,"K. Beraldo; V.G. França","-46.7663889","-23.4575",,"(Vell.) C.Ezcurra","53",,,,,,,,,,,,"Parque Estadual do Jaraguá. Região mais alta do Parque. Próximo à antena da Tv Band Parque Estadual do Jaraguá","23º27´27´´","46º45´59´´W",,,,,,,"São Paulo","2014-2",,,"BR",,,"2013-12-20","Campo. Solo areno-pedregoso",,,,,,"sp.","Physical Object",,,,"RB",,"Beraldo, K.","53","2013","Beraldo, K.","2014","Franca, V.G.","Beraldo",,"brazil","sao paulo","sao paulo","parque estadual do jaragua, regiao mais alta do parque, proximo a antena da tv band parque estadual do jaragua",,"locality","brazil_sao paulo_sao paulo","brazil_sao paulo_sao paulo",-23.65041685,-46.64802516,"county",,,,,,,,"SPF",,,,,,"urn:catalog:JBRJ:RB:1131989",,,,,,,,,,,,,,,,,,,,,,"RB 651334",,,,,,,,,,,,,,,,,,,,,,,,,,,,,,,,,,,,,,,,,,,,,,,,,,,,,,,,,,,,,,,,,,,,,,,,,,,,,,,,,,,,,,,,,,,,,,"emarginata",,,,,,,,,,,,,,,,,,,,,,,,,,,,,,,,,,,,,,,,,,,,,,,,,,,"jbrj-public-img.s3-sa-east-1.amazonaws.com/JPG/rb/1/13/19/89/01131989.jpg","1113",,,,,,,,,,,,,,,,,,,,,"2017-10-15 11:24:31+00","Angiospermas","brazil_sao paulo_sao paulo","Brazil","São Paulo","São Paulo",,"ibge","brazil_sao paulo_sao paulo","Brazil","São Paulo","São Paulo",,"ibge","brazil_sao paulo_sao paulo","Brazil","São Paulo","São Paulo",,"ibge","check_local.2municip.","Mandevilla emarginata","(Vell.) C.Ezcurra","name_w_authors","Apocynaceae","Mandevilla emarginata","(Vell.) C.Ezcurra","species","name accepted","bfo-4658",,,"Mandevilla emarginata (Vell.) C.Ezcurra","Mandevilla","Apocynaceae","low","Mandevilla emarginata"
"gbif","SPF","220294","Mandevilla tenuifolia (J.C.Mikan) Woodson","Plantae","Apocynaceae","Mandevilla","2013","10","11","Brasil","São Paulo",,,"USP-IB","PRESERVED_SPECIMEN","Beraldo, K","https://specieslink.net/col/7",,"Beraldo, K","-46.765083","-23.453889","2023-12-20 15:54:45","(J.C.Mikan) Woodson","33",,,"Tracheophyta","Magnoliopsida","Gentianales",,,"Erva ca. 10 cm alt. Raiz tuberosa, látex branco, botões vináceos.; Campo. Solo areno-pedregoso.",,,,"Parque Estadual do Jaraguá, Região mais alta do Parque. Próximo à antena da Tv Cultura.",,,,,,,,"GBIF","São Paulo","2014-05-01","Mandevilla tenuifolia (J.C.Mikan) Woodson",,"BR",,,"2013-10-11",,,,,,"ACCEPTED","SPECIES",,,,,,,,,,,,,,,"brazil","sao paulo","sao paulo","parque estadual do jaragua, regiao mais alta do parque",,"locality","brazil_sao paulo_sao paulo","brazil_sao paulo_sao paulo",-23.65041685,-46.64802516,"county","331090","1829092345",,,"CC_BY_4_0","Universidade de São Paulo","https://specieslink.net/guid/7/220294","Herbário da Universidade de São Paulo",,"Instituto de Biociências da Universidade de São Paulo",,,,"https://specieslink.net/guid/7/220294",,,,,,,,,,,"native",,,,"PRESENT",,,,,,,,,,,,,,,,,,,,,,,"284","284",,,,,,,,,"SOUTH_AMERICA",,,,,,,,,,,,,,,,,,,,,,,,,,,,,,,,,,,,,,,,,,,,,,,,"3615656",,,,,,,,,,,,,,,,,"Mandevilla",,,"tenuifolia",,,,,,,,"1bb3cae3-b91f-4109-8a2d-a1f05f2d6fd3","BR","2025-01-05 15:34:28.768","1121","0",,,,"CONTINENT_DERIVED_FROM_COORDINATES;INSTITUTION_MATCH_NONE",,TRUE,FALSE,"3615656","3615656","6","7707728","220","412","6701","3169658",,"3615656","Mandevilla tenuifolia","Mandevilla tenuifolia",,"EML","2025-01-05 15:34:28.768","2025-01-05 15:24:14.62",FALSE,,"null",FALSE,"LATIN_AMERICA","LATIN_AMERICA","BRA","Brazil","BRA.25_1","São Paulo","BRA.25.565_2","São Paulo",,,"NE","https://images.cria.org.br/viewer/SPF00220294","1121","1121",,,"WGS84",,,,,,,,,,,,,,,,,,,"brazil_sao paulo_sao paulo","Brazil","São Paulo","São Paulo",,"ibge","brazil_sao paulo_sao paulo","Brazil","São Paulo","São Paulo",,"ibge","brazil_sao paulo_sao paulo","Brazil","São Paulo","São Paulo",,"ibge","check_local.2municip.","Mandevilla tenuifolia","(J.C.Mikan) Woodson","name_w_authors","Apocynaceae","Mandevilla tenuifolia","(J.C.Mikan) Woodson","species","name accepted","bfo-4676",,,"Mandevilla tenuifolia (J.C.Mikan) Woodson","Mandevilla","Apocynaceae","unknown","Mandevilla tenuifolia"
