"data_source","collectionCode","catalogNumber","scientificName","kingdom","family","genus","year","month","day","country","stateProvince","county","coordinatePrecision","institutionCode","basisOfRecord","identifiedBy","collectionID","specificepithet","recordedBy","decimalLongitude","decimalLatitude","modified","scientificNameAuthorship","recordNumber","barcode","continentocean","phylum","class","order","minimumelevationinmeters","maximumelevationinmeters","occurrenceRemarks","yearIdentified","monthIdentified","dayIdentified","locality","verbatimLatitude","verbatimLongitude","typeStatus","infraspecificepithet","relatedcatalogitem","preparationtype","individualcount","downloadedFrom","municipality","dateIdentified","acceptedScientificName","bibliographicCitation","countryCode","datasetID","datasetName","eventDate","fieldNotes","habitat","identificationRemarks","latitude","longitude","taxonomicStatus","taxonRank","type","verbatimElevation","verbatimEventDate","verbatimLocality","collectionCode.new","collectionObs","recordedBy.new","recordNumber.new","year.new","identifiedBy.new","yearIdentified.new","recordedBy.aux","last.name","identifiedBy.aux","country.new","stateProvince.new","municipality.new","locality.new","locality.scrap","resol.orig","loc","loc.correct","latitude.gazetteer","longitude.gazetteer","resolution.gazetteer","X","gbifID","accessRights","language","license","publisher","references","rightsHolder","institutionID","ownerInstitutionCode","informationWithheld","dataGeneralizations","dynamicProperties","occurrenceID","recordedByID","individualCount","organismQuantity","organismQuantityType","sex","lifeStage","reproductiveCondition","caste","behavior","vitality","establishmentMeans","degreeOfEstablishment","pathway","georeferenceVerificationStatus","occurrenceStatus","preparations","disposition","associatedOccurrences","associatedReferences","associatedSequences","associatedTaxa","otherCatalogNumbers","organismID","organismName","organismScope","associatedOrganisms","previousIdentifications","organismRemarks","materialEntityID","materialEntityRemarks","verbatimLabel","materialSampleID","eventID","parentEventID","eventType","fieldNumber","eventTime","startDayOfYear","endDayOfYear","samplingProtocol","sampleSizeValue","sampleSizeUnit","samplingEffort","eventRemarks","locationID","higherGeographyID","higherGeography","continent","waterBody","islandGroup","island","verticalDatum","verbatimDepth","minimumDistanceAboveSurfaceInMeters","maximumDistanceAboveSurfaceInMeters","locationAccordingTo","locationRemarks","coordinateUncertaintyInMeters","pointRadiusSpatialFit","verbatimCoordinateSystem","verbatimSRS","footprintWKT","footprintSRS","footprintSpatialFit","georeferencedBy","georeferencedDate","georeferenceProtocol","georeferenceSources","georeferenceRemarks","geologicalContextID","earliestEonOrLowestEonothem","latestEonOrHighestEonothem","earliestEraOrLowestErathem","latestEraOrHighestErathem","earliestPeriodOrLowestSystem","latestPeriodOrHighestSystem","earliestEpochOrLowestSeries","latestEpochOrHighestSeries","earliestAgeOrLowestStage","latestAgeOrHighestStage","lowestBiostratigraphicZone","highestBiostratigraphicZone","lithostratigraphicTerms","group","formation","member","bed","identificationID","verbatimIdentification","identificationQualifier","identifiedByID","identificationReferences","identificationVerificationStatus","taxonID","scientificNameID","acceptedNameUsageID","parentNameUsageID","originalNameUsageID","nameAccordingToID","namePublishedInID","taxonConceptID","acceptedNameUsage","parentNameUsage","originalNameUsage","nameAccordingTo","namePublishedIn","namePublishedInYear","higherClassification","superfamily","subfamily","tribe","subtribe","genericName","subgenus","infragenericEpithet","specificEpithet","infraspecificEpithet","cultivarEpithet","verbatimTaxonRank","vernacularName","nomenclaturalCode","nomenclaturalStatus","taxonRemarks","datasetKey","publishingCountry","lastInterpreted","elevation","elevationAccuracy","depth","depthAccuracy","distanceFromCentroidInMeters","issue","mediaType","hasCoordinate","hasGeospatialIssues","taxonKey","acceptedTaxonKey","kingdomKey","phylumKey","classKey","orderKey","familyKey","genusKey","subgenusKey","speciesKey","species","verbatimScientificName","typifiedName","protocol","lastParsed","lastCrawled","repatriated","relativeOrganismQuantity","projectId","isSequenced","gbifRegion","publishedByGbifRegion","level0Gid","level0Name","level1Gid","level1Name","level2Gid","level2Name","level3Gid","level3Name","iucnRedListCategory","associatedMedia","minimumElevationInMeters","maximumElevationInMeters","minimumDepthInMeters","maximumDepthInMeters","geodeticDatum","verbatimCoordinates","scientificNameAuthorship.y","imageCollectionCode","virtualDuplicates","duplicates","DeterminationQualifier","recordedByExtra","dateCollected","dateCollectedMax","verbatimElevationMax","measurementUnit","verbatimLatitudeMax","verbatimLongitudeMax","updatedBy","dateUpdated","right","modified_incomplete","Clado","loc.correct.mun","NAME_0","NAME_1","NAME_2","NAME_3","source","loc.correct.mun.1","NAME_0.1","NAME_1.1","NAME_2.1","NAME_3.1","source.1","loc.correct.mun.2","NAME_0.2","NAME_1.2","NAME_2.2","NAME_3.2","source.2","loc.check","scientificName.new","scientificNameAuthorship.new","scientificNameStatus","suggestedFamily","suggestedName","suggestedAuthorship","taxon.rank","tax.notes","id","accepted.tax.name","accepted.tax.authorship","scientificNameFull","genus.new","family.new","tax.check","species.new"
"gbif","SPF","225776","Achyrocline albicans Griseb.","Plantae","Asteraceae","Achyrocline","2013","8","23","Brasil","São Paulo",,,"USP-IB","PRESERVED_SPECIMEN","França, VG","https://specieslink.net/col/7",,"França, VG","-46.765556","-23.456944","2024-01-30 15:18:45","Griseb.","6",,,"Tracheophyta","Magnoliopsida","Asterales",,,"Arbusto de 2 m alt. Heliófita. Capítulos marrom claros. Flores amarelas.; Solo arenoso.",,,,"Parque Estadual do Jaraguá, Próximo à antena da TV Band. Crescendo entre rochas.",,,,,,,,"GBIF","São Paulo","2014-07-01","Achyrocline albicans Griseb.",,"BR",,,"2013-08-23",,,,,,"ACCEPTED","SPECIES",,,,,,,,,,,,,,,"brazil","sao paulo","sao paulo","parque estadual do jaragua",,"locality","brazil_sao paulo_sao paulo_parque estadual jaragua","brazil_sao paulo_sao paulo_parque estadual jaragua",-23.462219,-46.763463,"locality","363585","1944965309",,,"CC_BY_4_0","Universidade de São Paulo","https://specieslink.net/guid/7/225776","Herbário da Universidade de São Paulo",,"Instituto de Biociências da Universidade de São Paulo",,,,"https://specieslink.net/guid/7/225776",,,,,,,,,,,"native",,,,"PRESENT",,,,,,,,,,,,,,,,,,,,,,,"235","235",,,,,,,,,"SOUTH_AMERICA",,,,,,,,,,,,,,,,,,,,,,,,,,,,,,,,,,,,,,,,,,,,,,,,"3139542",,,,,,,,,,,,,,,,,"Achyrocline",,,"albicans",,,,,,,,"1bb3cae3-b91f-4109-8a2d-a1f05f2d6fd3","BR","2025-01-05 15:34:29.087","109","0",,,,"CONTINENT_DERIVED_FROM_COORDINATES;INSTITUTION_MATCH_NONE",,TRUE,FALSE,"3139542","3139542","6","7707728","220","414","3065","7994043",,"3139542","Achyrocline albicans","Achyrocline albicans",,"EML","2025-01-05 15:34:29.087","2025-01-05 15:24:14.62",FALSE,,"null",FALSE,"LATIN_AMERICA","LATIN_AMERICA","BRA","Brazil","BRA.25_1","São Paulo","BRA.25.565_2","São Paulo",,,"NE",,"109","109",,,"WGS84",,,,,,,,,,,,,,,,,,,"brazil_sao paulo_sao paulo_parque estadual jaragua","Brazil","São Paulo","São Paulo","parque estadual jaragua","splink_jabot","brazil_sao paulo_sao paulo_parque estadual jaragua","Brazil","São Paulo","São Paulo","parque estadual jaragua","splink_jabot","brazil_sao paulo_sao paulo_parque estadual jaragua","Brazil","São Paulo","São Paulo","parque estadual jaragua","splink_jabot","ok_same_resolution","Achyrocline albicans","Griseb.","name_w_authors","Asteraceae","Achyrocline albicans","Griseb.","species","name accepted","bfo-102956",,,"Achyrocline albicans Griseb.","Achyrocline","Asteraceae","unknown","Achyrocline albicans"
"gbif","SPSF","35093","Achyrocline satureioides (Lam.) DC.","Plantae","Asteraceae","Achyrocline","2005","3","8","Brasil","Sp",,,"IF","PRESERVED_SPECIMEN",,"https://specieslink.net/col/13",,"F. A. R. D. P. Arzolla & G.V.Menezes & S.B.Nogueira","-46.766111","-23.456944","2024-08-06 09:13:02","(Lam.) DC.","887",,,"Tracheophyta","Magnoliopsida","Asterales",,,"COLETA: Campo sobre quartzito.&nf;Herbácea, flores amarelas.; GEOGRAFIA: proximo ao Pico do Jaraguá.;",,,,"Parque Estadual do Jaraguá",,,,,,,,"GBIF","São Paulo",,"Achyrocline satureioides (Lam.) DC.",,"BR",,,"2005-03-08",,,,,,"ACCEPTED","SPECIES",,,,,,,,,,,,,,,"brazil","sao paulo","sao paulo","parque estadual do jaragua",,"locality","brazil_sao paulo_sao paulo_parque estadual jaragua","brazil_sao paulo_sao paulo_parque estadual jaragua",-23.462219,-46.763463,"locality","21610","1086903795",,,"CC_BY_4_0","Instituto Florestal","https://specieslink.net/guid/13/35093","Herbário Dom Bento José Pickel",,"Instituto Florestal",,,,"https://specieslink.net/guid/13/35093",,,,,,,,,,,"native",,,,"PRESENT",,,,,,,,,,,,,,,,,,,,,,,"67","67",,,,,,,,,"SOUTH_AMERICA",,,,,,,,,,,,,,,,,,,,,,,,,,,,,,,,,,,,,,,,,,,,,,,,"3139534",,,,,,,,,,,,,,,,,"Achyrocline",,,"satureioides",,,,,,,,"16ed67e5-fd70-4fd4-85c3-70ea2da627fe","BR","2025-01-05 15:03:00.042","1100","0",,,,"INSTITUTION_MATCH_FUZZY;DIFFERENT_OWNER_INSTITUTION;INSTITUTION_COLLECTION_MISMATCH",,TRUE,FALSE,"3139534","3139534","6","7707728","220","414","3065","7994043",,"3139534","Achyrocline satureioides","Achyrocline satureioides",,"EML","2025-01-05 15:03:00.042","2025-01-05 15:02:28.694",FALSE,,"null",FALSE,"LATIN_AMERICA","LATIN_AMERICA","BRA","Brazil","BRA.25_1","São Paulo","BRA.25.565_2","São Paulo",,,"NE",,"1100","1100",,,"WGS84",,,,,,,,,,,,,,,,,,,"brazil_sao paulo_sao paulo_parque estadual jaragua","Brazil","São Paulo","São Paulo","parque estadual jaragua","splink_jabot","brazil_sao paulo_sao paulo_parque estadual jaragua","Brazil","São Paulo","São Paulo","parque estadual jaragua","splink_jabot","brazil_sao paulo_sao paulo_parque estadual jaragua","Brazil","São Paulo","São Paulo","parque estadual jaragua","splink_jabot","ok_same_resolution","Achyrocline satureioides","(Lam.) DC.","name_w_authors","Asteraceae","Achyrocline satureioides","(Lam.) DC.","species","name accepted","bfo-108826",,,"Achyrocline satureioides (Lam.) DC.","Achyrocline","Asteraceae","unknown","Achyrocline satureioides"
"gbif","SPSF","39986","Aegiphila sellowiana Cham.","Plantae","Lamiaceae","Aegiphila","2007","12","4","Brasil","Sp",,,"IF","PRESERVED_SPECIMEN","G.A.D.C. Franco","https://specieslink.net/col/13",,"F.M.Souza & R.C.Sousa & W. Corrêa & A.N.Oliveira","-46.767222","-23.452778","2024-08-06 09:14:19","Cham","1035",,,"Tracheophyta","Magnoliopsida","Lamiales",,,"COLETA: Árvore, 7m. Botões verdes.; GEOGRAFIA: Trilha do Mauro;",,,,"Parque Estadual do Jaraguá",,,,,,,,"GBIF","São Paulo","2008-04-08","Aegiphila verticillata Vell.",,"BR",,,"2007-12-04",,,,,,"SYNONYM","SPECIES",,,,,,,,,,,,,,,"brazil","sao paulo","sao paulo","parque estadual do jaragua",,"locality","brazil_sao paulo_sao paulo_parque estadual jaragua","brazil_sao paulo_sao paulo_parque estadual jaragua",-23.462219,-46.763463,"locality","24155","1086908569",,,"CC_BY_4_0","Instituto Florestal","https://specieslink.net/guid/13/39986","Herbário Dom Bento José Pickel",,"Instituto Florestal",,,,"https://specieslink.net/guid/13/39986",,,,,,,,,,,,,,,"PRESENT",,,,,,,,,,,,,,,,,,,,,,,"338","338",,,,,,,,,"SOUTH_AMERICA",,,,,,,,,,,,,,,,,,,,,,,,,,,,,,,,,,,,,,,,,,,,,,,,"3890115",,,,,,,,,,,,,,,,,"Aegiphila",,,"sellowiana",,,,,,,,"16ed67e5-fd70-4fd4-85c3-70ea2da627fe","BR","2025-01-05 15:02:58.925","1003","0",,,,"INSTITUTION_MATCH_FUZZY;DIFFERENT_OWNER_INSTITUTION;INSTITUTION_COLLECTION_MISMATCH",,TRUE,FALSE,"3890699","3890115","6","7707728","220","408","2497","9156446",,"3890115","Aegiphila verticillata","Aegiphila sellowiana",,"EML","2025-01-05 15:02:58.925","2025-01-05 15:02:28.694",FALSE,,"null",FALSE,"LATIN_AMERICA","LATIN_AMERICA","BRA","Brazil","BRA.25_1","São Paulo","BRA.25.565_2","São Paulo",,,"NE",,"1003","1003",,,"WGS84",,,,,,,,,,,,,,,,,,,"brazil_sao paulo_sao paulo_parque estadual jaragua","Brazil","São Paulo","São Paulo","parque estadual jaragua","splink_jabot","brazil_sao paulo_sao paulo_parque estadual jaragua","Brazil","São Paulo","São Paulo","parque estadual jaragua","splink_jabot","brazil_sao paulo_sao paulo_parque estadual jaragua","Brazil","São Paulo","São Paulo","parque estadual jaragua","splink_jabot","ok_same_resolution","Aegiphila integrifolia","(Jacq.) Moldenke","name_w_authors","Lamiaceae","Aegiphila integrifolia","(Jacq.) Moldenke","species","replaced synonym","bfo-23320","Aegiphila integrifolia","(Jacq.) Moldenke","Aegiphila integrifolia (Jacq.) Moldenke","Aegiphila","Lamiaceae","unknown","Aegiphila integrifolia"
"gbif","SPSF","40047","Albizia polycephala (Benth.) Killip","Plantae","Fabaceae","Albizia","2007","11","8","Brasil","Sp",,,"IF","PRESERVED_SPECIMEN","G.A.D.C. Franco","https://specieslink.net/col/13",,"R.Esteves & R.C.Sousa & H.F.A.Pereira & A.N.Oliveira","-46.766944","-23.4525","2024-08-06 09:13:45","(K. & H.B.) Killip","269",,,"Tracheophyta","Magnoliopsida","Fabales",,,"COLETA: Árvore, 5m. Flores com estames brancos e botões de cor verde.; GEOGRAFIA: Trilha do Mauro;",,,,"Parque Estadual do Jaraguá",,,,,,,,"GBIF","São Paulo","2008-04-09","Albizia polycephala (Benth.) Killip",,"BR",,,"2007-11-08",,,,,,"ACCEPTED","SPECIES",,,,,,,,,,,,,,,"brazil","sao paulo","sao paulo","parque estadual do jaragua",,"locality","brazil_sao paulo_sao paulo_parque estadual jaragua","brazil_sao paulo_sao paulo_parque estadual jaragua",-23.462219,-46.763463,"locality","24222","1086908649",,,"CC_BY_4_0","Instituto Florestal","https://specieslink.net/guid/13/40047","Herbário Dom Bento José Pickel",,"Instituto Florestal",,,,"https://specieslink.net/guid/13/40047",,,,,,,,,,,"native",,,,"PRESENT",,,,,,,,,,,,,,,,,,,,,,,"312","312",,,,,,,,,"SOUTH_AMERICA",,,,,,,,,,,,,,,,,,,,,,,,,,,,,,,,,,,,,,,,,,,,,,,,"2973294",,,,,,,,,,,,,,,,,"Albizia",,,"polycephala",,,,,,,,"16ed67e5-fd70-4fd4-85c3-70ea2da627fe","BR","2025-01-05 15:02:57.474","1009","0",,,,"INSTITUTION_MATCH_FUZZY;DIFFERENT_OWNER_INSTITUTION;INSTITUTION_COLLECTION_MISMATCH",,TRUE,FALSE,"2973294","2973294","6","7707728","220","1370","5386","2972897",,"2973294","Albizia polycephala","Albizia polycephala",,"EML","2025-01-05 15:02:57.474","2025-01-05 15:02:28.694",FALSE,,"null",FALSE,"LATIN_AMERICA","LATIN_AMERICA","BRA","Brazil","BRA.25_1","São Paulo","BRA.25.565_2","São Paulo",,,"NE",,"1009","1009",,,"WGS84",,,,,,,,,,,,,,,,,,,"brazil_sao paulo_sao paulo_parque estadual jaragua","Brazil","São Paulo","São Paulo","parque estadual jaragua","splink_jabot","brazil_sao paulo_sao paulo_parque estadual jaragua","Brazil","São Paulo","São Paulo","parque estadual jaragua","splink_jabot","brazil_sao paulo_sao paulo_parque estadual jaragua","Brazil","São Paulo","São Paulo","parque estadual jaragua","splink_jabot","ok_same_resolution","Albizia polycephala","(Benth.) Killip ex Record","name_w_authors","Fabaceae","Albizia polycephala","(Benth.) Killip ex Record","species","author misspelled","bfo-18067",,,"Albizia polycephala (Benth.) Killip ex Record","Albizia","Fabaceae","unknown","Albizia polycephala"
"gbif","SPSF","40005","Alchornea sidifolia Müll.Arg.","Plantae","Euphorbiaceae","Alchornea","2007","9","24","Brasil","Sp",,,"IF","PRESERVED_SPECIMEN","G.A.D.C. Franco","https://specieslink.net/col/13",,"R.Esteves & R.C.Sousa & H.F.A.Pereira & R.L.M.Garcia","-46.771667","-23.473056","2024-08-06 09:15:06","Müll. Arg.","248",,,"Tracheophyta","Magnoliopsida","Malpighiales",,,"COLETA: Árvore, 8m. Botões florais esverdeados.; GEOGRAFIA: Trilha das Garças;",,,,"Parque Estadual do Jaraguá",,,,,,,,"GBIF","São Paulo","2007-10-31","Alchornea sidifolia Müll.Arg.",,"BR",,,"2007-09-24",,,,,,"ACCEPTED","SPECIES",,,,,,,,,,,,,,,"brazil","sao paulo","sao paulo","parque estadual do jaragua",,"locality","brazil_sao paulo_sao paulo_parque estadual jaragua","brazil_sao paulo_sao paulo_parque estadual jaragua",-23.462219,-46.763463,"locality","24186","1086908606",,,"CC_BY_4_0","Instituto Florestal","https://specieslink.net/guid/13/40005","Herbário Dom Bento José Pickel",,"Instituto Florestal",,,,"https://specieslink.net/guid/13/40005",,,,,,,,,,,"native",,,,"PRESENT",,,,,,,,,,,,,,,,,,,,,,,"267","267",,,,,,,,,"SOUTH_AMERICA",,,,,,,,,,,,,,,,,,,,,,,,,,,,,,,,,,,,,,,,,,,,,,,,"3055491",,,,,,,,,,,,,,,,,"Alchornea",,,"sidifolia",,,,,,,,"16ed67e5-fd70-4fd4-85c3-70ea2da627fe","BR","2025-01-05 15:02:57.441","761","0",,,,"INSTITUTION_MATCH_FUZZY;DIFFERENT_OWNER_INSTITUTION;INSTITUTION_COLLECTION_MISMATCH",,TRUE,FALSE,"3055491","3055491","6","7707728","220","1414","4691","3055345",,"3055491","Alchornea sidifolia","Alchornea sidifolia",,"EML","2025-01-05 15:02:57.441","2025-01-05 15:02:28.694",FALSE,,"null",FALSE,"LATIN_AMERICA","LATIN_AMERICA","BRA","Brazil","BRA.25_1","São Paulo","BRA.25.565_2","São Paulo",,,"NE",,"761","761",,,"WGS84",,,,,,,,,,,,,,,,,,,"brazil_sao paulo_sao paulo_parque estadual jaragua","Brazil","São Paulo","São Paulo","parque estadual jaragua","splink_jabot","brazil_sao paulo_sao paulo_parque estadual jaragua","Brazil","São Paulo","São Paulo","parque estadual jaragua","splink_jabot","brazil_sao paulo_sao paulo_parque estadual jaragua","Brazil","São Paulo","São Paulo","parque estadual jaragua","splink_jabot","ok_same_resolution","Alchornea sidifolia","Müll.Arg.","name_w_authors","Euphorbiaceae","Alchornea sidifolia","Müll.Arg.","species","name accepted","bfo-35652",,,"Alchornea sidifolia Müll.Arg.","Alchornea","Euphorbiaceae","unknown","Alchornea sidifolia"
"gbif","SPSF","39288","Alchornea triplinervia (Spreng.) Müll.Arg.","Plantae","Euphorbiaceae","Alchornea","2008","1","31","Brasil","Sp",,,"IF","PRESERVED_SPECIMEN","F.M.Souza","https://specieslink.net/col/13",,"F.M.Souza & R.C.Sousa & D.Souza & C.D.Lima","-46.774444","-23.456389","2024-08-06 09:15:06","(Müll.Arg.)","1057",,,"Tracheophyta","Magnoliopsida","Malpighiales",,,"COLETA: Árvore, 14m. Frutos imaturos verdes.; GEOGRAFIA: Trilha do Mauro;",,,,"Parque Estadual do Jaraguá",,,,,,,,"GBIF","São Paulo","2008-01-31","Alchornea triplinervia (Spreng.) Müll.Arg.",,"BR",,,"2008-01-31",,,,,,"ACCEPTED","SPECIES",,,,,,,,,,,,,,,"brazil","sao paulo","sao paulo","parque estadual do jaragua",,"locality","brazil_sao paulo_sao paulo_parque estadual jaragua","brazil_sao paulo_sao paulo_parque estadual jaragua",-23.462219,-46.763463,"locality","23679","1086907926",,,"CC_BY_4_0","Instituto Florestal","https://specieslink.net/guid/13/39288","Herbário Dom Bento José Pickel",,"Instituto Florestal",,,,"https://specieslink.net/guid/13/39288",,,,,,,,,,,"native",,,,"PRESENT",,,,,,,,,,,,,,,,,,,,,,,"31","31",,,,,,,,,"SOUTH_AMERICA",,,,,,,,,,,,,,,,,,,,,,,,,,,,,,,,,,,,,,,,,,,,,,,,"3055511",,,,,,,,,,,,,,,,,"Alchornea",,,"triplinervia",,,,,,,,"16ed67e5-fd70-4fd4-85c3-70ea2da627fe","BR","2025-01-05 15:02:57.666","896","0",,,,"INSTITUTION_MATCH_FUZZY;DIFFERENT_OWNER_INSTITUTION;INSTITUTION_COLLECTION_MISMATCH",,TRUE,FALSE,"3055511","3055511","6","7707728","220","1414","4691","3055345",,"3055511","Alchornea triplinervia","Alchornea triplinervia",,"EML","2025-01-05 15:02:57.666","2025-01-05 15:02:28.694",FALSE,,"null",FALSE,"LATIN_AMERICA","LATIN_AMERICA","BRA","Brazil","BRA.25_1","São Paulo","BRA.25.565_2","São Paulo",,,"LC",,"896","896",,,"WGS84",,,,,,,,,,,,,,,,,,,"brazil_sao paulo_sao paulo_parque estadual jaragua","Brazil","São Paulo","São Paulo","parque estadual jaragua","splink_jabot","brazil_sao paulo_sao paulo_parque estadual jaragua","Brazil","São Paulo","São Paulo","parque estadual jaragua","splink_jabot","brazil_sao paulo_sao paulo_parque estadual jaragua","Brazil","São Paulo","São Paulo","parque estadual jaragua","splink_jabot","ok_same_resolution","Alchornea triplinervia","(Spreng.) Müll.Arg.","name_w_authors","Euphorbiaceae","Alchornea triplinervia","(Spreng.) Müll.Arg.","species","name accepted","bfo-17458",,,"Alchornea triplinervia (Spreng.) Müll.Arg.","Alchornea","Euphorbiaceae","unknown","Alchornea triplinervia"
"gbif","SPSF","39966","Allophylus edulis (A.St.-Hil., A.Juss. & Cambess.) Radlk.","Plantae","Sapindaceae","Allophylus","2007","8","7","Brasil","Sp",,,"IF","PRESERVED_SPECIMEN","G.A.D.C. Franco","https://specieslink.net/col/13",,"R.Esteves & R.C.Sousa & J.B.Silva & J.M.Silva","-46.763333","-23.451944","2024-08-06 09:16:56","(St.Hil.,Camb. & A.Juss) Radlk","182",,,"Tracheophyta","Magnoliopsida","Sapindales",,,"COLETA: Arvoreta, 4m. Flores brancas perfumadas, presença de polinizadores.; GEOGRAFIA: Trilha do Pai Zé;",,,,"Parque Estadual do Jaraguá",,,,,,,,"GBIF","São Paulo","2007-08-28","Allophylus edulis (A.St.-Hil., Cambess. & A.Juss.) Radlk. ex Warm.",,"BR",,,"2007-08-07",,,,,,"SYNONYM","SPECIES",,,,,,,,,,,,,,,"brazil","sao paulo","sao paulo","parque estadual do jaragua",,"locality","brazil_sao paulo_sao paulo_parque estadual jaragua","brazil_sao paulo_sao paulo_parque estadual jaragua",-23.462219,-46.763463,"locality","24144","1086908555",,,"CC_BY_4_0","Instituto Florestal","https://specieslink.net/guid/13/39966","Herbário Dom Bento José Pickel",,"Instituto Florestal",,,,"https://specieslink.net/guid/13/39966",,,,,,,,,,,"native",,,,"PRESENT",,,,,,,,,,,,,,,,,,,,,,,"219","219",,,,,,,,,"SOUTH_AMERICA",,,,,,,,,,,,,,,,,,,,,,,,,,,,,,,,,,,,,,,,,,,,,,,,"7264964",,,,,,,,,,,,,,,,,"Allophylus",,,"edulis",,,,,,,,"16ed67e5-fd70-4fd4-85c3-70ea2da627fe","BR","2025-01-05 15:02:58.906","970","0",,,,"INSTITUTION_MATCH_FUZZY;DIFFERENT_OWNER_INSTITUTION;INSTITUTION_COLLECTION_MISMATCH",,TRUE,FALSE,"7883158","7264964","6","7707728","220","933","6657","3189992",,"7264964","Allophylus edulis","Allophylus edulis",,"EML","2025-01-05 15:02:58.906","2025-01-05 15:02:28.694",FALSE,,"null",FALSE,"LATIN_AMERICA","LATIN_AMERICA","BRA","Brazil","BRA.25_1","São Paulo","BRA.25.565_2","São Paulo",,,"LC",,"970","970",,,"WGS84",,,,,,,,,,,,,,,,,,,"brazil_sao paulo_sao paulo_parque estadual jaragua","Brazil","São Paulo","São Paulo","parque estadual jaragua","splink_jabot","brazil_sao paulo_sao paulo_parque estadual jaragua","Brazil","São Paulo","São Paulo","parque estadual jaragua","splink_jabot","brazil_sao paulo_sao paulo_parque estadual jaragua","Brazil","São Paulo","São Paulo","parque estadual jaragua","splink_jabot","ok_same_resolution","Allophylus edulis","(A.St.-Hil. et al.) Hieron. ex Niederl.","name_w_authors","Sapindaceae","Allophylus edulis","(A.St.-Hil. et al.) Hieron. ex Niederl.","species","name accepted","bfo-20873",,,"Allophylus edulis (A.St.-Hil. et al.) Hieron. ex Niederl.","Allophylus","Sapindaceae","unknown","Allophylus edulis"
"gbif","SPF","220301","Alternanthera regelii (Seub.) Schinz","Plantae","Amaranthaceae","Alternanthera","2013","9","13","Brasil","São Paulo",,,"USP-IB","PRESERVED_SPECIMEN","Beraldo, K","https://specieslink.net/col/7",,"Beraldo, K","-46.76625","-23.457472","2023-12-20 15:53:53","(Seub.) Schinz","22",,,"Tracheophyta","Magnoliopsida","Caryophyllales",,,"Erva prostrada, ca. 1 m alt. Caule vermelho, flores creme.; Campo. Solo areno-pedregoso.",,,,"Parque Estadual do Jaraguá, Região mais alta do Parque. Próximo à antena da Tv Band.",,,,,,,,"GBIF","São Paulo","2013-11-01","Alternanthera regelii (Seub.) Schinz",,"BR",,,"2013-09-13",,,,,,"ACCEPTED","SPECIES",,,,,,,,,,,,,,,"brazil","sao paulo","sao paulo","parque estadual do jaragua, regiao mais alta do parque",,"locality","brazil_sao paulo_sao paulo","brazil_sao paulo_sao paulo",-23.65041685,-46.64802516,"county","331142","1829092475",,,"CC_BY_4_0","Universidade de São Paulo","https://specieslink.net/guid/7/220301","Herbário da Universidade de São Paulo",,"Instituto de Biociências da Universidade de São Paulo",,,,"https://specieslink.net/guid/7/220301",,,,,,,,,,,"native",,,,"PRESENT",,,,,,,,,,,,,,,,,,,,,,,"256","256",,,,,,,,,"SOUTH_AMERICA",,,,,,,,,,,,,,,,,,,,,,,,,,,,,,,,,,,,,,,,,,,,,,,,"3674870",,,,,,,,,,,,,,,,,"Alternanthera",,,"regelii",,,,,,,,"1bb3cae3-b91f-4109-8a2d-a1f05f2d6fd3","BR","2025-01-05 15:34:27.856","1114","0",,,,"CONTINENT_DERIVED_FROM_COORDINATES;INSTITUTION_MATCH_NONE",,TRUE,FALSE,"3674870","3674870","6","7707728","220","422","3064","3084921",,"3674870","Alternanthera regelii","Alternanthera regelii",,"EML","2025-01-05 15:34:27.856","2025-01-05 15:24:14.62",FALSE,,"null",FALSE,"LATIN_AMERICA","LATIN_AMERICA","BRA","Brazil","BRA.25_1","São Paulo","BRA.25.565_2","São Paulo",,,"NE","https://images.cria.org.br/viewer/SPF00220301","1114","1114",,,"WGS84",,,,,,,,,,,,,,,,,,,"brazil_sao paulo_sao paulo","Brazil","São Paulo","São Paulo",,"ibge","brazil_sao paulo_sao paulo","Brazil","São Paulo","São Paulo",,"ibge","brazil_sao paulo_sao paulo","Brazil","São Paulo","São Paulo",,"ibge","check_local.2municip.","Alternanthera regelii","(Seub.) Schinz","name_w_authors","Amaranthaceae","Alternanthera regelii","(Seub.) Schinz","species","name accepted","bfo-26329",,,"Alternanthera regelii (Seub.) Schinz","Alternanthera","Amaranthaceae","unknown","Alternanthera regelii"
