"UC","Grupos","Família","Gênero","Espécie","Autor","Táxon_completo","Barcode","BD_Origem","Herbário","Coletor","Número_da_Coleta","Origem_FFBr","ConfiançaID","Localidade","Já listada"
"ESTAÇÃO ECOLÓGICA JURÉIA-ITATINS","Angiosperms","Marantaceae","Calathea",,"G.Mey.","MARANTACEAE Calathea G.Mey.","247631","GBIF",,,"793",,"Latão","Estação Ecológica Juréia-Itatins, Trilha do Imperador, mata próximo ao alojamento","Não"
"ESTAÇÃO ECOLÓGICA JURÉIA-ITATINS","Angiosperms","Malvaceae","Callianthe","striata","(Dicks. ex Lindl.) Donnel","MALVACEAE Callianthe striata (Dicks. ex Lindl.) Donnel","269131","GBIF",,,"1365","Native","Latão","Estação Ecológica Juréia-Itatins, Serra da Juréia, Caminho do Imperador","Não"
"ESTAÇÃO ECOLÓGICA JURÉIA-ITATINS","Angiosperms","Calophyllaceae","Calophyllum","brasiliense","Cambess.","CALOPHYLLACEAE Calophyllum brasiliense Cambess.","100632848","GBIF",,,"960","Native","Latão","Estação ecológica Juréia-Itatins, margem do rio Verde.","Não"
"ESTAÇÃO ECOLÓGICA JURÉIA-ITATINS","Angiosperms","Calophyllaceae","Calophyllum","longifolium","Willd.","CALOPHYLLACEAE Calophyllum longifolium Willd.","100632844","GBIF",,,"276","Native","Latão","Estação Ecológica Juréia-Itatins, trilha da Figueira Grande.","Não"
"ESTAÇÃO ECOLÓGICA JURÉIA-ITATINS","Angiosperms","Calyceraceae",,,"R.Br. ex Rich.","CALYCERACEAE Calyceraceae R.Br. ex Rich.","24570","GBIF",,,"4473",,"Latão","Estação Ecológica Juréia-Itatins.","Não"
"ESTAÇÃO ECOLÓGICA JURÉIA-ITATINS","Angiosperms","Cyperaceae","Calyptrocarya","glomerulata","(Brongn.) Urb.","CYPERACEAE Calyptrocarya glomerulata (Brongn.) Urb.","248714","GBIF",,,"2516","Native","Latão","Estação Ecológica Juréia-Itatins, Restinga do rio Verde","Não"
"ESTAÇÃO ECOLÓGICA JURÉIA-ITATINS","Angiosperms","Campanulaceae",,,"A.Juss.","CAMPANULACEAE Campanulaceae A.Juss.","347688","GBIF",,,"767",,"Latão","Estação Ecológica Juréia-Itatins","Não"
"ESTAÇÃO ECOLÓGICA JURÉIA-ITATINS","Angiosperms","Myrtaceae","Campomanesia","guaviroba","(DC.) Kiaersk.","MYRTACEAE Campomanesia guaviroba (DC.) Kiaersk.","249126","GBIF",,,"889","Native","Latão","Estação Ecológica Juréia-Itatins, Caminho do Imperador","Não"
"ESTAÇÃO ECOLÓGICA JURÉIA-ITATINS","Angiosperms","Myrtaceae","Campomanesia","schlechtendaliana","(O.Berg) Nied.","MYRTACEAE Campomanesia schlechtendaliana (O.Berg) Nied.","299213B","GBIF",,,"41","Native","Latão","Estação Ecológica Juréia-Itatins, Núcleo Arpoador (Guarauzinho)","Não"
"ESTAÇÃO ECOLÓGICA JURÉIA-ITATINS","Angiosperms","Asteraceae","Campuloclinium","purpurascens","(Sch.Bip. ex Baker) R.M.King & H.Rob.","ASTERACEAE Campuloclinium purpurascens (Sch.Bip. ex Baker) R.M.King & H.Rob.","256482","GBIF",,,"7388","Native","Latão","Estação Ecológica Juréia-Itatins, Mata Atlântica, em beira de lavoura abandonada, em local alagado","Não"
"ESTAÇÃO ECOLÓGICA JURÉIA-ITATINS","Ferns and Lycophytes","Polypodiaceae","Campyloneurum","rigidum","Sm.","POLYPODIACEAE Campyloneurum rigidum Sm.","903","GBIF",,,"1748","Native","Latão","Estação Ecológica Juréia-Itatins, Praia do Arpoador, afloramento rochoso na transição entre a amta de restinga e a mata de encosta.","Não"
"ESTAÇÃO ECOLÓGICA JURÉIA-ITATINS","Bryophytes","Burmanniaceae","Campylopus","trachyblepharon","(Müll.Hal.) Mitt.","BURMANNIACEAE Campylopus trachyblepharon (Müll.Hal.) Mitt.","70928","GBIF",,,"4582","Native","Latão","Estação Ecológica Juréia-Itatins","Não"
"ESTAÇÃO ECOLÓGICA JURÉIA-ITATINS","Angiosperms","Fabaceae","Canavalia","bonariensis","Lindl.","FABACEAE Canavalia bonariensis Lindl.","248103","GBIF",,,"1528","Native","Latão","Estação Ecológica Juréia-Itatins, Beira da estrada após travessia do Rio Una","Não"
"ESTAÇÃO ECOLÓGICA JURÉIA-ITATINS","Angiosperms","Fabaceae","Canavalia","rosea","(Sw.) DC.","FABACEAE Canavalia rosea (Sw.) DC.","268557","GBIF",,,"491","Native","Latão","Estação Ecológica Juréia-Itatins, Serra da Juréia, praia do Rio Verde, dunas, vegetação rasteira e arbustiva","Não"
"ESTAÇÃO ECOLÓGICA JURÉIA-ITATINS","Angiosperms","Bromeliaceae","Canistropsis","billbergioides","(Schult. & Schult.f.) Leme","BROMELIACEAE Canistropsis billbergioides (Schult. & Schult.f.) Leme","247875","GBIF",,,"129","Native","Latão","Estação Ecológica Juréia-Itatins, Serra da Juréia, mata ao redor da cachoeira do Salto","Não"
"ESTAÇÃO ECOLÓGICA JURÉIA-ITATINS","Angiosperms","Cannaceae","Canna","indica","L.","CANNACEAE Canna indica L.","309041","GBIF",,,"590","Native","Latão","Estação Ecológica Juréia-Itatins, Cachoeira do Guilherme no quintal da casa da Dona Carmem","Não"
"ESTAÇÃO ECOLÓGICA JURÉIA-ITATINS","Angiosperms","Caricaceae","Carica","papaya","L.","CARICACEAE Carica papaya L.","309101","GBIF",,,"266","Naturalized","Latão","Estação Ecológica Juréia-Itatins, Cachoeira do Guilherme em frente á casa de Dona Jovelina","Não"
"ESTAÇÃO ECOLÓGICA JURÉIA-ITATINS","Angiosperms","Lecythidaceae","Cariniana","estrellensis","(Raddi) Kuntze","LECYTHIDACEAE Cariniana estrellensis (Raddi) Kuntze","247555","GBIF",,,"787","Native","Latão","Estação Ecológica Juréia-Itatins, Serra da Juréia, trilha para a Cachoeira do Salto, mata de planície","Não"
"ESTAÇÃO ECOLÓGICA JURÉIA-ITATINS","Angiosperms","Malpighiaceae","Carolus","renidens","(A.Juss.) W.R.Anderson","MALPIGHIACEAE Carolus renidens (A.Juss.) W.R.Anderson","238314","GBIF",,,"255","Native","Latão","Estação Ecológica Juréia-Itatins, Caminho do Imperador, em direção à praia da Juréia","Não"
"ESTAÇÃO ECOLÓGICA JURÉIA-ITATINS","Angiosperms","Salicaceae","Casearia","decandra","Jacq.","SALICACEAE Casearia decandra Jacq.","254412","GBIF",,,"1058","Native","Latão","Estação Ecológica Juréia-Itatins, Proximidades da trilha do Pocinho, mata de encosta","Não"
"ESTAÇÃO ECOLÓGICA JURÉIA-ITATINS","Angiosperms","Salicaceae","Casearia","sylvestris","Sw.","SALICACEAE Casearia sylvestris Sw.","248138","GBIF",,,"44","Native","Latão","Estação Ecológica Juréia-Itatins, Serra da Juréia, trilha do imperador","Não"
"ESTAÇÃO ECOLÓGICA JURÉIA-ITATINS","Angiosperms","Orchidaceae","Catasetum","hookeri","Lindl.","ORCHIDACEAE Catasetum hookeri Lindl.","248395","GBIF",,,"1568","Native","Latão","Estação Ecológica Juréia-Itatins, Margem do Rio Verde","Não"
"ESTAÇÃO ECOLÓGICA JURÉIA-ITATINS","Angiosperms","Orchidaceae","Catasetum","socco","(Vell.) Hoehne","ORCHIDACEAE Catasetum socco (Vell.) Hoehne","261948","GBIF",,,"20","Native","Latão","Estação Ecológica Juréia-Itatins, Caminho do Imperador próximo à praia da Juréia","Não"
"ESTAÇÃO ECOLÓGICA JURÉIA-ITATINS","Angiosperms","Orchidaceae","Cattleya","cernua","(Lindl.) Van den Berg","ORCHIDACEAE Cattleya cernua (Lindl.) Van den Berg","244609","GBIF",,,"1379","Native","Latão","Estação Ecológica Juréia-Itatins, Proximidades do alojamento do maciço da Juréia, morro a esquerda de bifurcação da trilha no alto da encosta, próxima ao alojamento do IBAMA","Não"
"ESTAÇÃO ECOLÓGICA JURÉIA-ITATINS","Angiosperms","Orchidaceae","Cattleya","intermedia","Grah.","ORCHIDACEAE Cattleya intermedia Grah.","252811","GBIF",,,"932","Native","Latão","Estação Ecológica Juréia-Itatins, Alto do maciço, próximo ao alojamento, mata arbustiva baixa","Não"
"ESTAÇÃO ECOLÓGICA JURÉIA-ITATINS","Angiosperms","Cucurbitaceae","Cayaponia","martiana","(Cogn.) Cogn.","CUCURBITACEAE Cayaponia martiana (Cogn.) Cogn.","309122","GBIF",,,"477","Native","Latão","Estação Ecológica Juréia-Itatins, Aguapeu, próximo ao caminho para a Aldeia","Não"
"ESTAÇÃO ECOLÓGICA JURÉIA-ITATINS","Angiosperms","Urticaceae","Cecropia","glaziovii","Snethl.","URTICACEAE Cecropia glaziovii Snethl.","247904","GBIF",,,"160","Native","Latão","Estação Ecológica Juréia-Itatins, Serra da Juréia, Trilha do Imperador","Não"
"ESTAÇÃO ECOLÓGICA JURÉIA-ITATINS","Angiosperms","Urticaceae","Cecropia","pachystachya","Trécul","URTICACEAE Cecropia pachystachya Trécul","263386","GBIF",,,"1268","Native","Latão","Estação Ecológica Juréia-Itatins, Caminho do Imperador","Não"
"ESTAÇÃO ECOLÓGICA JURÉIA-ITATINS","Angiosperms","Meliaceae","Cedrela","fissilis","Vell.","MELIACEAE Cedrela fissilis Vell.","329468","GBIF",,,"804","Native","Latão","Estação Ecológica Juréia-Itatins, Despraiado, no caminho da Cachoeira Dupla","Não"
"ESTAÇÃO ECOLÓGICA JURÉIA-ITATINS","Angiosperms","Amaranthaceae","Celosia","grandifolia","Moq.","AMARANTHACEAE Celosia grandifolia Moq.","272271","GBIF",,,"1404","Native","Latão","Estação Ecológica Juréia-Itatins, Serra dos Itatins, picada entre o alojamento do Núcleo Despraiado e o alto da Serra, mata de encosta bem preservada","Não"
"ESTAÇÃO ECOLÓGICA JURÉIA-ITATINS","Angiosperms","Apiaceae","Centella","asiatica","(L.) Urb.","APIACEAE Centella asiatica (L.) Urb.","248038","GBIF",,,"403","Native","Latão","Estação Ecológica Juréia-Itatins, Trilha próxima à Cachoeira do salto, mata","Não"
"ESTAÇÃO ECOLÓGICA JURÉIA-ITATINS","Angiosperms","Asteraceae","Centratherum","punctatum","Cass.","ASTERACEAE Centratherum punctatum Cass.","108633","GBIF",,,"202","Native","Latão","Estação Ecológica Juréia-Itatins, trilha do Imperador","Não"
"ESTAÇÃO ECOLÓGICA JURÉIA-ITATINS","Angiosperms","Asteraceae","Centratherum","punctatum",,"ASTERACEAE Centratherum punctatum f. punctatum","24580","GBIF",,,"4483",,"Latão","Estação Ecológica Juréia-Itatins.","Não"
"ESTAÇÃO ECOLÓGICA JURÉIA-ITATINS","Angiosperms","Fabaceae","Centrolobium","robustum","(Vell.) Mart. ex Benth.","FABACEAE Centrolobium robustum (Vell.) Mart. ex Benth.","329558","GBIF",,,"345A","Native","Latão","Estação Ecológica Juréia-Itatins, Cachoeira do Guilherme, próximo à casa de Dona Paula","Não"
"ESTAÇÃO ECOLÓGICA JURÉIA-ITATINS","Angiosperms","Fabaceae","Centrosema","virginianum","(L.) Benth.","FABACEAE Centrosema virginianum (L.) Benth.","734","GBIF",,,"1686","Native","Latão","Estação ecológica Juréia-Itatins, margem da foz do rio guaraú","Não"
"ESTAÇÃO ECOLÓGICA JURÉIA-ITATINS","Angiosperms","Cactaceae","Cereus","fernambucensis","Lem.","CACTACEAE Cereus fernambucensis Lem.","251814","GBIF",,,"1001","Native","Latão","Estação Ecológica Juréia-Itatins, Praia do rio Verde, próximo a Foz do rio Verde, junto ao costão rochoso","Não"
"ESTAÇÃO ECOLÓGICA JURÉIA-ITATINS","Angiosperms","Solanaceae","Cestrum","bracteatum","Link & Otto","SOLANACEAE Cestrum bracteatum Link & Otto","263101","GBIF",,,"1334","Native","Latão","Estação Ecológica Juréia-Itatins, Caminho do Imperador","Não"
"ESTAÇÃO ECOLÓGICA JURÉIA-ITATINS","Angiosperms","Solanaceae","Cestrum","schlechtendalii","G.Don","SOLANACEAE Cestrum schlechtendalii G.Don","253039","GBIF",,,"5","Native","Latão","Estação Ecológica Juréia-Itatins, Mata ao redor do alojamento","Não"
"ESTAÇÃO ECOLÓGICA JURÉIA-ITATINS","Angiosperms","Fabaceae","Chamaecrista","desvauxii","(Collad.) Killip","FABACEAE Chamaecrista desvauxii (Collad.) Killip","492169","GBIF",,,"505","Native","Latão","Estação Ecológica Juréia-Itatins, Praia do Guarauzinho","Não"
"ESTAÇÃO ECOLÓGICA JURÉIA-ITATINS","Angiosperms","Fabaceae","Chamaecrista","desvauxii","(Kunth ex Vogel) H.S.Irwin & Barneby","FABACEAE Chamaecrista desvauxii var. langsdorffii (Kunth ex Vogel) H.S.Irwin & Barneby","329597","GBIF",,,"322","Native","Latão","Estação Ecológica Juréia-Itatins, Aguapeu em frente à casa de Dona Francinha","Não"
"ESTAÇÃO ECOLÓGICA JURÉIA-ITATINS","Angiosperms","Celastraceae","Cheiloclinium","cognatum","(Miers) A.C.Sm.","CELASTRACEAE Cheiloclinium cognatum (Miers) A.C.Sm.","246953","GBIF",,,"732","Native","Latão","Estação Ecológica Juréia-Itatins, Serra da Juréia, trilha da Figueira, mata de encosta","Não"
"ESTAÇÃO ECOLÓGICA JURÉIA-ITATINS","Angiosperms","Celastraceae","Cheiloclinium","serratum","(Cambess.) A.C.Sm.","CELASTRACEAE Cheiloclinium serratum (Cambess.) A.C.Sm.","252697","GBIF",,,"942","Native","Latão","Estação Ecológica Juréia-Itatins, Margem do Rio Verde","Não"
"ESTAÇÃO ECOLÓGICA JURÉIA-ITATINS","Angiosperms","Rubiaceae","Chiococca","alba","(L.) Hitchc.","RUBIACEAE Chiococca alba (L.) Hitchc.","247693","GBIF",,,"826","Native","Latão","Estação Ecológica Juréia-Itatins, Serra da Juréia, trilha do Imperador, margem do Rio Verde, restinga arbórea","Não"
"ESTAÇÃO ECOLÓGICA JURÉIA-ITATINS","Angiosperms","Oleaceae","Chionanthus","filiformis","(Vell.) P.S.Green","OLEACEAE Chionanthus filiformis (Vell.) P.S.Green","309276","GBIF",,,"1206","Native","Latão","Estação Ecológica Juréia-Itatins","Não"
"ESTAÇÃO ECOLÓGICA JURÉIA-ITATINS","Angiosperms","Rubiaceae","Chomelia","brasiliana","A.Rich.","RUBIACEAE Chomelia brasiliana A.Rich.","306841","GBIF",,,"1196","Native","Latão","Estação Ecológica Juréia-Itatins, Planície às margens do Rio Verde, próximo ao alojamento da S.M.A.","Não"
"ESTAÇÃO ECOLÓGICA JURÉIA-ITATINS","Angiosperms","Asteraceae","Chrysanthemum","morifolium","(Ramat.) Hemsl.","ASTERACEAE Chrysanthemum morifolium (Ramat.) Hemsl.","309084","GBIF",,,"499","Cultivated","Latão","Estação Ecológica Juréia-Itatins, Rio Verde, no canteiro de Dona Maria Lúcia","Não"
"ESTAÇÃO ECOLÓGICA JURÉIA-ITATINS","Angiosperms","Chrysobalanaceae","Chrysobalanus","icaco","L.","CHRYSOBALANACEAE Chrysobalanus icaco L.","268564","GBIF",,,"498","Native","Latão","Estação Ecológica Juréia-Itatins, Serra da Juréia, praia do Rio Verde, dunas","Não"
"ESTAÇÃO ECOLÓGICA JURÉIA-ITATINS","Angiosperms","Sapotaceae","Chrysophyllum","paranaense","T.D.Penn.","SAPOTACEAE Chrysophyllum paranaense T.D.Penn.","247532","GBIF",,,"763","Native","Latão","Estação Ecológica Juréia-Itatins, Serra da Juréia, trilha para o pocinho","Não"
"ESTAÇÃO ECOLÓGICA JURÉIA-ITATINS","Angiosperms","Sapotaceae","Chrysophyllum","viride","Mart. & Eichler","SAPOTACEAE Chrysophyllum viride Mart. & Eichler","249133","GBIF",,,"896","Native","Latão","Estação Ecológica Juréia-Itatins, Trilha para a Figueira Grande, mata","Não"
"ESTAÇÃO ECOLÓGICA JURÉIA-ITATINS","Angiosperms","Poaceae","Chrysopogon","zizanioides","(L.) Roberty","POACEAE Chrysopogon zizanioides (L.) Roberty","329606","GBIF",,,"641","Naturalized","Latão","Estação Ecológica Juréia-Itatins, Praia do Una, quintal do Sr. Dito","Não"
"ESTAÇÃO ECOLÓGICA JURÉIA-ITATINS","Angiosperms","Poaceae","Chusquea","longispiculata","L.G.Clark","POACEAE Chusquea longispiculata L.G.Clark","429624","GBIF",,,"1052B","Native","Latão","Estação Ecológica Juréia-Itatins, maciço da Juréia, alto do morro próx. ao alojamento","Não"
"ESTAÇÃO ECOLÓGICA JURÉIA-ITATINS","Angiosperms","Poaceae","Chusquea","oxylepis","(Hack.) Ekman","POACEAE Chusquea oxylepis (Hack.) Ekman","250011","GBIF",,,"899","Native","Latão","Estação Ecológica Juréia-Itatins, Estrada próxima do posto de fiscalização do Barreirinho (balsa), após a travessia do Rio Una","Não"
"ESTAÇÃO ECOLÓGICA JURÉIA-ITATINS","Angiosperms","Canellaceae","Cinnamodendron","dinisii","Schwacke","CANELLACEAE Cinnamodendron dinisii Schwacke","249207","GBIF",,,"82","Native","Latão","Estação Ecológica Juréia-Itatins, Serra da Juréia, margem do Rio Verde","Não"
"ESTAÇÃO ECOLÓGICA JURÉIA-ITATINS","Angiosperms","Lauraceae","Cinnamomum","pseudoglaziovii","(Lorea-Hern.) Van der Werff","LAURACEAE Cinnamomum pseudoglaziovii (Lorea-Hern.) Van der Werff","309314","GBIF",,,"1156","Native","Latão","Estação Ecológica Juréia-Itatins, Margens do rio Verde, próximo ao alojamento","Não"
"ESTAÇÃO ECOLÓGICA JURÉIA-ITATINS","Angiosperms","Menispermaceae","Cissampelos","andromorpha","DC.","MENISPERMACEAE Cissampelos andromorpha DC.","249743","GBIF",,,"461","Native","Latão","Estação Ecológica Juréia-Itatins, Trilha próxima à foz do Rio Verde, mata de restinga","Não"
"ESTAÇÃO ECOLÓGICA JURÉIA-ITATINS","Angiosperms","Verbenaceae","Citharexylum","myrianthum","Cham.","VERBENACEAE Citharexylum myrianthum Cham.","329521","GBIF",,,"345-A","Native","Latão","Estação Ecológica Juréia-Itatins, Cachoeira do Guilherme","Não"
"ESTAÇÃO ECOLÓGICA JURÉIA-ITATINS","Angiosperms","Cardiopteridaceae","Citronella",,"D.Don","CARDIOPTERIDACEAE Citronella D.Don","729","GBIF",,,"1681",,"Latão","Estação ecológica Juréia-Itatins, próximo a praia do arpoador","Não"
"ESTAÇÃO ECOLÓGICA JURÉIA-ITATINS","Angiosperms","Rutaceae","Citrus","aurantiifolia","(Christm.) Swingle","RUTACEAE Citrus aurantiifolia (Christm.) Swingle","329503","GBIF",,,"s.n.","Cultivated","Latão","Estação Ecológica Juréia-Itatins, Rio Comprido, Sítio do Palial","Não"
"ESTAÇÃO ECOLÓGICA JURÉIA-ITATINS","Angiosperms","Cyperaceae","Cladium","mariscus","(L.) Pohl","CYPERACEAE Cladium mariscus (L.) Pohl","75025","GBIF",,,"27","Native","Latão","Estação Ecológica Juréia-Itatins Núcleo Rio Verde, margem direita do rio Verde, próximo à Cachoeira do Salto, local encharcado","Não"
"ESTAÇÃO ECOLÓGICA JURÉIA-ITATINS","Angiosperms","Cyperaceae","Cladium","mariscus","(Crantz) Kük.","CYPERACEAE Cladium mariscus subsp. jamaicense (Crantz) Kük.","344574","GBIF",,,"1794","Native","Latão","Estação Ecológica Juréia-Itatins, trilha para a Cachoeira do rio Verde","Não"
"ESTAÇÃO ECOLÓGICA JURÉIA-ITATINS","Angiosperms","Clethraceae","Clethra","scabra","(Meisn.) Sleumer","CLETHRACEAE Clethra scabra var. laevigata (Meisn.) Sleumer","309093","GBIF",,,"749","Native","Latão","Estação Ecológica Juréia-Itatins, Aguapeu no caminho que sai no Sr. Vitor ou no Rio Pequeno","Não"
"ESTAÇÃO ECOLÓGICA JURÉIA-ITATINS","Angiosperms","Melastomataceae","Clidemia","hirta","(L.) D.Don","MELASTOMATACEAE Clidemia hirta (L.) D.Don","249816","GBIF",,,"211","Native","Latão","Estação Ecológica Juréia-Itatins, Serra da Juréia, trilha do Imperador, próximo do mangue","Não"
"ESTAÇÃO ECOLÓGICA JURÉIA-ITATINS","Angiosperms","Melastomataceae","Clidemia","urceolata","DC.","MELASTOMATACEAE Clidemia urceolata DC.","248145","GBIF",,,"36","Native","Latão","Estação Ecológica Juréia-Itatins, Serra da Juréia, trilha do Imperador","Não"
"ESTAÇÃO ECOLÓGICA JURÉIA-ITATINS","Angiosperms","Clusiaceae","Clusia","criuva","Cambess.","CLUSIACEAE Clusia criuva Cambess.","329601","GBIF",,,"669","Native","Latão","Estação Ecológica Juréia-Itatins","Não"
"ESTAÇÃO ECOLÓGICA JURÉIA-ITATINS","Angiosperms","Clusiaceae","Clusia","criuva","Vesque","CLUSIACEAE Clusia criuva subsp. parviflora Vesque","556523","GBIF",,,"642","Native","Latão","Estaçao Ecológica Juréia-Itatins, proximades do maciço da Juréia, morro a direita na bifurcaçao da trilha no alto da encosta próxima ao alojamento do IBAMA","Não"
"ESTAÇÃO ECOLÓGICA JURÉIA-ITATINS","Angiosperms","Rubiaceae","Coccocypselum","capitatum","(Graham) C.B.Costa & Mamede","RUBIACEAE Coccocypselum capitatum (Graham) C.B.Costa & Mamede","258591","GBIF",,,"166","Native","Latão","Estação Ecológica Juréia-Itatins, Serra da Juréia, caminho do Imperador, em direção a Praia da Juréia","Não"
"ESTAÇÃO ECOLÓGICA JURÉIA-ITATINS","Angiosperms","Rubiaceae","Coccocypselum","condalia","Pers.","RUBIACEAE Coccocypselum condalia Pers.","244638","GBIF",,,"1398","Native","Latão","Estação Ecológica Juréia-Itatins, Proximidades do maciço da Juréia, mata no vale entre os dois morros, próximo do alojamento","Não"
"ESTAÇÃO ECOLÓGICA JURÉIA-ITATINS","Angiosperms","Rubiaceae","Coccocypselum","cordifolium","Nees & Mart.","RUBIACEAE Coccocypselum cordifolium Nees & Mart.","270917","GBIF",,,"581","Native","Latão","Estação Ecológica Juréia-Itatins, Serra da Juréia, caminho do imperador em direção a praia da juréia","Não"
"ESTAÇÃO ECOLÓGICA JURÉIA-ITATINS","Angiosperms","Rubiaceae","Coccocypselum","hasslerianum","Chodat","RUBIACEAE Coccocypselum hasslerianum Chodat","338333","GBIF",,,"699","Native","Latão","Estação Ecológica Juréia-Itatins, Serra da Juréia, mata pluvial de planície do rio Verde","Não"
"ESTAÇÃO ECOLÓGICA JURÉIA-ITATINS","Angiosperms","Rubiaceae","Coccocypselum","lanceolatum","(Ruiz & Pav.) Pers.","RUBIACEAE Coccocypselum lanceolatum (Ruiz & Pav.) Pers.","258574","GBIF",,,"147","Native","Latão","Estação Ecológica Juréia-Itatins, Serra da juréia, caminho do Imperador, em direção a praia do rio verde, próximo ao manguezal","Não"
"ESTAÇÃO ECOLÓGICA JURÉIA-ITATINS","Angiosperms","Polygonaceae","Coccoloba","declinata","(Vell.) Mart.","POLYGONACEAE Coccoloba declinata (Vell.) Mart.","247825","GBIF",,,"114","Native","Latão","Estação Ecológica Juréia-Itatins, Serra da Juréia, mata ao redor da cachoeira do Salto","Não"
"ESTAÇÃO ECOLÓGICA JURÉIA-ITATINS","Angiosperms","Polygonaceae","Coccoloba","salicifolia","Wedd.","POLYGONACEAE Coccoloba salicifolia Wedd.","247796","GBIF",,,"146","Native","Latão","Estação Ecológica Juréia-Itatins, Serra da Juréia, trilha do alojamento, restinga","Não"
"ESTAÇÃO ECOLÓGICA JURÉIA-ITATINS","Angiosperms","Orchidaceae","Cochleanthes","flabelliformis","(Sw.) R.E.Schult. & Garay","ORCHIDACEAE Cochleanthes flabelliformis (Sw.) R.E.Schult. & Garay","244631","GBIF",,,"1377","Native","Latão","Estação Ecológica Juréia-Itatins, Proximidade do maçciço da Juréia, trilha para a foz do Rio Verde a partir do alojamento do IBAMA","Não"
"ESTAÇÃO ECOLÓGICA JURÉIA-ITATINS","Angiosperms","Fabaceae","Cochliasanthus","caracalla","(L.) Trew","FABACEAE Cochliasanthus caracalla (L.) Trew","244548","GBIF",,,"1360","Native","Latão","Estação Ecológica Juréia-Itatins, Proximidades da Serra da Juréia, caminho do Imperador","Não"
"ESTAÇÃO ECOLÓGICA JURÉIA-ITATINS","Ferns and Lycophytes","Polypodiaceae","Cochlidium","serrulatum","(Sw.) L.E.Bishop","POLYPODIACEAE Cochlidium serrulatum (Sw.) L.E.Bishop","NY02422574","GBIF",,,"1019","Native","Latão","Estação Ecológica Juréia-Itatins, trilha para Figueira Grande","Não"
"ESTAÇÃO ECOLÓGICA JURÉIA-ITATINS","Angiosperms","Arecaceae","Cocos","nucifera","L.","ARECACEAE Cocos nucifera L.","164321","GBIF",,,"16","Naturalized","Latão","Estação Ecológica Juréia-Itatins","Não"
"ESTAÇÃO ECOLÓGICA JURÉIA-ITATINS","Angiosperms","Gesneriaceae","Codonanthe","devosiana","Lem.","GESNERIACEAE Codonanthe devosiana Lem.","248126","GBIF",,,"24","Native","Latão","Estação Ecológica Juréia-Itatins, Serra da Juréia, trilha para o Pocinho","Não"
"ESTAÇÃO ECOLÓGICA JURÉIA-ITATINS","Angiosperms","Gesneriaceae","Codonanthe","gracilis","(Mart.) Hanst.","GESNERIACEAE Codonanthe gracilis (Mart.) Hanst.","218921","GBIF",,,"1950","Native","Latão","Estação Ecológica Juréia-Itatins, Trilha para a Figueira, mata atlântica","Não"
"ESTAÇÃO ECOLÓGICA JURÉIA-ITATINS","Angiosperms","Rubiaceae","Coffea","arabica","L.","RUBIACEAE Coffea arabica L.","329509","GBIF",,,"256","Naturalized","Latão","Estação Ecológica Juréia-Itatins, Cachoeira do Guilherme, próximo à casa de Dona Jovelina. Cultivada","Não"
"ESTAÇÃO ECOLÓGICA JURÉIA-ITATINS","Angiosperms","Poaceae","Coix","lacryma-jobi","L.","POACEAE Coix lacryma-jobi L.","329603","GBIF",,,"244","Naturalized","Latão","Estação Ecológica Juréia-Itatins, Rio Comprido, no quintal da Dona Nair","Não"
"ESTAÇÃO ECOLÓGICA JURÉIA-ITATINS","Angiosperms","Poaceae","Colanthelia",,"McClure & E.W.Sm.","POACEAE Colanthelia McClure & E.W.Sm.","254345","GBIF",,,"1052A",,"Latão","Estação Ecológica Juréia-Itatins, Maciço da Juréia, alto do morro próximo ao alojamento","Não"
"ESTAÇÃO ECOLÓGICA JURÉIA-ITATINS","Angiosperms","Commelinaceae",,,"Mirb.","COMMELINACEAE Commelinaceae Mirb.","272278","GBIF",,,"525",,"Latão","Estação Ecológica Juréia-Itatins, Alto da Serra dos Itatins, mata alta bem preservada, com dossel irregular","Não"
"ESTAÇÃO ECOLÓGICA JURÉIA-ITATINS","Angiosperms","Rutaceae","Conchocarpus","fontanesianus","(A. St.-Hil.) Kallunki & Pirani","RUTACEAE Conchocarpus fontanesianus (A. St.-Hil.) Kallunki & Pirani","352634","GBIF",,,"s.n.","Native","Latão","Estação Ecológica Juréia-Itatins, Núcleo do Rio Verde","Não"
"ESTAÇÃO ECOLÓGICA JURÉIA-ITATINS","Angiosperms","Lamiaceae","Condea","undulata","(Schrank) Harley & J.F.B.Pastore","LAMIACEAE Condea undulata (Schrank) Harley & J.F.B.Pastore","291944","GBIF",,,"546","Native","Latão","Estação Ecológica Juréia-Itatins, Barra do Una","Não"
"ESTAÇÃO ECOLÓGICA JURÉIA-ITATINS","Angiosperms","Apocynaceae","Condylocarpon","isthmicum","(Vell.) A.DC.","APOCYNACEAE Condylocarpon isthmicum (Vell.) A.DC.","83465","GBIF",,,"1523","Native","Latão","Estação Ecológica Juréia-Itatins, Beira de estrada","Não"
"ESTAÇÃO ECOLÓGICA JURÉIA-ITATINS","Angiosperms","Connaraceae","Connarus","rostratus","(Vell.) L.B.Sm.","CONNARACEAE Connarus rostratus (Vell.) L.B.Sm.","275286","GBIF",,,"1480","Native","Latão","Estação Ecológica Juréia-Itatins, Trilha da Figueira, mata pluvial de encosta","Não"
"ESTAÇÃO ECOLÓGICA JURÉIA-ITATINS","Angiosperms","Asteraceae","Conyza","bonariensis","(L.) Cronquist","ASTERACEAE Conyza bonariensis (L.) Cronquist","307024","GBIF",,,"4472","Native","Latão","Estação Ecológica Juréia-Itatins, Rio Grajauna na estrada para o Rio Verde","Não"
"ESTAÇÃO ECOLÓGICA JURÉIA-ITATINS","Angiosperms","Fabaceae","Copaifera","langsdorffii","Desf.","FABACEAE Copaifera langsdorffii Desf.","248040","GBIF",,,"405","Native","Latão","Estação Ecológica Juréia-Itatins, Beira do Rio Verde, descendo em direção à foz, mata","Não"
"ESTAÇÃO ECOLÓGICA JURÉIA-ITATINS","Angiosperms","Rubiaceae","Cordiera","concolor","(Cham.) Kuntze","RUBIACEAE Cordiera concolor (Cham.) Kuntze","244642","GBIF",,,"644","Native","Latão","Estação Ecológica Juréia-Itatins, Proximidades do maciço da Juréia, morro a direita na bifurcação da trilha no alto da encosta próxima ao alojamento do IBAMA, capões de mata do alto do morro","Não"
