"data_source","barcode","collectionCode","catalogNumber","scientificName","kingdom","family","genus","year","month","day","country","stateProvince","county","locality","institutionCode","phylum","basisOfRecord","identifiedBy","yearIdentified","monthIdentified","verbatimLatitude","verbatimLongitude","collectionID","specificEpithet","recordedBy","decimalLongitude","decimalLatitude","modified","scientificNameAuthorship","recordNumber","occurrenceRemarks","dayIdentified","minimumElevationInMeters","maximumElevationInMeters","coordinatePrecision","continentocean","preparationtype","class","order","infraspecificEpithet","individualcount","downloadedFrom","municipality","dateIdentified","acceptedScientificName","bibliographicCitation","countryCode","datasetID","datasetName","eventDate","fieldNotes","habitat","identificationRemarks","latitude","longitude","taxonomicStatus","taxonRank","type","verbatimElevation","verbatimEventDate","verbatimLocality","collectionCode.new","collectionObs","recordedBy.new","recordNumber.new","year.new","identifiedBy.new","yearIdentified.new","recordedBy.aux","last.name","identifiedBy.aux","country.new","stateProvince.new","municipality.new","locality.new","locality.scrap","resol.orig","loc","loc.correct","latitude.gazetteer","longitude.gazetteer","resolution.gazetteer","gbifID","institutionID","informationWithheld","dataGeneralizations","occurrenceID","recordedByID","caste","vitality","georeferenceVerificationStatus","occurrenceStatus","materialEntityID","materialEntityRemarks","verbatimLabel","eventType","fieldNumber","samplingProtocol","eventRemarks","locationID","locationRemarks","coordinateUncertaintyInMeters","pointRadiusSpatialFit","verbatimCoordinateSystem","georeferencedBy","georeferencedDate","georeferenceProtocol","georeferenceRemarks","identificationID","verbatimIdentification","typeStatus","identifiedByID","taxonID","acceptedNameUsage","parentNameUsage","originalNameUsage","nameAccordingTo","namePublishedIn","namePublishedInYear","superfamily","subfamily","tribe","subtribe","genericName","subgenus","infragenericEpithet","cultivarEpithet","verbatimTaxonRank","taxonRemarks","datasetKey","distanceFromCentroidInMeters","mediaType","hasCoordinate","hasGeospatialIssues","species","verbatimScientificName","projectId","isSequenced","gbifRegion","publishedByGbifRegion","iucnRedListCategory","associatedMedia","minimumDepthInMeters","maximumDepthInMeters","geodeticDatum","verbatimCoordinates","imageCollectionCode","virtualDuplicates","duplicates","DeterminationQualifier","recordedByExtra","dateCollected","dateCollectedMax","verbatimElevationMax","measurementUnit","verbatimLatitudeMax","verbatimLongitudeMax","updatedBy","dateUpdated","right","modified_incomplete","Clado","loc.correct.mun","NAME_0","NAME_1","NAME_2","NAME_3","loc.check","scientificName.new","scientificNameAuthorship.new","scientificNameStatus","suggestedFamily","suggestedName","suggestedAuthorship","taxon.rank","tax.notes","id","accepted.tax.name","accepted.tax.authorship","scientificNameFull","genus.new","family.new","tax.check","species.new"
"speciesLink","HRCB049790","HRCB","49790","Acacia mollissima","Plantae","Fabaceae","Acacia","2002","02","22","Brasil","São Paulo","Gália","Estação Ecológica dos Caetetus","UNESP-RC",,"PreservedSpecimen","Udulutsch, R.G.","2002","02",,,"15","mollissima","Udulutsch, R.G.","-49.549999","-22.290001","2025-02-04T08:01:48","Willd.","500","<nO>Liana. Frutos imaturos verdesHabitat: Floresta estadual semidecídua</nO>","22",,,"23314",,,,,,,"SPLINK","Gália","2002-02-22",,,,,,,,,,,,,,,,,,"HRCB",,"Udulutsch, R.G.","500","2002","Udulutsch, R.G.","2002",,"Udulutsch",,"brazil","sao paulo","galia","estacao ecologica dos caetetus",,"locality","brazil_sao paulo_galia_estacao ecologica caetetus","brazil_sao paulo_galia_eec caetetus",-22.413951,-49.685434,"locality",,,,,,,,,,,,,,,,,,,,,,,,,,,,,,,,,,,,,,,,,,,,,,,,,,,,,,,,,,,,,,,,,,,,,,,,,,,,,,,,,,,,,,"ok_same_resolution","Acacia mangium","Willd.","possibly_ok","Fabaceae","Acacia mangium","Willd.","species","name misspelled","bfo-611526",,,"Acacia mangium Willd.","Acacia","Fabaceae","low","Acacia mangium"
"gbif",,"HRCB","49790","Acacia mollissima hort. ex Willd.","Plantae","Fabaceae","Acacia","2002","2","22","Brasil","São Paulo",,"Estação Ecológica dos Caetetus","UNESP-RC","Tracheophyta","PRESERVED_SPECIMEN","Udulutsch, R.G.",,,,,"https://specieslink.net/col/15","mollissima","Udulutsch, R.G.",,,"2024-12-18 09:15:51","Willd.","500",,,,,,,,"Magnoliopsida","Fabales",,,"GBIF","Gália","2002-02-22","Acacia pubescens (Vent.) R.Br.",,"BR",,,"2002-02-22",,,,,,"SYNONYM","SPECIES",,,,,,,,,,,,,,,"brazil","sao paulo","galia","estacao ecologica dos caetetus",,"locality","brazil_sao paulo_galia_estacao ecologica caetetus","brazil_sao paulo_galia_eec caetetus",-22.413951,-49.685434,"locality","1090694648",,,,"https://specieslink.net/guid/15/49790",,,,,"PRESENT",,,,,,,,,,,,,,,,,,,,,,,,,,,,,,,,"Acacia",,,,,,"fdf55163-54d8-4bc7-862d-7e41068589e3",,,FALSE,FALSE,"Acacia pubescens","Acacia mollissima","null",FALSE,"LATIN_AMERICA","LATIN_AMERICA","NE",,,,"WGS84",,,,,,,,,,,,,,,,,,"brazil_sao paulo_galia_eec caetetus","Brazil","São Paulo","Gália","EEc de Caetetus","ok_same_resolution","Acacia mollissima","hort. ex Willd.","name_w_authors",,"Acacia mollissima","hort. ex Willd.","species","not found",,,,"Acacia mollissima hort. ex Willd.","Acacia","Fabaceae","unknown","Acacia mollissima"
"speciesLink","UEC001791","UEC","139935","Pleurothallis aphthosa","Plantae","Orchidaceae","Pleurothallis","2003","02","11","Brazil","São Paulo","Gália","Estação Ecológica Caetetus, Parcelas permanentes. Fora da parcela, ao lado da A00.","UNICAMP","Liliopsida","S","Singer, RB","2003","05","-22.25","-49.5","2","aphthosa","Breier, TB; Breier, J","-49.5","-22.25","2025-04-07T10:44:40","Lindl.","864",,,,,,,,,,,,"SPLINK","Gália","2003-05-NA",,,,,,,,,,,,,,,,,,"UEC",,"Breier, T.B.","864","2003","Singer, R.B.","2003","Breier, J.","Breier",,"brazil","sao paulo","galia","estacao ecologica caetetus",,"locality","brazil_sao paulo_galia_estacao ecologica caetetus","brazil_sao paulo_galia_eec caetetus",-22.413951,-49.685434,"locality",,,,,,,,,,,,,,,,,,,,,,,,,,,,,,,,,,,,,,,,,,,,,,,,,,,,,,,,,,,,,,,,,,,,,,,,,,,,,,,,,,,,,,"ok_same_resolution","Acianthera aphthosa","(Lindl.) Pridgeon & M.W.Chase","possibly_ok","Orchidaceae","Acianthera aphthosa","(Lindl.) Pridgeon & M.W.Chase","species","replaced synonym","bfo-10992","Acianthera aphthosa","(Lindl.) Pridgeon & M.W.Chase","Acianthera aphthosa (Lindl.) Pridgeon & M.W.Chase","Acianthera","Orchidaceae","low","Acianthera aphthosa"
"speciesLink","UEC001744","UEC","140255","Pleurothallis nemorosa","Plantae","Orchidaceae","Pleurothallis",,,,"Brazil","São Paulo","Gália","Estação Ecológica Caetetus","UNICAMP","Liliopsida","S",,,,"-22.25","-49.5","2","nemorosa","Breier, TB","-49.5","-22.25","2023-03-09T11:24:46","Rodr.","902",,,,,,,,,,,,"SPLINK","Gália",,,,,,,,,,,,,,,,,,,"UEC",,"Breier, T.B.","902","n.d.","s.n.","n.d.",,"Breier",,"brazil","sao paulo","galia","estacao ecologica caetetus",,"locality","brazil_sao paulo_galia_estacao ecologica caetetus","brazil_sao paulo_galia_eec caetetus",-22.413951,-49.685434,"locality",,,,,,,,,,,,,,,,,,,,,,,,,,,,,,,,,,,,,,,,,,,,,,,,,,,,,,,,,,,,,,,,,,,,,,,,,,,,,,,,,,,,,,"ok_same_resolution","Acianthera nemorosa","(Barb.Rodr.) F.Barros","possibly_ok","Orchidaceae","Acianthera nemorosa","(Barb.Rodr.) F.Barros","species","author misspelled|replaced synonym","bfo-11036","Acianthera nemorosa","(Barb.Rodr.) F.Barros","Acianthera nemorosa (Barb.Rodr.) F.Barros","Acianthera","Orchidaceae","unknown","Acianthera nemorosa"
"user",,"ESA","ESA00137094","Actinostemon concepcionis (Chodat & Hassl.) Hochr.",,"Euphorbiaceae","Actinostemon","2015","10","11","Brasil","São Paulo",,"Estação Ecológica de Caetetus, trilha do Lago","ESA",,,"Sem determinador",,,,,,,"Colletta, G. D","0","0",,"(Chodat & Hassl.) Hochr.","2273",,,,,,,,,,,,"REFLORA","Gália",,,,,,,,,,,,,,"SPECIES",,,,,,,,,,,,,,,"brazil","sao paulo","galia","estacao ecologica de caetetus",,"locality","brazil_sao paulo_galia_estacao ecologica caetetus","brazil_sao paulo_galia_eec caetetus",-22.413951,-49.685434,"locality",,,,,,,,,,,,,,,,,,,,,,,,,,,,,"não",,,,,,,,,,,,,,,,,,,,,,,,"concepcionis","EUPHORBIACEAE Actinostemon concepcionis (Chodat & Hassl.) Hochr.",,,,,,,,,,,"ESA",,,,,"11/10/2015",,"680","METRO",,,,,,,,"brazil_sao paulo_galia_eec caetetus","Brazil","São Paulo","Gália","EEc de Caetetus","ok_same_resolution","Actinostemon concepcionis","(Chodat & Hassl.) Hochr.","name_w_authors","Euphorbiaceae","Actinostemon concepcionis","(Chodat & Hassl.) Hochr.","species","name accepted","bfo-29144",,,"Actinostemon concepcionis (Chodat & Hassl.) Hochr.","Actinostemon","Euphorbiaceae","high","Actinostemon concepcionis"
"speciesLink","PEUFR051396","PEUFR","51396","Actinostemon concolor","Plantae","Euphorbiaceae","Actinostemon","1999","06",,"Brasil","São Paulo","Gália","Estação Ecológica de Caetetus","UFRPE",,"PreservedSpecimen",,,,"22°25'S","49°41'W","159","concolor","M.R. Gorenstein","-49.683333","-22.416667","2024-02-19T11:53:40","(Spreng.) Müll.Arg.","5523",,,,,,,,,,,,"SPLINK","Gália",,,,,,,,,,,,,,,,,,,"PEUFR",,"Gorenstein, M.R.","5523","1999","s.n.","n.d.",,"Gorenstein",,"brazil","sao paulo","galia","estacao ecologica de caetetus",,"locality","brazil_sao paulo_galia_estacao ecologica caetetus","brazil_sao paulo_galia_eec caetetus",-22.413951,-49.685434,"locality",,,,,,,,,,,,,,,,,,,,,,,,,,,,,,,,,,,,,,,,,,,,,,,,,,,,,,,,,,,,,,,,,,,,,,,,,,,,,,,,,,,,,,"ok_same_resolution","Actinostemon concolor","(Spreng.) Müll.Arg.","possibly_ok","Euphorbiaceae","Actinostemon concolor","(Spreng.) Müll.Arg.","species","name accepted","bfo-17448",,,"Actinostemon concolor (Spreng.) Müll.Arg.","Actinostemon","Euphorbiaceae","unknown","Actinostemon concolor"
"speciesLink","HRCB052805","HRCB","52805","Adenocalymma bracteatum","Plantae","Bignoniaceae","Adenocalymma","2002","02","22","Brasil","São Paulo","Gália","Estação Ecológica dos Caetetus","UNESP-RC",,"PreservedSpecimen","Udulutsch, R.G.","2002","02",,,"15","bracteatum","Udulutsch, R.G.","-49.549999","-22.290001","2025-02-04T07:59:34","(Cham.) DC.","743","<nO>Coleta realizada na borda do fragmento florestal. Liana. Cálice verde claro, corola amarelo-ouro.Habitat: Floresta Estacional Semidecidual</nO>","22",,,"23314",,,,,,,"SPLINK","Gália","2002-02-22",,,,,,,,,,,,,,,,,,"HRCB",,"Udulutsch, R.G.","743","2002","Udulutsch, R.G.","2002",,"Udulutsch",,"brazil","sao paulo","galia","estacao ecologica dos caetetus",,"locality","brazil_sao paulo_galia_estacao ecologica caetetus","brazil_sao paulo_galia_eec caetetus",-22.413951,-49.685434,"locality",,,,,,,,,,,,,,,,,,,,,,,,,,,,,,,,,,,,,,,,,,,,,,,,,,,,,,,,,,,,,,,,,,,,,,,,,,,,,,,,,,,,,,"ok_same_resolution","Adenocalymma bracteatum","(Cham.) DC.","possibly_ok","Bignoniaceae","Adenocalymma bracteatum","(Cham.) DC.","species","name accepted","bfo-112322",,,"Adenocalymma bracteatum (Cham.) DC.","Adenocalymma","Bignoniaceae","high","Adenocalymma bracteatum"
"speciesLink","HRCB052794","HRCB","52794","Adenocalymma marginatum","Plantae","Bignoniaceae","Adenocalymma","2003","02","11","Brasil","São Paulo","Gália","Estação Ecológica dos Caetetus Coleta realizada na borda do fragmento florestal","UNESP-RC",,"PreservedSpecimen","Udulutsch, R.G.","2003","02",,,"15","marginatum","Udulutsch, R.G.","-49.549999","-22.290001","2025-02-04T07:59:36","(Cham.) DC.","1579","<nO>Liana. Flores amarelo-ouro.Habitat: Floresta Estacional Semidecidual</nO>","11",,,"23314",,,,,,,"SPLINK","Gália","2003-02-11",,,,,,,,,,,,,,,,,,"HRCB",,"Udulutsch, R.G.","1579","2003","Udulutsch, R.G.","2003",,"Udulutsch",,"brazil","sao paulo","galia","estacao ecologica dos caetetus coleta realizada na borda do fragmento florestal",,"locality","brazil_sao paulo_galia","brazil_sao paulo_galia",-22.31982553,-49.57741765,"county",,,,,,,,,,,,,,,,,,,,,,,,,,,,,,,,,,,,,,,,,,,,,,,,,,,,,,,,,,,,,,,,,,,,,,,,,,,,,,,,,,,,,,"check_local.2municip.","Adenocalymma marginatum","(Cham.) DC.","possibly_ok","Bignoniaceae","Adenocalymma marginatum","(Cham.) DC.","species","name accepted","bfo-112390",,,"Adenocalymma marginatum (Cham.) DC.","Adenocalymma","Bignoniaceae","high","Adenocalymma marginatum"
"user",,"RB","RB00610443","Adenocalymma paulistarum Bureau & K.Schum.","Plantae","Bignoniaceae","Adenocalymma","2003","9","21","Brasil","São Paulo",,"Estação Ecológica dos Caetetus.","JBRJ",,"Preserved Specimen","R.G.Udulutsch",,,,,,"paulistarum","R.G.Udulutsch; et al",,,,"Bureau & K.Schum.","2378",,,,,,,,,,,,,"Gália",,,,"BR",,,"2003-09-21","Floresta Estacional Semidecidual",,,,,,"sp.","Physical Object",,,,"RB",,"Udulutsch, R.G.","2378","2003","Udulutsch, R.G.","n.d.",,"Udulutsch",,"brazil","sao paulo","galia","estacao ecologica dos caetetus",,"locality","brazil_sao paulo_galia_estacao ecologica caetetus","brazil_sao paulo_galia_eec caetetus",-22.413951,-49.685434,"locality",,,,,"urn:catalog:JBRJ:RB:610443",,,,,,,,,,,,,,,,,,,,,,,,,,,,,,,,,,,,,,,,,,,,,,,,,,,,,,,"jbrj-public-img.s3-sa-east-1.amazonaws.com/JPG/rb/0/61/4/43/00610443.jpg",,,,,,,,,,,,,,,,,,,"2014-07-07 20:44:13+00","Angiospermas","brazil_sao paulo_galia_eec caetetus","Brazil","São Paulo","Gália","EEc de Caetetus","ok_same_resolution","Adenocalymma paulistarum","Bureau & K.Schum.","name_w_authors","Bignoniaceae","Adenocalymma paulistarum","Bureau & K.Schum.","species","name accepted","bfo-112407",,,"Adenocalymma paulistarum Bureau & K.Schum.","Adenocalymma","Bignoniaceae","high","Adenocalymma paulistarum"
"gbif",,,"21932","Aegiphila integrifolia (Jacq.) B.D.Jacks.","Plantae","Lamiaceae","Aegiphila",,,,"Brazil","Sp",,"A Estação Ecológica dos Caetetus (EEC) possui uma área contínua de 2178,84 ha, dentro da bacia hidrográfica do Médio Paranapanema.",,"Tracheophyta","OCCURRENCE",,,,,,,"integrifolia","Tiago Egydio Barreto","-49.7006539","-22.4082398","2016-07-28",,,,,,,,,,"Magnoliopsida","Lamiales",,,"GBIF","Gália",,"Aegiphila integrifolia (Jacq.) B.D.Jacks.",,"BR",,"SinBIOTA",,,,,,,"ACCEPTED","SPECIES","Dataset",,,"A Estação Ecológica dos Caetetus (EEC) possui uma área contínua de 2178,84 ha, dentro da bacia hidrográfica do Médio Paranapanema.",,,,,,,,,,,"brazil","sao paulo","galia","a estacao ecologica dos caetetus",,"locality","brazil_sao paulo_galia","brazil_sao paulo_galia",-22.31982553,-49.57741765,"county","3967831992",,,,"219320003","1615",,,,"PRESENT",,,,,,"Parcela Permanente. Área de 320x320 m dividida em 256 sub-parcelas contíguas de 20x20 m. Em cada uma das sub-parcelas, foram amostrados, georreferenciados e identificados todos os indivíduos arbóreos com PAP (perímetro na altura de 1,30 m a partir do solo) maior ou igual à 15 cm.",,"21826",,,,,,,,,,,,,"7044758",,,,,,,,,,,"Aegiphila",,,,,,"c1c5ef4b-8309-4f04-9247-3f7644260c85",,,TRUE,FALSE,"Aegiphila integrifolia","Aegiphila integrifolia","null",FALSE,"LATIN_AMERICA","LATIN_AMERICA","LC",,,,"EPSG:4291",,,,,,,,,,,,,,,,,,"brazil_sao paulo_galia","Brazil","São Paulo","Gália",,"check_local.2municip.","Aegiphila integrifolia","(Jacq.) Moldenke","name_w_authors","Lamiaceae","Aegiphila integrifolia","(Jacq.) Moldenke","species","author misspelled","bfo-23320",,,"Aegiphila integrifolia (Jacq.) Moldenke","Aegiphila","Lamiaceae","unknown","Aegiphila integrifolia"
"gbif",,,"21933","Agonandra excelsa Griseb.","Plantae","Opiliaceae","Agonandra",,,,"Brazil","Sp",,"A Estação Ecológica dos Caetetus (EEC) possui uma área contínua de 2178,84 ha, dentro da bacia hidrográfica do Médio Paranapanema.",,"Tracheophyta","OCCURRENCE",,,,,,,"excelsa","Tiago Egydio Barreto","-49.7004159","-22.4081668","2016-07-28",,,,,,,,,,"Magnoliopsida","Santalales",,,"GBIF","Gália",,"Agonandra excelsa Griseb.",,"BR",,"SinBIOTA",,,,,,,"ACCEPTED","SPECIES","Dataset",,,"A Estação Ecológica dos Caetetus (EEC) possui uma área contínua de 2178,84 ha, dentro da bacia hidrográfica do Médio Paranapanema.",,,,,,,,,,,"brazil","sao paulo","galia","a estacao ecologica dos caetetus",,"locality","brazil_sao paulo_galia","brazil_sao paulo_galia",-22.31982553,-49.57741765,"county","3967833953",,,,"219330004","1615",,,,"PRESENT",,,,,,"Parcela Permanente. Área de 320x320 m dividida em 256 sub-parcelas contíguas de 20x20 m. Em cada uma das sub-parcelas, foram amostrados, georreferenciados e identificados todos os indivíduos arbóreos com PAP (perímetro na altura de 1,30 m a partir do solo) maior ou igual à 15 cm.",,"21827",,,,,,,,,,,,,"9399315",,,,,,,,,,,"Agonandra",,,,,,"c1c5ef4b-8309-4f04-9247-3f7644260c85",,,TRUE,FALSE,"Agonandra excelsa","Agonandra excelsa","null",FALSE,"LATIN_AMERICA","LATIN_AMERICA","LC",,,,"EPSG:4291",,,,,,,,,,,,,,,,,,"brazil_sao paulo_galia","Brazil","São Paulo","Gália",,"check_local.2municip.","Agonandra excelsa","Griseb.","name_w_authors","Opiliaceae","Agonandra excelsa","Griseb.","species","name accepted","bfo-10984",,,"Agonandra excelsa Griseb.","Agonandra","Opiliaceae","unknown","Agonandra excelsa"
"speciesLink","SPFR015217","SPFR","15217","Eupatorium","Plantae","Asteraceae","Eupatorium","2011","06","21","Brasil","São Paulo","Gália","Estação Ecológica dos Caetetus.","FFCLRP",,"PreservedSpecimen",,,,"22°22'33,7""S","49°40'19,9''W","455",,"Rocha-Filho, R.C.","-49.671944","-22.375833","2025-05-13T17:36:59",,"8","<nO>Arbusto ca. 1m de altura, capítulos de cor lilás.Borda da mata.</nO>",,,,,,,,,,,"SPLINK","Gália",,,,,,,,,,,,,,,,,,,"SPFR",,"Rocha Filho, R.C.","8","2011","s.n.","n.d.",,"Rocha Filho",,"brazil","sao paulo","galia","estacao ecologica dos caetetus",,"locality","brazil_sao paulo_galia_estacao ecologica caetetus","brazil_sao paulo_galia_eec caetetus",-22.413951,-49.685434,"locality",,,,,,,,,,,,,,,,,,,,,,,,,,,,,,,,,,,,,,,,,,,,,,,,,,,,,,,,,,,,,,,,,,,,,,,,,,,,,,,,,,,,,,"ok_same_resolution","Agrimonia","L.","indet","Asteraceae|Rosaceae","Agrimonia","L.","genus","+1 name, but 1 accepted","bfo-116397","Agrimonia","L.","Agrimonia L.","Agrimonia","Asteraceae|Rosaceae","unknown",
"gbif",,,"21934","Albizia niopoides (Spruce ex Benth.) Burkart","Plantae","Fabaceae","Albizia",,,,"Brazil","Sp",,"A Estação Ecológica dos Caetetus (EEC) possui uma área contínua de 2178,84 ha, dentro da bacia hidrográfica do Médio Paranapanema.",,"Tracheophyta","OCCURRENCE",,,,,,,"niopoides","Tiago Egydio Barreto","-49.7004159","-22.4081668","2016-07-29",,,,,,,,,,"Magnoliopsida","Fabales",,,"GBIF","Gália",,"Albizia niopoides (Spruce ex Benth.) Burkart",,"BR",,"SinBIOTA",,,,,,,"ACCEPTED","SPECIES","Dataset",,,"A Estação Ecológica dos Caetetus (EEC) possui uma área contínua de 2178,84 ha, dentro da bacia hidrográfica do Médio Paranapanema.",,,,,,,,,,,"brazil","sao paulo","galia","a estacao ecologica dos caetetus",,"locality","brazil_sao paulo_galia","brazil_sao paulo_galia",-22.31982553,-49.57741765,"county","3967833050",,,,"219340005","1615",,,,"PRESENT",,,,,,"Parcela Permanente. Área de 320x320 m dividida em 256 sub-parcelas contíguas de 20x20 m. Em cada uma das sub-parcelas, foram amostrados, georreferenciados e identificados todos os indivíduos arbóreos com PAP (perímetro na altura de 1,30 m a partir do solo) maior ou igual à 15 cm.",,"21828",,,,,,,,,,,,,"592565",,,,,,,,,,,"Albizia",,,,,,"c1c5ef4b-8309-4f04-9247-3f7644260c85",,,TRUE,FALSE,"Albizia niopoides","Albizia niopoides","null",FALSE,"LATIN_AMERICA","LATIN_AMERICA","LC",,,,"EPSG:4291",,,,,,,,,,,,,,,,,,"brazil_sao paulo_galia","Brazil","São Paulo","Gália",,"check_local.2municip.","Albizia niopoides","(Spruce ex Benth.) Burkart","name_w_authors","Fabaceae","Albizia niopoides","(Spruce ex Benth.) Burkart","species","name accepted","bfo-82616",,,"Albizia niopoides (Spruce ex Benth.) Burkart","Albizia","Fabaceae","unknown","Albizia niopoides"
"gbif",,,"21933","Albizia polycephala (Benth.) Killip","Plantae","Fabaceae","Albizia",,,,"Brazil","Sp",,"A Estação Ecológica dos Caetetus (EEC) possui uma área contínua de 2178,84 ha, dentro da bacia hidrográfica do Médio Paranapanema.",,"Tracheophyta","OCCURRENCE",,,,,,,"polycephala","Tiago Egydio Barreto","-49.7004159","-22.4081668","2016-07-28",,,,,,,,,,"Magnoliopsida","Fabales",,,"GBIF","Gália",,"Albizia polycephala (Benth.) Killip",,"BR",,"SinBIOTA",,,,,,,"ACCEPTED","SPECIES","Dataset",,,"A Estação Ecológica dos Caetetus (EEC) possui uma área contínua de 2178,84 ha, dentro da bacia hidrográfica do Médio Paranapanema.",,,,,,,,,,,"brazil","sao paulo","galia","a estacao ecologica dos caetetus",,"locality","brazil_sao paulo_galia","brazil_sao paulo_galia",-22.31982553,-49.57741765,"county","3967833031",,,,"219330006","1615",,,,"PRESENT",,,,,,"Parcela Permanente. Área de 320x320 m dividida em 256 sub-parcelas contíguas de 20x20 m. Em cada uma das sub-parcelas, foram amostrados, georreferenciados e identificados todos os indivíduos arbóreos com PAP (perímetro na altura de 1,30 m a partir do solo) maior ou igual à 15 cm.",,"21827",,,,,,,,,,,,,"619769",,,,,,,,,,,"Albizia",,,,,,"c1c5ef4b-8309-4f04-9247-3f7644260c85",,,TRUE,FALSE,"Albizia polycephala","Albizia polycephala","null",FALSE,"LATIN_AMERICA","LATIN_AMERICA","NE",,,,"EPSG:4291",,,,,,,,,,,,,,,,,,"brazil_sao paulo_galia","Brazil","São Paulo","Gália",,"check_local.2municip.","Albizia polycephala","(Benth.) Killip ex Record","name_w_authors","Fabaceae","Albizia polycephala","(Benth.) Killip ex Record","species","author misspelled","bfo-18067",,,"Albizia polycephala (Benth.) Killip ex Record","Albizia","Fabaceae","unknown","Albizia polycephala"
"gbif",,,"21934","Alchornea glandulosa Poepp.","Plantae","Euphorbiaceae","Alchornea",,,,"Brazil","Sp",,"A Estação Ecológica dos Caetetus (EEC) possui uma área contínua de 2178,84 ha, dentro da bacia hidrográfica do Médio Paranapanema.",,"Tracheophyta","OCCURRENCE",,,,,,,"glandulosa","Tiago Egydio Barreto","-49.7004159","-22.4081668","2016-07-29",,,,,,,,,,"Magnoliopsida","Malpighiales",,,"GBIF","Gália",,"Alchornea glandulosa Poepp.",,"BR",,"SinBIOTA",,,,,,,"ACCEPTED","SPECIES","Dataset",,,"A Estação Ecológica dos Caetetus (EEC) possui uma área contínua de 2178,84 ha, dentro da bacia hidrográfica do Médio Paranapanema.",,,,,,,,,,,"brazil","sao paulo","galia","a estacao ecologica dos caetetus",,"locality","brazil_sao paulo_galia","brazil_sao paulo_galia",-22.31982553,-49.57741765,"county","3967831131",,,,"219340007","1615",,,,"PRESENT",,,,,,"Parcela Permanente. Área de 320x320 m dividida em 256 sub-parcelas contíguas de 20x20 m. Em cada uma das sub-parcelas, foram amostrados, georreferenciados e identificados todos os indivíduos arbóreos com PAP (perímetro na altura de 1,30 m a partir do solo) maior ou igual à 15 cm.",,"21828",,,,,,,,,,,,,"8163596",,,,,,,,,,,"Alchornea",,,,,,"c1c5ef4b-8309-4f04-9247-3f7644260c85",,,TRUE,FALSE,"Alchornea glandulosa","Alchornea glandulosa","null",FALSE,"LATIN_AMERICA","LATIN_AMERICA","LC",,,,"EPSG:4291",,,,,,,,,,,,,,,,,,"brazil_sao paulo_galia","Brazil","São Paulo","Gália",,"check_local.2municip.","Alchornea glandulosa","Poepp. & Endl.","name_w_authors","Euphorbiaceae","Alchornea glandulosa","Poepp. & Endl.","species","author misspelled","bfo-17456",,,"Alchornea glandulosa Poepp. & Endl.","Alchornea","Euphorbiaceae","unknown","Alchornea glandulosa"
"user",,"ESA","ESA00137142","Alchornea triplinervia (Spreng.) Müll. Arg.",,"Euphorbiaceae","Alchornea","2015","10","11","Brasil","São Paulo",,"Estação Ecológica de Caetetus, trilha do cipó","ESA",,,"Sem determinador",,,,,,,"Colletta, G. D","0","0",,"(Spreng.) Müll. Arg.","2321",,,,,,,,,,,,"REFLORA","Gália",,,,,,,,,,,,,,"SPECIES",,,,,,,,,,,,,,,"brazil","sao paulo","galia","estacao ecologica de caetetus",,"locality","brazil_sao paulo_galia_estacao ecologica caetetus","brazil_sao paulo_galia_eec caetetus",-22.413951,-49.685434,"locality",,,,,,,,,,,,,,,,,,,,,,,,,,,,,"não",,,,,,,,,,,,,,,,,,,,,,,,"triplinervia","EUPHORBIACEAE Alchornea triplinervia (Spreng.) Müll. Arg.",,,,,,,,,,,"ESA",,,,,"11/10/2015",,"680","METRO",,,,,,,,"brazil_sao paulo_galia_eec caetetus","Brazil","São Paulo","Gália","EEc de Caetetus","ok_same_resolution","Alchornea triplinervia","(Spreng.) Müll.Arg.","name_w_authors","Euphorbiaceae","Alchornea triplinervia","(Spreng.) Müll.Arg.","species","author misspelled","bfo-17458",,,"Alchornea triplinervia (Spreng.) Müll.Arg.","Alchornea","Euphorbiaceae","high","Alchornea triplinervia"
"speciesLink","UEC099404","UEC","79181","Alicia anisopetala","Plantae","Malpighiaceae","Alicia","1995","06","24","Brazil","São Paulo","Gália","Estação Ecológica dos Caetetus.","UNICAMP","Magnoliopsida","S","Almeida, RF","2013",,"-22.25","-49.5","2","anisopetala","Passos, FC; Kim, AC","-49.5","-22.25","2025-04-07T10:58:00","(A.Juss.) W.R.Anderson","FP69","<nO>Liana com frutos verdes claros.; Mata Semidecídua,</nO>",,,,,,,,,,,"SPLINK","Gália","2013-NA-NA",,,,,,,,,,,,,,,,,,"UEC",,"Passos, F.C.","FP69","1995","Almeida, R.F.","2013","Kim, A.C.","Passos",,"brazil","sao paulo","galia","estacao ecologica dos caetetus",,"locality","brazil_sao paulo_galia_estacao ecologica caetetus","brazil_sao paulo_galia_eec caetetus",-22.413951,-49.685434,"locality",,,,,,,,,,,,,,,,,,,,,,,,,,,,,,,,,,,,,,,,,,,,,,,,,,,,,,,,,,,,,,,,,,,,,,,,,,,,,,,,,,,,,,"ok_same_resolution","Alicia anisopetala","(A.Juss.) W.R.Anderson","possibly_ok","Malpighiaceae","Alicia anisopetala","(A.Juss.) W.R.Anderson","species","name accepted","bfo-8798",,,"Alicia anisopetala (A.Juss.) W.R.Anderson","Alicia","Malpighiaceae","high","Alicia anisopetala"
