"Nome.da.UC","NumRecords","NumTaxons","NumSpecies","NumGenus","NumFamilies","NumOuro","NumPrata","NumBronze","NumLatao","NumNoMatch"
"ÁREA DE PROTEÇÃO AMBIENTAL - PEDREGULHO",6,6,6,6,5,1,1,1,3,0
"ÁREA DE PROTEÇÃO AMBIENTAL BACIA DO PARAÍBA DO SUL",8237,1591,1549,718,170,697,114,512,268,220
"ÁREA DE PROTEÇÃO AMBIENTAL BALEIA SAHY",18,8,8,7,7,1,0,0,7,1
"ÁREA DE PROTEÇÃO AMBIENTAL BARREIRO RICO",1443,364,348,249,88,216,7,109,32,6
"ÁREA DE PROTEÇÃO AMBIENTAL BORORÉ-COLÔNIA",1008,269,253,196,80,67,23,110,69,44
"ÁREA DE PROTEÇÃO AMBIENTAL CABREUVA",1281,432,408,295,100,168,26,164,74,31
"ÁREA DE PROTEÇÃO AMBIENTAL CAJAMAR",177,81,81,63,36,20,0,28,33,0
"ÁREA DE PROTEÇÃO AMBIENTAL CAJATI",5,2,2,2,2,0,0,2,0,0
"ÁREA DE PROTEÇÃO AMBIENTAL CAMPOS DO JORDÃO",22968,2097,1986,842,195,809,170,746,372,491
"ÁREA DE PROTEÇÃO AMBIENTAL CUESTA CORUMBATAÍ",24447,2201,2139,863,170,997,191,763,250,213
"ÁREA DE PROTEÇÃO AMBIENTAL CUESTA GUARANI",5071,920,873,526,131,225,25,496,174,42
"ÁREA DE PROTEÇÃO AMBIENTAL CUESTA PARAPANEMA",704,178,161,146,67,57,41,54,26,8
"ÁREA DE PROTEÇÃO AMBIENTAL DA SERRA DE SANTO AMARO",2352,540,520,352,118,160,6,319,55,202
"ÁREA DE PROTEÇÃO AMBIENTAL DA SERRA DO PALMITAL",1,1,1,1,1,0,0,0,1,0
"ÁREA DE PROTEÇÃO AMBIENTAL DE CAMPINAS",4338,736,712,435,120,258,52,305,121,6
"ÁREA DE PROTEÇÃO AMBIENTAL DE CANANÉIA-IGUAPÉ-PERUÍBE",34693,2509,2432,949,204,1395,220,666,228,387
"ÁREA DE PROTEÇÃO AMBIENTAL DO AVECUIA",410,170,169,137,57,26,2,120,22,0
"ÁREA DE PROTEÇÃO AMBIENTAL DO BANHADO",76,18,16,16,9,5,0,5,8,0
"ÁREA DE PROTEÇÃO AMBIENTAL DO CABUÇU TANQUE GRANDE",783,259,254,200,65,67,41,119,32,5
"ÁREA DE PROTEÇÃO AMBIENTAL DO CAMPO GRANDE",5,5,5,5,4,0,0,0,5,0
"ÁREA DE PROTEÇÃO AMBIENTAL DO ENGENHO D’AGUA",1,1,1,1,1,0,0,0,1,0
"ÁREA DE PROTEÇÃO AMBIENTAL HARAS SÃO BERNARDO",0,0,0,0,0,0,0,0,0,NA
"ÁREA DE PROTEÇÃO AMBIENTAL IBITINGA",373,127,119,109,50,46,7,39,35,13
"ÁREA DE PROTEÇÃO AMBIENTAL ILHA COMPRIDA",2505,453,429,297,111,193,29,158,73,27
"ÁREA DE PROTEÇÃO AMBIENTAL ILHAS E VÁRZEAS DO RIO PARANÁ",0,0,0,0,0,0,0,0,0,NA
"ÁREA DE PROTEÇÃO AMBIENTAL ITUPARARANGA",6519,990,955,535,146,294,44,382,270,220
"ÁREA DE PROTEÇÃO AMBIENTAL JUNDIAÍ",16178,1913,1841,845,174,934,52,637,290,93
"ÁREA DE PROTEÇÃO AMBIENTAL MARINHA DO LITORAL CENTRO",2522,418,403,289,105,99,7,267,45,338
"ÁREA DE PROTEÇÃO AMBIENTAL MARINHA DO LITORAL NORTE",6804,NA,NA,NA,NA,NA,NA,NA,NA,NA
"ÁREA DE PROTEÇÃO AMBIENTAL MARINHA DO LITORAL SUL",668,NA,NA,NA,NA,NA,NA,NA,NA,NA
"ÁREA DE PROTEÇÃO AMBIENTAL MATA DO IGUATEMÍ",21,NA,NA,NA,NA,NA,NA,NA,NA,NA
"ÁREA DE PROTEÇÃO AMBIENTAL MORRO DE SÃO BENTO",0,0,0,0,0,0,0,0,0,NA
"ÁREA DE PROTEÇÃO AMBIENTAL MUNICIPAL DA SERRA DO GUARARU",542,NA,NA,NA,NA,NA,NA,NA,NA,NA
"ÁREA DE PROTEÇÃO AMBIENTAL MUNICIPAL DO CAPIVARI-MONOS",6932,NA,NA,NA,NA,NA,NA,NA,NA,NA
"ÁREA DE PROTEÇÃO AMBIENTAL PARQUE E FAZENDA DO CARMO",1468,NA,NA,NA,NA,NA,NA,NA,NA,NA
"ÁREA DE PROTEÇÃO AMBIENTAL PIRACICABA JUQUERI MIRIM ÁREA I",10714,NA,NA,NA,NA,NA,NA,NA,NA,NA
"ÁREA DE PROTEÇÃO AMBIENTAL PIRACICABA JUQUERÍ-MIRIM AREA II",13005,NA,NA,NA,NA,NA,NA,NA,NA,NA
"ÁREA DE PROTEÇÃO AMBIENTAL PLANALTO DO TURVO",63,NA,NA,NA,NA,NA,NA,NA,NA,NA
"ÁREA DE PROTEÇÃO AMBIENTAL QUILOMBOS DO MÉDIO RIBEIRA",3847,NA,NA,NA,NA,NA,NA,NA,NA,NA
"ÁREA DE PROTEÇÃO AMBIENTAL REPRESA BAIRRO DA USINA",11,NA,NA,NA,NA,NA,NA,NA,NA,NA
"ÁREA DE PROTEÇÃO AMBIENTAL RIO BATALHA",2832,NA,NA,NA,NA,NA,NA,NA,NA,NA
"ÁREA DE PROTEÇÃO AMBIENTAL RIO PARDINHO E RIO VERMELHO",6,NA,NA,NA,NA,NA,NA,NA,NA,NA
"ÁREA DE PROTEÇÃO AMBIENTAL SANTOS CONTINENTE",0,0,0,0,0,0,0,0,0,NA
"ÁREA DE PROTEÇÃO AMBIENTAL SÃO FRANCISCO XAVIER",470,NA,NA,NA,NA,NA,NA,NA,NA,NA
"ÁREA DE PROTEÇÃO AMBIENTAL SAPUCAÍ MIRIM",2220,NA,NA,NA,NA,NA,NA,NA,NA,NA
"ÁREA DE PROTEÇÃO AMBIENTAL SERRA DA MANTIQUEIRA",760,NA,NA,NA,NA,NA,NA,NA,NA,NA
"ÁREA DE PROTEÇÃO AMBIENTAL SERRA DO ITAPETI",648,NA,NA,NA,NA,NA,NA,NA,NA,NA
"ÁREA DE PROTEÇÃO AMBIENTAL SERRA DO MAR",19591,NA,NA,NA,NA,NA,NA,NA,NA,NA
"ÁREA DE PROTEÇÃO AMBIENTAL SILVEIRAS",538,NA,NA,NA,NA,NA,NA,NA,NA,NA
"ÁREA DE PROTEÇÃO AMBIENTAL SISTEMA CANTAREIRA",11845,NA,NA,NA,NA,NA,NA,NA,NA,NA
"ÁREA DE PROTEÇÃO AMBIENTAL TANQUÃ-RIO PIRACICABA",172,NA,NA,NA,NA,NA,NA,NA,NA,NA
"ÁREA DE PROTEÇÃO AMBIENTAL TIETÊ",1007,NA,NA,NA,NA,NA,NA,NA,NA,NA
"ÁREA DE PROTEÇÃO AMBIENTAL VÁRZEA DO RIO TIETÊ",1310,NA,NA,NA,NA,NA,NA,NA,NA,NA
"ÁREA DE RELEVANTE INTERESSE ECOLÓGICO BURITI DE VASSUNUNGA",0,0,0,0,0,0,0,0,0,NA
"ÁREA DE RELEVANTE INTERESSE ECOLÓGICO CERRADO PÉ-DE-GIGANTE",2468,NA,NA,NA,NA,NA,NA,NA,NA,NA
"ÁREA DE RELEVANTE INTERESSE ECOLÓGICO DA PEDRA BRANCA",0,0,0,0,0,0,0,0,0,NA
"ÁREA DE RELEVANTE INTERESSE ECOLÓGICO DE SÃO SEBASTIÃO",141,NA,NA,NA,NA,NA,NA,NA,NA,NA
"ÁREA DE RELEVANTE INTERESSE ECOLÓGICO DO GUARÁ",2,NA,NA,NA,NA,NA,NA,NA,NA,NA
"ÁREA DE RELEVANTE INTERESSE ECOLÓGICO ILHA AMEIXAL",0,0,0,0,0,0,0,0,0,NA
"ÁREA DE RELEVANTE INTERESSE ECOLÓGICO ILHAS QUEIMADA GRANDE E QUEIMADA PEQUENA",68,NA,NA,NA,NA,NA,NA,NA,NA,NA
"ÁREA DE RELEVANTE INTERESSE ECOLÓGICO LEOPOLDO MAGNO COUTINHO",483,NA,NA,NA,NA,NA,NA,NA,NA,NA
"ÁREA DE RELEVANTE INTERESSE ECOLÓGICO MATA DE SANTA GENEBRA",2780,NA,NA,NA,NA,NA,NA,NA,NA,NA
"ÁREA DE RELEVANTE INTERESSE ECOLÓGICO MATÃO DE COSMÓPOLIS",2,NA,NA,NA,NA,NA,NA,NA,NA,NA
"ÁREA DE RELEVANTE INTERESSE ECOLÓGICO ZONA DE VIDA SILVESTRE DA APA DA ILHA COMPRIDA",1872,NA,NA,NA,NA,NA,NA,NA,NA,NA
"ESTAÇÃO ECOLÓGICA BANANAL",3133,NA,NA,NA,NA,NA,NA,NA,NA,NA
"ESTAÇÃO ECOLÓGICA BRÁULIO GUEDES DA SILVA",0,0,0,0,0,0,0,0,0,NA
"ESTAÇÃO ECOLÓGICA CHAÚAS",321,NA,NA,NA,NA,NA,NA,NA,NA,NA
"ESTAÇÃO ECOLÓGICA DE ANGATUBA",1623,NA,NA,NA,NA,NA,NA,NA,NA,NA
"ESTAÇÃO ECOLÓGICA DE ASSIS",2204,NA,NA,NA,NA,NA,NA,NA,NA,NA
"ESTAÇÃO ECOLÓGICA DE AVARÉ",599,NA,NA,NA,NA,NA,NA,NA,NA,NA
"ESTAÇÃO ECOLÓGICA DE BAURU",126,NA,NA,NA,NA,NA,NA,NA,NA,NA
"ESTAÇÃO ECOLÓGICA DE ITAPETI",128,NA,NA,NA,NA,NA,NA,NA,NA,NA
"ESTAÇÃO ECOLÓGICA DE ITIRAPINA",2787,NA,NA,NA,NA,NA,NA,NA,NA,NA
"ESTAÇÃO ECOLÓGICA DE MARÍLIA",0,0,0,0,0,0,0,0,0,NA
"ESTAÇÃO ECOLÓGICA DE MOGI-GUAÇU",6685,NA,NA,NA,NA,NA,NA,NA,NA,NA
"ESTAÇÃO ECOLÓGICA DE PARANAPANEMA",1907,NA,NA,NA,NA,NA,NA,NA,NA,NA
"ESTAÇÃO ECOLÓGICA DE PAULO DE FARIA",3055,NA,NA,NA,NA,NA,NA,NA,NA,NA
"ESTAÇÃO ECOLÓGICA DE RIBEIRÃO PRETO",1190,NA,NA,NA,NA,NA,NA,NA,NA,NA
"ESTAÇÃO ECOLÓGICA DE SANTA BÁRBARA",3996,NA,NA,NA,NA,NA,NA,NA,NA,NA
"ESTAÇÃO ECOLÓGICA DE SANTA MARIA",73,NA,NA,NA,NA,NA,NA,NA,NA,NA
"ESTAÇÃO ECOLÓGICA DE XITUÉ",317,NA,NA,NA,NA,NA,NA,NA,NA,NA
"ESTAÇÃO ECOLÓGICA DO BARREIRO RICO",4,NA,NA,NA,NA,NA,NA,NA,NA,NA
"ESTAÇÃO ECOLÓGICA DO NOROESTE PAULISTA",1476,NA,NA,NA,NA,NA,NA,NA,NA,NA
"ESTAÇÃO ECOLÓGICA DO TANQUE GRANDE",0,0,0,0,0,0,0,0,0,NA
"ESTAÇÃO ECOLÓGICA DOS CAETETUS",2729,NA,NA,NA,NA,NA,NA,NA,NA,NA
"ESTAÇÃO ECOLÓGICA DOS TUPINIQUINS",43,NA,NA,NA,NA,NA,NA,NA,NA,NA
"ESTAÇÃO ECOLÓGICA GOVERNADOR MARIO COVAS",0,0,0,0,0,0,0,0,0,NA
"ESTAÇÃO ECOLÓGICA IBICATU",900,NA,NA,NA,NA,NA,NA,NA,NA,NA
"ESTAÇÃO ECOLÓGICA ITABERÁ",776,NA,NA,NA,NA,NA,NA,NA,NA,NA
"ESTAÇÃO ECOLÓGICA ITAPEVA",2773,NA,NA,NA,NA,NA,NA,NA,NA,NA
"ESTAÇÃO ECOLÓGICA JATAÍ",2132,NA,NA,NA,NA,NA,NA,NA,NA,NA
"ESTAÇÃO ECOLÓGICA JURÉIA-ITATINS",11902,NA,NA,NA,NA,NA,NA,NA,NA,NA
"ESTAÇÃO ECOLÓGICA MATA DO JACARÉ",0,0,0,0,0,0,0,0,0,NA
"ESTAÇÃO ECOLÓGICA MICO LEÃO PRETO",1,NA,NA,NA,NA,NA,NA,NA,NA,NA
"ESTAÇÃO ECOLÓGICA MUNICIPAL DO CAETÊ",5,NA,NA,NA,NA,NA,NA,NA,NA,NA
"ESTAÇÃO ECOLÓGICA MUNICIPAL DO PIRAJIBU",0,0,0,0,0,0,0,0,0,NA
"ESTAÇÃO ECOLÓGICA MUNICIPAL GUARANI",0,0,0,0,0,0,0,0,0,NA
"ESTAÇÃO ECOLÓGICA TUPINAMBÁS",614,NA,NA,NA,NA,NA,NA,NA,NA,NA
"ESTAÇÃO ECOLÓGICA VALINHOS",36,NA,NA,NA,NA,NA,NA,NA,NA,NA
"FLORESTA ESTADUAL DE ASSIS",394,NA,NA,NA,NA,NA,NA,NA,NA,NA
"FLORESTA ESTADUAL DE GUARULHOS",3,NA,NA,NA,NA,NA,NA,NA,NA,NA
"FLORESTA ESTADUAL DO NOROESTE PAULISTA",19,NA,NA,NA,NA,NA,NA,NA,NA,NA
"FLORESTA ESTADUAL EDMUNDO NAVARRO DE ANDRADE",1562,NA,NA,NA,NA,NA,NA,NA,NA,NA
"FLORESTA ESTADUAL PEDERNEIRAS",2,NA,NA,NA,NA,NA,NA,NA,NA,NA
"FLORESTA ESTADUAL SERRA DÁGUA",0,0,0,0,0,0,0,0,0,NA
"FLORESTA NACIONAL DE CAPÃO BONITO",0,0,0,0,0,0,0,0,0,NA
"FLORESTA NACIONAL DE IPANEMA",1594,NA,NA,NA,NA,NA,NA,NA,NA,NA
"FLORESTA NACIONAL DE LORENA",3,NA,NA,NA,NA,NA,NA,NA,NA,NA
"MONUMENTO NATURAL ESTADUAL DA PEDRA DO BAÚ",426,NA,NA,NA,NA,NA,NA,NA,NA,NA
"MONUMENTO NATURAL ESTADUAL DA PEDRA GRANDE",652,NA,NA,NA,NA,NA,NA,NA,NA,NA
"MONUMENTO NATURAL ESTADUAL MANTIQUEIRA PAULISTA",189,NA,NA,NA,NA,NA,NA,NA,NA,NA
"MONUMENTO NATURAL MUNICIPAL DO PICO DO ITAGUARÉ",64,NA,NA,NA,NA,NA,NA,NA,NA,NA
"PARQUE ESTADUAL ÁGUAS DA BILLINGS",121,NA,NA,NA,NA,NA,NA,NA,NA,NA
"PARQUE ESTADUAL ÁGUAS DA PRATA",13,NA,NA,NA,NA,NA,NA,NA,NA,NA
"PARQUE ESTADUAL ALBERTO LÖFGREN",563,NA,NA,NA,NA,NA,NA,NA,NA,NA
"PARQUE ESTADUAL CARLOS BOTELHO",18542,NA,NA,NA,NA,NA,NA,NA,NA,NA
"PARQUE ESTADUAL CAVERNA DO DIABO",1556,NA,NA,NA,NA,NA,NA,NA,NA,NA
"PARQUE ESTADUAL DA ARA",33,NA,NA,NA,NA,NA,NA,NA,NA,NA
"PARQUE ESTADUAL DA CAMPINA DO ENCANTADO",473,NA,NA,NA,NA,NA,NA,NA,NA,NA
"PARQUE ESTADUAL DA CANTAREIRA",5839,NA,NA,NA,NA,NA,NA,NA,NA,NA
"PARQUE ESTADUAL DA ILHA ANCHIETA",4018,NA,NA,NA,NA,NA,NA,NA,NA,NA
"PARQUE ESTADUAL DA ILHA DO CARDOSO",18799,NA,NA,NA,NA,NA,NA,NA,NA,NA
"PARQUE ESTADUAL DA SERRA DO MAR",75795,NA,NA,NA,NA,NA,NA,NA,NA,NA
"PARQUE ESTADUAL DAS FONTES DO IPIRANGA",30678,NA,NA,NA,NA,NA,NA,NA,NA,NA
"PARQUE ESTADUAL DAS FURNAS DO BOM JESUS",4940,NA,NA,NA,NA,NA,NA,NA,NA,NA
"PARQUE ESTADUAL DE CAMPOS DO JORDÃO",8219,NA,NA,NA,NA,NA,NA,NA,NA,NA
"PARQUE ESTADUAL DE ILHABELA",941,NA,NA,NA,NA,NA,NA,NA,NA,NA
"PARQUE ESTADUAL DE ITABERABA",905,NA,NA,NA,NA,NA,NA,NA,NA,NA
"PARQUE ESTADUAL DE ITAPETINGA",117,NA,NA,NA,NA,NA,NA,NA,NA,NA
"PARQUE ESTADUAL DE PORTO FERREIRA",2126,NA,NA,NA,NA,NA,NA,NA,NA,NA
"PARQUE ESTADUAL DE VASSUNUNGA",4046,NA,NA,NA,NA,NA,NA,NA,NA,NA
"PARQUE ESTADUAL DO AGUAPEÍ",346,NA,NA,NA,NA,NA,NA,NA,NA,NA
"PARQUE ESTADUAL DO ITINGUÇU",148,NA,NA,NA,NA,NA,NA,NA,NA,NA
"PARQUE ESTADUAL DO JARAGUÁ",2004,NA,NA,NA,NA,NA,NA,NA,NA,NA
"PARQUE ESTADUAL DO JUQUERY",2944,NA,NA,NA,NA,NA,NA,NA,NA,NA
"PARQUE ESTADUAL DO JURUPARÁ",811,NA,NA,NA,NA,NA,NA,NA,NA,NA
"PARQUE ESTADUAL DO MORRO DO DIABO",5589,NA,NA,NA,NA,NA,NA,NA,NA,NA
"PARQUE ESTADUAL DO PRELADO",25,NA,NA,NA,NA,NA,NA,NA,NA,NA
"PARQUE ESTADUAL DO RIO PEIXE",1,NA,NA,NA,NA,NA,NA,NA,NA,NA
"PARQUE ESTADUAL DO RIO TURVO",1437,NA,NA,NA,NA,NA,NA,NA,NA,NA
"PARQUE ESTADUAL DOS MANANCIAIS DE CAMPOS DO JORDÃO",132,NA,NA,NA,NA,NA,NA,NA,NA,NA
"PARQUE ESTADUAL INTERVALES",8019,NA,NA,NA,NA,NA,NA,NA,NA,NA
"PARQUE ESTADUAL LAGAMAR DE CANANEIA",226,NA,NA,NA,NA,NA,NA,NA,NA,NA
"PARQUE ESTADUAL MARINHO DA LAJE DE SANTOS",239,NA,NA,NA,NA,NA,NA,NA,NA,NA
"PARQUE ESTADUAL NASCENTES DO PARANAPANEMA",836,NA,NA,NA,NA,NA,NA,NA,NA,NA
"PARQUE ESTADUAL RESTINGA DE BERTIOGA",2721,NA,NA,NA,NA,NA,NA,NA,NA,NA
"PARQUE ESTADUAL TURÍSTICO DO ALTO DO RIBEIRA",5000,NA,NA,NA,NA,NA,NA,NA,NA,NA
"PARQUE ESTADUAL XIXOVÁ-JAPUÍ",1672,NA,NA,NA,NA,NA,NA,NA,NA,NA
"PARQUE NACIONAL DA SERRA DA BOCAINA",2356,NA,NA,NA,NA,NA,NA,NA,NA,NA
"PARQUE NATURAL MUNICIPAL AUGUSTO RUSCHI",29,NA,NA,NA,NA,NA,NA,NA,NA,NA
"PARQUE NATURAL MUNICIPAL BORORÉ",134,NA,NA,NA,NA,NA,NA,NA,NA,NA
"PARQUE NATURAL MUNICIPAL CABECEIRAS DO ARICANDUVA",63,NA,NA,NA,NA,NA,NA,NA,NA,NA
"PARQUE NATURAL MUNICIPAL CACHOEIRA DA MARTA",244,NA,NA,NA,NA,NA,NA,NA,NA,NA
"PARQUE NATURAL MUNICIPAL CORREDORES DE BIODIVERSIDADE",32,NA,NA,NA,NA,NA,NA,NA,NA,NA
"PARQUE NATURAL MUNICIPAL COTIA-PARÁ",3,NA,NA,NA,NA,NA,NA,NA,NA,NA
"PARQUE NATURAL MUNICIPAL DA CRATERA DE COLÔNIA",162,NA,NA,NA,NA,NA,NA,NA,NA,NA
"PARQUE NATURAL MUNICIPAL DA CULTURA NEGRA - SÍTIO DA CANDINHA",2,NA,NA,NA,NA,NA,NA,NA,NA,NA
"PARQUE NATURAL MUNICIPAL DA GROTA DE MIRASSOL",0,0,0,0,0,0,0,0,0,NA
"PARQUE NATURAL MUNICIPAL DE BRIGADEIRO TOBIAS",0,0,0,0,0,0,0,0,0,NA
"PARQUE NATURAL MUNICIPAL DE SÃO ROQUE",56,NA,NA,NA,NA,NA,NA,NA,NA,NA
"PARQUE NATURAL MUNICIPAL DO BANHADO",1,NA,NA,NA,NA,NA,NA,NA,NA,NA
"PARQUE NATURAL MUNICIPAL DO BASALTO",12,NA,NA,NA,NA,NA,NA,NA,NA,NA
"PARQUE NATURAL MUNICIPAL DO CAMPO GRANDE",0,0,0,0,0,0,0,0,0,NA
"PARQUE NATURAL MUNICIPAL DO CERRADO",0,0,0,0,0,0,0,0,0,NA
"PARQUE NATURAL MUNICIPAL DO DISTRITO DE SANTA TEREZINHA",4,NA,NA,NA,NA,NA,NA,NA,NA,NA
"PARQUE NATURAL MUNICIPAL DO DOURADO",0,0,0,0,0,0,0,0,0,NA
"PARQUE NATURAL MUNICIPAL DO JUQUERIQUERÊ",0,0,0,0,0,0,0,0,0,NA
"PARQUE NATURAL MUNICIPAL DO PEDROSO",2,NA,NA,NA,NA,NA,NA,NA,NA,NA
"PARQUE NATURAL MUNICIPAL DO TRABIJU",189,NA,NA,NA,NA,NA,NA,NA,NA,NA
"PARQUE NATURAL MUNICIPAL DOS JATOBÁS",113,NA,NA,NA,NA,NA,NA,NA,NA,NA
"PARQUE NATURAL MUNICIPAL DOUTOR RUI CALAZANS DE ARAÚJO",0,0,0,0,0,0,0,0,0,NA
"PARQUE NATURAL MUNICIPAL ENGENHO SAO JORGE DOS ERASMOS",206,NA,NA,NA,NA,NA,NA,NA,NA,NA
"PARQUE NATURAL MUNICIPAL ESTORIL - VIRGÍLIO SIMIONATO",8,NA,NA,NA,NA,NA,NA,NA,NA,NA
"PARQUE NATURAL MUNICIPAL FAZENDA DO CARMO",911,NA,NA,NA,NA,NA,NA,NA,NA,NA
"PARQUE NATURAL MUNICIPAL ITAIM",46,NA,NA,NA,NA,NA,NA,NA,NA,NA
"PARQUE NATURAL MUNICIPAL JACEGUAVA",57,NA,NA,NA,NA,NA,NA,NA,NA,NA
"PARQUE NATURAL MUNICIPAL MORRO DO OURO",141,NA,NA,NA,NA,NA,NA,NA,NA,NA
"PARQUE NATURAL MUNICIPAL NASCENTES DE PARANAPIACABA",1687,NA,NA,NA,NA,NA,NA,NA,NA,NA
"PARQUE NATURAL MUNICIPAL OLESIO DOS SANTOS",0,0,0,0,0,0,0,0,0,NA
"PARQUE NATURAL MUNICIPAL SALTO BOTELHO",0,0,0,0,0,0,0,0,0,NA
"PARQUE NATURAL MUNICIPAL VALE DO ITAIM",1,NA,NA,NA,NA,NA,NA,NA,NA,NA
"PARQUE NATURAL MUNICIPAL VARGINHA",119,NA,NA,NA,NA,NA,NA,NA,NA,NA
"REFÚGIO DE VIDA SILVESTRE AIMORÉS",1303,NA,NA,NA,NA,NA,NA,NA,NA,NA
"REFÚGIO DE VIDA SILVESTRE ANHANGUERA",132,NA,NA,NA,NA,NA,NA,NA,NA,NA
"REFÚGIO DE VIDA SILVESTRE DA MATA DA REPRESA",0,0,0,0,0,0,0,0,0,NA
"REFÚGIO DE VIDA SILVESTRE DAS ILHAS DO ABRIGO E GUARARITAMA",11,NA,NA,NA,NA,NA,NA,NA,NA,NA
"REFÚGIO DE VIDA SILVESTRE DO ARQUIPÉLAGO DE ALCATRAZES",358,NA,NA,NA,NA,NA,NA,NA,NA,NA
"REFÚGIO DE VIDA SILVESTRE DO BICUDINHO",7,NA,NA,NA,NA,NA,NA,NA,NA,NA
"RESERVA BIOLÓGICA DE ANDRADINA",65,NA,NA,NA,NA,NA,NA,NA,NA,NA
"RESERVA BIOLÓGICA MOGI-GUAÇU",246,NA,NA,NA,NA,NA,NA,NA,NA,NA
"RESERVA BIOLÓGICA MUNICIPAL DA SERRA DO JAPI",2781,NA,NA,NA,NA,NA,NA,NA,NA,NA
"RESERVA BIOLÓGICA TAMBORÉ",2,NA,NA,NA,NA,NA,NA,NA,NA,NA
"RESERVA DE DESENVOLVIMENTO SUSTENTÁVEL BARREIRO ANHEMAS",94,NA,NA,NA,NA,NA,NA,NA,NA,NA
"RESERVA DE DESENVOLVIMENTO SUSTENTÁVEL DA BARRA DO UNA",570,NA,NA,NA,NA,NA,NA,NA,NA,NA
"RESERVA DE DESENVOLVIMENTO SUSTENTÁVEL DO DESPRAIADO",150,NA,NA,NA,NA,NA,NA,NA,NA,NA
"RESERVA DE DESENVOLVIMENTO SUSTENTÁVEL DOS PINHEIRINHOS",0,0,0,0,0,0,0,0,0,NA
"RESERVA DE DESENVOLVIMENTO SUSTENTÁVEL ITAPANHAPIMA",6,NA,NA,NA,NA,NA,NA,NA,NA,NA
"RESERVA DE DESENVOLVIMENTO SUSTENTÁVEL LAVRAS",45,NA,NA,NA,NA,NA,NA,NA,NA,NA
"RESERVA DE DESENVOLVIMENTO SUSTENTÁVEL QUILOMBOS DE BARRA DO TURVO",2,NA,NA,NA,NA,NA,NA,NA,NA,NA
"RESERVA EXTRATIVISTA ILHA DO TUMBA",14,NA,NA,NA,NA,NA,NA,NA,NA,NA
"RESERVA EXTRATIVISTA MANDIRA",2,NA,NA,NA,NA,NA,NA,NA,NA,NA
"RESERVA EXTRATIVISTA TAQUARI",1,NA,NA,NA,NA,NA,NA,NA,NA,NA
"RESERVA PARTICULAR DO PATRIMÔNIO NATURAL  RIO DOS PILÕES",8,NA,NA,NA,NA,NA,NA,NA,NA,NA
"RESERVA PARTICULAR DO PATRIMÔNIO NATURAL ÁGUAS CLARAS",256,NA,NA,NA,NA,NA,NA,NA,NA,NA
"RESERVA PARTICULAR DO PATRIMÔNIO NATURAL BESOURO DE FOGO",0,0,0,0,0,0,0,0,0,NA
"RESERVA PARTICULAR DO PATRIMÔNIO NATURAL BOTUJURU-SERRA DO ITAPETY",14,NA,NA,NA,NA,NA,NA,NA,NA,NA
"RESERVA PARTICULAR DO PATRIMÔNIO NATURAL CABURÉ",0,0,0,0,0,0,0,0,0,NA
"RESERVA PARTICULAR DO PATRIMÔNIO NATURAL CACHOEIRA DA LUISA",0,0,0,0,0,0,0,0,0,NA
"RESERVA PARTICULAR DO PATRIMÔNIO NATURAL CANDEIA",0,0,0,0,0,0,0,0,0,NA
"RESERVA PARTICULAR DO PATRIMÔNIO NATURAL CARBOCLORO S/A",0,0,0,0,0,0,0,0,0,NA
"RESERVA PARTICULAR DO PATRIMÔNIO NATURAL CAVA II",0,0,0,0,0,0,0,0,0,NA
"RESERVA PARTICULAR DO PATRIMÔNIO NATURAL CENTRO DE VIVÊNCIA COM A NATUREZA - CVN",0,0,0,0,0,0,0,0,0,NA
"RESERVA PARTICULAR DO PATRIMÔNIO NATURAL CHACARA SANTA INEZ",0,0,0,0,0,0,0,0,0,NA
"RESERVA PARTICULAR DO PATRIMÔNIO NATURAL COPAÍBA",0,0,0,0,0,0,0,0,0,NA
"RESERVA PARTICULAR DO PATRIMÔNIO NATURAL CRUZ PRETA",0,0,0,0,0,0,0,0,0,NA
"RESERVA PARTICULAR DO PATRIMÔNIO NATURAL DUAS CACHOEIRAS",207,NA,NA,NA,NA,NA,NA,NA,NA,NA
"RESERVA PARTICULAR DO PATRIMÔNIO NATURAL ECOWORLD",1,NA,NA,NA,NA,NA,NA,NA,NA,NA
"RESERVA PARTICULAR DO PATRIMÔNIO NATURAL ESTÂNCIA JATOBÁ",41,NA,NA,NA,NA,NA,NA,NA,NA,NA
"RESERVA PARTICULAR DO PATRIMÔNIO NATURAL FAZENDA BELA AURORA",0,0,0,0,0,0,0,0,0,NA
"RESERVA PARTICULAR DO PATRIMÔNIO NATURAL FAZENDA CATADUPA",0,0,0,0,0,0,0,0,0,NA
"RESERVA PARTICULAR DO PATRIMÔNIO NATURAL FAZENDA HORII",0,0,0,0,0,0,0,0,0,NA
"RESERVA PARTICULAR DO PATRIMÔNIO NATURAL FAZENDA MATA NATIVA",0,0,0,0,0,0,0,0,0,NA
"RESERVA PARTICULAR DO PATRIMÔNIO NATURAL FAZENDA PALMIRA",0,0,0,0,0,0,0,0,0,NA
"RESERVA PARTICULAR DO PATRIMÔNIO NATURAL FAZENDA RELÓGIO QUEIMADO",0,0,0,0,0,0,0,0,0,NA
"RESERVA PARTICULAR DO PATRIMÔNIO NATURAL FAZENDA RENOPOLIS",0,0,0,0,0,0,0,0,0,NA
"RESERVA PARTICULAR DO PATRIMÔNIO NATURAL FAZENDA SAN MICHELE",0,0,0,0,0,0,0,0,0,NA
"RESERVA PARTICULAR DO PATRIMÔNIO NATURAL FAZENDA SERRINHA",0,0,0,0,0,0,0,0,0,NA
"RESERVA PARTICULAR DO PATRIMÔNIO NATURAL FAZENDA SILVO AGRO-PASTORIL GONÇALVES",0,0,0,0,0,0,0,0,0,NA
"RESERVA PARTICULAR DO PATRIMÔNIO NATURAL FERLAG RESINAS BRASIL",0,0,0,0,0,0,0,0,0,NA
"RESERVA PARTICULAR DO PATRIMÔNIO NATURAL FLORESTA DAS ÁGUAS PERENES",3,NA,NA,NA,NA,NA,NA,NA,NA,NA
"RESERVA PARTICULAR DO PATRIMÔNIO NATURAL FLORESTA MARIA HELENA",0,0,0,0,0,0,0,0,0,NA
"RESERVA PARTICULAR DO PATRIMÔNIO NATURAL FLORESTA NEGRA, PARQUE NATURAL PARA ESTUDOS, PESQUISA E EDUCAÇÃO AMBIENTAL",0,0,0,0,0,0,0,0,0,NA
"RESERVA PARTICULAR DO PATRIMÔNIO NATURAL FRUTA DO LOBO",0,0,0,0,0,0,0,0,0,NA
"RESERVA PARTICULAR DO PATRIMÔNIO NATURAL GIGANTE DO ITAGUARÉ",2,NA,NA,NA,NA,NA,NA,NA,NA,NA
"RESERVA PARTICULAR DO PATRIMÔNIO NATURAL GUAINUMBI",1,NA,NA,NA,NA,NA,NA,NA,NA,NA
"RESERVA PARTICULAR DO PATRIMÔNIO NATURAL JACARANDÁS",0,0,0,0,0,0,0,0,0,NA
"RESERVA PARTICULAR DO PATRIMÔNIO NATURAL JAGUARETÊ",0,0,0,0,0,0,0,0,0,NA
"RESERVA PARTICULAR DO PATRIMÔNIO NATURAL LAFIGUEIRA - NATURARTE",0,0,0,0,0,0,0,0,0,NA
"RESERVA PARTICULAR DO PATRIMÔNIO NATURAL MAHAYANA",0,0,0,0,0,0,0,0,0,NA
"RESERVA PARTICULAR DO PATRIMÔNIO NATURAL MARINA DO CONDE",0,0,0,0,0,0,0,0,0,NA
"RESERVA PARTICULAR DO PATRIMÔNIO NATURAL MATA DO ROQUE",0,0,0,0,0,0,0,0,0,NA
"RESERVA PARTICULAR DO PATRIMÔNIO NATURAL MATA VIRGEM",0,0,0,0,0,0,0,0,0,NA
"RESERVA PARTICULAR DO PATRIMÔNIO NATURAL MEANDROS",0,0,0,0,0,0,0,0,0,NA
"RESERVA PARTICULAR DO PATRIMÔNIO NATURAL MEANDROS II",0,0,0,0,0,0,0,0,0,NA
"RESERVA PARTICULAR DO PATRIMÔNIO NATURAL MEANDROS III",0,0,0,0,0,0,0,0,0,NA
"RESERVA PARTICULAR DO PATRIMÔNIO NATURAL MORRO DO CURUSSU MIRIM",212,NA,NA,NA,NA,NA,NA,NA,NA,NA
"RESERVA PARTICULAR DO PATRIMÔNIO NATURAL MOSQUITO",72,NA,NA,NA,NA,NA,NA,NA,NA,NA
"RESERVA PARTICULAR DO PATRIMÔNIO NATURAL MUTINGA",6,NA,NA,NA,NA,NA,NA,NA,NA,NA
"RESERVA PARTICULAR DO PATRIMÔNIO NATURAL NARDINI SEMPRE VERDE",0,0,0,0,0,0,0,0,0,NA
"RESERVA PARTICULAR DO PATRIMÔNIO NATURAL O PRIMATA",0,0,0,0,0,0,0,0,0,NA
"RESERVA PARTICULAR DO PATRIMÔNIO NATURAL OLHO D'ÁGUA",0,0,0,0,0,0,0,0,0,NA
"RESERVA PARTICULAR DO PATRIMÔNIO NATURAL PARAÍSO",0,0,0,0,0,0,0,0,0,NA
"RESERVA PARTICULAR DO PATRIMÔNIO NATURAL PARAÍSO",0,0,0,0,0,0,0,0,0,NA
"RESERVA PARTICULAR DO PATRIMÔNIO NATURAL PARQUE DAS NASCENTES",0,0,0,0,0,0,0,0,0,NA
"RESERVA PARTICULAR DO PATRIMÔNIO NATURAL PARQUE DO ZIZO",310,NA,NA,NA,NA,NA,NA,NA,NA,NA
"RESERVA PARTICULAR DO PATRIMÔNIO NATURAL PARQUE DOS PÁSSAROS",0,0,0,0,0,0,0,0,0,NA
"RESERVA PARTICULAR DO PATRIMÔNIO NATURAL PARQUE FLORESTAL SÃO MARCELO",1,NA,NA,NA,NA,NA,NA,NA,NA,NA
"RESERVA PARTICULAR DO PATRIMÔNIO NATURAL PEDRA DA MINA",23,NA,NA,NA,NA,NA,NA,NA,NA,NA
"RESERVA PARTICULAR DO PATRIMÔNIO NATURAL PORTO DO IFÉ",0,0,0,0,0,0,0,0,0,NA
"RESERVA PARTICULAR DO PATRIMÔNIO NATURAL POUSADA CAMPOS DA BOCAINA",5,NA,NA,NA,NA,NA,NA,NA,NA,NA
"RESERVA PARTICULAR DO PATRIMÔNIO NATURAL RECANTO OLHO D'ÁGUA",0,0,0,0,0,0,0,0,0,NA
"RESERVA PARTICULAR DO PATRIMÔNIO NATURAL RESERVA DO DADINHO",0,0,0,0,0,0,0,0,0,NA
"RESERVA PARTICULAR DO PATRIMÔNIO NATURAL RESERVA DO JACU",0,0,0,0,0,0,0,0,0,NA
"RESERVA PARTICULAR DO PATRIMÔNIO NATURAL RESERVA DO PINHAL - GLEBA 2",0,0,0,0,0,0,0,0,0,NA
"RESERVA PARTICULAR DO PATRIMÔNIO NATURAL RESERVA DO PINHAL - GLEBA 3",0,0,0,0,0,0,0,0,0,NA
"RESERVA PARTICULAR DO PATRIMÔNIO NATURAL RESERVA DOS MURIQUIS",1,NA,NA,NA,NA,NA,NA,NA,NA,NA
"RESERVA PARTICULAR DO PATRIMÔNIO NATURAL RESERVA ECOLÓGICA AMADEU BOTELHO",4,NA,NA,NA,NA,NA,NA,NA,NA,NA
"RESERVA PARTICULAR DO PATRIMÔNIO NATURAL RESERVA HINAYANA",0,0,0,0,0,0,0,0,0,NA
"RESERVA PARTICULAR DO PATRIMÔNIO NATURAL RESERVA MURIQUI",0,0,0,0,0,0,0,0,0,NA
"RESERVA PARTICULAR DO PATRIMÔNIO NATURAL RESERVA RIZZIERI",9,NA,NA,NA,NA,NA,NA,NA,NA,NA
"RESERVA PARTICULAR DO PATRIMÔNIO NATURAL RIO VERMELHO",12,NA,NA,NA,NA,NA,NA,NA,NA,NA
"RESERVA PARTICULAR DO PATRIMÔNIO NATURAL SANTA RITA DE CASSIA",0,0,0,0,0,0,0,0,0,NA
"RESERVA PARTICULAR DO PATRIMÔNIO NATURAL SÃO ELIAS",0,0,0,0,0,0,0,0,0,NA
"RESERVA PARTICULAR DO PATRIMÔNIO NATURAL SÃO JUDAS TADEU",0,0,0,0,0,0,0,0,0,NA
"RESERVA PARTICULAR DO PATRIMÔNIO NATURAL SÃO LOURENÇO",0,0,0,0,0,0,0,0,0,NA
"RESERVA PARTICULAR DO PATRIMÔNIO NATURAL SERRA DA BOCAINA",4,NA,NA,NA,NA,NA,NA,NA,NA,NA
"RESERVA PARTICULAR DO PATRIMÔNIO NATURAL SERRA DO ITATINS",0,0,0,0,0,0,0,0,0,NA
"RESERVA PARTICULAR DO PATRIMÔNIO NATURAL SERRINHA",0,0,0,0,0,0,0,0,0,NA
"RESERVA PARTICULAR DO PATRIMÔNIO NATURAL SÍTIO CAETE",0,0,0,0,0,0,0,0,0,NA
"RESERVA PARTICULAR DO PATRIMÔNIO NATURAL SÍTIO CAPUAVINHA",0,0,0,0,0,0,0,0,0,NA
"RESERVA PARTICULAR DO PATRIMÔNIO NATURAL SÍTIO CURUCUTU",0,0,0,0,0,0,0,0,0,NA
"RESERVA PARTICULAR DO PATRIMÔNIO NATURAL SÍTIO DAS PEDRAS",0,0,0,0,0,0,0,0,0,NA
"RESERVA PARTICULAR DO PATRIMÔNIO NATURAL SÍTIO DO CANTONEIRO",0,0,0,0,0,0,0,0,0,NA
"RESERVA PARTICULAR DO PATRIMÔNIO NATURAL SÍTIO DO JACU",0,0,0,0,0,0,0,0,0,NA
"RESERVA PARTICULAR DO PATRIMÔNIO NATURAL SÍTIO KON TIKI",0,0,0,0,0,0,0,0,0,NA
"RESERVA PARTICULAR DO PATRIMÔNIO NATURAL SÍTIO MANACA",0,0,0,0,0,0,0,0,0,NA
"RESERVA PARTICULAR DO PATRIMÔNIO NATURAL SÍTIO PALMITAL",0,0,0,0,0,0,0,0,0,NA
"RESERVA PARTICULAR DO PATRIMÔNIO NATURAL SÍTIO PITHON",0,0,0,0,0,0,0,0,0,NA
"RESERVA PARTICULAR DO PATRIMÔNIO NATURAL SÍTIO PRIMAVERA",1,NA,NA,NA,NA,NA,NA,NA,NA,NA
"RESERVA PARTICULAR DO PATRIMÔNIO NATURAL SÍTIO RYAN",0,0,0,0,0,0,0,0,0,NA
"RESERVA PARTICULAR DO PATRIMÔNIO NATURAL SÍTIO SABIUNA",0,0,0,0,0,0,0,0,0,NA
"RESERVA PARTICULAR DO PATRIMÔNIO NATURAL SÍTIO SÃO JOAQUIM I",0,0,0,0,0,0,0,0,0,NA
"RESERVA PARTICULAR DO PATRIMÔNIO NATURAL SÍTIO SOLAR DA MONTANHA",0,0,0,0,0,0,0,0,0,NA
"RESERVA PARTICULAR DO PATRIMÔNIO NATURAL SÍTIO TAGUAÍBA II",0,0,0,0,0,0,0,0,0,NA
"RESERVA PARTICULAR DO PATRIMÔNIO NATURAL TOCA DA PACA",0,0,0,0,0,0,0,0,0,NA
"RESERVA PARTICULAR DO PATRIMÔNIO NATURAL TOQUE TOQUE PEQUENO",0,0,0,0,0,0,0,0,0,NA
"RESERVA PARTICULAR DO PATRIMÔNIO NATURAL TRANSBAÚ I",9,NA,NA,NA,NA,NA,NA,NA,NA,NA
"RESERVA PARTICULAR DO PATRIMÔNIO NATURAL TRÁPAGA",2,NA,NA,NA,NA,NA,NA,NA,NA,NA
"RESERVA PARTICULAR DO PATRIMÔNIO NATURAL TRAVESSIA",3,NA,NA,NA,NA,NA,NA,NA,NA,NA
"RESERVA PARTICULAR DO PATRIMÔNIO NATURAL TRILHA COROADOS - FB",0,0,0,0,0,0,0,0,0,NA
"RESERVA PARTICULAR DO PATRIMÔNIO NATURAL TRILHAS DO CERRADO",0,0,0,0,0,0,0,0,0,NA
"RESERVA PARTICULAR DO PATRIMÔNIO NATURAL VALE DO CORISCO",0,0,0,0,0,0,0,0,0,NA
"RESERVA PARTICULAR DO PATRIMÔNIO NATURAL VALE VERDEJANTE",0,0,0,0,0,0,0,0,0,NA
"RESERVA PARTICULAR DO PATRIMÔNIO NATURAL VIDA EM ABUNDÂNCIA",0,0,0,0,0,0,0,0,0,NA
"RESERVA PARTICULAR DO PATRIMÔNIO NATURAL VISTA BONITA",0,0,0,0,0,0,0,0,0,NA
"RESERVA PARTICULAR DO PATRIMÔNIO NATURAL VOTURUNA",0,0,0,0,0,0,0,0,0,NA
"RESERVA PARTICULAR DO PATRIMÔNIO NATURAL VOTURUNA II",0,0,0,0,0,0,0,0,0,NA
"RESERVA PARTICULAR DO PATRIMÔNIO NATURAL VOTURUNA V",0,0,0,0,0,0,0,0,0,NA
"RESERVA PARTICULAR DO PATRIMÔNIO NATURAL VUTURUSSU",0,0,0,0,0,0,0,0,0,NA
